chunk_id,text,char_length,word_count,token_count,section_index,source_file,processed_date
206,"# # # # # # and agreements, the papf has sent delegations to over 30 countries for bilateral or multilateral counter - terrorism exchanges, including france, germany, spain, italy, australia, israel, brazil, cuba, south africa, russia and pakistan, and hosted delegations from 17 countries, such as russia, romania, france, italy, hungary, south africa, egypt, austra - lia and belarus. sending personnel abroad to receive training or provide training assistance. the papf has sent delegations or personnel to a dozen countries, including france, israel, hungary, singapore, malaysia and thailand, to attend training courses",624,93,130,110,china_2008_NationalDefense.md,2025-01-28 18:54:15
207,"in special duties, participate in or observe contests of various kinds, and conduct exchanges in counter - terrorism techniques and skills. it has sent teams of instructors to such countries as romania and azerbaijan to provide teaching or training assistance. holding joint counter - terrorism exercises. in september 2007, the papf and the internal troops of russia staged their first joint counter - terrorism exercise, “ cooperation - 2007. ” the exercise focused on “ operations by special forces to rescue hostages and destroy terror - ist organizations and groups. ”",573,91,103,110,china_2008_NationalDefense.md,2025-01-28 18:54:15
208,# # # # # maintaining public security in border and coastal areas and orderly entry and exit at ports,101,20,22,111,china_2008_NationalDefense.md,2025-01-28 18:54:15
209,"# # # # # # the border public security force, listed as a component of the papf, is an armed law - enforcement body deployed by the state in border and coastal areas and at ports. its main responsibilities are as follows : bor - der and coastal public security administration ; ports and border inspec - tion and surveillance ; patrols and surveillance in areas adjacent to hong kong and macao ; patrols and surveillance along the demarcation line of the beibu gulf ; and the prevention of and crackdown on illegal and criminal acts in border and coastal areas, such as illegal border crossing, smuggling and drug trafficking. 47",629,112,130,112,china_2008_NationalDefense.md,2025-01-28 18:54:15
210,- - - - -,9,5,7,112,china_2008_NationalDefense.md,2025-01-28 18:54:15
211,"# # # # # # the border public security force has 30 contingents in provinces ( autonomous regions or municipalities directly under the central gov - ernment, except beijing ) ; 110 detachments in border and coastal pre - fectures ( prefecture - level cities, autonomous prefectures or leagues ) and 20 marine police detachments in coastal prefectures ; 207 ac - tive - duty border inspection stations at open ports ; 310 groups in border and coastal counties ( county - level cities or banners ) ; 1, 691 border police substations in border and coastal townships ( towns ) ; 46 frontier inspection stations on major border routes ; and 113",639,114,130,113,china_2008_NationalDefense.md,2025-01-28 18:54:15
212,"mobile groups deployed in important sectors in border areas. in recent years the border public security force has made efforts to implement the strategy of safeguarding the people and consolidating border defense ; strengthen public security efforts by the general public ; improve mechanisms for investigating, mediating and settling disputes, conflicts and mass incidents ; tackle prominent public security issues ; promote the building of model villages and consolidate border defense ; and help children in need, thus vigorously promoting harmony and stability in border and coastal areas. further efforts have been made by border inspection stations to improve their services. as a result, an environment has been created for safe, rapid and convenient customs",765,115,130,113,china_2008_NationalDefense.md,2025-01-28 18:54:15
213,"clearance. the border public security force, supported by other relevant departments, has cracked down hard on crimes, such as illegal border crossing, drug trafficking and smuggling, and carried out campaigns to combat organized criminal gangs and suppress evil forces in border and coastal areas. since 2007 it has arrested 4, 400 illegal border cross - ers, seized 3, 806 kg of drugs, seized smuggled goods worth rmb620 million, cracked 19, 205 criminal cases and handled 60, 063 violations of public security. pursuant to relevant provisions of the ministry of public security, the marine police force has established and strengthened maritime law - enforcement agencies,",675,104,130,113,china_2008_NationalDefense.md,2025-01-28 18:54:15
214,"augmented its law - enforcement personnel, 48 - - - - -",55,12,15,113,china_2008_NationalDefense.md,2025-01-28 18:54:15
215,"# # # # # # refined its law - enforcement regulations, and improved its ships and equipment. it has cracked 41 maritime criminal cases, carried out 115 maritime rescue and salvage operations, and saved 238 people in distress. 49 - - - - -",238,45,52,114,china_2008_NationalDefense.md,2025-01-28 18:54:15
216,# # # ix. national defense reserve buildup,42,8,12,115,china_2008_NationalDefense.md,2025-01-28 18:54:15
217,"# # # # # # china firmly relies on the people for national defense, and seeks to strengthen the buildup of the national defense reserve in compliance with the requirement of being able to deal with both emergencies and wars.",224,41,46,116,china_2008_NationalDefense.md,2025-01-28 18:54:15
218,# # # # # reserve force buildup,31,8,11,117,china_2008_NationalDefense.md,2025-01-28 18:54:15
219,"# # # # # # with active servicemen as its backbone and reserve officers and men as its foundation, the reserve force is an armed force formed in line with the unified structure and organization of the pla. it is under the dual leadership of the pla and local party committees and governments. the reserve force was founded in 1983. in august 1986 it formally became a part of the pla. in may 1995 the npc standing committee adopted the law of the people ’ s republic of china on reserve officers. in april 1996 the cmc began to confer military ranks on reserve offi - cers. the law of the people",595,113,130,118,china_2008_NationalDefense.md,2025-01-28 18:54:15
220,"’ s republic of china on national defense promulgated in march 1997 explicitly stipulates that china ’ s armed forces consist of the active - duty force and the reserve force of the pla, the people ’ s armed police force and the militia. after 25 years of buildup and development, the reserve force has become an important component of the national defense reserve. it is made up of the army reserve, navy reserve, air force reserve and the second artillery force reserve. the army reserve breaks down into infantry, artillery, antiaircraft artillery, antitank artillery, tank, engineer - ing, chemical defense, signals, coastal",628,103,130,118,china_2008_NationalDefense.md,2025-01-28 18:54:15
221,"defense and other specialized forces. the navy reserve is mainly composed of reconnaissance, 50 - - - - -",105,19,23,118,china_2008_NationalDefense.md,2025-01-28 18:54:15
222,"# # # # # # mine - sweeping and mine - laying, radar observation and communications and other specialized forces. the air force reserve mainly comprises ground - to - air missile, radar and other specialized forces. the second artillery force reserve mainly consists of the specialized missile support force and special equipment maintenance force. in line with the unified structure and organization of the pla, the reserve force has reserve divisions, brigades and regiments, and corre - sponding leading organs. reserve units are organized mainly on a re - gional basis. divisions are set up in provinces and brigades ( regiments ) in prefectures ( autonomous prefectures or prefecture",688,111,130,119,china_2008_NationalDefense.md,2025-01-28 18:54:15
223,"- level cities ). a division ( brigade ) can be set up in a region covering more than one prefecture ( autonomous prefecture or prefecture - level city ), and a regiment in a region covering more than one county ( county - level city or district ). in recent years, the reserve force has made new strides in organiza tion building and military training. it has gradually enlarged the pool of reservists, improved its organizational methods, and actively ex - plored new organizational models, such as industrial, trans - regional and community - based organizations. it conducts and manages training according to the training program and law, so as",648,111,130,119,china_2008_NationalDefense.md,2025-01-28 18:54:15
224,"to regularize training. as stipulated in the outline for the military training and evaluation of the reserve force, one third of the authorized strength of a unit must undergo 30 days of training annually. training tasks are based on pos - sible wartime assignments and the caliber of the reservists. the reserve force is in the process of shifting its focus from quantity and scale to quality and efficiency, and from a combat role to a support role. the goal is to enable the reserve and active forces to cooperate closely with each other, to complement each other, and to develop in a coordinated way.",604,105,122,119,china_2008_NationalDefense.md,2025-01-28 18:54:15
225,# # # # # militia force building,32,8,10,120,china_2008_NationalDefense.md,2025-01-28 18:54:15
226,# # # # # # militia work is under the unified leadership of the state council 51 - - - - -,90,23,25,121,china_2008_NationalDefense.md,2025-01-28 18:54:15
227,"# # # # # # and the cmc, and the leadership of local party committees, local gov - ernments as well as the local military commands. the general staff headquarters supervises militia work nationwide. the military area commands are responsible for militia work in their respective jurisdic - tions. provincial military commands, prefectural military commands and people ’ s armed forces departments of counties ( county - level cities or districts ) are the organs of military leadership and command, and responsible for the militia work in their respective jurisdictions. the grass - roots people ’ s armed forces departments established in town - ships ( towns ), urban sub -",675,112,130,122,china_2008_NationalDefense.md,2025-01-28 18:54:15
228,"districts, enterprises and public institutions are responsible for organizing and carrying out militia work. local party committees and governments at all levels make overall plans and arrangements for militia work. in recent years china has persisted in reform and innovation in mi litia force buildup, adjusted its size and structure, and upgraded its weaponry and equipment. the organizational structure has optimized to increase the capabilities of the militia to support combat and emer - gency response forces, and to gradually shift the center of its responsi - bilities from rural areas to cities, areas along communication lines and other key areas. importance has been attached to establishing militia organizations",725,109,130,122,china_2008_NationalDefense.md,2025-01-28 18:54:15
229,in emerging enterprises and high - tech industries to in - crease the technology content of the militia force. investment in weaponry and equipment has been increased to systematically and or - ganically provide a series of new types of militia air defense equip - ment such as air defense artillery and portable air defense missiles in key areas. equipment for emergency response and stability - maintenance operations has been improved. some types of weapons have been up - graded. during the eleventh five - year plan period ( 2006 - 2010 ) the number of militia personnel is scheduled to be reduced from 10 million to eight million. in may 2007 the general staff headquarters released a,690,118,130,122,china_2008_NationalDefense.md,2025-01-28 18:54:15
230,new edition of the outline for the training and evaluation of the militia. the new 52 - - - - -,95,21,24,122,china_2008_NationalDefense.md,2025-01-28 18:54:15
231,"# # # # # # outline adds over a hundred training tasks in dozens of categories cov - ering specialties of the navy, air force and second artillery force, marking a shift from traditional single - service to multi - service / arm specialized militia training. based on the principles of integrating resources, pooling strengths, organizing training level by level and conducting trans - regional training, the military training of the militia has a four - level organizational system : the provincial military com - mands are the backbone ; the prefectural military commands are the main body ; the people ’ s armed forces departments are the basis ; and the grass - roots",671,116,130,123,china_2008_NationalDefense.md,2025-01-28 18:54:15
232,"people ’ s armed forces departments are the supplement. the militia is improving its technology - based training, and promoting on - base, simulated and web - based training step by step. prominence is given to such tasks as rapid mobilization of specialized detachments, coordination with active units and operations in complex electromag - netic environments. in addition, efforts are being made to enhance training in emergency response and rescue. the aim is to raise the mi - litia ’ s capabilities in combat operations, emergency rescue, disaster re - lief, crisis response and social stability maintenance. 53 - - - - -",626,103,122,123,china_2008_NationalDefense.md,2025-01-28 18:54:15
233,# # # x. the armed forces and the people,40,10,13,124,china_2008_NationalDefense.md,2025-01-28 18:54:15
234,"# # # # # # the chinese armed forces belong to the people. as stipulated by the constitution and laws, it is an important task for the armed forces to take part in national development and disaster relief. supporting the military and giving preferential treatment to families of servicemen and revolutionary martyrs, and supporting the government and cher - ishing the people ( the “ two supports ” ) constitute the political basis for strengthening the buildup of national defense and the armed forces.",503,85,95,125,china_2008_NationalDefense.md,2025-01-28 18:54:15
235,# # # # # participating in emergency rescue and disaster relief operations,74,13,15,126,china_2008_NationalDefense.md,2025-01-28 18:54:15
236,"# # # # # # the pla, papf and the militia are the shock force in emergency rescue and disaster relief operations. their main tasks are to rescue and evacuate disaster victims and people in danger ; ensure the security of important facilities and areas ; rescue and transport important materials and goods ; participate in specialized operations such as rush repairs of roads, bridges and tunnels, maritime search and rescue, nbc rescue operations, epidemic control, and medical aid ; eliminate or control other major dangers and disasters ; and assist local governments in post - disaster reconstruction if necessary. in recent years the pla has formed 19 units specialized in flood control and emergency rescue",711,117,130,127,china_2008_NationalDefense.md,2025-01-28 18:54:15
237,"operations. in june 2005 the state council and the cmc published the regula tions on the participation of the people ’ s liberation army in emer - gency rescue and disaster relief. according to the regulations, if the 54 - - - - -",230,44,54,127,china_2008_NationalDefense.md,2025-01-28 18:54:15
238,"# # # # # # pla is needed in emergency rescue and disaster relief operations or - ganized by the state council, the department of the state council in charge of the operations may file a request to the general staff head - quarters. if the pla is needed in such operations organized by the people ’ s governments at or above the county level, the latter may file a request via local military organs at the corresponding level. however, in case of emergency the local people ’ s governments may directly re - quest pla units stationed in the area to provide assistance, and the lat - ter must take immediate action and simultaneously report",639,117,130,128,china_2008_NationalDefense.md,2025-01-28 18:54:15
239,"to the higher authorities, according to the regulations. upon detecting any hazard or disaster, local pla units must also take immediate action and simulta - neously report to the higher authorities. pla units come under the uni - fied leadership of the people ’ s government when participating in local emergency rescue and disaster relief operations. their specific tasks are assigned by the headquarters for the operations, while their actions are directed through the military chain of command. in november 2006 the cmc approved and issued the master scenario for emer - gency response. in the past two years the pla and the papf have dispatched a total",657,108,130,128,china_2008_NationalDefense.md,2025-01-28 18:54:15
240,"of 600, 000 troops / time, employed 630, 000 vehicles ( or machines ) / time of various types, flown over 6, 500 sorties / time ( including the use of helicopters ), mobilized 1. 39 million militiamen and reservists / time, participated in over 130 disaster relief operations in cases of floods, earthquakes, snowstorms, typhoons and fires, and rescued or evacuated a total of 10 million people. in january 2008 large areas of southern china were stricken by a savage spell of freezing weather, sleet and snowstorms. the pla and the papf sent 224, 000 troops and 1",564,99,130,128,china_2008_NationalDefense.md,2025-01-28 18:54:15
241,". 036 million militiamen and re - servists, and flew 226 sorties / time ( using military transport aircraft and helicopters ) to undertake urgent, difficult, dangerous and heavy tasks, such as clearing major lines of communication, rescuing victims and restoring power supply. 55 - - - - -",289,49,62,128,china_2008_NationalDefense.md,2025-01-28 18:54:15
242,"# # # # # # on may 12, 2008 an earthquake measuring 8. 0 on the richter scale rocked wenchuan county, sichuan province. in response, the pla and the papf deployed 146, 000 troops, mobilized 75, 000 militiamen and reservists, flew over 4, 700 sorties / time ( including the use of helicop - ters ) and employed 533, 000 vehicles / time in the relief effort. they rescued 3, 338 survivors, evacuated 1. 4 million local residents, and transported, airlifted and air - dropped 1. 574 million tons of relief mate - ri",512,95,130,129,china_2008_NationalDefense.md,2025-01-28 18:54:15
243,"##als. they sent 210 teams of medical workers, psychotherapists, and sanitation and epidemic prevention specialists, and treated 1. 367 mil - lion injured people. the troops strictly observed discipline, and kept detailed records of hundreds of millions of yuan in cash and large quantities of valuables recovered from the debris, all of which was handed over to the owners or relevant departments of local governments.",419,65,83,129,china_2008_NationalDefense.md,2025-01-28 18:54:15
244,# # # # # participating in olympic security work and supporting the preparations for the olympics,97,17,19,130,china_2008_NationalDefense.md,2025-01-28 18:54:15
245,"# # # # # # at the request of the beijing organizing committee for the games of the xxix olympiad, the pla and the papf actively participated in olympic security work, and supported preparations for the olympics and paralympics, making important contributions to the success of the events. in security work for the olympics, the main responsibilities of the pla were to ensure the air security of venues in and outside beijing and the maritime security of olympic venues in coastal and neighbor - ing areas ; take part in the handling of terrorist incidents such as nbc ( nuclear, biological, and chemical ) terrorist attacks and explosions ; provide intelligence support ; organize emergency rescue",699,117,130,131,china_2008_NationalDefense.md,2025-01-28 18:54:15
246,", medical aid and helicopter transportation ; and strengthen border administration and control during the olympics. the pla contributed 46, 000 troops, 98 fixed - wing aircraft, 60 helicopters, 63 ships, and some ground - to - air missiles, and radar, chemical defense and engineering support equip - ment. the papf was mainly responsible for ensuring the security of 56 - - - - -",380,65,81,131,china_2008_NationalDefense.md,2025-01-28 18:54:15
247,"# # # # # # the torch relay ; guarding olympic venues, vip residences and relevant airports ; carrying out guard duties for the opening and closing ceremo - nies, the activities of important foreign guests in china and major sports events ; protecting water, power, oil and gas supply facilities and communication hubs closely related to the olympics as well as the launching sites of rockets used for artificial rainfall control in beijing, tianjin and hebei ; acting in collaboration with public security organs to set up checkpoints in the neighborhood of olympic venues and on major roads in the vicinity of beijing, and to perform armed patrols in important public places in cities",686,116,130,132,china_2008_NationalDefense.md,2025-01-28 18:54:15
248,"hosting or co - hosting the olym - pics ; conducting security checks at olympic venues ; and executing counter - terrorism, anti - hijacking and contingency response operations. the papf contributed 85, 000 troops to olympic security work, appropri - ately handled nearly 300 incidents which might have endangered guarded targets, and confiscated over 9, 000 prohibited items and over 140, 000 limited items. to support the preparations for the olympics, the pla and the papf contributed over 14, 000 professional and amateur performers to the opening and closing ceremonies of the olympics and paralympics. over 6, 900 volunteers from the pla",643,103,130,132,china_2008_NationalDefense.md,2025-01-28 18:54:15
249,"and the papf undertook 84 kinds of support tasks, including transport support, flag raising at medal presentation ceremonies, medical aid and various services at olympic venues. pla and papf units stationed in beijing mobilized 670, 000 troops / time to take part in the construction of 36 key olympic projects, such as the aviation corridor of the beijing capital international air - port and the national olympic forest park.",427,69,81,132,china_2008_NationalDefense.md,2025-01-28 18:54:15
250,# # # # # participating in and supporting national construction,63,11,13,133,china_2008_NationalDefense.md,2025-01-28 18:54:15
251,"# # # # # # under the unified arrangement of the central people ’ s government and local people ’ s governments at all levels, the pla and the papf ac - tively participate in all aspects of national construction. in the past two 57 - - - - -",241,51,59,134,china_2008_NationalDefense.md,2025-01-28 18:54:15
252,"# # # # # # years they have put over 14 million workdays and one million vehicles ( or machines ) / time into this endeavor. providing aid for construction of infrastructure and ecological projects. the pla and the papf have supported over 200 key con - struction projects for energy, transportation, hydropower and commu - nications. they have taken part in over 170 projects for the protection of the ecological environment at such places as the upper and middle reaches of the yellow river and sources of sandstorms affecting beijing and tianjin. they have afforested three million mu ( one mu is about 700 sq m )",616,109,130,135,china_2008_NationalDefense.md,2025-01-28 18:54:15
253,"of barren hills, waste land and desolate beaches, and provided aerial protection and maintenance for 24 million mu of forests. participating in the building of a new countryside. the pla and the papf provide support for the construction of irrigation and wa - ter - conservancy works and rural infrastructure. they have built or re - paired over 2, 100 roads in poverty - stricken rural areas, and completed over 90, 000 small construction projects such as rural hydropower pro - jects, drinking water projects for both people and livestock, and pro - jects for the improvement of small river valley areas. they have also set up or",631,108,130,135,china_2008_NationalDefense.md,2025-01-28 18:54:15
254,"consolidated 25, 000 places of contact for poverty reduction, and helped over 80, 000 households out of poverty. supporting scientific and technological, educational, cultural and health undertakings. the pla and the papf have helped to train nearly 10, 000 people in various skills, and set up 240 science and technology demonstration centers. they have built over 200 primary and secondary schools, and helped 240, 000 poor students complete their schooling. they have established long - term assistance relations with 470 county or township hospitals in poverty - stricken areas, and dispatched 13, 000 medical teams offering free medical consultation and treatment in 41 million cases. supporting the economic and",717,109,130,135,china_2008_NationalDefense.md,2025-01-28 18:54:15
255,social development of areas inhab ited by ethnic minorities. the pla and the papf have helped to build 58 - - - - -,115,24,31,135,china_2008_NationalDefense.md,2025-01-28 18:54:15
256,"# # # # # # or enlarge three airports, five power stations and 12 water conservancy facilities ; repair over 900 km of highways ; dig 300 wells ; and build a total of 6, 000 small rainwater cellars, small power stations, solar en - ergy installations and tv transmission facilities.",282,52,67,136,china_2008_NationalDefense.md,2025-01-28 18:54:15
257,# # # # # supporting national defense and armed forces modernization,68,12,14,137,china_2008_NationalDefense.md,2025-01-28 18:54:15
