chunk_id,text,char_length,word_count,token_count,section_index,source_file,processed_date
309,"sco governments on cooperation in combating the illegal circulation of weapons, ammunition and explosives, fi - nalized such legal documents as the agreement on the training of counter - terrorism professionals, and launched cooperation in such new areas as information security by formulating the action plan to ensure international information security. procurators - general, heads of supreme courts, defense ministers, and leaders of law enforcement and security agencies from the member states have held meetings, deepening cooperation in the justice, defense, law enforcement, secu - rity and other fields. 70 - - - - -",625,95,119,160,china_2008_NationalDefense.md,2025-01-28 18:54:15
310,"# # # # # # china attaches great importance to the asean regional forum ( arf ). at the 14th arf ministerial meeting in august 2007 china stressed that the new security concept is based on the diversity and common interests of the asia - pacific region, and accords with the in - herent law and requirements of the region ’ s pursuit of peace, develop - ment, progress and prosperity. in the past two years china has co - hosted with indonesia and thailand respectively the arf round table dis - cussion on stocktaking of maritime security issues and the arf seminar on narcotics control. the arf general",604,110,130,161,china_2008_NationalDefense.md,2025-01-28 18:54:15
311,"guidelines for dis - aster relief cooperation proposed and drafted by china was adopted at the 14th arf ministerial meeting, making it the first arf frame - work document providing guidance for disaster relief cooperation. china - asean and asean plus three ( china, japan and the re public of korea ) cooperation in non - traditional security fields is de - veloping in depth. at the china - asean summit and the asean plus three summit, held respectively in january and november 2007, china put forward a series of initiatives for strengthening cooperation in non - traditional security fields, and emphasized the importance of conducting institutionalized defense cooperation and military ex - changes",704,114,130,161,china_2008_NationalDefense.md,2025-01-28 18:54:15
312,. china hosted the first china - asean dialogue between senior defense scholars ( cadsds ) in march 2008 and the second asean plus three workshop on disaster relief by armed forces in june 2008.,194,35,40,161,china_2008_NationalDefense.md,2025-01-28 18:54:15
313,# # # # # participating in un peacekeeping operations,53,10,12,162,china_2008_NationalDefense.md,2025-01-28 18:54:15
314,"# # # # # # as a permanent member of the un security council, china has consistently supported and actively participated in the peacekeeping operations consonant with the spirit of the un charter. since 1990 the pla has sent 11, 063 military personnel / time to participate in 18 un peacekeeping operations. eight lost their lives on duty. as of the end of november 2008, china had 1, 949 military peacekeeping personnel 71 - - - - -",433,79,91,163,china_2008_NationalDefense.md,2025-01-28 18:54:15
315,"# # # # # # serving in nine un mission areas and the un department of peace - keeping operations. among them, there were 88 military observers and staff officers ; 175 engineering troops and 43 medical personnel for the united nations organization mission in the democratic republic of the congo ( unmonuc ) ; 275 engineering troops, 240 transporta - tion troops and 43 medical personnel for the united nations mission in liberia ( unmil ) ; 275 engineering troops, 100 transportation troops and 60 medical personnel for the united nations mission in the sudan ( unmis ) ; 275 engineering troops and 60 medical personnel for the united nations interim force in lebanon (",670,117,130,164,china_2008_NationalDefense.md,2025-01-28 18:54:15
316,"unifil ) ; and 315 engi - neering troops for the african union / united nations hybrid operation in darfur ( unamid ). since 2000, china has sent 1, 379 peacekeeping policeman / time to seven mission areas. currently, 208 chinese peace - keeping policemen are in liberia, kosovo, haiti, sudan and east timor for peacekeeping operations.",336,57,76,164,china_2008_NationalDefense.md,2025-01-28 18:54:15
317,# # # # # military exchanges and cooperation with other countries,65,12,14,165,china_2008_NationalDefense.md,2025-01-28 18:54:15
318,"# # # # # # implementing the nation ’ s foreign policy, the pla develops coop erative military relations with other countries that are non - aligned, non - confrontational and not directed against any third party, and en - gages in various forms of military exchanges and cooperation in an ef - fort to create a military security environment featuring mutual trust and mutual benefit. creating a new situation in military diplomacy which is open, practical and dynamic. china has established military ties with over 150 countries, and has military attache offices in 109 countries. a total of 98 countries have military attache offices in china. in the past two years senior",674,114,130,166,china_2008_NationalDefense.md,2025-01-28 18:54:15
319,"pla delegations have visited more than 40 countries, and defense ministers and chiefs of the general staff from more than 60 countries have visited china. practical cooperation between the mili - tary forces of china and russia at various levels and in multiple fields 72 - - - - -",281,50,58,166,china_2008_NationalDefense.md,2025-01-28 18:54:15
320,"# # # # # # has continued to develop in depth. the military forces of the two sides have deepened their strategic mutual confidence and held frequent ex - changes of high - level visits. the defense ministers of the two countries have a direct telephone link, which is the first of its kind between china and another country. china - us military relations have made gradual progress. the two countries have formally established a tele - phone link between china ’ s ministry of national defense and the us department of defense, held the first exchange of their ncos, and formally launched military archive cooperation on information relating to us military personnel missing in action around the",696,119,130,167,china_2008_NationalDefense.md,2025-01-28 18:54:15
321,"period of the korean war. meanwhile, china - japan defense relations have made headway. the two sides have held the seventh and eighth china - japan defense and security consultation, made their first exchange of port calls by naval ships, and held the first consultation over the establish - ment of a maritime liaison mechanism between their teams of experts. china ’ s defense exchanges with its neighbors, including asean, india and pakistan, have been further expanded. china has begun to hold defense and security consultations with india. the channels of com - munication between the defense sectors and military forces of china and european countries remain open. china ’ s",681,111,130,167,china_2008_NationalDefense.md,2025-01-28 18:54:15
322,"military cooperation with developing countries has been strengthened. actively holding bilateral or multilateral joint military exercises with other countries. since 2007 china has held over 20 joint military exercises or joint training exercises with a score of countries. in august 2007, within the framework of the sco, china, russia, kazakhstan, kyrgyzstan, tajikistan and uzbekistan held a joint counter - terrorism military exercise in the xinjiang uygur autonomous region, china, and chelyabinsk, russia, focusing on the task of combating terrorism, separatism and extremism. this was the first time for the pla to par - ticipate in a major land",652,98,130,167,china_2008_NationalDefense.md,2025-01-28 18:54:15
323,- air joint exercise outside the chinese territory. in july 2007 and july 2008 china and thailand conducted joint counter - terrorism training involving both countries ’ army special op 73 - - - - -,198,36,39,167,china_2008_NationalDefense.md,2025-01-28 18:54:15
324,"# # # # # # erations respectively in guangzhou, china, and chiang mai, thailand. in december 2007 and december 2008, armies of china and india staged joint counter - terrorism training exercises respectively in kunming, china and belgaum, india. during the past two years, the chinese navy has held bilateral joint maritime training exercises with the na - vies of 14 countries, including russia, the united kingdom, france, the united states, pakistan, india and south africa. china has also conducted various forms of multilateral joint maritime training exer - cises with relevant countries, focusing on various tasks. in march 2007,",636,101,130,168,china_2008_NationalDefense.md,2025-01-28 18:54:15
325,"china held the “ peace - 2007 ” joint maritime training exercise in the arabian sea with seven other countries, including pakistan. in may 2007 china and eight other countries, including singapore, conducted a multilateral joint maritime exercise in singaporean waters within the framework of the western pacific naval symposium ( wpns ). in oc - tober the same year china, australia and new zealand staged a joint maritime search - and - rescue training exercise in the tasman sea. conducting cooperation and exchanges in personnel develop ment. china is sending an increasing number of military students overseas. in the past two years it has sent over 900 military students to",679,111,130,168,china_2008_NationalDefense.md,2025-01-28 18:54:15
326,"more than 30 countries. twenty military educational institutions in china have established and maintained inter - collegiate exchange rela - tions with their counterparts in over 20 countries, including the united states, russia, japan and pakistan. meanwhile, some 4, 000 military personnel from more than 130 countries have come to china to study at chinese military educational institutions. to further military exchanges and cooperation, and enhance mutual military confidence, china ’ s ministry of national defense officially set up an spokesperson system in may 2008. the newly - founded in - formation office of the ministry of national defense of the prc re - leases important military information through regular or irregular press conferences and",757,115,130,168,china_2008_NationalDefense.md,2025-01-28 18:54:15
327,written statements. 74 - - - - -,32,8,11,168,china_2008_NationalDefense.md,2025-01-28 18:54:15
328,# # # xiv. arms control and disarmament,39,8,13,169,china_2008_NationalDefense.md,2025-01-28 18:54:15
329,"# # # # # # the chinese government has always attached importance to and been supportive of international efforts in the field of arms control, disarmament and non - proliferation. china has taken concrete measures to faithfully fulfill its relevant international obligations. china is com - mitted to, along with the international community, consolidating and strengthening the existing international arms control, disarmament and non - proliferation mechanisms pursuant to the purposes and principles of the charter of the united nations and other universally recognized norms governing international relations, and to the preservation of in - ternational strategic stability and promotion of the common security of all countries.",732,108,128,170,china_2008_NationalDefense.md,2025-01-28 18:54:15
330,# # # # # nuclear disarmament,29,7,11,171,china_2008_NationalDefense.md,2025-01-28 18:54:15
331,"# # # # # # china holds that all nuclear - weapon states should make an un equivocal commitment to the thorough destruction of nuclear weapons, undertake to stop research into and development of new types of nu - clear weapons, and reduce the role of nuclear weapons in their national security policy. the two countries possessing the largest nuclear arse - nals bear special and primary responsibility for nuclear disarmament. they should earnestly comply with the relevant agreements already concluded, and further drastically reduce their nuclear arsenals in a verifiable and irreversible manner, so as to create the necessary condi - tions for",647,105,130,172,china_2008_NationalDefense.md,2025-01-28 18:54:15
332,the participation of other nuclear - weapon states in the process of nuclear disarmament. china supports the early entry into force of the comprehensive 75 - - - - -,165,30,35,172,china_2008_NationalDefense.md,2025-01-28 18:54:15
333,"# # # # # # nuclear test - ban treaty, and will continue to honor its moratorium commitment on nuclear testing. china supports the preparatory work for the entry into force of the treaty by the preparatory commission of the comprehensive nuclear test - ban treaty organization, and has contributed to the establishment of the international monitoring sys - tem ( ims ). china has always stayed true to its commitments that it will not be the first to use nuclear weapons at any time and in any circumstances, and will unconditionally not use or threaten to use nuclear weapons against non - nuclear - weapon states or in nuclear - weapon - free zones",650,116,130,173,china_2008_NationalDefense.md,2025-01-28 18:54:15
334,". china calls upon other nuclear - weapon states to make the same com - mitments and conclude an international legal instrument in this regard. china has already signed all relevant protocols which have been opened for signature of various nuclear - weapon - free zone treaties, and has reached agreement with the asean on relevant issues of the protocol of the treaty on the southeast asia nuclear - weapon - free zone. china welcomes the treaty on a nuclear - weapon - free zone in central asia signed by the five central asian countries. china values the role of the conference on disarmament ( cd ) in geneva, and supports efforts in the cd to reach a comprehensive",669,119,130,173,china_2008_NationalDefense.md,2025-01-28 18:54:15
335,"and balanced program of work, so as to enable the cd to start substantial work on such issues as the fissile material cut - off treaty ( fmct ), prevention of an arms race in outer space, nuclear disarmament and security assurance to non - nuclear - weapon states. china maintains that the global missile defense program will be detrimental to strategic balance and stability, undermine international and regional security, and have a negative impact on the process of nu - clear disarmament. china pays close attention to this issue.",534,90,107,173,china_2008_NationalDefense.md,2025-01-28 18:54:15
336,# # # # # prohibition of biological and chemical weapons,56,11,13,174,china_2008_NationalDefense.md,2025-01-28 18:54:15
337,# # # # # # china observes in good faith its obligations under the biological 76 - - - - -,90,22,24,175,china_2008_NationalDefense.md,2025-01-28 18:54:15
338,"# # # # # # weapons convention ( bwc ), and supports the multilateral efforts aimed at strengthening the effectiveness of the convention. china has actively participated in the meetings of the parties to the convention and the meetings of experts in a pragmatic manner. china has already established a comprehensive legislation system for the implementation of the convention, set up a national implementation focal point, and submitted its declarations regarding confidence - building measures to the implementation support unit of the convention in a timely fashion. china has also strengthened bio - safety, bio - security and disease sur - veillance, and actively carried out related international exchanges and cooperation. china",734,113,130,176,china_2008_NationalDefense.md,2025-01-28 18:54:15
339,"earnestly fulfils its obligations under the chemical weapons convention ( cwc ) by setting up implementation offices at both cen - tral and local levels, submitting timely and complete annual declara - tions, subsequent declarations regarding newly discovered chemical weapons abandoned by japan in china and information on the national protection program. china has received more than 170 on - site inspec - tions by the organization for the prohibition of chemical weapons ( opcw ). the analytical chemistry research laboratory of the insti - tute of chemical defense became the first opcw - designated labora - tory in china in 1998,",636,102,130,176,china_2008_NationalDefense.md,2025-01-28 18:54:15
340,"followed by the toxicant analysis laboratory of the academy of military medical sciences, which became an opcw - designated laboratory in 2007. in may 2008 china and the opcw jointly held a training course on protection and assistance in beijing. with a view to accelerating the destruction of chemical weapons abandoned by japan in china, china has assisted japan in carrying out more than 100 on - site investigations, and excavated more than 40, 000 items of chemical weapons abandoned by japan. china urges japan to earnestly implement its obligations under the conven - tion, and start the actual destruction of chemical weapons abandoned by japan in china as soon as possible",681,112,130,176,china_2008_NationalDefense.md,2025-01-28 18:54:15
341,. 77 - - - - -,14,7,9,176,china_2008_NationalDefense.md,2025-01-28 18:54:15
342,# # # # # non - proliferation,29,8,10,177,china_2008_NationalDefense.md,2025-01-28 18:54:15
343,"# # # # # # china firmly opposes the proliferation of weapons of mass destruc tion ( wmd ) and their means of delivery, and actively takes part in in - ternational non - proliferation efforts. china holds that an integrated approach should be adopted to address both the symptoms and root causes of proliferation. the international community should devote itself to building a global and regional security environment featuring stability, cooperation and mutual trust, and earnestly maintaining and strengthening the authority and effectiveness of the international non - proliferation regime. in this regard, double standards must be abandoned. all states should resort to dialogue and negotiation to resolve differences in the field",734,114,130,178,china_2008_NationalDefense.md,2025-01-28 18:54:15
344,"of non - proliferation. the relations be - tween non - proliferation and the peaceful use of science and technology should be properly addressed, with the aim of preserving the right of peaceful use of each state while effectively preventing wmd proliferation. china has joined all international treaties and international organi zations in the field of non - proliferation. it attaches great importance to the role of the treaty on the non - proliferation of nuclear weapons ( npt ), the biological weapons convention ( bwc ) and the chemical weapons convention ( cwc ) in preventing the proliferation of wmd. china supports the role played by the un in the field",664,112,130,178,china_2008_NationalDefense.md,2025-01-28 18:54:15
345,"of non - proliferation, and has conscientiously implemented the relevant resolutions of the un security council. china is dedicated to the denuclearization of the korean peninsula, and firmly promotes the six - party talks process on that issue. china facilitated the adoption of “ initial actions for the implementation of the joint statement ” and the “ second - phase actions for the imple - mentation of the joint statement ” respectively in february and octo - ber 2007. 78 - - - - -",488,85,102,178,china_2008_NationalDefense.md,2025-01-28 18:54:15
346,"# # # # # # china maintains that the iranian nuclear issue should be resolved peacefully by political and diplomatic means. china has participated in the meetings of foreign ministers or political directors of the ministries of foreign affairs, and hosted a meeting of political directors of the ministries of foreign affairs of those six countries in shanghai in april 2008. china has also actively taken part in the deliberation on the iranian nuclear issue at the international atomic energy agency ( iaea ) and the un security council, playing a constructive role. china attaches great importance to non - proliferation export con trol, and has established a comprehensive legal system for export control of nuclear",719,117,130,179,china_2008_NationalDefense.md,2025-01-28 18:54:15
347,", biological, chemical and missile and related dual - use items and technologies. china has also constantly updated these laws and regulations in light of its international obligations and the need for export control. china amended the regulations of the prc on the control of nuclear exports in november 2006, the regulations of the prc on the control of dual - use nuclear items and related technologies exports in january 2007 and its control list in july of the same year. china has spared no effort in strengthening law enforcement in the field of non - proliferation export control. china values and actively carries out international exchanges and cooperation in the field of non - proliferation and export control. china has",732,121,130,179,china_2008_NationalDefense.md,2025-01-28 18:54:15
348,"held regular arms control and non - proliferation consultations with a dozen countries and the eu, and non - proliferation dialogues with nato. china also maintains dialogues and exchanges with multina - tional export control regimes such as the australia group and the wassenaar arrangement. china supports the objectives and principles of the global initiative to combat nuclear terrorism. as one of the original partners of the initiative, china has taken part in all meetings of the partners. in december 2007 china and the united states jointly held a workshop 79 - - - - -",578,96,109,179,china_2008_NationalDefense.md,2025-01-28 18:54:15
349,# # # # # # in beijing on radiation emergency response within the framework of the initiative.,94,18,21,180,china_2008_NationalDefense.md,2025-01-28 18:54:15
350,# # # # # prevention of the introduction of weapons and an arms race in outer space,83,18,20,181,china_2008_NationalDefense.md,2025-01-28 18:54:15
351,"# # # # # # the chinese government has all along advocated the peaceful use of outer space, and opposed the introduction of weapons and an arms race in outer space. the existing international legal instruments con - cerning outer space are not sufficient to effectively prevent the spread of weapons to outer space. the international community should nego - tiate and conclude a new international legal instrument to close the loopholes in the existing legal system concerning outer space. in february 2008 china and russia jointly submitted to the cd a draft treaty on the prevention of the placement of weapons in outer space and the threat or use of force against outer space objects. china",693,118,130,182,china_2008_NationalDefense.md,2025-01-28 18:54:15
352,"hopes that the cd will start substantial discussions on the draft as soon as possible, and negotiate and conclude the treaty at an early date.",142,25,29,182,china_2008_NationalDefense.md,2025-01-28 18:54:15
353,# # # # # conventional arms control,35,8,10,183,china_2008_NationalDefense.md,2025-01-28 18:54:15
354,"# # # # # # china has earnestly fulfilled its obligations under the convention on certain conventional weapons ( ccw ) and its protocols. it has taken concrete measures to ensure that its anti - personnel landmines in service meet the relevant technical requirements of the amended pro - tocol on landmines. china actively participates in the work of the group of governmental experts ( gge ) on cluster munitions. china is also continuing its preparations for ratifying the protocol on explosive remnants of war. china has continuously taken an active part in in - ternational humanitarian de - mining assistance. in the past two years, it 80 - - -",649,112,130,184,china_2008_NationalDefense.md,2025-01-28 18:54:15
355,- -,3,2,4,184,china_2008_NationalDefense.md,2025-01-28 18:54:15
356,"# # # # # # has held de - mining training courses for angola, mozambique, chad, burundi, guinea - bissau, and both northern and southern sudan. china has also donated de - mining equipment to the above - mentioned coun - tries and egypt, and provided peru, ecuador and ethiopia with mine eradication funds. china has actively participated in the international efforts to com bat the illicit trade in small arms and light weapons ( salw ). it has conscientiously implemented the un program of action ( poa ) on salw and the international instrument on identifying and tracing il - licit salw. china has",601,106,130,185,china_2008_NationalDefense.md,2025-01-28 18:54:15
357,"issued and implemented new detailed rules on salw markings, and has taken part in the work of the un gge on an “ arms trade treaty. ”",133,27,33,185,china_2008_NationalDefense.md,2025-01-28 18:54:15
358,# # # # # transparency in military expenditures and registration of transfer of conventional arms,97,16,18,186,china_2008_NationalDefense.md,2025-01-28 18:54:15
359,"# # # # # # china attaches great importance to military transparency, and makes unremitting efforts to enhance military transparency and pro - mote mutual trust with other countries in the military sphere. in 2007 china joined the un standardized instrument for reporting military expenditures, and reports annually to the un the basic data of its mili - tary expenditures for the latest fiscal year. china has made important contributions to the establishment and development of the un register of conventional arms. after the register was established, china provided the register with annual data on imports and exports of conventional arms in the seven cate - gories covered by the register.",694,112,130,187,china_2008_NationalDefense.md,2025-01-28 18:54:15
360,"however, since 1996 a particular country has provided data on its arms sales to china ’ s taiwan prov - ince to the register, which contradicts the spirit of the relevant reso - lutions of the un general assembly as well as the objectives and principles of the register. china was impelled to suspend its submis 81 - - - - -",324,62,75,187,china_2008_NationalDefense.md,2025-01-28 18:54:15
