chunk_id,text,char_length,word_count,token_count,section_index,source_file,processed_date
1,# china ’ s national defense in 2008,36,8,10,0,china_2008_NationalDefense.md,2025-01-28 18:54:15
2,# # # # # # information office of the state council of the people ’ s republic of china,87,20,22,1,china_2008_NationalDefense.md,2025-01-28 18:54:15
3,"# # # # # january 2009, beijing - - - - -",41,13,16,2,china_2008_NationalDefense.md,2025-01-28 18:54:15
4,# # # contents,14,4,6,3,china_2008_NationalDefense.md,2025-01-28 18:54:15
5,"# # # # # # preface 1 i. the security situation 3 ii. national defense policy 8 iii. reform and development of the pla 13 iv. the army 27 v. the navy 31 vi. the air force 35 vii. the second artillery force 40 viii. the people ’ s armed police force 44 ix. national defense reserve buildup 50 x. the armed forces and the people 54 xi. science, technology and industry for national de fense 60 xii. defense expenditure 65 xiii. international security cooperation 70 xiv. arms control and disarmament 75 appendix i major international exchanges of the chinese",556,101,123,4,china_2008_NationalDefense.md,2025-01-28 18:54:15
6,# # # # # # military ( 2007 - 2008 ) appendix ii joint exercises and training with foreign armed forces ( 2007 - 2008 ) appendix iii china ’ s participation in un peacekeeping operations,186,37,39,5,china_2008_NationalDefense.md,2025-01-28 18:54:15
7,# # # # # # 83 99 100 - - - - -,31,14,16,6,china_2008_NationalDefense.md,2025-01-28 18:54:15
8,# # # # # # appendix iv imports and exports of seven major types of conventional arms of the prc ( 2007 ),105,24,26,7,china_2008_NationalDefense.md,2025-01-28 18:54:15
9,# # # # # # 102,15,7,9,8,china_2008_NationalDefense.md,2025-01-28 18:54:15
10,# # # # # # appendix v defense expenditure of the prc ( 1978 - 2007 ) 103 appendix vi major military regulations issued in 2007 and,131,28,30,9,china_2008_NationalDefense.md,2025-01-28 18:54:15
11,# # # # # # 2008,16,7,9,10,china_2008_NationalDefense.md,2025-01-28 18:54:15
12,# # # # # # 104 - - - - -,25,12,14,11,china_2008_NationalDefense.md,2025-01-28 18:54:15
13,"# # # # # # first edition 2009 china internet information center home page : http : / / www. china. org. cn e - mail : infornew @ public. bta. net. cn isbn 978 - 7 - 119 - 05605 - 0 © foreign languages press, beijing, china, 2009 published by foreign languages press 24 baiwanzhuang road, beijing 100037, china distributed by china international book trading corporation 35 chegongzhuang xilu, beijing 100044, china p. o. box 399, beijing, china printed in the people ’ s republic of china - - - -",497,94,130,12,china_2008_NationalDefense.md,2025-01-28 18:54:15
14,-,1,1,3,12,china_2008_NationalDefense.md,2025-01-28 18:54:15
15,# # # preface,13,4,6,13,china_2008_NationalDefense.md,2025-01-28 18:54:15
16,"# # # # # # the year 2008 was an extraordinary one in the history of the people ’ s republic of china ( prc ). in that year china overcame a devastating earthquake, with the epicenter in wenchuan county, si - chuan province ; successfully hosted the 29th olympic games and paralympics in beijing ; and greeted the 30th anniversary of the adop - tion of reform and opening - up policies. historic changes have taken place in the relations between con temporary china and the rest of the world. the chinese economy has become an important part of the world economy, china has become an important member of the international system, and",633,115,130,14,china_2008_NationalDefense.md,2025-01-28 18:54:15
17,"the future and destiny of china have been increasingly closely connected with the international community. china cannot develop in isolation from the rest of the world, nor can the world enjoy prosperity and stability without china. starting from this new historical turning point, china is unswerv ingly taking the road of peaceful development, unswervingly carrying out its policies of reform and opening - up and socialist modernization, unswervingly pursuing an independent foreign policy of peace and a national defense policy solely aimed at protecting its territory and peo - ple, and endeavoring to build, together with other countries, a harmo - nious world of",669,104,130,14,china_2008_NationalDefense.md,2025-01-28 18:54:15
18,"enduring peace and common prosperity. china adheres to taking the scientific outlook on development as an important guiding principle for national defense and armed forces building ; is actively adapting itself to new trends in world military de - velopment, taking it as its fundamental purpose to safeguard national 1 - - - - -",329,55,62,14,china_2008_NationalDefense.md,2025-01-28 18:54:15
19,"# # # # # # sovereignty, security and development, taking reform and innovation as its fundamental driving force, and advancing the modernization of its national defense and armed forces from a higher starting point. 2 - - - - -",228,41,47,15,china_2008_NationalDefense.md,2025-01-28 18:54:15
20,# # # i. the security situation,31,7,10,16,china_2008_NationalDefense.md,2025-01-28 18:54:15
21,"# # # # # # with the advent of the new century, the world is undergoing tre mendous changes and adjustments. peace and development remain the principal themes of the times, and the pursuit of peace, development and cooperation has become an irresistible trend of the times. however, global challenges are on the increase, and new security threats keep emerging. economic globalization and world multi - polarization are gaining momentum. the progress toward industrialization and informationiza - tion throughout the globe is accelerating and economic cooperation is in full swing, leading to increasing economic interdependence, inter - connectivity and interactivity among countries. the rise",694,105,130,17,china_2008_NationalDefense.md,2025-01-28 18:54:15
22,"and decline of international strategic forces is quickening, major powers are stepping up their efforts to cooperate with each other and draw on each other ’ s strengths. they continue to compete with and hold each other in check, and groups of new emerging developing powers are arising. therefore, a profound readjustment is brewing in the international system. in ad - dition, factors conducive to maintaining peace and containing war are on the rise, and the common interests of countries in the security field have increased, and their willingness to cooperate is enhanced, thereby keeping low the risk of worldwide, all - out and large - scale wars for a",660,110,130,17,china_2008_NationalDefense.md,2025-01-28 18:54:15
23,"relatively long period of time. world peace and development are faced with multiple difficulties and challenges. struggles for strategic resources, strategic locations and strategic dominance have intensified. meanwhile, hegemonism and power politics still exist, regional turmoil keeps spilling over, hot 3 - - - - -",317,46,58,17,china_2008_NationalDefense.md,2025-01-28 18:54:15
24,"# # # # # # spot issues are increasing, and local conflicts and wars keep emerging. the impact of the financial crisis triggered by the us subprime mort - gage crisis is snowballing. in the aspect of world economic development, issues such as energy and food are becoming more serious, highlight - ing deep - seated contradictions. economic risks are manifesting a more interconnected, systematic and global nature. issues such as terrorism, environmental disasters, climate change, serious epidemics, transna - tional crime and pirates are becoming increasingly prominent. the influence of military security factors on international relations is mounting. driven by competition in",681,104,130,18,china_2008_NationalDefense.md,2025-01-28 18:54:15
25,"overall national strength and the development of science and technology, international military compe - tition is becoming increasingly intense, and the worldwide revolution in military affairs ( rma ) is reaching a new stage of development. some major powers are realigning their security and military strategies, increasing their defense investment, speeding up the transformation of armed forces, and developing advanced military technology, weapons and equipment. strategic nuclear forces, military astronautics, missile defense systems, and global and battlefield reconnaissance and sur - veillance have become top priorities in their efforts to strengthen armed forces. some developing countries are also actively seeking to acquire advanced weapons and equipment to increase their",787,109,130,18,china_2008_NationalDefense.md,2025-01-28 18:54:15
26,"military power. all countries are attaching more importance to supporting diplomatic struggles with military means. as a result, arms races in some regions are heating up, posing grave challenges to the international arms con - trol and non - proliferation regime. the asia - pacific security situation is stable on the whole. the re gional economy is brimming with vigor, mechanisms for regional and sub - regional economic and security cooperation maintain their devel - opment momentum, and it has become the policy orientation of all countries to settle differences and hotspot issues peacefully through dialogue. the member states of the shanghai cooperation organiza - tion ( sc",684,108,130,18,china_2008_NationalDefense.md,2025-01-28 18:54:15
27,##o ) have signed the treaty on long - term good - neighborly 4 - - - - -,73,19,24,18,china_2008_NationalDefense.md,2025-01-28 18:54:15
28,"# # # # # # relations, friendship and cooperation, and practical cooperation has made progress in such fields as security and economy. the conclusion of the asean charter has enabled a new step to be taken toward asean integration. remarkable achievements have been made in cooperation between china and asean, as well as between asean and china, japan and the republic of korea. cooperation within the framework of the east asia summit ( eas ) and the south asian asso - ciation for regional cooperation ( saarc ) continues to make pro - gress. the six - party talks on the korean nuclear issue have scored successive achievements, and the tension in",651,113,130,19,china_2008_NationalDefense.md,2025-01-28 18:54:15
29,"northeast asia is much released. however, there still exist many factors of uncertainty in asia - pacific security. the drastic fluctuations in the world economy impact heavily on regional economic development, and political turbulence persists in some countries undergoing economic and social transition. ethnic and religious discords, and conflicting claims over territorial and maritime rights and interests remain serious, regional hotspots are complex. at the same time, the us has increased its strategic attention to and input in the asia - pacific region, further consolidating its military alliances, adjusting its military deployment and enhancing its military capabili - ties. in addition, terrorist, separatist",722,103,130,19,china_2008_NationalDefense.md,2025-01-28 18:54:15
30,"and extremist forces are running rampant, and non - traditional security issues such as serious natural disasters crop up frequently. the mechanisms for security cooperation between countries and regions are yet to be enhanced, and the capabil - ity for coping with regional security threats in a coordinated way has to be improved. china ’ s security situation has improved steadily. the achievements made in china ’ s modernization drive have drawn worldwide attention. china ’ s overall national strength has increased substantially, its peo - ple ’ s living standards have kept improving, the society remains stable and unified, and the capability for upholding national security has been further enhanced",709,111,130,19,china_2008_NationalDefense.md,2025-01-28 18:54:15
31,. the attempts of the separatist forces for “ taiwan 5 - - - - -,64,16,20,19,china_2008_NationalDefense.md,2025-01-28 18:54:15
32,"# # # # # # independence ” to seek “ de jure taiwan independence ” have been thwarted, and the situation across the taiwan straits has taken a sig - nificantly positive turn. the two sides have resumed and made pro - gress in consultations on the common political basis of the “ 1992 consensus, ” and consequently cross - straits relations have improved. meanwhile, china has made steady progress in its relations with the developed countries, strengthened in all respects the good - neighborly friendship with its neighboring countries, and kept deepening its tra - ditional friendship with the developing countries. china is playing an active",644,108,130,20,china_2008_NationalDefense.md,2025-01-28 18:54:15
33,"and constructive role in multilateral affairs, thus notably ele - vating its international position and influence. china is still confronted with long - term, complicated, and diverse security threats and challenges. issues of existence security and devel - opment security, traditional security threats and non - traditional secu - rity threats, and domestic security and international security are interwoven and interactive. china is faced with the superiority of the developed countries in economy, science and technology, as well as military affairs. it also faces strategic maneuvers and containment from the outside while having to face disruption and sabotage by separatist and hostile forces from the inside",716,106,130,20,china_2008_NationalDefense.md,2025-01-28 18:54:15
34,". being in a stage of economic and social transition, china is encountering many new circumstances and new issues in maintaining social stability. separatist forces working for “ taiwan independence, ” “ east turkistan independence ” and “ tibet independence ” pose threats to china ’ s unity and security. damages caused by non - traditional security threats like terrorism, natural disas - ters, economic insecurity, and information insecurity are on the rise. impact of uncertainties and destabilizing factors in china ’ s outside se - curity environment on national security and development is growing. in particular, the united states continues to sell",657,103,130,20,china_2008_NationalDefense.md,2025-01-28 18:54:15
35,"arms to taiwan in vio - lation of the principles established in the three sino - us joint commu - niques, causing serious harm to sino - us relations as well as peace and stability across the taiwan straits. 6 - - - - -",219,45,53,20,china_2008_NationalDefense.md,2025-01-28 18:54:15
36,"# # # # # # in the face of unprecedented opportunities and challenges, china will hold high the banner of peace, development and cooperation, persist in taking the road of peaceful development, pursue the open - ing - up strategy of mutual benefit, and promote the building of a har - monious world with enduring peace and common prosperity ; and it will persist in implementing the scientific outlook on development in a bid to achieve integration of development with security, persist in giving due consideration to both traditional and non - traditional secu - rity issues, enhancing national strategic capabilities, and perfecting the national emergency management system. at the same time,",694,113,130,21,china_2008_NationalDefense.md,2025-01-28 18:54:15
37,"it will per - sist in pursuing the new security concept featuring mutual trust, mutual benefit, equality and coordination, and advocating the settlement of international disputes and hotspot issues by peaceful means. it will encourage the advancement of security dialogues and cooperation with other countries, oppose the enlargement of military alliances, and acts of aggression and expansion. china will never seek hegemony or en - gage in military expansion now or in the future, no matter how devel - oped it becomes. 7 - - - - -",533,88,108,21,china_2008_NationalDefense.md,2025-01-28 18:54:15
38,# # # ii. national defense policy,33,7,10,22,china_2008_NationalDefense.md,2025-01-28 18:54:15
39,"# # # # # # china pursues a national defense policy which is purely defensive in nature. china places the protection of national sovereignty, security, territorial integrity, safeguarding of the interests of national develop - ment, and the interests of the chinese people above all else. china en - deavors to build a fortified national defense and strong military forces compatible with national security and development interests, and enrich the country and strengthen the military while building a moderately prosperous society in all aspects. china ’ s national defense policy for the new stage in the new cen tury basically includes : upholding national security and unity, and en",686,110,130,23,china_2008_NationalDefense.md,2025-01-28 18:54:15
40,"- suring the interests of national development ; achieving the all - round, coordinated and sustainable development of china ’ s national defense and armed forces ; enhancing the performance of the armed forces with informationization as the major measuring criterion ; implementing the military strategy of active defense ; pursuing a self - defensive nuclear strategy ; and fostering a security environment conducive to china ’ s peaceful development. according to the requirements of national security and the level of economic and social development, china pursues a three - step devel - opment strategy to modernize its national defense and armed forces step by step in a well - planned way. this strategic",711,114,130,23,china_2008_NationalDefense.md,2025-01-28 18:54:15
41,framework is defined as follows : promoting the informationization of china ’ s national defense and armed forces. taking informationization as the goal of modernization of its national defense and armed forces and in light of its national and 8 - - - - -,255,45,50,23,china_2008_NationalDefense.md,2025-01-28 18:54:15
42,"# # # # # # military conditions, china actively pushes forward the rma with chinese characteristics. it has formulated in a scientific way strategic plans for national defense and armed forces building and strategies for the development of the services and arms, according to which it will lay a solid foundation by 2010, basically accomplish mechanization and make major progress in informationization by 2020, and by and large reach the goal of modernization of national defense and armed forces by the mid - 21st century. overall planning of economic development and national defense building. sticking to the principle of coordinated development of economy and national defense, china makes overall plans for the use of its",727,116,130,24,china_2008_NationalDefense.md,2025-01-28 18:54:15
43,"national resources and strikes a balance between enriching the country and strengthening the military, so as to ensure that its strategy for national defense and armed forces building is compatible with its strategy for national development. it makes national defense building an organic part of its social and economic development, endeavors to establish scientific mechanisms for the coordinated development of economy and national defense, and thus provides rich resources and sustainable driving force for the modernization of its national defense and armed forces. in national defense building, china makes it a point to take into consideration the needs of economic and social develop - ment and insists on having military and civilian purposes compatible with and beneficial to each",789,119,130,24,china_2008_NationalDefense.md,2025-01-28 18:54:15
44,"other, so as to achieve more social benefits in the use of national defense resources in peacetime. deepening the reform of national defense and armed forces. china is working to adjust and reform the organization, structure and policies of the armed forces, and will advance step by step the mod - ernization of the organizational form and pattern of the armed forces in order to develop by 2020 a complete set of scientific modes of organi - zation, institutions and ways of operation both with chinese character - istics and in conformity with the laws governing the building of modern armed forces. china strives to adjust and reform the systems of 9",654,112,130,24,china_2008_NationalDefense.md,2025-01-28 18:54:15
45,- - - - -,9,5,7,24,china_2008_NationalDefense.md,2025-01-28 18:54:15
46,"# # # # # # defense - related industry of science and technology and the procurement of weapons and equipment, and enhance its capacity for independent innovation in r & d of weapons and equipment with better quality and cost - effectiveness. china endeavors to establish and improve the sys - tems of weaponry and equipment research and manufacturing, military personnel training and logistical support that integrate military with civilian purposes and combine military efforts with civilian support. in addition, china makes an effort to establish and improve a national defense mobilization system that is centralized and unified, well struc - tured, rapid in reaction, and authoritative and efficient. taking the road of",725,114,130,25,china_2008_NationalDefense.md,2025-01-28 18:54:15
47,"leapfrog development. persisting in taking mechanization as the foundation and informationization as focus, china is stepping up the composite development of mechanization and informationization. persisting in strengthening the military by means of science and technology, china is working to develop new and high - tech weaponry and equipment, carry out the strategic project of training talented people, conduct military training in conditions of in - formationization, and build a modern logistics system in an all - round way, so as to change the mode of formation of war - fighting capabilities. persisting in laying stress on priorities, china distinguishes between the primary and the secondary,",702,105,130,25,china_2008_NationalDefense.md,2025-01-28 18:54:15
48,"and refrains from doing certain things, striving to achieve leapfrog development in key areas. china persists in building the armed forces through diligence and thrift, attaching importance to scientific management, in order to make the fullest use of its limited defense resources. china implements a military strategy of active defense. strategi cally, it adheres to the principle of featuring defensive operations, self - defense and striking and getting the better of the enemy only after the enemy has started an attack. in response to the new trends in world military developments and the requirements of the national security and development strategy, china has",668,103,130,25,china_2008_NationalDefense.md,2025-01-28 18:54:15
49,formulated a military strategic guideline of active defense for the new period. 10 - - - - -,92,18,22,25,china_2008_NationalDefense.md,2025-01-28 18:54:15
50,"# # # # # # this guideline aims at winning local wars in conditions of informa tionization. it takes into overall consideration the evolution of modern warfare and the major security threats facing china, and prepares for defensive operations under the most difficult and complex circum - stances. meeting the requirements of confrontation between war sys - tems in modern warfare and taking integrated joint operations as the basic approach, it is designed to bring the operational strengths of dif - ferent services and arms into full play, combine offensive operations with defensive operations, give priority to the flexible application of strategies and tactics, seek advantages and avoid disadvantage",706,110,130,26,china_2008_NationalDefense.md,2025-01-28 18:54:15
51,"##s, and make the best use of our strong points to attack the enemy ’ s weak points. it endeavors to refine the command system for joint operations, the joint training system and the joint support system, optimize the structure and composition of forces, and speed up the building of a combat force structure suitable for winning local wars in conditions of informationization. this guideline lays stress on deterring crises and wars. it works for close coordination between military struggle and political, diplomatic, economic, cultural and legal endeavors, strives to foster a favorable security environment, and takes the initiative to prevent and defuse crises, and deter conflicts",686,107,132,26,china_2008_NationalDefense.md,2025-01-28 18:54:15
52,"and wars. it strictly adheres to a position of self - defense, exercises prudence in the use of force, seeks to effec - tively control war situations, and strives to reduce the risks and costs of war. it calls for the building of a lean and effective deterrent force and the flexible use of different means of deterrence. china remains committed to the policy of no first use of nuclear weapons, pursues a self - defensive nuclear strategy, and will never enter into a nuclear arms race with any other country. this guideline focuses on enhancing the capabilities of the armed forces in countering various security threats",622,107,130,26,china_2008_NationalDefense.md,2025-01-28 18:54:15
53,and accomplishing diver - sified military tasks. with the focus of attention on performing the historical missions of the armed forces for the new stage in the new 11 - - - - -,176,34,39,26,china_2008_NationalDefense.md,2025-01-28 18:54:15
54,"# # # # # # century and with raising the capability to win local wars in conditions of informationization at the core, it works to increase the country ’ s capabilities to maintain maritime, space and electromagnetic space security and to carry out the tasks of counter - terrorism, stability maintenance, emergency rescue and international peacekeeping. it takes military operations other than war ( mootw ) as an important form of applying national military forces, and scientifically makes and executes plans for the development of mootw capabilities. china participates in international security cooperation, conducts various forms of mili - tary exchanges and promotes the establishment of military confi -",711,110,130,27,china_2008_NationalDefense.md,2025-01-28 18:54:15
