chunk_id,text,char_length,word_count,token_count,section_index,source_file,processed_date
117,". b. regionale militarische sicherheitslage, vollzugsbehorde, reservistenarbeit ( außerhalb beorderungen ) und kurierdienst 30 siehe glossar bundeswehr konnen zu hilfeleistungen herangezogen werden. die reserve unterstutzt aktive truppenteile und dienststellen und erhoht deren durchhaltefahigkeit. die steuerung von hilfeleistungen der bundeswehr im inland erfolgt durch die",375,44,130,15,germany_2013_KonzeptionDerBundeswehr_noneng.md,2025-01-28 18:57:01
118,territoriale organisation.,26,2,6,15,germany_2013_KonzeptionDerBundeswehr_noneng.md,2025-01-28 18:57:01
119,"# # rettung und evakuierung, geiselbefreiung im ausland die bundeswehr leistet einen wesentlichen beitrag zur gesamtstaatlichen aufgabe der nationalen krisen - und risikovorsorge ( natkrv ), um den schutz und die sicherheit deutscher staatsangehoriger im ausland zu gewahrleisten. die aufgabe umfasst die krisenvorsorgeberatung der deutschen auslandsvertretungen, die erhebung krisen",383,49,130,16,germany_2013_KonzeptionDerBundeswehr_noneng.md,2025-01-28 18:57:01
120,"##relevanter daten und als dauereinsatzaufgabe31 das vorhalten einsatzbereiter krafte fur die bewaltigung krisenhafter lagen im ausland. operationen zur rettung, evakuierung und geiselbefreiung im ausland werden grundsatzlich ressortgemeinsam vorbereitet, in nationaler verantwortung durchgefuhrt und lageabhangig multinational koordiniert. sie erfordern besondere geheimhaltung und",382,41,130,16,germany_2013_KonzeptionDerBundeswehr_noneng.md,2025-01-28 18:57:01
121,"den zugriff auf ausgewahlte militarische fahigkeiten. die beteiligung von verbundeten und partnern ist im einzelfall moglich. der einsatz unterliegt keinen geografischen einschrankungen, kann ohne vorwarnzeit in unmittelbarer reaktion erfolgen und ist von kurzer dauer. die bereitstellung der erforderlichen fahigkeiten in hochster verfugungsbereitschaft ist eine strukturbe",374,45,130,16,germany_2013_KonzeptionDerBundeswehr_noneng.md,2025-01-28 18:57:01
122,##grundende dauereinsatzaufgabe. sie wird von spezial - und spezialisierten kraften unter abstutzung auf weitere fahigkeiten im bundeswehrgemeinsamen einsatzverbund wahrgenommen.,178,19,68,16,germany_2013_KonzeptionDerBundeswehr_noneng.md,2025-01-28 18:57:01
123,"# # partnerschaft und kooperation partnerschaft und kooperation unterstutzt die praventive sicherheitspolitik. sie ist standige aufgabe32 der bundeswehr und dient dazu, vertrauen zu bilden, stabilitat zu fordern und dadurch bewaffneten konflikten vorzubeugen. zu dieser aufgabe gehoren neben dem aufbau und der kontinuierlichen pflege der bilateralen beziehungen unter anderem auch rustungskont",394,50,130,17,germany_2013_KonzeptionDerBundeswehr_noneng.md,2025-01-28 18:57:01
124,"##rollmaßnahmen, vertrauens - und sicherheitsbildende maßnahmen ( vsbm ), ausbildungsunterstutzung und die beteiligung an multinationalen ubungen oder manovern. die deutsche rustungspolitik schafft die grundlagen fur die internationale rustungskooperation als teil von partnerschaft und kooperation. durch partnerschaft und kooperation konnen die krafte von staaten einer region befahigt werden, die verantwortung fur die sic",425,52,132,17,germany_2013_KonzeptionDerBundeswehr_noneng.md,2025-01-28 18:57:01
125,##herheit in einer krisenregion zu ubernehmen. das tragt zur dauerhaften konfliktvorbeugung bei und kann eigene krafte entlasten. beitrage im rahmen der partnerschaft und kooperation werden aus den bestehenden strukturen heraus erfullt. im einzelfall konnen strukturelemente fur diese aufgabe verstarkt werden. 31 siehe glossar unter aufgabentypen 32 siehe glossar unter auf,374,50,132,17,germany_2013_KonzeptionDerBundeswehr_noneng.md,2025-01-28 18:57:01
126,##gabentypen,12,1,7,17,germany_2013_KonzeptionDerBundeswehr_noneng.md,2025-01-28 18:57:01
127,"# # hilfeleistungen im ausland die bundeswehr leistet subsidiar mit verfugbaren kraften und mitteln hilfe im ausland33 bei naturkatastrophen und besonders schweren unglucksfallen. auch im rahmen der konfliktverhutung und krisenbewaltigung konnen sich hilfeersuchen zeitweilig auf die dort eingesetzten streitkrafte konzentrieren, solange die dafur spezial",355,44,130,18,germany_2013_KonzeptionDerBundeswehr_noneng.md,2025-01-28 18:57:01
128,##isierten und zustandigen zivilen organisationen in einem einsatzgebiet noch nicht in ausreichendem umfang handlungsfahig sind.,128,15,48,18,germany_2013_KonzeptionDerBundeswehr_noneng.md,2025-01-28 18:57:01
129,"# # weitere gesamtstaatliche aufgaben die bundeswehr nimmt gesamtstaatliche aufgaben wahr und unterstutzt dadurch im grundgesetzlich moglichen rahmen andere staatliche institutionen. den kern bildet dabei ihr beitrag zum heimatschutz. sie tragt zur krisenvorsorge, zum krisenmanagement, zum gesamtstaatlichen lagebild und zur protokollarischen reprasentanz bei und gewahr",371,45,130,19,germany_2013_KonzeptionDerBundeswehr_noneng.md,2025-01-28 18:57:01
130,##leistet den politisch - parlamentarischen flugbetrieb. wissenschaftliche einrichtungen der bundeswehr tauschen ihre erkenntnisse mit zivilen institutionen aus. daruber hinaus bringt sich die bundeswehr bei der gestaltung ressortgemeinsamer optimierungsprozesse ein34 und nimmt impulse aus den landern auf. die bundeswehr ist fur den schutz ihrer eigenen informations - und kommunikationsinfrastruktur und,406,49,132,19,germany_2013_KonzeptionDerBundeswehr_noneng.md,2025-01-28 18:57:01
131,"ihrer daten verantwortlich. sie trifft vorkehrungen gegen bedrohungen aus dem cyberraum innerhalb ihres verantwortungsbereichs35. 33 auch beitrage zur humanitaren hilfe 34 z. b. bei der einrichtung leistungsubergreifender elemente in der bundesverwaltung 35 die gewahrleistung von sicherheit im cyberraum, die durchsetzung von recht und der schutz der kritischen informationsinfrastrukt",386,48,130,19,germany_2013_KonzeptionDerBundeswehr_noneng.md,2025-01-28 18:57:01
132,##uren richten sich nach der cyber - sicherheitsstrategie fur deutschland vom 21. februar 2012 unter federfuhrung des bmi.,122,18,43,19,germany_2013_KonzeptionDerBundeswehr_noneng.md,2025-01-28 18:57:01
133,"# # 4. bundeswehrgemeinsame prinzipien 4. 1 einsatzorientierung die bundeswehr hat die ihr gestellten aufgaben permanent zu erfullen. dazu gehoren neben den mandatierten einsatzen36 der konfliktverhutung und krisenbewaltigung die kontinuierlich zu leistenden dauereinsatzaufgaben, einsatzgleichen verpflichtungen, daueraufgaben zur unterstutzung von einsatzen, stand",366,41,130,20,germany_2013_KonzeptionDerBundeswehr_noneng.md,2025-01-28 18:57:01
134,"##ige aufgaben, maßnahmen des heimatschutzes37 und die vorbereitung und unterstutzung dieser einsatze aus der basis inland38. dieses aufgabenspektrum beschreibt die leistung, die die bundeswehr mit ihrem breiten potenzial an fahigkeiten und einer vielzahl an instrumenten zur wirkung bringt. hinzu kommt der tagliche dienst in der basis inland, der zur aufrechterhaltung des betriebs der bundeswehr er",401,55,133,20,germany_2013_KonzeptionDerBundeswehr_noneng.md,2025-01-28 18:57:01
135,"##forderlich ist. einsatzorientierung bedeutet, die bundeswehr auf die gesamtheit dieser leistungen auszurichten. sie verlangt das selbstverstandnis, dass nicht nur das personal im auslandseinsatz, sondern - unabhangig vom dienstort - alle militarischen und zivilen angehorigen der bundeswehr einschließlich der reservistendienst leistenden zum einsatz beitragen. viele prozesse verbinden",388,46,132,20,germany_2013_KonzeptionDerBundeswehr_noneng.md,2025-01-28 18:57:01
136,"die basis inland unmittelbar mit den kraften im einsatz. diese zunehmende verflechtung und die moglichkeit, einsatzaufgaben direkt aus deutschland heraus zu erfullen, lassen keine bruche zwischen dem dienst im heimatland und dem in einem einsatzgebiet zu. alle prozesse sind deshalb an den einsatzerfordernissen auszurichten. "" vom einsatz her denken "" ist dabei die richtschnur. einsat",386,55,130,20,germany_2013_KonzeptionDerBundeswehr_noneng.md,2025-01-28 18:57:01
137,"##zorientierung fordert von den angehorigen der bundeswehr ein hohes maß an physischer und psychischer robustheit sowie personlicher flexibilitat und mobilitat. verlasslichkeit, fursorge und planungssicherheit im gegenzug ist selbstverpflichtung der bundeswehr gegenuber all ihren angehorigen. die besonderen risiken in den auslandseinsatzen werden durch versorgungsrechtliche regelungen39 berucksic",399,45,133,20,germany_2013_KonzeptionDerBundeswehr_noneng.md,2025-01-28 18:57:01
138,"##htigt. bundeswehrgemeinsames denken und handeln ist uber die aktuellen auslandseinsatze hinaus darauf ausgerichtet, die befahigung der bundeswehr zum einsatz im hinblick auf neue und zukunftige entwicklungen im gesamten aufgabenspektrum auszurichten.",252,30,91,20,germany_2013_KonzeptionDerBundeswehr_noneng.md,2025-01-28 18:57:01
139,"# # 4. 2 langfristige sicherheitsvorsorge die langfristige sicherheitsvorsorge hat zum ziel, die bundeswehr auf die wahrscheinlichen und auf neue herausforderungen vorzubereiten. angesichts der begrenzten vorhersehbarkeit kunftiger herausforderungen muss die bundeswehr uber ein breites spektrum an fahigkeiten verfugen, um bei bedarf schnell schwerpunkte bilden zu konne",371,46,130,21,germany_2013_KonzeptionDerBundeswehr_noneng.md,2025-01-28 18:57:01
140,"##n. dabei erfordern anpassungen der streitkrafte im regelfall auch angleichungen der beitrage der zivilen organisationsbereiche. zu den aufgaben der zukunftsentwicklung40 als wesentlichem verfahren der langfristigen sicherheitsvorsorge gehort es, diese schwerpunkte rechtzeitig zu identifizieren. die 36 siehe glossar 37 z. b. sicherheit im deutschen luft - und seeraum und",374,48,132,21,germany_2013_KonzeptionDerBundeswehr_noneng.md,2025-01-28 18:57:01
141,"absicherung militarischer liegenschaften, im rahmen subsidiarer hilfeleistung 38 vgl. 5. 4 basis inland 39 u. a. einsatzversorgungsgesetz, einsatz - weiterverwendungsgesetz, einsatzversorgungs - verbesserungsgesetz 40 siehe glossar bundeswehr stutzt sich unter anderem auf erkenntnisse der rustungskontrolle und des militarischen nachrichtenwesens und berucksichtig",365,41,130,21,germany_2013_KonzeptionDerBundeswehr_noneng.md,2025-01-28 18:57:01
142,"##t erkenntnisse aus der auswertung der einsatzerfahrungen, der technologischen entwicklungen sowie der analyse geopolitischer veranderungsprozesse. mit wissenschaftlichen methoden41 tragt sie kontinuierlich zur risikoabschatzung und fruherkennung bei, zeigt trends auf und hilft, neue bedrohungen zu erkennen. die erkenntnisse bilden den ausgangspunkt fur planungen und die weiterentwicklung all",396,46,132,21,germany_2013_KonzeptionDerBundeswehr_noneng.md,2025-01-28 18:57:01
143,"##er bereiche der bundeswehr. vorschlage zum umgang mit sich abzeichnenden risiken und bedrohungen dienen der kontinuierlichen anpassung des leistungsprofils. im sinne einer lernenden organisation entwickelt sich die bundeswehr permanent weiter. um neue herausforderungen zu bewaltigen, muss sie schnell uber den im eigenen bereich vorhandenen zivilen und militarischen sachverstand hinaus",389,49,132,21,germany_2013_KonzeptionDerBundeswehr_noneng.md,2025-01-28 18:57:01
144,"kompetenzen aufbauen konnen. ein wesentliches element hierfur bildet die beteiligung an expertennetzwerken, in denen trends und analysen diskutiert und bewertet werden. reservistendienst leistende mit spezifischen kenntnissen aus ihrer zivilen tatigkeit konnen ihren rat und sachverstand beisteuern.",299,36,104,21,germany_2013_KonzeptionDerBundeswehr_noneng.md,2025-01-28 18:57:01
145,"# # 4. 3 multinationalitat die feste integration in bundnisse ist ein kennzeichnendes merkmal der bundeswehr von ihrer grundung an. sie resultiert aus der politischen einbindung deutschlands in nato und eu und ist ein sichtbares zeichen fur verbundenheit, gestaltungswillen und das eintreten fur gemeinsame wertvorstellungen und interessen. daher ist das nationale fahigkeitsprofil strukturell und inhaltlich",408,55,130,22,germany_2013_KonzeptionDerBundeswehr_noneng.md,2025-01-28 18:57:01
146,"an nato - und eu - verteidigungsplanungszielen bzw. - fahigkeitsforderungen orientiert. einsatze der bundeswehr finden gemeinsam mit verbundeten und partnern im rahmen von nato, eu, vn und osze statt. eine ausnahme konnen national gefuhrte einsatze zur rettung, evakuierung und geiselbefreiung im ausland sein. neben der politischen bedeutung hat die multinationale zusammenarbeit",380,51,130,22,germany_2013_KonzeptionDerBundeswehr_noneng.md,2025-01-28 18:57:01
147,"erhebliche militarische und praktische auswirkungen. sie kann handlungsoptionen erweitern, die durchhaltefahigkeit eigener krafte erhohen und kosten reduzieren ; umgekehrt ergeben sich aus bundnisverpflichtungen planerische vorgaben an die eigenen fahigkeiten. deshalb bedarf die multinationale zusammenarbeit grundsatzlich der kontinuierlichen politischen abstimmung und",371,40,130,22,germany_2013_KonzeptionDerBundeswehr_noneng.md,2025-01-28 18:57:01
148,"kann das zuruckstellen nationaler vorbehalte erfordern. die beitrage, die deutschland dabei im multinationalen rahmen zur verfugung stellt, sind eine wesentliche grundlage, um selbst einfluss auf planungen und entscheidungen zur lastenteilung in der nato und im rahmen der gemeinsamen sicherheits - und verteidigungspolitik der eu nehmen zu konnen. weil die zusammensetzung der krafte in multinationalen kontingenten",416,55,130,22,germany_2013_KonzeptionDerBundeswehr_noneng.md,2025-01-28 18:57:01
149,"vor allem bei neuen einsatzen nur in begrenztem maße planbar ist, bestehen besondere anforderungen an die interoperabilitat der eingesetzten krafte und mittel. sie hangt neben einem gemeinsamen 41 siehe glossar operativen verstandnis von der harmonisierung von vorgaben, verfahren42, ausbildung und der kompatibilitat von material und ausrustung in den bundnissen ab. modularitat und interoperabilitat er",404,54,130,22,germany_2013_KonzeptionDerBundeswehr_noneng.md,2025-01-28 18:57:01
150,##moglichen in diesem zusammenhang die integration militarischer beitrage anderer nationen in eigene strukturen und das einbringen eigener krafte in multinationale strukturen.,175,21,55,22,germany_2013_KonzeptionDerBundeswehr_noneng.md,2025-01-28 18:57:01
151,"# # rahmennation das leistungsprofil der bundeswehr berucksichtigt fahigkeiten und kapazitaten zur ubernahme sicherheits -, verteidigungs - und rustungspolitischer verantwortung deutschlands als rahmennation. das beinhaltet auch, in einem multinationalen einsatz anteile von streitkraften der verbundeten und partner integrieren und fuhren zu konnen. die bundeswehr muss in einer solchen",387,48,130,23,germany_2013_KonzeptionDerBundeswehr_noneng.md,2025-01-28 18:57:01
152,"fuhrungsrolle grundsatzlich uber das gesamte fahigkeitsspektrum im verbund von fuhrung, aufklarung, wirkung und unterstutzung verfugen43. von einer rahmennation werden dabei vor allem schlusselfahigkeiten in der fuhrung, aufklarung und unterstutzung erwartet, uber die nicht alle verbundete oder partner in gleichem maße verfugen. in dieser rolle werden kontingente",365,46,130,23,germany_2013_KonzeptionDerBundeswehr_noneng.md,2025-01-28 18:57:01
153,"der bundeswehr deshalb aus einem funktionellen verbund bestehen mit einem kern im bereich wirkung und grundmodulen der fuhrung, aufklarung und unterstutzung44. verbundete und partner sind eingeladen, die im kontingent bereitgestellten fahigkeiten vor allem im bereich wirkung und mit weiteren funktionalen elementen, die ihnen zur verfugung stehen, zu erganzen. um die kontinuitat",380,51,130,23,germany_2013_KonzeptionDerBundeswehr_noneng.md,2025-01-28 18:57:01
154,"der kraftegenerierung zu fordern, sind dazu vorzugsweise langfristig wirksame konfigurationen anzustreben. die beitrage konnen in abstimmung zwischen den truppen stellenden nationen abwechseln.",193,22,70,23,germany_2013_KonzeptionDerBundeswehr_noneng.md,2025-01-28 18:57:01
155,"# # multinationale fahigkeitsentwicklung fahigkeiten der bundeswehr orientieren sich grundsatzlich an den fahigkeitsforderungen von nato und eu. nationale fahigkeitsentwicklungen mussen so koordiniert werden, dass lucken bei den fahigkeiten einer nation nicht zu einer fahigkeitslucke in nato und eu fuhren. bei der bewertung von fahigkeiten der bundeswehr ist dazu regelmaßig deren einordnu",391,51,130,24,germany_2013_KonzeptionDerBundeswehr_noneng.md,2025-01-28 18:57:01
156,"##ng in das fahigkeitsprofil und den kunftigen fahigkeitsbedarf von nato und eu und ggf. das fahigkeitsprofil einzelner partner zu berucksichtigen. auf nationale fahigkeiten und kapazitaten kann nur dann verzichtet werden, wenn die verfugbarkeit durch multinationale abstimmung gesichert ist oder in angemessener zeit aus den vorhandenen fahigkeiten bzw. ressourcen auf",369,49,132,24,germany_2013_KonzeptionDerBundeswehr_noneng.md,2025-01-28 18:57:01
157,"##gebaut werden kann. zudem ist es moglich, fahigkeiten quantitativ zu reduzieren, wenn die geforderte durchhaltefahigkeit durch abstimmung in den bundnissen gesichert werden kann. dazu werden mit den etablierten verteidigungsplanungsverfahren45 von nato und eu die fahigkeitsprofile zwischen den partnern abgestimmt und fahigkeitsdefizite aus",343,42,132,24,germany_2013_KonzeptionDerBundeswehr_noneng.md,2025-01-28 18:57:01
158,"##geglichen, um ein umfassendes und moglichst luckenloses fahigkeitsspektrum mit hoher 42 z. b. kenntnis und umsetzung von multinationalen verfahrensvorschriften wie bspw. copd und verfahrensregelungen wie bspw. sop sowie anwendung in ubung, ausbildung und einsatz 43 vgl. 5. 3 verbund fawu unter berucksichtigung 5. 6 gestaltungsparameter (",341,46,132,24,germany_2013_KonzeptionDerBundeswehr_noneng.md,2025-01-28 18:57:01
159,"breite vor tiefe ) 44 so genannte "" enabler "" 45 nato defence planning process ( ndpp ) bzw. capability development mechanism ( cdm ) durchhaltefahigkeit zu gewahrleisten. diese multinationale abstimmung ist integraler bestandteil des nationalen planungsprozesses mit direktem einfluss auf die nationale fahigkeitsentwicklung. dadurch werden die etablierten verteidigungsplanungsverfahren synchronisiert, gestar",411,51,130,24,germany_2013_KonzeptionDerBundeswehr_noneng.md,2025-01-28 18:57:01
160,##kt und ungewollte redundanzen vermieden. daruber hinaus ist eine enge zusammenarbeit mit anderen nationen anzustreben.,120,15,48,24,germany_2013_KonzeptionDerBundeswehr_noneng.md,2025-01-28 18:57:01
161,"# # internationale personelle reprasentanz angehorige der bundeswehr werden in die bundnisstrukturen, in weitere internationale organisationen und in multinationale stabe entsandt. hinzu kommen bilaterale kontakte durch militar - und wehrtechnische attaches und attachees, bundeswehrgemeinsame verbindungselemente, austauschpersonal und personal zur begleitung von rustungsprogrammen und die teilnahme an ausbildungsgangen im ausland. internationale person",456,51,130,25,germany_2013_KonzeptionDerBundeswehr_noneng.md,2025-01-28 18:57:01
162,"##elle reprasentanz resultiert aus sicherheits -, verteidigungs - und rustungspolitischen interessen deutschlands und dem zusammenarbeitsbedarf mit der aufnehmenden organisation. durch dieses engagement wird einerseits den organisationen qualifiziertes personal zur verfugung gestellt, andererseits ermoglicht es, eigene interessen aktiv und konstruktiv in die organisationen einzubringen. in multinationalen staben und organisationen eingesetzte ang",450,50,132,25,germany_2013_KonzeptionDerBundeswehr_noneng.md,2025-01-28 18:57:01
163,"##ehorige der bundeswehr handeln im rahmen ihrer aufgabenstellung im sinne dieser interessen. unabhangig von der jeweiligen funktion reprasentieren alle in internationaler funktion eingesetzten angehorigen der bundeswehr diese gegenuber anderen nationen und internationalen organisationen. mit ihren erfahrungen, eindrucken und erkenntnissen tragen sie dazu bei, dass die bundeswehr ihrer multinationalen ausrichtung in vollem umfang",433,52,132,25,germany_2013_KonzeptionDerBundeswehr_noneng.md,2025-01-28 18:57:01
164,gerecht wird.,13,2,7,25,germany_2013_KonzeptionDerBundeswehr_noneng.md,2025-01-28 18:57:01
165,"# # 4. 4 vernetztes denken und handeln die vielschichtigen ursachen heutiger konflikte und krisen erfordern ein umfassendes verstandnis von sicherheit, das die teilweise komplexen zusammenhange der inneren und außeren sicherheit deutschlands beachtet. die gewahrleistung von sicherheit und stabilitat verlangen zunehmend einen im in - und ausland abgestimmten ansatz aller handelnden ak",386,52,130,26,germany_2013_KonzeptionDerBundeswehr_noneng.md,2025-01-28 18:57:01
166,"##teure46 ; nicht zuletzt auch im sinne der effizienz. die durch die bundeswehr unterstutzte vernetzte sicherheit ist ein national und international anwendbares handlungsprinzip. es dient dazu, alle fur die erweiterte sicherheit relevanten staatlichen und nicht staatlichen akteure zu verknupfen und langfristig in ein koordiniertes gemeinsames krisenmanagement mit dem ziel eines kohar",386,51,132,26,germany_2013_KonzeptionDerBundeswehr_noneng.md,2025-01-28 18:57:01
167,"##enten gesamtansatzes zu integrieren. dies erfolgt in allen krisenund konfliktphasen47 und kann verschiedene auspragungen der vernetzung48 umfassen, wobei deren grad sich an effizienz - und effektivitatskriterien orientiert. diesen ansatz gilt es, national wie international - vornehmlich mit eu, nato und vn - fortzuentwickeln und zu intensivieren. 46 comprehensive approach - ressortubergre",393,51,132,26,germany_2013_KonzeptionDerBundeswehr_noneng.md,2025-01-28 18:57:01
168,"##ifendes zusammenwirken 47 pravention, fruherkennung, bewaltigung und nachsorge 48 z. b. ziele, prozesse, fahigkeiten, aufgaben und strukturen in den bereichen ausbildung, planung, einsatz, auswertung, weiterentwicklung sowie entscheidungsfindung der fuhrung. in krisengebieten sind sicherheit und stabilitat voraussetzungen fur einen",335,38,132,26,germany_2013_KonzeptionDerBundeswehr_noneng.md,2025-01-28 18:57:01
169,"dauerhaften frieden. sie erfordern ein system, das dem individuellen sicherheitsbedurfnis der jeweiligen bevolkerung rechnung tragt, von der bevolkerung akzeptiert wird und politisch legitimiert ist. dabei sind gesellschaftliche, okonomische, okologische, volkerrechtliche und kulturelle bedingungen zu berucksichtigen. die bundeswehr kann deshalb im sinne des vernetzten ansatzes nur",384,45,130,26,germany_2013_KonzeptionDerBundeswehr_noneng.md,2025-01-28 18:57:01
170,"im zusammenwirken mit vielen anderen institutionen beitrage leisten. im rahmen des heimatschutzes leistet die bundeswehr im inland unter abstutzung auf ihre fahigkeit zur zivil - militarischen zusammenarbeit ( zmz ) einen beitrag zur gesamtstaatlichen sicherheitsvorsorge. die territoriale organisation bildet dazu ein flachendeckendes, an der foderalen struktur ausgerichtetes und zum",385,49,130,26,germany_2013_KonzeptionDerBundeswehr_noneng.md,2025-01-28 18:57:01
171,"teil durch reservistendienst leistende getragenes netzwerk, um zivile stellen auf bundes -, landes - und kommunalebene zu beraten und zu unterstutzen. daruber hinaus bringt sich die bundeswehr als teil der exekutive aktiv und gestaltend in die laufende verwaltungsmodernisierung ein, um sicherzustellen, dass belange der bundeswehr bei der ressortubergreifenden betrachtung berucksicht",385,50,130,26,germany_2013_KonzeptionDerBundeswehr_noneng.md,2025-01-28 18:57:01
172,"##igung finden. insgesamt leitet sich daraus das zunehmende erfordernis einer engen zusammenarbeit der bundeswehr mit staatlichen und nicht staatlichen akteuren im in - und ausland ab, um die sicherheit deutschlands zu gewahrleisten.",233,32,85,26,germany_2013_KonzeptionDerBundeswehr_noneng.md,2025-01-28 18:57:01
173,"# # 4. 5 selbstverstandnis das selbstverstandnis und die organisationskultur der bundeswehr leiten sich aus dem verfassungsauftrag ab. sie sind gepragt durch die grundsatze der inneren fuhrung mit dem staatsburger in uniform, durch die hergebrachten grundsatze des berufsbeamtentums und des offentlichen dienstes sowie durch das gewachsene dienstleistungsverstandnis der bundes",377,49,130,27,germany_2013_KonzeptionDerBundeswehr_noneng.md,2025-01-28 18:57:01
174,"##wehrverwaltung. dieses selbstverstandnis verdichtet die kernbotschaft "" wir. dienen. deutschland. "". ein pragnant formuliertes bundeswehrgemeinsames selbstverstandnis wird dies reflektieren. innere fuhrung ist die fuhrungsphilosophie der bundeswehr. sie gewahrleistet die verwirklichung der werte und normen unseres grundgesetzes in der bundeswehr. sie wirkt im spannung",372,43,133,27,germany_2013_KonzeptionDerBundeswehr_noneng.md,2025-01-28 18:57:01
175,"##sfeld zwischen den soldatischen prinzipien von befehl und gehorsam und den personlichen und demokratischen freiheitsrechten, das auch dem konzept "" staatsburger in uniform "" zu grunde liegt. die gewachsene herausforderung fur die bundeswehr besteht darin, diesen hohen anspruch auch unter großen belastungen durch die einsatze und unter den bedingungen der freiwilligenarmee zu verwirkliche",392,53,132,27,germany_2013_KonzeptionDerBundeswehr_noneng.md,2025-01-28 18:57:01
176,"##n. schon in der ausbildung werden unsere soldaten und soldatinnen deshalb verstarkt auf jene bewahrungsproben fur die innere fuhrung vorbereitet, die sich ergeben, wenn kampf, multinationalitat und der kontakt mit fremden kulturen die einsatzwirklichkeit bestimmen. die prinzipien der inneren fuhrung wirken dabei sinnstiftend und starken die moral unserer soldaten und soldatinnen.",384,51,132,27,germany_2013_KonzeptionDerBundeswehr_noneng.md,2025-01-28 18:57:01
