chunk_id,text,char_length,word_count,token_count,section_index,source_file,processed_date
411,##t fur die gesamtorganisation legt das ministerium entsprechend die wesentlichen organisationsubergreifenden und bundeswehrgemeinsamen grundsatze und organisationsprinzipien fest. das ministerium ist auf die ministeriellen kernaufgaben konzentriert104 und nimmt gegenuber dem nachgeordneten bereich die rechts - und fachaufsicht im rahmen seiner strategischen verantwortung wahr. daruber hinausgehende aufgaben und,415,46,132,60,germany_2013_KonzeptionDerBundeswehr_noneng.md,2025-01-28 18:57:01
412,die entsprechende operative verantwortung sind dem nachgeordneten bereich zugeordnet ; das bundesministerium der verteidigung steuert diesen ungeachtet organisatorischer zuordnungen und militarischer unterstellungsverhaltnisse durch die fachlich zustandigen ministeriellen stellen. dem generalinspekteur bzw. der generalinspekteurin der bundeswehr als ministerielle institution sind die streitkrafte unterstellt,411,42,130,60,germany_2013_KonzeptionDerBundeswehr_noneng.md,2025-01-28 18:57:01
413,". die inspekteure und inspekteurinnen fuhren die militarischen organisationsbereiche mittels eigener kommandos außerhalb des ministeriums. dem ministerium nachgeordnet sind die militarischen organisationsbereiche heer, luftwaffe, marine, streitkraftebasis ( skb ) und zentraler sanitatsdienst der bundeswehr ( zsandstbw ), die zivilen organisationsbereiche der militarseelsorge, der rechtspfle",393,44,130,60,germany_2013_KonzeptionDerBundeswehr_noneng.md,2025-01-28 18:57:01
414,"##ge und der bundeswehrverwaltung mit den ressourcenbereichen personal ( p ), ausrustung, informationstechnik und nutzung ( ain ) und infrastruktur, umweltschutz und dienstleistungen ( iud ) sowie dem ministerium unmittelbar unterstellte militarische dienststellen105. fur die ressourcenbereiche ist jeweils eine bundesoberbehorde als zentrales element zur wahrnehmung der nicht ministeriellen durchfuhrung",406,49,132,60,germany_2013_KonzeptionDerBundeswehr_noneng.md,2025-01-28 18:57:01
415,##saufgaben und zur steuerung des eigenen bereichs eingerichtet. fur die fuhrung der auslandseinsatze untersteht dem generalinspekteur bzw. der generalinspekteurin der bundeswehr der befehlshaber bzw. die befehlshaberin des einsatzfuhrungskommandos der bundeswehr. 104 trotzdem bleibt jede aufgabe der bundeswehr grundsatzlich im ministerium verankert. 105 einsatzfuhrungskomma,377,43,132,60,germany_2013_KonzeptionDerBundeswehr_noneng.md,2025-01-28 18:57:01
416,"##ndo der bundeswehr, planungsamt der bundeswehr einsatzkontingente der bundeswehr werden aus dem einheitlichen kraftedispositiv fur den jeweiligen auftrag bundeswehrgemeinsam zusammengestellt. die organisation der bundeswehr ist entsprechend auf die modulare kontingentbildung und fruhzeitige kohasion zusammenwirkender truppenteile und unterstutzungselemente auszurichten. dabei ist zu berucksichtigen, dass die",413,44,133,60,germany_2013_KonzeptionDerBundeswehr_noneng.md,2025-01-28 18:57:01
417,"dauer, fur die spezifische fahigkeiten benotigt werden, variieren kann ; der einsatz einzelner elemente kann sich lagebedingt verlangern, andere bereitgehaltene fahigkeiten werden hingegen nicht oder nur fur kurze zeit abgerufen. starre verfahren und strukturen konnen dies nicht leisten. das system muss flexibel genug sein, in angemessener zeit auf derart",357,49,130,60,germany_2013_KonzeptionDerBundeswehr_noneng.md,2025-01-28 18:57:01
418,##ige schwerpunktverlagerungen zu reagieren und die erforderlichen fahigkeiten bereitzustellen.,95,9,40,60,germany_2013_KonzeptionDerBundeswehr_noneng.md,2025-01-28 18:57:01
419,"# # 6. 2 personal aus auftrag, aufgaben und organisationsstruktur der bundeswehr leiten sich personalumfang und - struktur ab106. diese mussen nachhaltig finanzierbar und demografiefest sein.",191,26,66,61,germany_2013_KonzeptionDerBundeswehr_noneng.md,2025-01-28 18:57:01
420,"# # anforderungen an das personal die bundeswehr ist eine einsatzorientierte freiwilligenarmee. sie benotigt kompetentes, talentiertes, den anforderungen entsprechend gebildetes und ausgebildetes, leistungsfahiges und leistungswilliges personal, das von seinem auftrag uberzeugt ist. seine bereitschaft sich personlich weiterzuentwickeln und veranderungen als herausforderungen zu begreifen, seine",397,44,130,62,germany_2013_KonzeptionDerBundeswehr_noneng.md,2025-01-28 18:57:01
421,"qualifikation, motivation und berufszufriedenheit bestimmen maßgeblich die einsatzfahigkeit und einsatzbereitschaft der bundeswehr. reservistendienst leistende erganzen und verstarken das personelle potenzial der bundeswehr. sie werden in allen aufgabengebieten der bundeswehr eingesetzt. im rahmen des personalmanagements sind alle moglichkeiten auszuschopfen und weiterzuentwickeln,",384,40,130,62,germany_2013_KonzeptionDerBundeswehr_noneng.md,2025-01-28 18:57:01
422,um qualifiziertes personal auch nach dem ausscheiden aus dem aktiven dienst ggf. wiederbzw. weiterzuverwenden ( binnenarbeitsmarkt bundeswehr ). uber den status der reservistendienst leistenden hinausgehend konnen kooperationsmodelle mit organisationen außerhalb der bundeswehr entwickelt werden. im rahmen von freien kapazitaten steht das bildungs - und qualifizierungssystem der,380,46,130,62,germany_2013_KonzeptionDerBundeswehr_noneng.md,2025-01-28 18:57:01
423,bundeswehr auch reservistendienst leistenden offen. somit kann eine langfristige bindung an die bundeswehr unterstutzt werden. daruber hinaus sind reservisten und reservistinnen der bundeswehr mittler und multiplikatoren fur die bundeswehr in der gesellschaft.,260,32,81,62,germany_2013_KonzeptionDerBundeswehr_noneng.md,2025-01-28 18:57:01
424,"# # gesundheitsmanagement ein praventiv ausgerichtetes gesundheitsmanagement tragt maßgeblich zu qualifizierten, motivierten, gesunden, leistungsfahigen und leistungsbereiten beschaftigten bei. die gesundheitsforderung ist in der personal - und organisationsentwicklung zu berucksichtigen. gesundheitsschutz und gesundheitsforderung liegen somit nicht nur im selbstverstandlichen interesse jed",393,40,130,63,germany_2013_KonzeptionDerBundeswehr_noneng.md,2025-01-28 18:57:01
425,"##es einzelnen, sondern sind auch aufgaben des dienstherrn und arbeitgebers. 106 in beachtung art 87a grundgesetz abs. 1 satz 2 ( zahlenmaßige starke und die grundzuge ihrer organisation mussen sich aus dem haushaltsplan ergeben )",230,35,81,63,germany_2013_KonzeptionDerBundeswehr_noneng.md,2025-01-28 18:57:01
426,"# # personalmanagement der bundeswehr das personalmanagement der bundeswehr ( persmgmtbw ) gewahrleistet die personelle einsatzbereitschaft und durchhaltefahigkeit der bundeswehr. ein zentraler aspekt dabei ist es, geeignetes personal fur eine hohe anzahl fachlich diversifizierter und spezialisierter aufgaben zu gewinnen. diesem steigenden bedarf stehen auf dem arbeitsmarkt immer weniger menschen mit den ben",411,52,130,64,germany_2013_KonzeptionDerBundeswehr_noneng.md,2025-01-28 18:57:01
427,"##otigten qualifikationen und kompetenzen gegenuber. fur das bundeswehrgemeinsame persmgmtbw ergibt sich daraus zum einen die notwendigkeit, sich wettbewerbsfahig auf dem arbeitsmarkt zu positionieren. zum anderen gilt es mehr als zuvor, die potenziale und kompetenzen aller angehorigen der bundeswehr in einem integrierten personalkorper zu nutzen und zu entwick",363,47,132,64,germany_2013_KonzeptionDerBundeswehr_noneng.md,2025-01-28 18:57:01
428,"##eln. dazu sind, soweit es sachlich sinnvoll ist, die organisatorischen und haushalterischen voraussetzungen sowie die personalentwicklungsinstrumente zu schaffen, um dienstposten je nach angebot und bedarf sowohl militarisch als auch zivil wechselseitig zu besetzen. alle angehorigen der bundeswehr sind gemaß ihren gezeigten leistungen und kompetenzen bedarfsorientier",371,45,132,64,germany_2013_KonzeptionDerBundeswehr_noneng.md,2025-01-28 18:57:01
429,"##t auf verwendungen ihrer laufbahngruppe oder funktionsebene vorzubereiten und zu fordern. chancen - und leistungsgerechtigkeit, transparenz, planbarkeit und verlasslichkeit stellen dabei verbindliche leitlinien des persmgmtbw dar. vor diesem hintergrund kommt es insbesondere darauf an, die bestehenden instrumente und verfahren der personalgewinnung, - entwicklung, aus",372,44,132,64,germany_2013_KonzeptionDerBundeswehr_noneng.md,2025-01-28 18:57:01
430,"##bildung sowie bildung und qualifizierung zu harmonisieren und weiterzuentwickeln. dies erfolgt in enger abstimmung und im dialog zwischen den bedarfstragern und dem bedarfsdecker. das persmgmtbw basiert auf den drei saulen personalgewinnung, personalentwicklung sowie ausbildung, bildung und qualifizierung. eine umfassend verantwortliche personalgewinnungsorganisation soll",376,42,132,64,germany_2013_KonzeptionDerBundeswehr_noneng.md,2025-01-28 18:57:01
431,"das auf dem arbeitsmarkt vorhandene potenzial der an einer beschaftigung bei der bundeswehr interessierten besser ausschopfen und bei verschiedenen personengruppen ein verstarktes interesse wecken. sie kann auf maßnahmen der informations - und offentlichkeitsarbeit, die ein positives image und ein generelles interesse an der bundeswehr fordern, aufbauen. die personalwerbliche kommunikation attraktiver berufsbilder,",418,51,130,64,germany_2013_KonzeptionDerBundeswehr_noneng.md,2025-01-28 18:57:01
432,"karriereperspektiven und besoldung verbessert die wettbewerbsfahigkeit der bundeswehr auf dem arbeitsmarkt. ziel der personalentwicklung ist es, den personalbedarf der bundeswehr leistungs - und potenzialorientiert zu decken und zu steuern. sie tragt damit zu einer - soweit moglich - die interessen der angehorigen der bundeswehr wahrenden chancengerechten stellen - und dienstpostenbesetz",390,50,130,64,germany_2013_KonzeptionDerBundeswehr_noneng.md,2025-01-28 18:57:01
433,"##ung sowie karrieregestaltung bei. ausbildung, bildung und qualifizierung unterstutzen uber die gesamte beschaftigungs - bzw. dienstzeit die personalentwicklung der bundeswehr. sie sind zu berucksichtigende faktoren bei der fortlaufenden anpassung der fahigkeiten der bundeswehr an sich verandernde bedingungen und stellen die befahigung des einzelnen zum wirken im team sicher.",379,48,132,64,germany_2013_KonzeptionDerBundeswehr_noneng.md,2025-01-28 18:57:01
434,"# # ausbildung, bildung und qualifizierung aus -, fort - und weiterbildung in der bundeswehr fordert mit einem umfassenden bildungsund qualifizierungsangebot die einsatzorientierung und schafft die voraussetzungen fur betrieb und einsatz. sie ist effektiv sowie effizient zu planen und durchzufuhren. mit aktuellen inhalten deckt sie den unmittelbaren und absehbaren",366,49,130,65,germany_2013_KonzeptionDerBundeswehr_noneng.md,2025-01-28 18:57:01
435,"bedarf. lebenslanges lernen und die nutzung moderner ausbildungstechnik und - infrastruktur werden dabei zielgerichtet genutzt, um unter berucksichtigung bereits vorhandener kompetenzen die ausbildung auf den spezifischen qualifizierungsbedarf des einzelnen auszurichten ( individualisierung der ausbildung ). ausbildung, bildung und qualifizierung in der bundeswehr leistet",374,43,130,65,germany_2013_KonzeptionDerBundeswehr_noneng.md,2025-01-28 18:57:01
436,"einen beitrag zur wettbewerbsfahigkeit der bundeswehr als arbeitgeber, indem sie eine individuelle zivilberufliche qualifizierung und die laufbahndurchlassigkeit fordert. zivil zertifizierte bzw. zertifizierbare international vergleichbare qualifizierungen garantieren daneben einen mit der privatwirtschaft vergleichbaren qualitatsstandard. die durchgefuhrten",360,35,130,65,germany_2013_KonzeptionDerBundeswehr_noneng.md,2025-01-28 18:57:01
437,ausbildungen sind personenbezogen zu dokumentieren und erworbene kompetenzen wo immer moglich zivilberuflich verwertbar zu zertifizieren. dabei ist auf internationaler und nationaler ebene auf die vergleichbarkeit erworbener kompetenzen und qualifikationen gemaß der vorgaben des europaischen qualifikationsrahmens ( eqr ) und des deutschen qualifikationsrahmens fur lebenslange,378,44,130,65,germany_2013_KonzeptionDerBundeswehr_noneng.md,2025-01-28 18:57:01
438,"##s lernen ( dqr ) zu achten. ziel ist, die bundeswehrgemeinsame und ressortubergreifende sowie multinationale ausbildungs - kooperation auszubauen, ausbildungsinhalte abzustimmen und ausbildungsvorhaben - wo immer moglich und sinnvoll - gemeinsam durchzufuhren. im verstandnis eines gemeinsamen "" binnenarbeitsmarktes bundeswehr "" werden dadurch die voraussetzungen ge",369,45,132,65,germany_2013_KonzeptionDerBundeswehr_noneng.md,2025-01-28 18:57:01
439,"##schaffen, ausscheidende zeitsoldaten und zeitsoldatinnen mithilfe einer individuellen und arbeitsmarktorientierten berufsforderung fur eine tatigkeit als zivile mitarbeiter und mitarbeiterinnen der bundeswehr oder fur ein erwerbsleben außerhalb der bundeswehr vorzubereiten.",276,29,97,65,germany_2013_KonzeptionDerBundeswehr_noneng.md,2025-01-28 18:57:01
440,"# # 6. 3 ausbildung streitkrafte und ubungen die ausbildung der streitkrafte ist unter dem leitenden prinzip der einsatzorientierung ein herausgehobener gestaltungsbereich in verantwortung des generalinspekteurs bzw. der generalinspekteurin der bundeswehr. allgemein militarische grundfertigkeiten, ein einheitliches verstandnis der aufgaben fuhrer und ausbilder sowi",367,43,130,66,germany_2013_KonzeptionDerBundeswehr_noneng.md,2025-01-28 18:57:01
441,##e eine standardisierte und fur einen einsatz streitkraftegemeinsam geplante und durchgefuhrte einsatzvorbereitende ausbildung sind grundlage fur den erfolg im einsatz. ausbildung in den streitkraften stellt daher die befahigung des einzelnen zur teilnahme an einsatzen und zum militarischen wirken im team sicher. allgemeine militarische fahigkeiten und verfah,362,46,132,66,germany_2013_KonzeptionDerBundeswehr_noneng.md,2025-01-28 18:57:01
442,"##ren werden grundsatzlich so vermittelt, dass sie unter gefechtsbedingungen beherrscht werden. daher richtet sich die ausbildung in den streitkraften kontinuierlich an den einsatzerfordernissen aus und hat die befahigung zum kampf als ziel. im rahmen der einsatzvorbereitung werden die militarischen grundfertigkeiten durch spezifische, auf den jeweiligen einsatz bezogene ferti",379,48,132,66,germany_2013_KonzeptionDerBundeswehr_noneng.md,2025-01-28 18:57:01
443,"##gkeiten und kenntnisse erganzt. ubungen dienen in erster linie dem herstellen, dem halten und dem nachweis der einsatzbereitschaft der bundeswehr fur einsatze, dauereinsatzaufgaben und einsatzgleiche verpflichtungen im gesamten aufgabenspektrum. sie befahigen die bundeswehr, auftrage in einem komplexen, multinationalen umfeld, zusammen mit internationalen und zivilen partnern, organisationen und",400,47,132,66,germany_2013_KonzeptionDerBundeswehr_noneng.md,2025-01-28 18:57:01
444,"akteuren107 wahrzunehmen. weiterhin sollen sie die in den einsatzen gewonnenen erfahrungen in der bundeswehr umsetzen, indem sie ausbildungs - und ausrustungslucken identifizieren und konzepte, taktiken sowie geanderte grundsatze und verfahren erproben, bevor sie im einsatz zum tragen kommen. daruber hinaus sind ubungen ein teil des gestaltungsp",347,46,130,66,germany_2013_KonzeptionDerBundeswehr_noneng.md,2025-01-28 18:57:01
445,"##rozesses deutscher außen -, militarund rustungspolitik. in diesem rahmen dienen sie der allgemeinen informationsgewinnung, forderung von partnerschaften und kooperationen und verdeutlichen und unterstutzen nationale interessen. der ubungsprozess der bundeswehr ist zyklisch und mit den ubungsplanungsprozessen der nato und eu synchronisiert.",343,40,114,66,germany_2013_KonzeptionDerBundeswehr_noneng.md,2025-01-28 18:57:01
446,"# # 6. 4 material und ausrustung die materielle ausstattung der bundeswehr und die verfugbarkeit erforderlicher dienstleistungen sind voraussetzung fur die auftragserfullung, die einsatzfahigkeit, einsatzbereitschaft und die sicherheit der eingesetzten krafte. die materielle ausstattung leitet sich aus dem priorisierten fahigkeitsprofil, den konzeptionellen dokumenten und den vo",381,46,130,67,germany_2013_KonzeptionDerBundeswehr_noneng.md,2025-01-28 18:57:01
447,##rgaben der mittelfristplanung ab. sie tragt zum fahigkeitsgewinn bzw. - erhalt der bundeswehr bei. material und dienstleistungen mussen zeit - und bedarfsgerecht in ausreichendem umfang einsatzreif zur verfugung stehen. voraussetzung dafur ist die rechtzeitige einplanung im integrierten planungsprozess und die rasche bereitstellung der erforderlichen ausrus,361,45,133,67,germany_2013_KonzeptionDerBundeswehr_noneng.md,2025-01-28 18:57:01
448,"##tung, informationstechnik und dienstleistungen im ausrustungs - und nutzungsprozess. in der ausrustung erfolgt mit dem zielvorgabenorientierten ausrustungsumfang ein neuansatz. dem prinzip der einsatzorientierung folgend wird der ausrustungsumfang beschafft, der zur gewahrleistung des priorisierten fahigkeitsprofils mit den daraus abgeleiteten kraftedispositiven einschlie",376,40,132,67,germany_2013_KonzeptionDerBundeswehr_noneng.md,2025-01-28 18:57:01
449,"##ßlich der notwendigen ausbildung erforderlich und finanzierbar ist. um die erforderliche ausstattung unter gegebenen finanziellen rahmenbedingungen realisieren zu konnen, werden im verlauf des integrierten planungsprozesses ziele festgelegt. dabei stehen beabsichtigte maßnahmen zur anpassung der ausrustung der bundeswehr aufgrund der begrenzung der ressourcen in konkurrenz",377,44,132,67,germany_2013_KonzeptionDerBundeswehr_noneng.md,2025-01-28 18:57:01
450,"zueinander und sind entsprechend ihres beitrags zum leistungs - und fahigkeitsprofil zu priorisieren. ein breites fahigkeitsspektrum ist nicht gleichzusetzen mit einer hoch differenzierten ausstattungsvielfalt. anzustreben sind skalierbare, flexible und fahigkeitsubergreifende oder modulare systeme, um die bundeswehr in die lage zu versetzen, sich schnell vera",362,44,130,67,germany_2013_KonzeptionDerBundeswehr_noneng.md,2025-01-28 18:57:01
451,"##ndernden einsatzbedingungen anpassen zu konnen. zur verbesserung der interoperabilitat ist die 107 comprehensive approach - ressortubergreifendes zusammenwirken materielle fahigkeitsentwicklung multinational abzustimmen. personelle, betriebliche, ausbildungs - und infrastrukturaspekte sind bei der abstimmung zu berucksichtigen. vorgaben fur die realisierung der materiellen ausstattung mit informationstechnik erge",418,43,133,67,germany_2013_KonzeptionDerBundeswehr_noneng.md,2025-01-28 18:57:01
452,"##ben sich aus der it - strategie des bmvg. die bundeswehr vermeidet aufwandige oder risikobehaftete entwicklungen, setzt den schwerpunkt auf zukunftsentwicklung im rahmen von forschung und technologie ( f & t ) und stutzt sich zur beschaffung von ausrustung und dienstleistungen im großtmoglichen umfang auf marktverfugbare bzw. handelsubliche pro",348,49,132,67,germany_2013_KonzeptionDerBundeswehr_noneng.md,2025-01-28 18:57:01
453,##dukte mit leistungen der nationalen und internationalen gewerblichen wirtschaft und wehrtechnischen industrie ab. hierbei werden auch internationale kooperationsmoglichkeiten gepruft. eine sicherheitspolitisch erforderliche und wirtschaftlich tragfahige nationale wehrtechnische kernfahigkeit und - kapazitat sowie eine in einem europaischen rustungsmarkt abgesicherte bedarfsdeckung stehen im besonderen interesse der gesic,426,45,133,67,germany_2013_KonzeptionDerBundeswehr_noneng.md,2025-01-28 18:57:01
454,"##herten und durchhaltefahigen versorgung der streitkrafte, insbesondere in krisenzeiten. life cycle cost management ( lccm ) 108 sowie die optimierung der beschaffung sind ausdruck der verstarkten nutzung betriebswirtschaftlicher methoden bei der bedarfsdeckung der bundeswehr. zur sicherstellung moderner, leistungsfahiger und zukunftsfahiger streitkrafte, beschafft die bundeswehr",383,44,132,67,germany_2013_KonzeptionDerBundeswehr_noneng.md,2025-01-28 18:57:01
455,"ausrustung und komplexe dienstleistungen und betriebsbedingtes material mit einer eigenen beschaffungs - und nutzungsmanagementorganisation, in der eigene, von der industrie unabhangige wehrtechnische kompetenzen und kapazitaten bereitgehalten werden. die beschaffungs - und nutzungsmanagementorganisation stellt uber das gesamte leistungsspektrum der bundeswehr bedarfsgerechte materiel",387,41,130,67,germany_2013_KonzeptionDerBundeswehr_noneng.md,2025-01-28 18:57:01
456,"##le losungen109 ( produkte und dienstleistungen ) bereit, ermoglicht flexible technische losungen, nimmt bewertungs - und beratungsaufgaben wahr und gewahrleistet insbesondere die einsatzreife des materials. die in der nutzung, insbesondere in den einsatzen, gewonnenen erkenntnisse werden durch sie bei neuentwicklungen, weiterentwicklungen und der anpassung eingefuhrter produkte und",386,47,132,67,germany_2013_KonzeptionDerBundeswehr_noneng.md,2025-01-28 18:57:01
457,"dienstleistungen eingebracht. die beschaffungs - und nutzungsmanagementorganisation bundelt das uber den gesamten lebensweg erworbene technische "" system - know - how "" im bereich der bundeswehr mit einem durchgangigen management. dessen aufgabenspektrum reicht von der erarbeitung von vorschlagen im bereich fur materielle losungen und dienstleistungen uber die realisierung und nutzung bis hin zur aussonderung und",416,55,130,67,germany_2013_KonzeptionDerBundeswehr_noneng.md,2025-01-28 18:57:01
458,"verwertung von wehrmaterial. im rahmen ihrer beratungsaufgaben stellt sie auch eine bewertung moglicher gegnerischer produkte sicher. zum erhalt der analyse - und bewertungsfahigkeit in allen wehrtechnischen belangen und zur gewahrleistung einer modernen ausrustung, die auch kunftigen anforderungen gerecht wird, betreibt sie fur die bundeswehr wehrtechnische forschung und technologie.",387,48,130,67,germany_2013_KonzeptionDerBundeswehr_noneng.md,2025-01-28 18:57:01
459,108 lccm ist eine betriebswirtschaftliche methode zur heranziehung von lebenswegkosten fur entscheidungen im zyklus von produkten. 109 zu beschaffende neue waffensysteme und munition sind auf deren volkerrechtliche zulassigkeit und konformitat mit rustungskontrollvertragen und - abkommen zu prufen.,299,37,101,67,germany_2013_KonzeptionDerBundeswehr_noneng.md,2025-01-28 18:57:01
460,"# # 6. 5 infrastruktur, dienstleistungen und gesetzliche schutzaufgaben die bundeswehr braucht attraktive, moderne und ablaufoptimierte infrastruktureinrichtungen im in - und ausland sowie in den einsatzgebieten. das erfordert die rechtzeitige durchfuhrung von entsprechenden infrastrukturvorhaben und den effizienten betrieb von liegenschaften sowie die",354,42,130,68,germany_2013_KonzeptionDerBundeswehr_noneng.md,2025-01-28 18:57:01
461,entsprechende finanzierung. im inland bundelt die bundeswehr fachkompetenz und verantwortung in einer zivilmilitarischen infrastrukturorganisation. das aufgabenspektrum der bedarfstrager - und bedarfsdeckerorganisation wird in einer organisation zusammengefuhrt und schafft dadurch eine straffung der arbeitsablaufe sowie effizientere aufgabenerledigung im infrastrukturber,373,38,130,68,germany_2013_KonzeptionDerBundeswehr_noneng.md,2025-01-28 18:57:01
462,"##eich. zur ausfuhrung der baumaßnahmen bedient sich die bundeswehr der bauverwaltungen des bundes und der lander, die im rahmen der organleihe110 planung und ausfuhrung der infrastrukturvorhaben wahrnehmen. in einsatzgebieten werden die fachaufgaben fur das bauwesen, den bau und den betrieb von einsatzliegenschaften durch ziviles fachpersonal und militarische krafte der bundeswehr",384,50,132,68,germany_2013_KonzeptionDerBundeswehr_noneng.md,2025-01-28 18:57:01
463,"sichergestellt. damit sind moglichkeiten zur raschen, flexiblen und durchhaltefahigen unterbringung unabhangig von den gegebenen klimatischen, geografischen und geologischen bedingungen zu gewahrleisten. zu den dienstleistungen des zivilen bereichs der bundeswehr gehoren des weiteren die bereitstellung von verpflegung und die bewirtschaftete betreuung. um diese leistungen im einsatz",385,45,130,68,germany_2013_KonzeptionDerBundeswehr_noneng.md,2025-01-28 18:57:01
464,"zu gewahrleisten, sind modulare, sich dem einsatzbedarf flexibel anpassende komponenten weiterzuentwickeln und vorzuhalten. die bundeswehr nimmt als trager hoheitlicher belange zustimmungs - und genehmigungsfunktionen mit außenwirkung gegenuber dritten wahr111. die bundeswehr hat in erfullung ihrer fursorgepflicht und auf der grundlage gesetzlicher regel",356,42,130,68,germany_2013_KonzeptionDerBundeswehr_noneng.md,2025-01-28 18:57:01
465,"##ungen, leben und gesundheit ihrer angehorigen zu schutzen, offentlich - rechtliche aufgaben in eigenvollzugskompetenz wahrzunehmen und gleichzeitig den schutz von natur und umwelt zu beachten112. gesetzliche und weitere schutzaufgaben113 sind deshalb integraler bestandteil aller prozesse, verfahren und anwendungen im betrieb und im einsatz der bundeswehr.",359,45,133,68,germany_2013_KonzeptionDerBundeswehr_noneng.md,2025-01-28 18:57:01
466,"110 auf der grundlage § 8 abs. 5 finanzverwaltungsgesetz werden die bauverwaltungen der lander ( als organ eines rechtstragers ) fur den bund ( als entleiher ) tatig und haben dessen weisungen zu befolgen. ihre maßnahmen werden dem bund zugerechnet. 111 z. b. luftverkehrsgesetz, raumordnungsgesetz, energiegesetze 112 einschlagige regelungen zu den einzelnen",359,52,130,68,germany_2013_KonzeptionDerBundeswehr_noneng.md,2025-01-28 18:57:01
467,"rechtsgebieten erfolgen durch ministerielle grundsatzweisungen. 113 u. a. umweltschutz, arbeitsschutz, brandschutz, gefahrgutwesen, selbstschutz, munitionstechnische sicherheit und schießsicherheit",197,17,75,68,germany_2013_KonzeptionDerBundeswehr_noneng.md,2025-01-28 18:57:01
