chunk_id,text,char_length,word_count,token_count,section_index,source_file,processed_date
236,"schnelle reaktion genutzt werden, um die sicherheitslage soweit wie moglich zu stabilisieren und anderen maßnahmen die erforderliche zeit zu verschaffen, ihre wirkung zu entfalten. hiermit wird zugleich bedrohungen, die von außen nach deutschland bzw. die eu und das nordatlantische bundnis wirken konnen, an ihrem ursprungsort entgegengetreten. in kunft",354,48,130,38,germany_2013_KonzeptionDerBundeswehr_noneng.md,2025-01-28 18:57:01
237,"##igen konflikten ist zu erwarten, dass die bedrohung durch handfeuerwaffen inkl. panzerabwehrhandwaffen und sprengstofffallen54 hoch bleibt, die durch klassische luftkriegsmittel wahrscheinlich stagnieren und die durch ballistische flugkorper, marschflugkorper, unbemannte ( kleinst - ) flugzeuge und durch raketen, artillerie und morser55 hingegen eher zunehmen wird",368,44,133,38,germany_2013_KonzeptionDerBundeswehr_noneng.md,2025-01-28 18:57:01
238,". auf see konnen potenzielle akteure mittel des seadenial56 einsetzen, um handels - und verbindungswege zu sperren und operationen im kustenvorfeld zu storen. die wachsende verwundbarkeit der modernen infrastruktur und die ressourcenabhangigkeit moderner gesellschaften bieten vielfaltige angriffspunkte. die verbreitung von massenvernichtungswaffen und ihrer tragersysteme57, konflik",384,45,130,38,germany_2013_KonzeptionDerBundeswehr_noneng.md,2025-01-28 18:57:01
239,"##tfuhrung mit terroristischen mitteln und angriffe im cyberraum58 konnen zu einer direkten bedrohung deutschlands und seiner verbundeten werden. die technische und operative uberlegenheit der euroatlantischen streitkrafte besteht absehbar fort. staatliche und nicht staatliche gewaltakteure werden deshalb versuchen, sich der offenen konfliktaustragung zu entziehen und ganz oder teilwei",388,47,132,38,germany_2013_KonzeptionDerBundeswehr_noneng.md,2025-01-28 18:57:01
240,"##se zu asymmetrischen strategien uberzugehen. sie werden sich darum bemuhen, dass ihr vorgehen spat oder gar nicht volkerrechtlich als bedrohung oder bruch des friedens, als aggression oder als bewaffneter angriff qualifiziert wird, um dadurch eine geschlossene intervention der staatengemeinschaft zu vermeiden. insgesamt ist zu erwarten, dass die wechselwirkungen von innerer und außerer",390,52,132,38,germany_2013_KonzeptionDerBundeswehr_noneng.md,2025-01-28 18:57:01
241,"sicherheit weiter zunehmen. mit direkten angriffen und der instrumentalisierung ethnischer und 54 sogenannte improvised explosive device ( ied ) 55 abgekurzt ram, wirkmittel fur indirektes feuer 56 sea - denial : die nutzung der see verwehren, ohne sie selbst kontrollieren zu konnen ; dazu konnen u. a. seeminen, u - boote, speedboote und unbemannte fliegende und schwimmende",376,57,130,38,germany_2013_KonzeptionDerBundeswehr_noneng.md,2025-01-28 18:57:01
242,"systeme eingesetzt werden. 57 ballistische flugkorper ( engl. ballistic missiles ( bm ) ) stellen in diesem zusammenhang ein besonderes risikopotenzial dar. 58 sogenannte cyberangriffe religioser minderheiten konnen gegner versuchen, ihren bewaffneten kampf in die euroatlantischen staaten zu tragen. operationen eigener krafte im ausland konnen gegner zu angriffen im inland bewe",380,51,130,38,germany_2013_KonzeptionDerBundeswehr_noneng.md,2025-01-28 18:57:01
243,"##gen, um damit den politischen preis des einsatzes zu erhohen und den ruckhalt in der eigenen bevolkerung zu untergraben. zugleich sind terroristische angriffe auf krafte und einrichtungen im einsatz moglich. als vorherrschende konfliktformen werden deshalb sogenannte hybride konflikte mit sowohl staatlichen als auch nichtstaatlichen konfliktparteien und gegnern erwart",372,48,132,38,germany_2013_KonzeptionDerBundeswehr_noneng.md,2025-01-28 18:57:01
244,"##et, die symmetrische und asymmetrische mittel einsetzen. deshalb wird kunftig der schwerpunkt absehbar auf operationen niedriger bis mittlerer intensitat außerhalb des bundnisgebietes unter asymmetrischer bedrohung liegen. dabei sind zeitlich und ortlich begrenzte gefechte hoher intensitat nicht auszuschließen. aufgrund von unvorhersehbarkeiten in konflik",359,42,132,38,germany_2013_KonzeptionDerBundeswehr_noneng.md,2025-01-28 18:57:01
245,"##ten muss es besondere starke der streitkrafte bleiben, auf unerwartete herausforderungen schnell, zielgerichtet und wirkungsvoll reagieren zu konnen. das erfordert flexibilitat und schnelles anpassungsvermogen.",212,24,80,38,germany_2013_KonzeptionDerBundeswehr_noneng.md,2025-01-28 18:57:01
246,"# # 5. 2 dimensionen mit der betrachtung nach dimensionen orientiert sich die bundeswehr an einer in den etablierten verteidigungsplanungsverfahren von nato und eu bewahrten einteilung und richtet das fahigkeitsspektrum ihrer streitkrafte nach den maßgeblichen raumen aus, in denen sie zur wirkung kommt. zu den klassischen operationsraumen land, see und luft treten der weltraum und",383,55,130,39,germany_2013_KonzeptionDerBundeswehr_noneng.md,2025-01-28 18:57:01
247,"der informationsraum hinzu. jeder dieser raume ist durch spezifische eigenschaften gekennzeichnet, die einfluss auf den militarischen einsatz haben.",148,18,51,39,germany_2013_KonzeptionDerBundeswehr_noneng.md,2025-01-28 18:57:01
248,"# # land die bedeutung des operationsraums land ergibt sich aus seiner funktion als siedlungsraum der bevolkerung, quelle wichtiger ressourcen, wirtschaftsraum, sitz von staatlichen, gesellschaftlichen, kulturellen institutionen und heimat der menschen. das gilt fur das eigene land wie fur andere regionen, in denen streitkrafte eingesetzt werden. um in diesem raum zu wirken, mussen landstre",393,54,130,40,germany_2013_KonzeptionDerBundeswehr_noneng.md,2025-01-28 18:57:01
249,##itkrafte sichtbar prasent sein. die kontrolle urbaner zentren ist zum aufbau und erhalt von sicherheit und ordnung unabdingbar. die krafte operieren deshalb regelmaßig in ausgedehnten urbanen gebieten im unmittelbaren kontakt zur zivilbevolkerung. aufgrund von besiedelung und bebauung ergeben sich in diesem umfeld spezifische herausforderungen bei operationen. unbet,370,47,132,40,germany_2013_KonzeptionDerBundeswehr_noneng.md,2025-01-28 18:57:01
250,"##eiligte und gegner sind in vielen fallen kaum unterscheidbar. neben lokaler bevolkerung, regierungs - / nichtregierungsorganisationen ( go / ngo ), internationalen organisationen ( io ), nachbarstaaten, globalen und regionalen wirtschaftsunternehmen, medienvertretern, sicherheitskraften und regularen streitkraften mit eigenem lageverstandnis, spezifischen bedurfnissen und zielen ko",386,44,133,40,germany_2013_KonzeptionDerBundeswehr_noneng.md,2025-01-28 18:57:01
251,"##nnen eine vielzahl von dezentral strukturierten, informell koordinierten gegnerischen akteuren auftreten. letztere werden in landoperationen zumindest teilweise in der lage sein, militarisch organisiert das gefecht zu fuhren. mit operationen hoher intensitat ist deshalb zumindest zeitlich oder ortlich begrenzt jederzeit zu rechnen. diese bedingungen wirken sich in besonderer",379,47,132,40,germany_2013_KonzeptionDerBundeswehr_noneng.md,2025-01-28 18:57:01
252,weise bei einsatzen zur konfliktverhutung und krisenbewaltigung aus. aus ihnen erwachsen risiken fur die eingesetzten krafte und herausforderungen wie zum beispiel die vermeidung von unbeabsichtigten begleitschaden59. die eingesetzten krafte mussen uber lange zeitraume in regionen mit ausgedehnten verantwortungsbereichen operieren. haufig wechseln in den einsatzra,366,44,130,40,germany_2013_KonzeptionDerBundeswehr_noneng.md,2025-01-28 18:57:01
253,"##umen der krafte intensitaten schlagartig ; oft kommt es in einem einsatzraum zu einem nebeneinander von gefechtshandlungen unterschiedlicher intensitaten. deshalb mussen sich die eingesetzten krafte schnell verandernden lagen in allen intensitaten anpassen konnen. sie mussen gleichzeitig kooperationsbereit sein und uber ein glaubhaftes eskalationspotenzial verfugen, um ihre",378,46,133,40,germany_2013_KonzeptionDerBundeswehr_noneng.md,2025-01-28 18:57:01
254,"##n beitrag zur wiederherstellung von sicherheit und staatlicher ordnung in krisengebieten zu leisten. ziel ist es, einerseits gegenuber der bevolkerung durch prasenz sicherheit zu vermitteln und dadurch vertrauen zu schaffen, andererseits den gegner abzuschrecken und ihm die unterstutzung zu entziehen. zeitweilig, vor allem in einer anfangsphase, mussen",356,47,132,40,germany_2013_KonzeptionDerBundeswehr_noneng.md,2025-01-28 18:57:01
255,"die eingesetzten krafte zum kampf im hohen intensitatsspektrum befahigt sein, um militarisch organisierte und asymmetrisch agierende gegner am boden bekampfen und schlagen zu konnen. zur verstarkung und schnellen wirkungsprojektion mussen durchsetzungsfahige krafte rasch im gesamten einsatzraum verlegt werden und dort ggf. auch langer autark operieren",353,45,130,40,germany_2013_KonzeptionDerBundeswehr_noneng.md,2025-01-28 18:57:01
256,"konnen. militarische landoperationen im rahmen der bundnisverteidigung sind kunftig vornehmlich noch an der peripherie des bundnisgebiets zu erwarten, wenn es darum geht, verbundeten gegen bedrohungen und risiken von außen beizustehen und das bundnisgebiet zu schutzen. die hierfur vorgesehenen krafte mussen innerhalb eines angemessenen zeitraums verlegen ko",359,46,130,40,germany_2013_KonzeptionDerBundeswehr_noneng.md,2025-01-28 18:57:01
257,"##nnen und zum kampf im gesamten intensitatsspektrum befahigt sein. bei der verlegung in ihre einsatzgebiete sind landstreitkrafte auf unterstutzung angewiesen. landstreitkrafte tragen im frieden zum heimatschutz bei, indem sie u. a. bei der lagefeststellung unterstutzen, sicherungsaufgaben ubernehmen und sich an der bewaltigung von schadensere",346,44,132,40,germany_2013_KonzeptionDerBundeswehr_noneng.md,2025-01-28 18:57:01
258,##ignissen beteiligen.,22,2,11,40,germany_2013_KonzeptionDerBundeswehr_noneng.md,2025-01-28 18:57:01
259,"# # see den großten teil des operationsraums see bilden die keiner gebietshoheit eines staates unterliegenden ausschließlichen wirtschaftszonen und die hohe see, an die sich die territorialen gewasser der staaten anschließen. die see ermoglicht die freiheit des welthandels. sie ist als transportweg, als zugang zu rohstoffen und markten und als rohstoffquelle von weltwirtschaftlicher bedeu",391,54,130,41,germany_2013_KonzeptionDerBundeswehr_noneng.md,2025-01-28 18:57:01
260,"##tung. da weite teile der see durch jedermann frei genutzt werden konnen, eroffnen sich auch unerwunschte moglichkeiten des missbrauchs zu frieden storenden oder kriminellen zwecken mit teilweise gravierenden wirtschaftlichen folgen. deutschland ist als außenhandels - und rohstoffabhangige nation aus strategischer, wirtschaftlicher und okologischer sicht besonders auf die uneingeschrankte nutzung",400,49,132,41,germany_2013_KonzeptionDerBundeswehr_noneng.md,2025-01-28 18:57:01
261,"der see angewiesen. diese nutzung ist bundnis - und bundeswehrgemeinsam sicherzustellen. 59 das humanitare volkerrecht untersagt die hinnahme exzessiver begleitschaden. aus operativer sicht sollten begleitschaden soweit wie moglich vermieden werden, da sie oft schwerwiegende langfristige auswirkungen auf die lage in einem einsatzgebiet haben konnen ( z. b. be",361,48,130,41,germany_2013_KonzeptionDerBundeswehr_noneng.md,2025-01-28 18:57:01
262,"##volkerung, infrastruktur ). aufgrund dieser maritimen abhangigkeit deutschlands kommt der bundeswehr beim schutz eigener kustengewasser und internationaler seeverbindungslinien eine besondere verantwortung zu. deutsche seestreitkrafte leisten in multinationaler und zivil - militarischer kooperation einen standigen beitrag zur maritimen sicherheit60. seestreitkrafte konnen zugig und relativ unabhangig",405,44,131,41,germany_2013_KonzeptionDerBundeswehr_noneng.md,2025-01-28 18:57:01
263,"internationale gewasser als operationsund bereitstellungsraum und als zugang zu anderen regionen nutzen. sie konnen verdeckt oder offen eine dauerhafte prasenz gewahrleisten, ohne auf hoheitliche bzw. territoriale beschrankungen rucksicht nehmen zu mussen. in einsatzen zur konfliktverhutung und krisenbewaltigung konnen sie damit fruhzeitig demonstrativ seeseitig in einer krisenregion vo",389,47,130,41,germany_2013_KonzeptionDerBundeswehr_noneng.md,2025-01-28 18:57:01
264,##rausstationiert werden. sie konnen seegebiete uberwachen und gegnern deren nutzung durch embargo - und blockademaßnahmen verwehren. seestreitkrafte tragen zu militarischen operationen durch den schutz von aufmarsch und verlegung bei und ermoglichen bzw. sichern den zugang zum operationsgebiet. sie unterstutzen eigene an oder uber land operierende krafte von see aus durch aufklarung,386,51,133,41,germany_2013_KonzeptionDerBundeswehr_noneng.md,2025-01-28 18:57:01
265,", fuhrung, waffenwirkung, seetransport, logistik und sanitatsdienst und stellen die nutzung der see als basis fur streitkraftegemeinsame operationen sicher. die bekampfung gegnerischer seestreitkrafte, insbesondere solcher, die die seewege und verbindungslinien eigener operationen bedrohen, bleibt sowohl in der landesverteidigung als bundnisverteidigung als auch in einsatzen zur kon",385,46,130,41,germany_2013_KonzeptionDerBundeswehr_noneng.md,2025-01-28 18:57:01
266,##fliktverhutung und krisenbewaltigung maßgebliche aufgabe der seestreitkrafte. dazu mussen sie auch gefechte hoher intensitat fuhren konnen. die uberwachung des deutschen seeraums und die wahrnehmung seehoheitlicher aufgaben in ressortubergreifender zusammenarbeit sind als dauereinsatzaufgaben beitrage zum heimatschutz.,322,35,120,41,germany_2013_KonzeptionDerBundeswehr_noneng.md,2025-01-28 18:57:01
267,"# # luft die ungefahrdete nutzung des luftraumes hat politische und wirtschaftliche bedeutung. die sicherheit des luftraumes, das recht zu seiner nutzung und die gewahrleistung gemeinsamer verfahren der luftraumnutzung liegen deshalb im nationalen und internationalen interesse. die nutzung des luftraums ist global reglementiert. uber dem territorium deutschlands und seiner territorialen gewasser gehort der lu",412,54,130,42,germany_2013_KonzeptionDerBundeswehr_noneng.md,2025-01-28 18:57:01
268,"##ftraum zum staatlichen hoheitsgebiet ; der ubergang zwischen luftraum und weltraum ist fließend61. der luftraum bietet militarischen kraften im gesamten aufgabenspektrum die moglichkeit kurzfristiger und flexibler, weltweiter reaktionen in form von abgestuften militarischen einsatzoptionen mit luftkriegsmitteln. diese reichen von der gewinnung von lageinform",362,43,132,42,germany_2013_KonzeptionDerBundeswehr_noneng.md,2025-01-28 18:57:01
269,"##ationen uber humanitare hilfeleistungen, rettungs - und evakuierungseinsatze bis hin zur physischen wirkung im einsatzgebiet. insbesondere zu beginn von militarischen 60 u. a. durch fahigkeiten zur seeraumuberwachung, zur gewinnung eines umfassenden maritimen lagebildes im multinationalen verbund, zur seeminenabwehr, zur abwehr terroristischer bedrohungen und zur bekampfung von piraterie 61 die obe",403,50,133,42,germany_2013_KonzeptionDerBundeswehr_noneng.md,2025-01-28 18:57:01
270,##re grenze des luftraums wird uberwiegend in anlehnung an den niedrigsten moglichen orbit im bereich zwischen 80 und 110 kilometern uber der erdoberflache gesehen. der weltraum daruber ist hoheitsfrei. operationen kann im und aus dem luftraum schnell erste wirkung erzielt werden. im lufttransport konnen eigene krafte in kurzer zeit prasenz in einer krisenregion aufbauen. der,378,55,132,42,germany_2013_KonzeptionDerBundeswehr_noneng.md,2025-01-28 18:57:01
271,"einsatz von kraften in der luft ist durch sehr hohe geschwindigkeit, rasche schwerpunktbildung und hohe durchsetzungsfahigkeit verbunden mit praziser, skalierbarer wirkung gekennzeichnet. uberlegenheit im luftraum ist haufig voraussetzung fur militarische land - und seeoperationen. sie herzustellen und zu erhalten ist eine wesentliche aufgabe von luftstreitkra",362,45,130,42,germany_2013_KonzeptionDerBundeswehr_noneng.md,2025-01-28 18:57:01
272,"##ften, insbesondere in anfangsoperationen. luftstreitkrafte tragen durch den schutz von aufmarsch und verlegung zu militarischen operationen bei und unterstutzen eigene an land und auf see operierende krafte durch aufklarung, wirkung und transport. im rahmen der konfliktverhutung und krisenbewaltigung sind sie zum durchsetzen von flugverbotszonen befahigt. zur humanita",372,47,132,42,germany_2013_KonzeptionDerBundeswehr_noneng.md,2025-01-28 18:57:01
273,##ren hilfeleistung tragen luftstreitkrafte vor allem mit ihren transport - und aufklarungsmitteln bei. die uberwachung und der schutz des deutschen luftraums ist eine dauereinsatzaufgabe. luftstreitkrafte leisten dazu in nationaler zivil - militarischer verantwortung und internationaler kooperation einen standigen beitrag. daruber hinaus tragt deutschland zum schutz des luftraums verbundeter,395,48,132,42,germany_2013_KonzeptionDerBundeswehr_noneng.md,2025-01-28 18:57:01
274,staaten bei.,12,2,7,42,germany_2013_KonzeptionDerBundeswehr_noneng.md,2025-01-28 18:57:01
275,"# # weltraum die nutzung des weltraums ist fur moderne gesellschaften im informationszeitalter unverzichtbar. sie durchdringt alle bereiche des privaten, kommerziellen und offentlichen handelns. es ist fur deutschland von strategischer bedeutung, freien zugang zum weltraum zu haben. der schutz und die freie nutzung der dort eingesetzten systeme sind teil der gesamtstaatlichen sicherheitsvorsor",396,52,130,43,germany_2013_KonzeptionDerBundeswehr_noneng.md,2025-01-28 18:57:01
276,##ge. der weltraum unterliegt keiner staatlichen gebietshoheit. die hoheitsgewalt der staaten uber ihnen zugeordnete weltraumobjekte und sich im weltraum aufhaltende personen ihrer nationalitat bleibt hiervon unberuhrt. weltraumgestutzte systeme zeichnen sich durch ihre langfristige prasenz und ihren weltumspannenden einsatz aus. die abhangig,344,41,132,43,germany_2013_KonzeptionDerBundeswehr_noneng.md,2025-01-28 18:57:01
277,"##keit von ortsfesten, terrestrischen netzen und einrichtungen kann dadurch reduziert werden. weltraumgestutzte systeme sind zusammen mit den zugehorigen bodenelementen als teil der ausrustung der streitkrafte beziehungsweise als ( zivile ) kritische infrastruktur zu schutzen. eigene weltraumgestutzte systeme leisten einen wesentlichen beitrag zur informations - und wirk",373,46,132,43,germany_2013_KonzeptionDerBundeswehr_noneng.md,2025-01-28 18:57:01
278,"##ungsuberlegenheit62 im sinne der vernetzten operationsfuhrung insbesondere in der aufklarung, der kommunikation und der navigation. der gesicherte und unabhangige zugriff auf nationale systeme zur weltweiten aufklarung und weitraumigen kommunikation ist voraussetzung fur ein unabhangiges lagebild und die souverane handlungsfahigkeit der bundesregierung. die bundeswehr baut daruber hinaus in",395,47,132,43,germany_2013_KonzeptionDerBundeswehr_noneng.md,2025-01-28 18:57:01
279,enger kooperation mit partnern fahigkeiten zur erfassung und bewertung der weltraumlage einschließlich weltraumuberwachung und weltraumaufklarung auf. 62 siehe glossar,167,19,60,43,germany_2013_KonzeptionDerBundeswehr_noneng.md,2025-01-28 18:57:01
280,"# # informationsraum im zentrum der dimension informationsraum steht die information. diese ist umgeben vom informationsumfeld, in dem sie wahrgenommen, interpretiert und weiter verbreitet wird. eine besonderheit stellt der cyberraum dar, der in das informationsumfeld eingebettet ist. der cyberraum umfasst uber territoriale und strukturelle grenzen hinweg alle erreichbaren informationsinfrastrukturen. moderne gesellschaften nutzen die",438,53,130,44,germany_2013_KonzeptionDerBundeswehr_noneng.md,2025-01-28 18:57:01
281,"chancen, die vernetzte informations - und kommunikationssysteme sowie globale informationsnetze bieten und sind deshalb in besonderer weise von ihnen abhangig. diese chancen, die der cyberraum durch allgegenwartige verfugbarkeit von informationen und neue formen der wissensaufbereitung und - prasentation bietet, sind auch zur verbesserung der effektivitat und effizienz der bundeswehr zu nutzen. das",401,52,130,44,germany_2013_KonzeptionDerBundeswehr_noneng.md,2025-01-28 18:57:01
282,"prinzip der vernetzten operationsfuhrung ist in heutigen streitkraften fest verankert. vernetzte einrichtungen, plattformen und waffensysteme sind auf die ungehinderte nutzung von information angewiesen. in der operationsplanung und - fuhrung der streitkrafte ist die gesicherte und rechtzeitige verfugbarkeit verlasslicher informationen die grundlage fur den militarischen entscheidungsprozess und",398,46,130,44,germany_2013_KonzeptionDerBundeswehr_noneng.md,2025-01-28 18:57:01
283,die befehlsgebung. gleiches gilt fur alle weiteren fuhrungs - und geschaftsprozesse und fur den inneren dienst - und geschaftsbetrieb. gezielte angriffe gegen diese systeme mussen insbesondere in konfliktsituationen erwartet werden. deshalb sind diese systeme zu schutzen ; den wirkungen solcher angriffe ist vorbeugend zu begegnen. die bundeswehr muss im rahmen eines,368,51,130,44,germany_2013_KonzeptionDerBundeswehr_noneng.md,2025-01-28 18:57:01
284,"einsatzes in der lage sein, auch initiativ im cyberraum zu wirken. das umfasst den zielgerichteten und koordinierten einsatz von maßnahmen im cyberraum zur aufklarung, veranderung und beeintrachtigung gegnerischer informations - und kommunikationssysteme und der darin verarbeiteten informationen. streitkrafte wirken durch ihr handeln immer auch im informationsumfeld. jede operation, jede",390,49,130,44,germany_2013_KonzeptionDerBundeswehr_noneng.md,2025-01-28 18:57:01
285,"entscheidung und jede waffenwirkung hat somit konsequenzen im informationsumfeld - erwunschte oder unerwunschte. wirkungen konnen dabei weit uber den eigentlichen verantwortungsbereich hinaus reichen, mit gunstigen oder nachteiligen folgen fur die gesamtsituation. die im informationsumfeld wahrgenommenen, weiter verbreiteten und interpretierten informationen beeinflussen das denken und handeln der akteure",408,47,130,44,germany_2013_KonzeptionDerBundeswehr_noneng.md,2025-01-28 18:57:01
286,". im rahmen eines einsatzes muss die bundeswehr daher auch im informationsumfeld in der lage sein, initiativ zu wirken, um das verhalten festgelegter zielgruppen im sinne der eigenen operationsziele zu beeinflussen. zudem muss die bundeswehr mit blick auf die deutsche und auch internationale offentlichkeit stets durch kommunikative maßnahmen die sicherheits - und verteidigungspolitischen ziele, position",406,55,130,44,germany_2013_KonzeptionDerBundeswehr_noneng.md,2025-01-28 18:57:01
287,und interessen deutschlands erlautern und das verstandnis und die anerkennung fur den soldatischen dienst im einsatz fordern.,125,17,38,44,germany_2013_KonzeptionDerBundeswehr_noneng.md,2025-01-28 18:57:01
288,"# # 5. 3 verbund fuhrung - aufklarung - wirkung - unterstutzung einsatze der bundeswehr erfolgen grundsatzlich in mehreren dimensionen bundeswehrgemeinsam im verbund fuhrung, aufklarung, wirkung, unterstutzung ( verbund fawu ). fur eine moglichst schnelle und effiziente operationsfuhrung ist dieser verbund so weit wie moglich zu vernetzen ( vernetzte operationsfuhrung, netop",377,51,130,45,germany_2013_KonzeptionDerBundeswehr_noneng.md,2025-01-28 18:57:01
289,"##fu ). fuhrung und einsatz von streitkraften unter den bedingungen der vernetzten operationsfuhrung erfordert einen bundeswehrgemeinsamen, alle fuhrungsebenen umfassenden, national und multinational interoperablen und sicheren informations - und kommunikationsverbund. alle relevanten personen, stellen, truppenteile und einrichtungen sowie sensoren und effektoren werden auf basis multinational interoperabler mittel und verfahren mit",436,49,132,45,germany_2013_KonzeptionDerBundeswehr_noneng.md,2025-01-28 18:57:01
290,##einander verbunden. von fuhrern und gefuhrten erfordert es die bereitschaft zu vernetztem denken und handeln sowie das wissen um die moglichkeiten und grenzen der vernetzung. die befahigung zur vernetzten operationsfuhrung ist ein vorrangiges ziel der weiterentwicklung der bundeswehr. sie ist deshalb auch ein wichtiger betrachtungsgegenstand in der fahigkeitslage der bundeswehr. die informations,400,52,132,45,germany_2013_KonzeptionDerBundeswehr_noneng.md,2025-01-28 18:57:01
291,"- und kommunikationstechnik ( it ) ist eine voraussetzung fur die realisierung der vernetzten operationsfuhrung und unterstutzt entscheidend die nationale und multinationale einsatzund fuhrungsfahigkeit von streitkraften63. um die befahigung als rahmennation sicherzustellen, konnen im zweifelsfall interoperabilitat und kompatibilitat in der nato und der eu vorrang vor nationaler bundeswehrge",394,48,130,45,germany_2013_KonzeptionDerBundeswehr_noneng.md,2025-01-28 18:57:01
292,"##meinsamkeit haben. die geoinfo - unterstutzung64 stellt fur die bundeswehr sicher, einsatzrelevante umwelteinflusse zu erkennen, fur das eigene handeln auszuwerten, sich exakt im dreidimensionalen raum zu positionieren, zu navigieren und prazise auf ziele zu wirken. sie stellt die geofaktoren der dimensionen land, luft, see und weltraum in einem informationsrau",365,49,131,45,germany_2013_KonzeptionDerBundeswehr_noneng.md,2025-01-28 18:57:01
293,##m auch fur den verbund fawu zur verfugung. mobilitat ist voraussetzung fur die durchfuhrung von operationen. sie umfasst fahigkeiten zur verlegung und die beweglichkeit der krafte. lage - und auftragsgerechte maßnahmen zum schutz eigener krafte sind teilweise gesetzlich normierte vorgabe und verpflichtender bestandteil von verantwortungsbewusstem fuhrungs,359,46,132,45,germany_2013_KonzeptionDerBundeswehr_noneng.md,2025-01-28 18:57:01
