chunk_id,text,char_length,word_count,token_count,section_index,source_file,processed_date
1,# # # # # the cabinet [UNK] [UNK],33,9,11,0,iraq_2007_NationalSecurityStrategy.md,2025-01-28 18:54:35
2,# iraq first,12,3,5,1,iraq_2007_NationalSecurityStrategy.md,2025-01-28 18:54:35
3,# # 2007 – 2010 - - - - - - - - - -,35,15,17,2,iraq_2007_NationalSecurityStrategy.md,2025-01-28 18:54:35
4,# # # # # # iraq first * * the iraqi national security strategy * * - - - - -,77,22,24,3,iraq_2007_NationalSecurityStrategy.md,2025-01-28 18:54:35
5,"# # # # # # in the name of allah, most gracious, most merciful republic of iraq [UNK] [UNK] the cabinet [UNK] [UNK] * * [UNK] * * * * national security council * * * * [UNK] [UNK] [UNK] [UNK] [UNK] * * * * press release * * * * iraq ’ s national security strategy * * * * [ 2007 – 2010 ] * * * * why a new strategy? * * 1. this strategy will provide for the first time for an iraqi government, in a single document, coherent top level direction to all the government in its efforts to establish security, promote prosperity, and assure self - reliance. 2",554,117,130,4,iraq_2007_NationalSecurityStrategy.md,2025-01-28 18:54:35
6,". the strategy is named “ iraq first ” because it focuses on iraq, its people, its situation, its challenges, and its enormous potential. 3. this strategy is linked to the international compact for iraq that brings into harmony all the international community efforts to assist iraq. 4. perhaps most important, the strategy is based on national reconciliation and has a broad understanding of national security. * * key elements : * * 1. defines iraq ’ s national interests ( including security, political, economic, and informational ). 2. affirms principles of federalism, rule of law, human and civil rights. 3. guides development of",636,104,130,4,iraq_2007_NationalSecurityStrategy.md,2025-01-28 18:54:35
7,"iraq ’ s human resources and natural resources. 4. protects freedom of the media and expression. 5. identifies threats to iraq ( terrorism, insurgency, corruption, crime, armed groups and militias, foreign interference, ethnic and sectarian violence, the dictatorial mentality of the past, and serious societal ills ). 6. defines four strategic components for using iraq ’ s resources to overcome threats and realize its interests : a. security component that includes sovereignty, territorial integrity, and the use of security forces. b. political component that includes national reconciliation, good governance, regional cooperation, and international agreements, that includes promoting human rights, *",707,100,130,4,iraq_2007_NationalSecurityStrategy.md,2025-01-28 18:54:35
8,"* iraq ’ s national security strategy * * * * [ 2007 – 2010 ] * * * * why a new strategy? * * 1. this strategy will provide for the first time for an iraqi government, in a single document, coherent top level direction to all the government in its efforts to establish security, promote prosperity, and assure self - reliance. 2. the strategy is named “ iraq first ” because it focuses on iraq, its people, its situation, its challenges, and its enormous potential. 3. this strategy is linked to the international compact for iraq that brings into harmony all the international community efforts to assist iraq. perhaps most",624,113,130,4,iraq_2007_NationalSecurityStrategy.md,2025-01-28 18:54:35
9,"important, the strategy is based on national reconciliation and has a broad understanding of national security. * * key elements : * * 1. defines iraq ’ s national interests ( including security, political, economic, and informational ). 2. affirms principles of federalism, rule of law, human and civil rights. 3. guides development of iraq ’ s human resources and natural resources. - - - - -",394,67,86,4,iraq_2007_NationalSecurityStrategy.md,2025-01-28 18:54:35
10,"# # # # # # in the name of allah, most gracious, most merciful republic of iraq [UNK] [UNK] the cabinet [UNK] [UNK] * * [UNK] * *",129,29,35,5,iraq_2007_NationalSecurityStrategy.md,2025-01-28 18:54:35
11,"# # # # # # ational security council * * [UNK] [UNK] [UNK] [UNK] [UNK] * * compensating victims, attacking unemployment and poverty, and providing for amnesty. c. economic component that includes reformed societal institutions, combating corruption, and promoting economic growth. d. informational component that provides legal sanctions for free and responsible journalism and confronts incitements to violence and terrorism. references : this strategy has been formulated based on the iraqi constitution, key new agreements such as the international compact for iraq, and the iraqi national reconciliation and dialog project. the strategy is promulgated now following the success of the constitutional government and iraqi",724,105,130,6,iraq_2007_NationalSecurityStrategy.md,2025-01-28 18:54:35
12,"security forces in operations in baghdad ( fahrd al qanoon ), the anbar awakening ( sahwat al anbar ), and success in diyala province – in the expectation of "" sahwat "" throughout the republic. this strategy will be broadly disseminated in order to stimulate public discussion and debate in which all citizens can participate. amnesty. c. economic component that includes reformed societal institutions, combating corruption, and promoting economic growth. d. informational component that provides legal sanctions for free and responsible journalism and confronts incitements to violence and terrorism. references : this strategy has been formulated based on the iraqi",668,100,130,6,iraq_2007_NationalSecurityStrategy.md,2025-01-28 18:54:35
13,"constitution, key new agreements such as the international compact for iraq, and the iraqi national reconciliation and dialog project. the strategy is promulgated now following the success of the constitutional government and iraqi security forces in operations in baghdad ( fahrd al qanoon ), the anbar awakening ( sahwat al anbar ), and success in diyala province – in the expectation of "" sahwat "" throughout the republic. this strategy will be broadly disseminated in order to stimulate public discussion and debate in which all citizens can participate. - - - - -",568,93,118,6,iraq_2007_NationalSecurityStrategy.md,2025-01-28 18:54:35
14,"# # # # # # in the name of allah, most gracious, most merciful republic of iraq [UNK] [UNK] the cabinet [UNK] [UNK] * * [UNK] * *",129,29,35,7,iraq_2007_NationalSecurityStrategy.md,2025-01-28 18:54:35
15,"# # # # # # ational security council * * [UNK] [UNK] [UNK] [UNK] [UNK] * * republic of iraq the cabinet national security council no. 2 / a to : council of representatives presidency the presidency of iraq the cabinet supreme judicial council all ministries institutions not linked to ministries parliament and government of the kurdistan region heads of provincial governing councils and governors subject : iraqi national security strategy ( ( general introduction ) ) peace be on you … the iraqi constitution of 2005 – item 110 – second paragraph states that ( establishing and implementing national security policy ) is one of the specific duties of the federal government. therefore, prime minister maliki directed the national security council",749,123,130,8,iraq_2007_NationalSecurityStrategy.md,2025-01-28 18:54:35
16,"to develop a national security strategy 2007 - 2010. the strategy that represents the policy of the government, in achieving national interests and identifying and deterring threats as part of the political and practical program of the government, was prepared in a joint national iraqi effort and high level coordination in meetings that continued for four months in the ministries and other concerned entities. the national security strategy is a document that the ministries and other institutions of the government use in establishing their policies and plans related to national security. the announcement of this strategy helps in enhancing understanding of the direction and intent of the government of iraq in the region and with other countries ; assists in establishing positive",788,122,130,8,iraq_2007_NationalSecurityStrategy.md,2025-01-28 18:54:35
17,"relationships with the international community and especially in the region ; and creates national tie between the people and the government so as to make the people part of the political, economic, social and security program. in order to make the national project a joint effort to build the government and protect its principles and premises, the following should be taken into consideration : the cabinet national security council to : council of representatives presidency the presidency of iraq the cabinet supreme judicial council all ministries institutions not linked to ministries parliament and government of the kurdistan region heads of provincial governing councils and governors subject : iraqi national security strategy ( ( general introduction ) ) peace be on you … the iraqi",793,124,130,8,iraq_2007_NationalSecurityStrategy.md,2025-01-28 18:54:35
18,"constitution of 2005 – item 110 – second paragraph states that ( establishing and implementing national security policy ) is one of the specific duties of the federal government. therefore, prime minister maliki directed the national security council to develop a national security strategy 2007 - 2010. the strategy that represents the policy of the government, in achieving national interests and identifying and deterring threats as part of the political and practical program of the government, was prepared in a joint national iraqi effort and high level coordination in meetings that continued for four months in the ministries and other concerned entities. - - - - -",673,107,117,8,iraq_2007_NationalSecurityStrategy.md,2025-01-28 18:54:35
19,"# # # # # # in the name of allah, most gracious, most merciful republic of iraq [UNK] [UNK] * * [UNK] [UNK] * * * * [UNK] * *",125,31,37,9,iraq_2007_NationalSecurityStrategy.md,2025-01-28 18:54:35
20,"# # # # # # ational security council * * [UNK] [UNK] [UNK] [UNK] [UNK] * * 1. national security strategy preparation phases : a. the joint planning center ( jpc ), including representatives of members of the dmcns ( deputy ministerial committee on national security ) and directors general ( dgs ) from the main ministries, was authorized on 27 march 2007 to prepare the strategy. the jpc held six long meetings hosting a number of experts and specialists in the field of strategy and the recommendations and work plan were sent to the dmcns in april 2007. b. a main team for preparing the strategy was formed and supervised by",627,113,130,10,iraq_2007_NationalSecurityStrategy.md,2025-01-28 18:54:35
21,"the deputy nsa ( national security advisor ) ; directed by the dg of the jpc ; and included eight different advisors from different fields as members ; according to the administrative order 401 of 9 may 2007. this main team worked jointly with a supporting team composed of representatives of members of the mcns in the jpc and a group of experts. c. nineteen meetings were held for the two teams in the national security council during the period 10 april 2007 to 1 july 2007. a number of authoritative experts ( from the ministry of defense, ministry of planning, public integrity commission, vice - president hashimi ’ s office, and representatives of the",658,115,130,10,iraq_2007_NationalSecurityStrategy.md,2025-01-28 18:54:35
22,"kurdistan regional government ) and university professors were hosted. d. a draft of the strategy was sent to the three presidencies, to all ministries, and to all institutions not linked to ministries in our letter 461 on 8 may 2007. the two teams incorporated all recommendations and comments received after studying and examining them. e. the strategy was presented to the dmcns in the phase of preparation on 30 april 2007 and to the mcns on 10 june 2007. the notes and recommendations of the two councils were taken into consideration. of particular note is that the two councils showed their support for the drafting procedure and affirmed the necessity of preparing this",677,113,130,10,iraq_2007_NationalSecurityStrategy.md,2025-01-28 18:54:35
23,"historical document. the document then was submitted to the dmcns in 25 june 2007 and finally submitted to the mcns on 22 july 2007 where it was approved. f. a group of the national security strategy preparation team visited vice - president tariq hashimi, first deputy of the council of representatives head sheik khalid al - atya, the minister of interior, the chief of the diwan of the council of ministers, the president of the kurdistan region and a number of officials in kurdistan, to present the details of the strategy and take notes and recommendations to advance this national project as the first national security strategy in the political history of",663,112,130,10,iraq_2007_NationalSecurityStrategy.md,2025-01-28 18:54:35
24,"iraq. a. the joint planning center ( jpc ), including representatives of members of the dmcns ( deputy ministerial committee on national security ) and directors general ( dgs ) from the main ministries, was authorized on 27 march 2007 to prepare the strategy. the jpc held six long meetings hosting a number of experts and specialists in the field of strategy and the recommendations and work plan were sent to the dmcns in april 2007. b. a main team for preparing the strategy was formed and supervised by the deputy nsa ( national security advisor ) ; directed by the dg of the jpc ; and included eight different advisors from",629,112,130,10,iraq_2007_NationalSecurityStrategy.md,2025-01-28 18:54:35
25,"different fields as members ; according to the administrative order 401 of 9 may 2007. this main team worked jointly with a supporting team composed of representatives of members of the mcns in the jpc and a group of experts. c. nineteen meetings were held for the two teams in the national security council during the period 10 april 2007 to 1 july 2007. a number of authoritative experts ( from the ministry of defense, ministry of planning, public integrity commission, vice - president hashimi ’ s office, and representatives of the kurdistan regional government ) and university professors were hosted. d. a draft of the strategy was sent to the three presidencies",669,113,130,10,iraq_2007_NationalSecurityStrategy.md,2025-01-28 18:54:35
26,", to all ministries, and to all institutions not linked to ministries in our letter 461 on 8 may 2007. the two teams incorporated all recommendations and comments received after studying and examining them. e. the strategy was presented to the dmcns in the phase of preparation on 30 - - - - -",293,54,63,10,iraq_2007_NationalSecurityStrategy.md,2025-01-28 18:54:35
27,"# # # # # # in the name of allah, most gracious, most merciful republic of iraq [UNK] [UNK] the cabinet [UNK] [UNK] * * [UNK] * *",129,29,35,11,iraq_2007_NationalSecurityStrategy.md,2025-01-28 18:54:35
28,"# # # # # # ational security council * * [UNK] [UNK] [UNK] [UNK] [UNK] * * 2. prime minister maliki wrote the introduction to the national security strategy on 21 july 2007. 3. the introduction and appreciation letter was written by the national security advisor on 22 july 2007. 4. due to the importance of the presenting and obtaining support for the strategy at all levels and from all authorities in iraq, the strategy was printed in arabic and translated into english. a kurdish version is also being produced. 2. prime minister maliki wrote the introduction to the national security strategy on 21 july 2007. 3. the introduction and appreciation letter was",662,114,130,12,iraq_2007_NationalSecurityStrategy.md,2025-01-28 18:54:35
29,"written by the national security advisor on 22 july 2007. 4. due to the importance of the presenting and obtaining support for the strategy at all levels and from all authorities in iraq, the strategy was printed in arabic and translated into english. a kurdish version is also being produced. 5. references used in the preparation of this strategy : a ) iraqi constitution of 2005 b ) international compact for iraq document c ) national dialogue and reconciliation project document d ) a number of different national security strategies from other countries. please consider this … with respect * * dr. mowaffak rubaie * * * * national security advisor * * * *",662,115,130,12,iraq_2007_NationalSecurityStrategy.md,2025-01-28 18:54:35
30,july 2007 * * - - - - -,23,9,11,12,iraq_2007_NationalSecurityStrategy.md,2025-01-28 18:54:35
31,# # # # # # iraq first * * the iraqi national security strategy * *,67,17,19,13,iraq_2007_NationalSecurityStrategy.md,2025-01-28 18:54:35
32,"# # # # in the name of allah, most gracious and most merciful message from the prime minister of iraq progress of countries and nations is measured by the presence of a clear strategy that is scientifically based and adopts practical criteria for measuring progress and success. the success of our democratic approach depends on the general framework of the national security strategy ; in which all security domains including political, economic, security and informational are the foundation for democracy. throughout its history iraq was governed and oppressed by despotism and dictatorship, did not have clarity in its objectives and policies, and adopted a self - contradictory defective ideology and practices that",720,113,130,14,iraq_2007_NationalSecurityStrategy.md,2025-01-28 18:54:35
33,"resulted in many crises. therefore, in order to establish a federal democratic iraq, the national security strategy was created. noori al maliki prime minister of iraq july 2007",177,28,36,14,iraq_2007_NationalSecurityStrategy.md,2025-01-28 18:54:35
34,"# # # # criteria for measuring progress and success. the success of our democratic approach depends on the general framework of the national security strategy ; in which all security domains including political, economic, security and informational are the foundation for democracy. throughout its history iraq was governed and oppressed by despotism and dictatorship, did not have clarity in its objectives and policies, and adopted a self - contradictory defective ideology and practices that resulted in many crises. therefore, in order to establish a federal democratic iraq, the national security strategy was created. noori al maliki prime minister of iraq july 2007 - - - - -",682,108,126,15,iraq_2007_NationalSecurityStrategy.md,2025-01-28 18:54:35
35,# # # # # # iraq first * * the iraqi national security strategy * *,67,17,19,16,iraq_2007_NationalSecurityStrategy.md,2025-01-28 18:54:35
36,"# # # # # # message from the national security advisor of iraq in appreciation and acknowledgement article ( 110 ) of the constitution states that national security policy is one of the tasks of the federal government ; therefore the national security strategy represents a constitutional requirement presented by the government to announce its vision of the national interests, threats, and the means available to defeat these threats. the national security strategy represents the general framework to be followed by the government in achieving the national interests of the iraqi people in light of the threats iraq confronts ; the concerned ministries will use this strategy in establishing detailed programs for the implementation of the principles of the strategy. distribution of",786,123,130,17,iraq_2007_NationalSecurityStrategy.md,2025-01-28 18:54:35
37,"the strategy to the world will make the world more reassured of iraq ’ s intent to establish positive and cordial relationships with its neighbors and other countries ; and reemphasize iraq ’ s position in refusing to make its territory a starting ground, a headquarters, or a passage to terrorists and criminal groups that threaten the security of iraq and its neighbors — this will pave the way to rebuilding practical relationships with other countries, especially neighboring countries. the distribution of the strategy, also, contributes to informing the citizenry of the government ’ s directions and intent to achieve its supreme interests such as security, welfare, stability and peace. this strategy",708,112,130,17,iraq_2007_NationalSecurityStrategy.md,2025-01-28 18:54:35
38,"is the result of weeks of a collective effort and hard work of an iraqi team, in which iraqis demonstrated the spirit of dedication and seriousness. i am most thankful to all those officials from all security ministries and institutions who contributed to this strategy, especially my colleague ministers for their invaluable notes. i also present a special acknowledgment to the joint planning center in the national security advisory team and its director mr. ali abdul aziz and to all those who contributed to completing this major effort. dr. mowaffak al rubaie national security advisor july 2007",601,97,120,17,iraq_2007_NationalSecurityStrategy.md,2025-01-28 18:54:35
39,"# # # # # # means available to defeat these threats. the national security strategy represents the general framework to be followed by the government in achieving the national interests of the iraqi people in light of the threats iraq confronts ; the concerned ministries will use this strategy in establishing detailed programs for the implementation of the principles of the strategy. distribution of the strategy to the world will make the world more reassured of iraq ’ s intent to establish positive and cordial relationships with its neighbors and other countries ; and reemphasize iraq ’ s position in refusing to make its territory a starting ground, a headquarters, or a passage to terrorists and criminal groups",721,119,130,18,iraq_2007_NationalSecurityStrategy.md,2025-01-28 18:54:35
40,"that threaten the security of iraq and its neighbors — this will pave the way to rebuilding practical relationships with other countries, especially neighboring countries. the distribution of the strategy, also, contributes to informing the citizenry of the government ’ s directions and intent to achieve its supreme interests such as security, welfare, stability and peace. this strategy is the result of weeks of a collective effort and hard work of an iraqi team, in which iraqis demonstrated the spirit of dedication and seriousness. i am most thankful to all those officials from all security ministries and institutions who contributed to this strategy, especially my colleague ministers for their invaluable notes.",722,111,130,18,iraq_2007_NationalSecurityStrategy.md,2025-01-28 18:54:35
41,i also present a special acknowledgment - - - - -,49,11,18,18,iraq_2007_NationalSecurityStrategy.md,2025-01-28 18:54:35
42,# # # # # # iraq first * * the iraqi national security strategy * * - - - - -,77,22,24,19,iraq_2007_NationalSecurityStrategy.md,2025-01-28 18:54:35
43,# # # # # # iraq first * * the iraqi national security strategy * *,67,17,19,20,iraq_2007_NationalSecurityStrategy.md,2025-01-28 18:54:35
44,"# # # # in the name of allah, most gracious and most merciful message from the prime minister of iraq progress of countries and nations is measured by the presence of a clear strategy that is scientifically based and adopts practical criteria for measuring progress and success. the success of our democratic approach depends on the general framework of the national security strategy ; in which all security domains including political, economic, security and informational are the foundation for democracy. throughout its history iraq was governed and oppressed by despotism and dictatorship, did not have clarity in its objectives and policies, and adopted a self - contradictory defective ideology and practices that",720,113,130,21,iraq_2007_NationalSecurityStrategy.md,2025-01-28 18:54:35
45,"resulted in many crises. therefore, in order to establish a federal democratic iraq, the national security strategy was created. noori al maliki prime minister of iraq july 2007",177,28,36,21,iraq_2007_NationalSecurityStrategy.md,2025-01-28 18:54:35
46,"# # # # a clear strategy that is scientifically based and adopts practical criteria for measuring progress and success. the success of our democratic approach depends on the general framework of the national security strategy ; in which all security domains including political, economic, security and informational are the foundation for democracy. throughout its history iraq was governed and oppressed by despotism and dictatorship, did not have clarity in its objectives and policies, and adopted a self - contradictory defective ideology and practices that resulted in many crises. therefore, in order to establish a federal democratic iraq, the national security strategy was created. noori al maliki prime minister of",724,110,130,22,iraq_2007_NationalSecurityStrategy.md,2025-01-28 18:54:35
47,iraq july 2007 - - - - -,24,8,10,22,iraq_2007_NationalSecurityStrategy.md,2025-01-28 18:54:35
48,# # # # # # iraq first * * the iraqi national security strategy * *,67,17,19,23,iraq_2007_NationalSecurityStrategy.md,2025-01-28 18:54:35
49,"# # # # # # message from the national security advisor of iraq in appreciation and acknowledgement article ( 110 ) of the constitution states that national security policy is one of the tasks of the federal government ; therefore the national security strategy represents a constitutional requirement presented by the government to announce its vision of the national interests, threats, and the means available to defeat these threats. the national security strategy represents the general framework to be followed by the government in achieving the national interests of the iraqi people in light of the threats iraq confronts ; the concerned ministries will use this strategy in establishing detailed programs for the implementation of the principles of the strategy. distribution of",786,123,130,24,iraq_2007_NationalSecurityStrategy.md,2025-01-28 18:54:35
