chunk_id,text,char_length,word_count,token_count,section_index,source_file,processed_date
98,"# # # # # # policy coordination for effective policy coordination, a new national security coordination secretariat ( nscs ), working under the guidance of the existing security policy review committee ( sprc ), has been institutionalized at the heart of the singapore government. security policy review committee : the coordinating minister for security and defence chairs this committee, which also comprises the ministers for defence, home affairs and foreign affairs. the committee meets regularly to guide national security strategy and policy formulation. it examines the country ’ s most critical national security capability development goals, discusses critical issues and threats, and reviews prevailing national security measures. national security coordination secretariat : the",790,114,130,43,singapore_2004_NationalSecurityStrategy.md,2025-01-28 18:53:51
99,"secretariat is an important central hub located within the prime minister ’ s office, tasked with national security planning and the coordination of policy and intelligence issues. a permanent secretary for national security and intelligence coordination has been appointed to head the secretariat. the permanent secretary will report directly to the prime minister through the coordinating minister for security and defence. he will chair a national security coordinating committee comprising other permanent secretaries. this committee will be responsible to sprc for security policy coordination. in addition, the permanent secretary will also chair an intelligence coordinating committee which will be in charge of coordinating singapore ’ s counter - terrorism intelligence activities. the national security coordination secretariat depends on two",852,119,130,43,singapore_2004_NationalSecurityStrategy.md,2025-01-28 18:53:51
100,"key agencies - the national security coordination centre ( nscc ) and the joint counter - - - - - terrorism centre ( jctc ) - to support its policy and _ operational coordination _ intelligence functions. the nscc comprises separate groups to undertake policy, planning and risk - there are established arrangements in singapore to assessment and horizon - scanning responsibilities, deal with national crises. since 1978, the government including the operation of a horizon scanning centre. has maintained an inter - agency crisis management structure called the the jctc provides executive group ( eg ). intelligence and the eg is a tested",641,104,119,43,singapore_2004_NationalSecurityStrategy.md,2025-01-28 18:53:51
101,"# # # # # # “ the enhancements to the crisis assessments on terrorist system, having been threats to facilitate _ management structure will enable my _ deployed for crisis policy - making and _ ministry to plan for contingency _ situations ranging from counter - terrorism efforts. the collapse of the",301,53,60,44,singapore_2004_NationalSecurityStrategy.md,2025-01-28 18:53:51
102,"# # # # # # responses more holistically. ” it serves as a multi - hotel new world in agency centre of 1986 to the hijacking of _ minister for home affairs wong kan seng _ expertise on terrorism to _ addressing parliament on 12 march 2004 _ sq 117 in 1991. in provide comprehensive 2003, the eg was and timely terrorist - activated to coordinate related threat assessments. the jctc thus integrates singapore ’ s response to the sars crisis. the work of the various intelligence agencies and departments in singapore. in fact, drawing from our experience with sars, we know that national crises may come in unexpected",616,110,130,45,singapore_2004_NationalSecurityStrategy.md,2025-01-28 18:53:51
103,"forms. the threats and challenges we face are unpredictable and may cut across the ambit of a number of ministries and agencies. a robust crisis management framework is required to coordinate national responses, allocate resources and manage farreaching consequences and implications. for better operational coordination, the ministry of home affairs has introduced a homefront crisis management system consisting of a homefront crisis ministerial committee ( hcmc ) and a homefront crisis executive group ( hceg ). homefront crisis ministerial committee : the hcmc is chaired by the minister for home affairs and _ the executive group ( eg ) mechanism has been activated on a number of _ _",690,109,130,45,singapore_2004_NationalSecurityStrategy.md,2025-01-28 18:53:51
104,"occasions, such as during the collapse of the hotel new world in 1986, _ comprises other cabinet ministers as principal _ which killed 33 and injured 17. _ members. the hcmc provides strategic and political - - - - - guidance on the handling of crises with the aim of maintaining normalcy as far as possible. homefront crisis executive group : the hceg is a decision - making group, staffed by high - level policy decision - makers from the various ministries and government agencies. it is led by the permanent secretary of the ministry of home affairs. generally, the responsibility of the hceg is to provide policy guidance and strategic decisions on the",657,114,130,45,singapore_2004_NationalSecurityStrategy.md,2025-01-28 18:53:51
105,"management of major crises. it will also provide operational coordination support to the ministerial committee, resolve crossministry issues and ensure that decisions and directives from the ministerial committee are implemented. the hceg is supported by multi - agency and multi - discipline crisis management groups where cross - agency issues can be coordinated and resolved quickly.",386,56,67,45,singapore_2004_NationalSecurityStrategy.md,2025-01-28 18:53:51
106,"# # # # # # capability development coordination understanding networking : a network must be supported by individuals equipped not just with their respective skills and specialties, but also with a common understanding of singapore ’ s national security strategy and policies. the government will implement several programmes to further inter - agency exchanges. for a start, a national security course will be conducted for senior security practitioners. the course, to be coordinated by the national security coordination centre, will focus on the inter - agency and networkcentric character of singapore ’ s national security architecture. it will be useful to the national security community in a number of ways. it enables a better understanding of",753,117,130,46,singapore_2004_NationalSecurityStrategy.md,2025-01-28 18:53:51
107,"transnational terrorism and explains the need for continued vigilance. it enhances the awareness of the specific organizations, linkages and processes that have been created or strengthened to deal with national security issues. in addition, it increases awareness of the various national security policies, and capability development and contingency plans. the government will also hold annual national security seminars for national security agencies. the seminars are organized by the national security coordination centre. the coordinating minister for security and defence will use the occasion to present the broad national security objectives for the immediate future. the national security seminar will help to align individual government ministries and agencies with the larger national security",804,112,130,46,singapore_2004_NationalSecurityStrategy.md,2025-01-28 18:53:51
108,"picture and keep them updated on government policies. in this regard, it will provide insights into current issues and help explain new security initiatives. anticipating surprises : in the longer term, we need to establish a risk - assessment and horizon - scanning capability to anticipate strategic surprises. in a world _ deputy prime minister and then defence minister dr tony tan _ _ addressing the inaugural national security seminar in june 2003, _ _ attended by senior security officials across the singapore government. _ - - - - - where threats can come right out of the blue, as we have learnt from our experience with sars, it is useful to have a framework to",672,116,130,46,singapore_2004_NationalSecurityStrategy.md,2025-01-28 18:53:51
109,"help us deal with them in a coherent way. uncertainty and unpredictability are the key challenges, and our focus will be on anticipating surprises. deputy prime minister and coordinating minister for security and defence dr tony tan has warned that globalization and our open borders present many more possibilities for the unexpected, which can inflict great damage and even alter our way of life. “ sars, for example, caught us completely by surprise, ” he noted. “ we have learnt many valuable lessons from the experience, but the next strategic surprise may be very different from the last. beyond the actual damage, the psychological impact of these surprises can be extremely",681,111,130,46,singapore_2004_NationalSecurityStrategy.md,2025-01-28 18:53:51
110,"serious and we would need to guard against being dislocated by such shocks. ” the government will strengthen risk - assessment and horizon - scanning capabilities to bring together different agencies in the tasks of monitoring and authoring scenarios, assessing risks and sounding early warnings. we will also work with think - tanks and research institutes, such as the international centre for political violence and terrorism research at the institute of defence and strategic studies to develop a common, in - depth understanding of the terrorism problem, especially its ideological underpinnings.",601,91,107,46,singapore_2004_NationalSecurityStrategy.md,2025-01-28 18:53:51
111,"# # # # # # evolving architecture the series of security structures and programmes outlined here serves to fully equip the government to deal with various contingencies, whether episodic or of a prolonged nature, whether focused internally or with an external dimension. in summary, the national security coordination secretariat will provide overall security policy direction in the national counterterrorism effort. it will also coordinate singapore ’ s national intelligence agencies. as structures cannot remain inflexible in the face of evolving threats, we will continue to strengthen and upgrade the national security architecture to meet new challenges. - - - - - - - - - -",681,107,129,47,singapore_2004_NationalSecurityStrategy.md,2025-01-28 18:53:51
112,# # # # # # chapter five,24,8,10,48,singapore_2004_NationalSecurityStrategy.md,2025-01-28 18:53:51
113,# # # # implementing our strategy - - - - - preface [ a national security strategy for singapore ] one [ confronting transnational terrorism ] two [ s i n g a p o r e ’ s e x p e r i e n c e w i t h t e r r o r i s m ] t hree [ t h e n e w s e c u r i t y e n v i r o n m e n t ] four [ s i n g a p o r e ’ s n at i o na l s e c u r i t y a r c h i t,350,126,130,49,singapore_2004_NationalSecurityStrategy.md,2025-01-28 18:53:51
114,e c t u r e ] * * five [ i m p l e m e n t i n g o u r s t r at e g y ] * * six [ national secrity : a national effort ],120,45,48,49,singapore_2004_NationalSecurityStrategy.md,2025-01-28 18:53:51
115,"# # # # # # o deal effectively with the threat of transnational terrorism, singapore has # # t # # # # # # deployed a robust defence strategy built upon a well - organized network of government agencies, often working in partnership with commercial and private parties. this integrated, layered approach is structured around the prevention, protection and response domains. by an effective combination of various measures, we can be confident of meeting major terror threats.",475,79,90,50,singapore_2004_NationalSecurityStrategy.md,2025-01-28 18:53:51
116,"# # # # # # prevention prevention represents the most critical layer of defence against terrorism. a successful strategy saves lives, preserves property, and avoids potential disruption to our economy and society. it entails an integration of effective diplomacy, good intelligence work, and strong border controls. where we can, we must ensure that terror threats are eliminated before they materialize.",404,61,74,51,singapore_2004_NationalSecurityStrategy.md,2025-01-28 18:53:51
117,# # # # # # an integrated approach to national security - - - - -,65,17,19,52,singapore_2004_NationalSecurityStrategy.md,2025-01-28 18:53:51
118,# # # # # # singapore as a responsible singapore also signed the un convention for the,86,18,20,53,singapore_2004_NationalSecurityStrategy.md,2025-01-28 18:53:51
119,"# # # # # # global citizen suppression of the financing of terrorism in december 2001, ratifying it the following year. the singapore works diligently with partners in the region monitoring and cutting off of funds to terrorist and the wider international community on various organizations constitutes a crucial stroke in the fronts. we recognize that the war against terrorism not international effort against terrorism. singapore is also only affects us, but is also a problem shared by many a participant in the us - led proliferation security other countries. initiative, a multilateral singapore leaders have effort to combat the spoken out clearly and spread of weapons of consistently at various _ “ your nation has",723,117,130,54,singapore_2004_NationalSecurityStrategy.md,2025-01-28 18:53:51
120,also been a vital and _ mass destruction. local and international _ steadfast friend in the fight against _ forums against the threat _ global terror. singapore has made _ of transnational,188,32,39,54,singapore_2004_NationalSecurityStrategy.md,2025-01-28 18:53:51
121,# # # # # # determined and successful efforts to terrorism.,59,12,15,55,singapore_2004_NationalSecurityStrategy.md,2025-01-28 18:53:51
122,"# # # # # # break up terror plots before they can take more specifically, the _ innocent lives. ” _ government has worked * * asean * * closely with other _ united states president george w. bush _ countries in _ 6 may 2003 _ implementing a series of practical anti - terror in the region, singapore measures. for instance, _ “ we share together a lot of information _ has joined other asean singapore responded _ on terrorism. we work together closely on _ states in appointing swiftly in the passage of points of contact for",526,100,109,56,singapore_2004_NationalSecurityStrategy.md,2025-01-28 18:53:51
123,"# # # # # # trying to ensure that terrorism in the the landmark united intelligence liaison. this nations security council _ region is progressively brought under _ was formalized during resolution 1373 of 2001, _ control... ” _ the special asean which established a legal ministerial meeting on foundation for _ australian foreign minister alexander downer _ terrorism in may 2002. _ 27 july 2003 _ international action in addition, singapore against terrorism. co - hosted a workshop according to minister for with the united states foreign affairs prof s. jayakumar, this was “ a landmark on counter - terrorism financing in january 2003. the resolution which dealt comprehensively with",689,112,130,57,singapore_2004_NationalSecurityStrategy.md,2025-01-28 18:53:51
124,"counter - workshop sought to help asean and pacific islands terrorism ”, providing “ a legal basis for all states to take forum members strengthen their domestic efforts action against terrorists and their supporters. ” against terrorism. - - - - - _ us customs commissioner robert c. bonner signs the csi _ _ with koh cheng hwa, director - general of singapore ’ s _ _ customs and excise department. _",402,72,84,57,singapore_2004_NationalSecurityStrategy.md,2025-01-28 18:53:51
125,"# # # # # # what is the container security initiative? _ singapore is the first asian country to join _ _ the us - led container security initiative. _ _ the csi recognizes the potential dangers _ _ posed by illicit seaborne cargo, such as _ _ bomb materials. csi ports use intelligence _ _ to identify and target high - risk american - _ _ bound containers and pre - screen them _ _ before they are shipped to us ports. many _ _ other ports worldwide have agreed to join _ _ the csi and are at various stages of _ _ implementing the initiative. collectively, _ _ these ports handle two - thirds of container",608,120,130,58,singapore_2004_NationalSecurityStrategy.md,2025-01-28 18:53:51
126,_ _ traffic shipped to the us. _,32,8,11,58,singapore_2004_NationalSecurityStrategy.md,2025-01-28 18:53:51
127,"# # # # # # what are solas and the isps code? _ the international convention for the safety of _ _ life at sea ( solas ) is one of the most important _ _ international conventions dealing with _ _ maritime safety. it is also one of the oldest, with _ _ the first version having been adopted at a 1914 _ _ convention. since then, four other solas _ _ conventions have been held. solas specifies _ _ standards on safety for the construction, _ _ equipping and operations of ships. _ _ the isps ( international ship and port facility _ _ security ) code contains mandatory",569,112,130,59,singapore_2004_NationalSecurityStrategy.md,2025-01-28 18:53:51
128,"detailed _ _ security - related requirements for governments, _ _ port authorities, port facilities and shipping _ _ companies. a non - mandatory section contains _ _ a series of guidelines on how to meet these _ _ requirements. the code provides a _ _ standardized framework to evaluate the risk _ _ of terrorist acts, enabling governments and _ _ ship operators to calibrate preparedness levels _ _ and potential responses to corresponding _ _ threat levels. isps - compliant ports put in place _ _ a wide series of security plans, with regular _ _ assessments and drills. _ - - - - - singapore was also the first port in asia to",631,116,130,59,singapore_2004_NationalSecurityStrategy.md,2025-01-28 18:53:51
129,"implement the us container security initiative ( csi ) in january 2003. the csi aims to screen high - risk containers before they arrive at american ports. in other areas of maritime security, singapore cooperates closely with member states of the international maritime organization to formulate measures to enhance security. singapore has implemented special amendments to the international convention for the safety of life at sea ( solas ) and the international ship and port facility security code ( isps code ).",517,82,93,59,singapore_2004_NationalSecurityStrategy.md,2025-01-28 18:53:51
130,"# # # # # # successful intelligence coordination one critical component in combating transnational terrorism is good intelligence. accurate and early intelligence allows authorities to disrupt terror plots _ mas selamat kastari, the head of ji in singapore, was arrested in _ _ indonesia following a tip - off from singapore intelligence agencies. he was _ _ accused of plotting an airborne attack on singapore ’ s changi airport. _ and arrest key operatives before attacks can be launched. the foiling of the ji plots stemmed from effective intelligence work. singapore ’ s intelligence agencies also cooperate closely with their regional counterparts on information exchanges. the arrest in indonesia of mas",709,112,130,60,singapore_2004_NationalSecurityStrategy.md,2025-01-28 18:53:51
131,"selamat kastari, the singapore ji cell leader, and the arrest in thailand of arifin ali, a senior member of the cell, demonstrated the effectiveness of coordinated action and intelligence sharing with other partners.",216,33,45,60,singapore_2004_NationalSecurityStrategy.md,2025-01-28 18:53:51
132,"# # # # # # effective border controls the security of individual singaporeans is strengthened not just by protective measures at their doorstep, but also by strong controls at the borders of the country. land, sea and air access into singapore must be fortified by effective controls. stringent measures are necessary to prevent the entry of foreign terrorist elements and materials. recognizing the need to create a clear, coordinated border control system, the government merged the border control functions of both the customs and excise department and the singapore immigration and registration to form the immigration and checkpoints authority, or ica, on 1 april 2003. the ica now has seamless",699,111,130,61,singapore_2004_NationalSecurityStrategy.md,2025-01-28 18:53:51
133,operational capabilities to monitor and regulate the movement of goods and people across singapore ’ s borders.,111,17,20,61,singapore_2004_NationalSecurityStrategy.md,2025-01-28 18:53:51
134,"# # # # # # protection improved capabilities to prevent terrorist actions will help to reduce the overall threat. nonetheless, we still need to harden singapore with a layer of strong, protective measures. rather than protect every possible target, we have to prioritize our efforts, given - - - - - _ standing guard at access points _ _ to jurong island. _ our limited resources, and focus on areas of greatest concern.",420,74,88,62,singapore_2004_NationalSecurityStrategy.md,2025-01-28 18:53:51
135,"# # # # # # protection of critical infrastructure and key installations since the september 11 attacks, the government has enhanced the security of singapore ’ s critical infrastructure. we have instituted a range of security measures, such as the installation of surveillance cameras at power stations and water networks. more broadly, a national critical infrastructure assurance committee was formed to study the vulnerabilities of singapore ’ s critical infrastructure, and to recommend the protective steps to take. security at other local and overseas key installations, such as our embassies, has also been strengthened. on jurong island, the site of singapore ’ s petrochemical hub, armed personnel",706,108,130,63,singapore_2004_NationalSecurityStrategy.md,2025-01-28 18:53:51
136,", including singapore armed forces ( saf ) troops, have been deployed to increase security. they work closely with the police coast guard and commercial security forces that guard sea and land access to jurong island. apart from the emphasis on the protection of key installations, security at prominent public places such as boat quay, the esplanade and holland village has been stepped up as well.",399,66,79,63,singapore_2004_NationalSecurityStrategy.md,2025-01-28 18:53:51
137,"# # # # # # enhanced security at high - profile events singapore plays host to various prominent international events each year, many of which draw top foreign dignitaries. these include regular fixtures such as the asian aerospace airshow and the asia - - - - - security conference, also known as the shangri - la dialogue. a disruption of any of these events will not only offer terrorists a great symbolic victory, but will also inflict great harm on singapore. the government conducts thorough security assessments of each event. depending on the level of risk, the appropriate security measures will be enforced to counter potential terrorist threats. extensive measures to deal with conting",696,115,130,64,singapore_2004_NationalSecurityStrategy.md,2025-01-28 18:53:51
138,"##encies in the mass rapid transit ( mrt ) network. agencies such as the home affairs ministry, the singapore police force, the singapore civil defence force ( scdf ), the land transport authority and rail operators work closely to formulate detailed response plans. exercises are held to test disaster management procedures, and regular security audits are conducted on emergency systems. many of the security measures in place at train stations, such as tightened access to vital premises and the use of close - circuit television to monitor the mrt network, were implemented as part of the security planning for singapore ’ s train systems. however, the march 2004 terrorist train bombings in",695,112,133,64,singapore_2004_NationalSecurityStrategy.md,2025-01-28 18:53:51
139,madrid have prompted a further review of land transport security in singapore. both the police and transport operators will deploy security personnel at key locations. public vigilance broadcast messages and posters have also been introduced.,242,35,42,64,singapore_2004_NationalSecurityStrategy.md,2025-01-28 18:53:51
140,"# # # # # # land transport security the security of singapore ’ s land transport system is a critical issue for all citizens. millions of journeys are made each day on singapore ’ s rail and bus networks. the economy depends significantly on the efficiency of this mass movement of people. it is vital, therefore, for commuters to be assured that their regular journeys are not only fast and efficient, but also safe and protected. this is something that the government and transport operators are working hard to ensure. in terms of emergency responses, there are _ millions of journeys are made each day on _ _ singapore ’ s public transport system. _ furthermore",665,117,130,65,singapore_2004_NationalSecurityStrategy.md,2025-01-28 18:53:51
141,", a public transport security committee has been formed to undertake a comprehensive review of security arrangements, - - - - - and to recommend and oversee improvements to the security of the public transport system, covering infrastructure such as bus interchanges, terminals, mrt stations and depots.",303,47,57,65,singapore_2004_NationalSecurityStrategy.md,2025-01-28 18:53:51
