chunk_id,text,char_length,word_count,token_count,section_index,source_file,processed_date
52,"plane be refuelled, so that they could fly to australia. singapore immediately activated a high - level crisis team. early the following morning at 2. 30am, sq 117 was moved to an outer tarmac. the hijackers pushed two sia stewards out of the plane, injuring them. they also threatened to kill one passenger every 10 - - - - - minutes after dawn if their demands were not met. the situation was grave. an order was given to storm the aircraft. elite commandos entered the plane in the early dawn hours, killing the four pakistani hijackers and freeing unharmed all 118 passengers and nine crewme",595,105,130,25,singapore_2004_NationalSecurityStrategy.md,2025-01-28 18:53:51
53,##mbers.,8,1,7,25,singapore_2004_NationalSecurityStrategy.md,2025-01-28 18:53:51
54,"# # # # # # “ unlike some other countries, singapore does not roll over and play dead when threatened with a gun. it can and will fight back, effectively, ruthlessly. ” _ the straits times, 28 march 1991 _",205,41,50,26,singapore_2004_NationalSecurityStrategy.md,2025-01-28 18:53:51
55,"# # # # # # the new face of terrorism a decade on, terrorism continues to cast a dark shadow worldwide, threatening peaceful societies and established governments. from the 1993 bombing of the world trade center in new york, to the 1995 sarin gas attack in a tokyo subway, and the 1998 us embassy bombings in kenya and tanzania, acts of terrorism have led to numerous casualties across several continents over the past few years. osama bin laden ’ s al - qaeda network and its affiliates, which were behind much of the terrorist violence of the past decade around the world, present a new form of terrorism that is radically different from what singapore and",658,117,130,27,singapore_2004_NationalSecurityStrategy.md,2025-01-28 18:53:51
56,"the rest of the world have been familiar with. nonetheless, we have not stood idle in the wake of some of their recent operations. _ a catastrophic act of terrorism - the world trade center towers in new _ _ york hit by al - qaeda on september 11, 2001. _",255,51,58,27,singapore_2004_NationalSecurityStrategy.md,2025-01-28 18:53:51
57,"# # # # # # major pre - september 11 al - qaeda attacks - 1993 world trade center bombing, new york - 1996 khobar towers bombing, saudi arabia - 1998 us embassy bombings, east africa - 2000 uss cole bombing, yemen - - - - - _ source : ministry of home affairs _ - - - - - _ the american embassy in singapore was one of the targets for _ _ terrorist action. _ thirty - one persons were arrested and detained in two security operations against jemaah islamiyah in january and september 2002. seven other persons were arrested and detained between october 2002 and december 2003. in january 2004,",593,114,130,28,singapore_2004_NationalSecurityStrategy.md,2025-01-28 18:53:51
58,"restriction orders under the internal security act were issued against 12 persons. many of those under detention or restriction orders were members, sympathizers or supporters of ji, while the rest were members of or affiliated to the moro islamic liberation front ( milf ) in the philippines. authorities revealed that the singapore ji operatives were planning to attack a range of targets in singapore, including western interests and local installations. they had sought to obtain tonnes of ammonium nitrate to be used for truck bombs. ji also planned to hijack an airplane and crash it into singapore ’ s changi airport. andrew tan, a terrorism analyst at singapore ’ s institute",683,111,130,28,singapore_2004_NationalSecurityStrategy.md,2025-01-28 18:53:51
59,"of defence and strategic studies, noted that if realized, the ji attacks would have had grave consequences for singapore. _ ibrahim maidin, spiritual leader _ _ of the singapore ji cell. _ - - - - - “ had these attacks succeeded, not only would they have inflicted heavy civilian casualties, they would also have had a devastating effect on the economy and shattered business confidence, with potentially uncertain consequences for communal relations as well, ” he commented. investigations further uncovered an elaborate network, in which local cell members worked under the direction of ji leaders based outside singapore, and under the guidance of al - qaeda - linked agents. through a combination of",703,114,130,28,singapore_2004_NationalSecurityStrategy.md,2025-01-28 18:53:51
60,"good intelligence and early action, singapore was able to thwart the planned attacks. with their capture, ji operations in singapore have also been severely disrupted. however, the threat will persist if ji terrorists intent on targeting singapore are at large in the region. ji and milf networks in singapore may have been made ineffective by recent actions. yet, in the longer term, the spectre of terrorism will hang over south - east asia as long as ji - linked schools continue to train militants who receive instruction in camps like those under the milf in mindanao. at the same time, we must also guard against other extremist threats. the danger",654,110,130,28,singapore_2004_NationalSecurityStrategy.md,2025-01-28 18:53:51
61,to singapore ’ s security remains.,34,6,9,28,singapore_2004_NationalSecurityStrategy.md,2025-01-28 18:53:51
62,"# # # # # # “ one cannot forget that since the september 11 attacks on the united states, jemaah islamiyah has been one of the most active al - qaeda affiliates, and southeast asia one of the most important theatres of operation... it would be foolish to underestimate ji ’ s capabilities or goals. ” _ dr zachary abuza _ _ terrorism analyst at simmons college, boston _ _ 29 october 2003 _ - - - - - - - - - -",410,85,101,29,singapore_2004_NationalSecurityStrategy.md,2025-01-28 18:53:51
63,# # # # # # chapter three # # # # the new security environment - - - - - preface [ a national security strategy for singapore ] one [ confronting transnational terrorism ] two [ s i n g a p o r e ’ s e x p e r i e n c e w i t h t e r r o r i s m ] * * three [ t h e n e w s e c u r i t y e n v i r o n m e n t ] * * four [ s i n g a p o r e ’ s n at i o n a l s e,363,127,130,30,singapore_2004_NationalSecurityStrategy.md,2025-01-28 18:53:51
64,c u r i t y a r c h i t e c t u r e ] f ive [ i m p l e m e n t i n g o u r s t r at e g y ] six [ national security : a national effort ],138,54,57,30,singapore_2004_NationalSecurityStrategy.md,2025-01-28 18:53:51
65,"# # # # # # efore the events of september 11 highlighted the new era of transnational # # b # # # # # # terrorism, singapore ’ s national security strategy had focused largely on building strong external defence capabilities. singapore assembled a credible, citizen - based defence force. well trained and well equipped, it was tasked with meeting clear military challenges from state - based threats. it was chiefly a conventional army geared towards fighting a conventional war. at home, no less importantly, the singapore police force and other homefront agencies were responsible for internal order and security. they dealt successfully with a wide range of threats, from communist",685,113,130,31,singapore_2004_NationalSecurityStrategy.md,2025-01-28 18:53:51
66,"subversion to dangers posed by foreign terrorist elements. in the international arena, the ministry of foreign affairs focused on diplomacy and managed singapore ’ s external relations. but the regional security environment of today is different and complex. singapore finds itself confronted by a form of terrorism that transcends borders. this terrorism, as highlighted earlier, has a global reach, is rooted in ideology, and employs sophisticated methods to achieve catastrophic outcomes.",491,71,86,31,singapore_2004_NationalSecurityStrategy.md,2025-01-28 18:53:51
67,"# # # # # # features of transnational terrorism global ambitions, global reach : modern transnational terrorism has taken on a clear international dimension, with a global agenda and global network. many other terrorist groups were more limited in their aims and areas of operation. examples include the liberation tigers of tamil eelam, the irish republican army and the basque separatist group eta. in south - east asia, for instance, the abu sayyaf operates mainly against the philippines government. these groups generally mount terrorist activities largely within their own _ abu bakar bashir, spiritual _ national boundaries. _ leader of jemaah islamiyah.",661,103,130,32,singapore_2004_NationalSecurityStrategy.md,2025-01-28 18:53:51
68,_ - - - - -,11,6,8,32,singapore_2004_NationalSecurityStrategy.md,2025-01-28 18:53:51
69,"# # # # # # the role of mike and sammy _ jemaah islamiyah ’ s terror plot against _ _ singapore was not entirely home - grown. ji _ _ members received critical help from two _ _ foreign operatives, codenamed “ sammy ” and _ _ “ mike ”. sammy, who was subsequently _ _ identified as mohamed mansour jabarah, a _ _ canadian national of arab origin, was an al - _ _ qaeda agent dispatched to singapore to assist _ _ the local ji cell in surveillance and the _ _ selection of targets. he has since been _ _ captured by us forces. mike,",531,110,130,33,singapore_2004_NationalSecurityStrategy.md,2025-01-28 18:53:51
70,"who was also _ _ involved in directing the singapore ji plot, _ _ was the name given to fathur rohman al - _ _ ghozi, an indonesian bomb expert who had _ _ served with the moro islamic liberation front _ _ in the philippines. he was captured in the _ _ philippines and subsequently shot dead three _ _ months after escaping from detention. _ however, the transnational terrorism of the 21st century is strikingly different. osama bin laden ’ s alqaeda has explicit global aims. it seeks to destroy the united states and its western allies, and establish panislamic caliphates, overturn",585,104,130,33,singapore_2004_NationalSecurityStrategy.md,2025-01-28 18:53:51
71,"##ing the international political order. in its quest, al - qaeda has spawned a network of affiliated terrorist groups across the globe that subscribes not only to its extreme terror tactics but also to its deviant ideology. jemaah islamiyah, a movement inspired by a similar vision for the world, is its principal south - east asian representative. the singapore ji plot highlighted the international nature of the struggle. after authorities had uncovered the plan against the country, their subsequent investigations revealed that while the surveillance work was conducted by singaporeans, the planning was done by an al - qaeda operative of arab descent holding a canadian passport. the bomb maker",701,110,132,33,singapore_2004_NationalSecurityStrategy.md,2025-01-28 18:53:51
72,was an indonesian living in the philippines.,44,7,10,33,singapore_2004_NationalSecurityStrategy.md,2025-01-28 18:53:51
73,"# # # # # # “ the most alarming aspect of the attacks on september 11th is that they conform to a trend in international terrorism that has emerged in recent years … the infliction of mass, indiscriminate casualties by enigmatic adversaries, striking far beyond terrorism ’ s traditional operational theatres in europe and the middle east. ” _ dr bruce hoffman _ _ terrorism analyst at the rand corporation _ _ 8 october 2002 _ ideological perversion : underpinning transnational terrorism is an extremist ideology that justifies terror attacks against civilized and open societies. it is an ideology based upon a gross misreading",630,105,130,34,singapore_2004_NationalSecurityStrategy.md,2025-01-28 18:53:51
74,"of islamic religious texts, which is then used to rationalize current acts of terrorism. it debases concepts like jihad. all who stand in the way are considered legitimate targets, even co - religionists who do not share the same degree of fervour. the current terrorist threat against singapore has deep ideological roots. the social profiles of the ji suspects who had been arrested were no different from those of normal singaporeans. they were educated, held stable jobs, and had families. they were neither - - - - - destitute nor disenfranchised nor dispossessed. yet, they shared a willingness to",603,99,130,34,singapore_2004_NationalSecurityStrategy.md,2025-01-28 18:53:51
75,"cause destruction and kill others in the name of a higher spiritual calling. we have to recognize this extreme element and remain conscious of this ideological dimension when dealing with transnational terrorism. sophisticated methods, catastrophic outcomes : transnational terrorism is characterized by a high degree of operational and technical sophistication, making attacks more lethal and dangerous. al - qaeda and its subsidiary groups have repeatedly shown a capacity to mount multiple, well - coordinated strikes. _ more than 200 people lost their _ _ lives in the october 2002 bali _ _ bombing. _ the september 11 attacks, where flight - trained terrorists were able to commandeer four separate airplanes, are well",723,112,130,34,singapore_2004_NationalSecurityStrategy.md,2025-01-28 18:53:51
76,"documented. but al - qaeda and its affiliates have been able to maintain the momentum, and subsequent incidents in riyadh, istanbul and madrid demonstrated their ability to launch highly synchronized terror bombings that resulted in hundreds of casualties. singapore ’ s minister for home affairs wong kan seng has noted the fanaticism in modern - day terrorism. - - - - - “ nothing is unthinkable, ” he observed. “ this moral free - fall and lack of restraint is what makes us sense that the scale of violence of this current terrorism has no boundaries other than what the imagination supported by opportunity and access to relevant resource can achieve. ”",658,112,130,34,singapore_2004_NationalSecurityStrategy.md,2025-01-28 18:53:51
77,"such sophisticated methods and tactics have allowed modern terror networks to seek catastrophic outcomes from their actions, looking to inflict maximum casualties. attacks are often aimed at defenceless civilians, with little regard for human life, instead of hardened military targets. in an assessment of likely terrorism trends for 2004, terrorism analyst rohan gunaratna noted that al - qaeda poses more threat to such soft targets. “ because of government hardening of military and diplomatic targets, terrorists will shift their attacks to economic targets and population centres, ” he wrote. the number of fatalities arising from a terrorist attack using weapons of mass destruction is likely to be significantly higher. while recent terrorist",750,112,130,34,singapore_2004_NationalSecurityStrategy.md,2025-01-28 18:53:51
78,"incidents have mainly employed conventional explosives, there is growing evidence that terrorist groups would seek to obtain chemical, biological and radiological weapons. it is crucial, therefore, that their efforts be stopped. in a recent speech, singapore ’ s defence minister radm teo chee hean warned, “ the threat of terrorism is amplified by the risk of proliferation of weapons of mass destruction. ” he spoke of a nightmare scenario of terrorists and rogue regimes collaborating in the use of weapons of mass destruction - a scenario within the “ realm of possibility ”. “ if terrorists were to set off a nuclear device or chemical or biological agents, the damage and panic",683,112,130,34,singapore_2004_NationalSecurityStrategy.md,2025-01-28 18:53:51
79,"would be massive, ” he said.",28,6,10,34,singapore_2004_NationalSecurityStrategy.md,2025-01-28 18:53:51
80,"# # # # # # strategic convergence clearly, the new security environment facing us is complex and varied. it does not permit us to simply say that we are a nation either at peace or at war. consequently, singapore ’ s definition of national security must extend beyond the containment of conventional threats. it must take into account transnational terrorist threats from non - state elements. the current structure for dealing with national security is characterized by sharp distinctions between foreign and domestic interests, and between external and internal issues, with functions largely performed by individual agencies. the emergence of transnational terrorism has created a new effect in national security policy and practice - the blur",746,117,130,35,singapore_2004_NationalSecurityStrategy.md,2025-01-28 18:53:51
81,"##ring of boundaries between government bodies responsible for national security. the separate and apparently distinct functions and capacities of the government agencies involved in national security converge when dealing with transnational terrorism. in devising a new approach to managing national security, the key lies, therefore, in strengthening coordination and integration among government agencies.",408,53,65,35,singapore_2004_NationalSecurityStrategy.md,2025-01-28 18:53:51
82,"# # # # # # policy challenges the government has to examine some critical issues that will shape our long - term national security strategy. first, can we be totally safe? while the outcome of a conventional war can be definitive, the same cannot be said of the campaign against transnational terrorism. given the nature of these terrorist threats, absolute security is unattainable. even if the government - - - - -",416,73,86,36,singapore_2004_NationalSecurityStrategy.md,2025-01-28 18:53:51
83,"# # # # # # sars – a valuable learning experience for singapore _ the unexpected outbreak of sars ( severe acute _ _ respiratory syndrome ) in 2003 taught singapore _ _ many valuable lessons. although it was not a _ _ case of bio - terrorism, it served as a useful _ _ exercise for government authorities, businesses _ _ and the public in tackling the spread of an _ _ infectious disease. furthermore, sars impacted _ _ not just singapore ’ s health system, but also had _ _ significant effects on the economy and daily life. _ _ sars had to be defeated not only through the _ _ efforts of",589,116,130,37,singapore_2004_NationalSecurityStrategy.md,2025-01-28 18:53:51
84,"doctors and nurses, but also through the _ _ work of all singaporeans. the episode _ _ demonstrated the need for tight inter - agency _ _ coordination and widespread community _ _ participation – elements which will be critical in _ _ meeting future national crises. _ aspires to achieve it, attempting to plug every conceivable capability gap will become an immense drain on our resources. as there are other national concerns such as education, housing, good and affordable health care, and sustainable economic growth, there is a need to prioritize and strike a balance between different goals. security issues cannot become an overriding concern that disp",659,108,130,37,singapore_2004_NationalSecurityStrategy.md,2025-01-28 18:53:51
85,"##laces other national imperatives. second, what must change in our processes and structures? having separate, specialized security processes can help sharpen the responses needed for specific problems. but seen against the context of threats to national security, separate processes, for example, to deal with internal and external threats would not be optimal when the line between the two has blurred. the sars crisis has taught us the importance of a total approach to a national problem. security requires us to confront a spectrum of threats, and for that, we would need to have a comprehensive approach and an over - arching strategy. we are familiar with a hierarchical organizational structure where",708,111,132,37,singapore_2004_NationalSecurityStrategy.md,2025-01-28 18:53:51
86,"clear lines of command and control have always proven to be expeditious. the hierarchical - - - - - structure favours consolidation, and a common vision and purpose. the national security mission of today, however, is complex. it involves too many entities and it is not possible to bring them all under one roof. the network approach would be a better fit for singapore, given our small size and limited resources. this network, though, would need direction and coordination from a central hub that has sufficient influence to motivate constituent agencies. it would _ hazmat ( hazardous materials ) teams train for both civil and _ _ security",644,108,130,37,singapore_2004_NationalSecurityStrategy.md,2025-01-28 18:53:51
87,"emergencies. _ also need dedicated and forward - looking staff to anticipate, cope with and direct future events. in short, the organizational challenge of national security is to mobilize, coordinate and lead government agencies, the business community and the general public to make singapore better prepared, more secure and more responsive to an array of threats. - - - - - - - - - -",387,66,80,37,singapore_2004_NationalSecurityStrategy.md,2025-01-28 18:53:51
88,# # # # # # chapter four,24,8,10,38,singapore_2004_NationalSecurityStrategy.md,2025-01-28 18:53:51
89,# # # # singapore ’ s national security architecture - - - - - preface [ a national security strategy for singapore ] one [ confronting transnational terrorism ] two [ s i n g a p o r e ’ s e x p e r i e n c e w i t h t e r r o r i s m ] three [ t h e n e w s e c u r i t y e n v i r o n m e n t ] * * four [ s i n g a p o r e ’ s n at i o n a l s e c u r i t y a r,365,127,130,39,singapore_2004_NationalSecurityStrategy.md,2025-01-28 18:53:51
90,c h i t e c t u r e ] * * f ive [ i m p l e m e n t i n g o u r s t r at e g y ] six [ national security : a national effort ],126,48,51,39,singapore_2004_NationalSecurityStrategy.md,2025-01-28 18:53:51
91,"# # # # # # ingapore recognizes the diverse and constantly evolving nature of terrorism. # # s # # # # # # to fight the terrorist threat in the long haul, the government has adopted a multi - ministry networked approach. networking integrates the work of otherwise separate bodies, enables inter - agency coordination and allows us to leverage upon the strengths of diverse organizations. traditionally, no single central body has directed singapore ’ s national security apparatus. instead, various ministries share jurisdiction over securityrelated functions. defence against conventional external threats comes under the singapore armed forces and the ministry of defence. internal security has been the responsibility of",724,112,130,40,singapore_2004_NationalSecurityStrategy.md,2025-01-28 18:53:51
92,"home team agencies, such as the police and the ministry of home affairs. however, the problems of transnational terrorism present scenarios that involve multiple authorities and require varied expertise. no single agency will have all the resources or capabilities needed to handle the range of threats at all levels.",317,49,57,40,singapore_2004_NationalSecurityStrategy.md,2025-01-28 18:53:51
93,"# # # # # # the home team _ agencies within the ministry of home affairs _ _ are organized around the home team concept. _ _ it comprises the mha headquarters and the _ _ singapore police force, the singapore civil _ _ defence force, the internal security _ _ department, the immigration and checkpoints _ _ authority, the prisons department, the central _ _ narcotics bureau, the commercial and _ _ industrial security corporation ( cisco ), and _ _ the singapore corporation for rehabilitative _ _ enterprises ( score ). _ _ many different _ _ organizations, a _ _ multiplicity of purpose, _ _ but one shared",610,112,130,41,singapore_2004_NationalSecurityStrategy.md,2025-01-28 18:53:51
94,"goal of _ _ making singapore the _ _ best home for all, one _ _ which is safe and secure. _ - - - - - how can this networked government be responsive and effective? a few critical efforts must be undertaken. first, an autonomous and influential node should be established at the centre of government to coordinate national security policies. it must be a strong centre which sets clear policy directions, but which leaves operational coordination and responses to other agencies. structures and processes should be introduced to help maintain discipline and continuity. where possible, structures should be built on what we already have to maintain a clear focus. those that have proven to",689,116,130,41,singapore_2004_NationalSecurityStrategy.md,2025-01-28 18:53:51
95,"be robust should be allowed to continue to operate. next, the government will put in place strategic forums to discuss critical issues and to promote a _ army - police patrols at changi airport – a practical example of _ _ inter - agency coordination and convergence. _ shared understanding of security concerns among all security policy - makers and practitioners. a national security strategic planning and policy process should be institutionalized. over time, there may be a tendency for organizations to expand rather than to build alliances. networks and coordinating structures must be encouraged, as they will help agencies to leverage on each other ’ s strengths, rather than duplicate resources and build competing capabilities.",738,116,130,41,singapore_2004_NationalSecurityStrategy.md,2025-01-28 18:53:51
96,"while structures and processes for effective networking can be put in place, the real emphasis should be on cultivating a culture of collaboration. we have to nurture a propensity to think about how - - - - - we can achieve more as a team even as we play our functional roles. the key to doing this is to develop a common vision and invest in team building.",357,68,78,41,singapore_2004_NationalSecurityStrategy.md,2025-01-28 18:53:51
97,"# # # # # # national security architecture what are the elements of singapore ’ s revised national security architecture? essentially, we have put in place a robust system that organizes the various agencies around the three essential security pillars of policy, operations and capability development.",301,47,53,42,singapore_2004_NationalSecurityStrategy.md,2025-01-28 18:53:51
