chunk_id,text,char_length,word_count,token_count,section_index,source_file,processed_date
655,"# # # # # # in 2017, the minister of defence of ukraine took part in 47 international events in ukraine and 14 events outside of ukraine. ukrainian deputy defense ministers took part in 40 international events in ukraine and 13 events abroad. the participation of leaders ( representatives ) of defence establishments from ukraine ’ s partner countries ( great britain, georgia, estonia, latvia, lithuania, poland, usa, canada, moldova, turkey, montenegro ) and alliance troops in the independence day parade in ukraine became of the most significant event in 2017. bilateral defence cooperation between ukraine and the united states of america in 2017 was characterized by a large number of diverse contacts",708,114,130,261,ukraine_2017_WhiteBook.md,2025-01-28 18:56:25
656,"at all levels. ukrainian high - level defence ministry officials participated in 15 international meetings. the main achievements of international cooperation between ukraine and the usa are as follows : - military cooperation and political dialogue development ; - - - - - international cooperation, peacekeeping activity and arms control - receiving material and technical assistance ( in 2017 international technical assistance from the us to the armed forces of ukraine amounted to over usd 56. 0 million ) ; - continuous assistance to ukraine from international instructors in the framework of the multinational joint coordination committee on military cooperation and defence reforms ; - continued training of mechanized units, as well as airborne assault troops and special operations forces of the armed",811,123,130,261,ukraine_2017_WhiteBook.md,2025-01-28 18:56:25
657,"forces of ukraine within the joint multinational training group - ukraine ( jmtg - u ) ( ten ukrainian battalions have already been prepared ) ; - participation of a high - level strategic advisor within reform committee of the ministry of defence and armed forces of ukraine, and 36 american advisers who provide advisory assistance to ukraine in various functional areas ; - treatment and rehabilitation of ukrainian soldiers in us healthcare facilities ;",457,75,80,261,ukraine_2017_WhiteBook.md,2025-01-28 18:56:25
658,"# # # # # # receiving material and technical assistance ( in 2017 international technical assistance from the us to the armed forces of ukraine amounted to over usd 56. 0 million ) - professional and english language training of ukrainian military personnel in us military higher education institutions and training centres. in 2017, bilateral cooperation between the ministry of defence of ukraine and the department of national defence and the canadian armed forces continued to develop. - - - - - international cooperation, peacekeeping activity and arms control ukrainian high - level defence ministry officials participated in 13 international events. in that sense, the main achievements are as follows : - development of a legal framework for bilateral defence",767,121,130,262,ukraine_2017_WhiteBook.md,2025-01-28 18:56:25
659,"cooperation between ukraine and canada ; - signed agreement on defence cooperation between the ministry of defence of ukraine and the department of national defence and the canadian armed forces on april 3, 2017 ; - on december 13, 2017, the government of canada included ukraine in the automatic firearms country control list, which allows exporters to obtain the necessary permits for the export of weapons, including firearms ; - the unifier, canada ’ s military training mission in ukraine mandate was extended for 2018 - 2019 ; the number of canadian instructors was increased by 50 people ( up to 260 military personnel ) ; - the assistance from a high - level strategic advisor within the framework of",708,120,130,262,ukraine_2017_WhiteBook.md,2025-01-28 18:56:25
660,"the reform committee of the ministry of defence and armed forces of ukraine was continued ; - professional and english language training of ukrainian military personnel in canada ’ s military higher education institutions and training centres was continued. in addition, the national team of ukraine led by the president of ukraine took part in the 2017 invictus games in toronto. ukrainians won 14 medals : 8 gold medals, 3 silver medals and 3 bronze medals. the team of ukraine won the second place in the team count for the number of victories. - - - - - international cooperation, peacekeeping activity and arms control in 2017, cooperation between the ministry of defence of ukraine and the",695,117,130,262,ukraine_2017_WhiteBook.md,2025-01-28 18:56:25
661,"ministry of defence of the united kingdom of great britain and northern ireland also developed effectively. in 2017, 37 events were held with the participation of : - the minister of defence of ukraine participated in 7 meetings ( 2 meetings at the level of high defence officials ) ; - deputy defence ministers took part in 2 international events ; - high officials of the general staff of the armed forces of ukraine took part in 3 international events ; - the representatives of the mod and gs structural divisions took part in 25 international events. the main achievements of international cooperation between the ministry of defence of ukraine and the ministry of defence of the united kingdom of great britain and northern ireland",737,125,130,262,ukraine_2017_WhiteBook.md,2025-01-28 18:56:25
662,"are the following : - military cooperation and political dialogue development ; - the british instructors ’ activity in support of operation orbital in ukraine was continued ; - the assistance from a high - level strategic advisor within reform committee of the ministry of defence and armed forces of ukraine, and advisory assistance by 3 british advisers in various functional areas was continued ; the bilateral defence cooperation between ukraine and germany in 2017 was characterized by a large number of diverse contacts at all levels. in 2017, 19 events of similar context were conducted : - visit of the minister of defence of ukraine to germany and meeting with the federal minster of defence ; - 2 visits of deputy ministers of",737,124,130,262,ukraine_2017_WhiteBook.md,2025-01-28 18:56:25
663,"defence of ukraine ; - 8 working visits ; - 7 seminars ; - 4 training courses. - - - - - international cooperation, peacekeeping activity and arms control main achievements of cooperation with the federal republic of germany include : - intensification of politico - military dialogue ; - continuation of work of the high - level strategic advisor within the framework of the reform committee of the ministry of defence of ukraine and the armed forces of ukraine, providing advisory assistance by german advisor in terms of defence resource management, and continuation of work of the the german instructor at the hetman petro sahaidachny national army academy ; - organization of treatment",690,114,130,262,ukraine_2017_WhiteBook.md,2025-01-28 18:56:25
664,and rehabilitation of the wounded in action soldiers of the armed forces of ukraine in the course of anti - terrorist operation in german healthcare facilities ( in 2017 15 soldiers of the armed forces of ukraine were treated ) ; - continuation of professional ( medical ) and foreign language training of the armed forces of ukraine service personnel in the higher military educational institutions and training centres of the federal republic of germany.,456,75,78,262,ukraine_2017_WhiteBook.md,2025-01-28 18:56:25
665,"# # # # # # germany ' s military, the bundeswehr, handed over to the armed forces of ukraine a set of musical instruments ( 21 units for the amount of us $ 6, 800 ) as humanitarian aid. germany ' s military, the bundeswehr, donated to the armed forces of ukraine a set of musical instruments ( 21 units for the amount of us $ 6, 800 ). cooperation with neighbouring countries and leading countries of the world bilateral military and political cooperation with the baltic states has traditionally been a priority area for international cooperation. in 2017, 16 meetings were held between the minister of defence of ukraine and the ministers",640,114,130,263,ukraine_2017_WhiteBook.md,2025-01-28 18:56:25
666,"of the baltic defence institutions, in particular with lithuania - eleven meetings, three meetings with estonia, and two meetings with latvia. - - - - - international cooperation, peacekeeping activity and arms control military units of the armed forces, as well as the defence ministers of lithuania, latvia and estonia participated in the military parade on the occasion of the 26th anniversary of ukraine ' s independence. the successful work on different directions was carried out, especially in the domains of military, professional and language training of servicemen of the armed forces of ukraine, as well as advisory and technical assistance. since the beginning of the conflict in the east of ukraine the republic of lithuania",737,116,130,263,ukraine_2017_WhiteBook.md,2025-01-28 18:56:25
667,"has provided treatment and rehabilitation to 180 ukrainian wounded soldiers, which is the highest rate among all the countries, providing similar assistance to ukraine. a very important area of joint international cooperation is the lithuanian - polishukrainian brigade ( litpolukrbrig ) capabilities development. the amendments to the litpolukrbrig agreement signed by defence minister of ukraine, defence minister of lithuania and defence minister of poland on october 5, 2017 in lublin provided legal rules for engagement of the litpolukrbrig to participate in international operations that comply with international law. in 2017 significant development of international cooperation took place with scandinavian countries. the minister",738,102,130,263,ukraine_2017_WhiteBook.md,2025-01-28 18:56:25
668,"of defence of ukraine held working meetings with defence minister of sweden, defence minister of norway and defence minister of finland, during which further ways to develop mutually beneficial cooperation were outlined. thanks to the support provided by the kingdom of norway, the three long - term projects were successfully implemented in ukraine : retraining and transition to civilian life project ; distance learning development project ; and another one project aimed at reducing the corruption risks in the human resources management system in the defence ministry.",573,87,96,263,ukraine_2017_WhiteBook.md,2025-01-28 18:56:25
669,"# # # # # # thanks to the support provided by the kingdom of norway, the three long - term projects were successfully implemented in ukraine : retraining and transition to civilian life project ; distance learning development project ; and another one project aimed at reducing the corruption risks in the human resources management system in the defence ministry. - - - - - international cooperation, peacekeeping activity and arms control the kingdom of sweden continued to provide professional training to ukrainian service personnel in its high military educational establishments and military training centres.",615,96,104,264,ukraine_2017_WhiteBook.md,2025-01-28 18:56:25
670,"# # # # # # the kingdom of sweden continued to provide professional training to ukrainian service personnel in its high military educational establishments and military training centres. in 2017, bilateral cooperation between ukraine and the republic of finland in the field of military medicine was initiated ; in particular, ukrainian combat medics within the framework of this cooperation had an opportunity to get acquainted with modern methods of emergency medical care. the strategic partnership between ukraine and georgia was conditioned by common goals, challenges and threats. in 2017, the official visit of the minister of defence of georgia to ukraine and the official visit of the minister of defence of ukraine to georgia took place. the delegation",762,119,130,265,ukraine_2017_WhiteBook.md,2025-01-28 18:56:25
671,"of the georgian ministry of defence, headed by l. chikovan, the first deputy minister of defence of georgia, participated in the independence day parade in ukraine. the georgian military unit of 29 soldiers also participated in the military parade. ukrainian soldiers injured in the ato area were rehabilitated in the georgian national mod military rehabilitation centre named after m. makashvili. bilateral cooperation between the ministry of defence of ukraine and the ministry of defence of the republic of turkey was characterized by positive dynamics and high performance. in 2017, the three intergovernmental agreements were signed : on cooperation in the field of geographic information ; on military",707,107,130,265,ukraine_2017_WhiteBook.md,2025-01-28 18:56:25
672,"- financial cooperation ; and on financial assistance. in addition, more than 20 visits and meetings took place, including at the defence ministers level. in accordance with the signed agreements, the turkish side allocated 9. 3 million turkish lire as a financial assistance to the armed forces of ukraine. - - - - - international cooperation, peacekeeping activity and arms control ukraine continues to cooperate with romania in the defence area. in 2017, a number of bilateral meetings were held between the chief of the general staff of the armed forces of ukraine and the chief of the general staff of the armed forces of romania ; the military units of both countries participated in the tis",697,117,130,265,ukraine_2017_WhiteBook.md,2025-01-28 18:56:25
673,"##a multinational engineering battalion, and provide training to their designated troops in order to participate in future joint exercises. in 2017, the ministry of defence of ukraine and the ministry of national defence republic of poland continued to develop bilateral cooperation ; in particular, the polish strategic advisor military advisor continued work in ukraine. in 2017, polish military instructors continued training units of the ukrainian armed forces within the joint multinational training group ukraine ( jmtg - u ). in addition, ukrainian soldiers continued their studies at military educational institutions in poland.",636,92,107,265,ukraine_2017_WhiteBook.md,2025-01-28 18:56:25
674,"# # # # # # the ministry of defence of ukraine and the ministry of national defence republic of poland are developing a strategic dialogue. one of the main priorities of polish foreign policy is the liberation of ukraine ' s territories occupied by the russian federation, further support to ukraine ' s strategic goals for membership in nato and the eu, as well as the continuation of defence cooperation. the ministry of defence of ukraine and the ministry of national defence republic of poland are developing a strategic dialogue. one of the main priorities of polish foreign policy is the liberation of ukraine ' s territories occupied by the russian federation, further support to ukraine ' s strategic goals for",718,122,130,266,ukraine_2017_WhiteBook.md,2025-01-28 18:56:25
675,"membership in nato and the eu, as well as the continuation of defence cooperation. the minister of defence of ukraine visited the republic of poland to celebrate the polish armed forces day ( august 14 - august 15, 2017 ). bilateral cooperation between ukraine and the portuguese republic has also intensified. in particular, in january 2017, the defence minister of ukraine visited portugal, and in the period from march 2017 to june 2017, two ukrainian soldiers were rehabilitated at the portuguese armed forces military hospital. the multilateral cooperation between ukraine and hungary, the czech republic and the slovak republic was carried out within the framework of the tisa multinational engineering battalion, as",722,112,130,266,ukraine_2017_WhiteBook.md,2025-01-28 18:56:25
676,well as within joint participation in military exercises.,57,8,11,266,ukraine_2017_WhiteBook.md,2025-01-28 18:56:25
677,"# # # # # # multilateral cooperation and cooperation within international organizations and initiatives the main efforts of the ministry of defence of ukraine during multilateral cooperation and cooperation within international organizations and initiatives were aimed at the implementation of the standards necessary for ukraine to become a member of the european union and nato, as well as to ensure equal and mutually beneficial cooperation with other partners in the military and political, military and technical spheres. in 2017, bilateral cooperation between the ministry of defence of ukraine and the eu was carried out in accordance with the priorities and tasks defined by the following documents : - - - - - international cooperation, peacekeeping activity and arms control -",786,121,130,267,ukraine_2017_WhiteBook.md,2025-01-28 18:56:25
678,"action plan on implementation of the association agreement between ukraine and the eu ( insofar as it relates to the activities of the ministry of defence of ukraine ) ; - the annual work plan of the armed forces of ukraine and the general secretariat of the council of the european union cooperation ( common security and defence policy ) ; - the mod and afu consolidated annual plan for international cooperation. - the main areas of defence cooperation between ukraine and the eu in 2017 were as follows : - development of military and political dialogue between the ministry of defence of ukraine, the general staff of the armed forces of ukraine and the relevant eu institutions ( agencies ) ;",698,122,129,267,ukraine_2017_WhiteBook.md,2025-01-28 18:56:25
679,"# # # # # # on january 23, 2017, the chief of the general staff - commander - in - chief of the armed forces of ukraine made a decision to involve the armed forces of ukraine in the operational rotation of the helbrok eu ctg in the first half of 2018 and in the first half of 2020. - involvement of the armed forces of ukraine in the formation of eu combat tactical groups ( hereinafter - eu ctg ) ; on january 23, 2017, the chief of the general staff - commander - in - chief of the armed forces of ukraine made a decision to involve the armed forces of ukraine in",565,116,130,268,ukraine_2017_WhiteBook.md,2025-01-28 18:56:25
680,the operational rotation of the helbrok eu ctg in the first half of 2018 and in the first half of 2020.,103,21,27,268,ukraine_2017_WhiteBook.md,2025-01-28 18:56:25
681,"# # # # # # military personnel and civilian personnel of the armed forces of ukraine completed training in the field of the common security and defence policy ( csdp ) at the csdp orientation course ( held annually ) with the assistance of the european security and defence college in the ivan chernyakhovsky national defence university of ukraine and in co - operation with the austrian ministry of national defence and sport ( october 23, 2017 - october 27, 2017 ). the event was attended by 55 participants, representatives of the eastern partnership countries. in addition, ukrainian mod representatives participated in various courses and workshops on csdp cooperation within multilateral platform 1 “",706,115,130,269,ukraine_2017_WhiteBook.md,2025-01-28 18:56:25
682,"democracy, good governance and stability ”. - participation in the eastern partnership initiative ( training ). military personnel and civilian personnel of the armed forces of ukraine completed training in the field of the common security and defence policy ( csdp ) at the csdp orientation course ( held annually ) with the assistance of the european security and defence college in the ivan chernyakhovsky national defence university of ukraine and in co - operation with the austrian ministry of national defence and sport ( october 23, 2017 - october 27, 2017 ). the event was attended by 55 participants, representatives of the eastern partnership countries. in addition, ukrainian mod representatives participated in various",731,114,130,269,ukraine_2017_WhiteBook.md,2025-01-28 18:56:25
683,"courses and workshops on csdp cooperation within multilateral platform 1 “ democracy, good governance and stability ”. - - - - - international cooperation, peacekeeping activity and arms control in 2017, the ministry of defence of ukraine took the necessary measures to implement the administrative agreement between the ministry of defence of ukraine and the european defence agency concluded on december 7, 2015 in brussels. the ministry of defence has identified three areas of cooperation with the european defence agency : - material standardization. mod representatives were participating in the following expert groups ( eg ) : eg 25 compatible training areas, eg 27 automatic identification methods, eg 26 explosive effects and e",737,113,130,269,ukraine_2017_WhiteBook.md,2025-01-28 18:56:25
684,"##g 28 camouflage ; - the single european sky ( ses ). mod representatives participated in the military aviation council meetings. - logistics ( strategic air transportation, european air transport fleet ). the ministry of defence together with the state enterprise “ antonov ” ( sc “ ukroboronprom ” ) are considering possible ways to start cooperation on strategic transportation. ukraine - nato cooperation in 2017, nato continued to demonstrate their commitment to the distinctive partnership between ukraine and nato and support ukrainian defence and security sector reforms though the nato - ukraine joint working group on defence reform ( jwgdr ) and the operational capabilities concept planning and review mechanism ( occ",730,113,132,269,ukraine_2017_WhiteBook.md,2025-01-28 18:56:25
685,"p & r ), as well as the advisory mission of the nato office in ukraine. nato member countries have contributed to the transformation of the national security and defence sector of ukraine in order to ensure civilian and democratic control, as well as to counter russia ' s aggression and provide defence against military threats. | col1 | col2 | col3 | | - - - | - - - | - - - | | | | | | | | | | | | | - - - - - international cooperation, peacekeeping activity and arms control one of the most promising areas of practical cooperation between ukraine and nato in 2017 was the nato ' s",585,120,130,269,ukraine_2017_WhiteBook.md,2025-01-28 18:56:25
686,"assistance in achieving five strategic goals within the framework of the defence reform according to the strategic defence bulletin of ukraine. at the end of 2017, 67 foreign advisers under the ministry of defence of ukraine and the general staff of the armed forces of ukraine from 13 nato member countries were providing advisory assistance to the implementation of military reform. the high - level strategic consultancy and advisory foreign expert group within reform committee of the ministry of defence and the armed forces of ukraine was established. this expert group includes representatives from six countries ( great britain, canada, lithuania, poland, usa and germany ). in 2017, they made eight visits to ukraine. in 2017,",735,116,130,269,ukraine_2017_WhiteBook.md,2025-01-28 18:56:25
687,a military and political dialogue between ukraine and nato continued.,69,10,13,269,ukraine_2017_WhiteBook.md,2025-01-28 18:56:25
688,"# # # # # # one of the most promising areas of practical cooperation between ukraine and nato in 2017 was the nato ' s assistance in achieving five strategic goals within the framework of the defence reform according to the strategic defence bulletin of ukraine. the minister of defence of ukraine participated in the nato nac meeting in kyiv, chaired by jens stoltenberg, the secretary general of the alliance and the president of ukraine, as part of the 20th anniversary of the signing of the charter on a distinctive partnership between ukraine and nato ( july, kyiv ). the delegation of the ministry of defence of ukraine headed by the minister of defence of ukraine took part",680,119,130,270,ukraine_2017_WhiteBook.md,2025-01-28 18:56:25
689,"in the nato nac meeting at the level of defence ministers of nato - contributing countries to "" resolute support "" mission in the islamic republic of afghanistan and held a series of bilateral meetings with defence ministers of nato members and partner - countries ( june, brussels, belgium ). - - - - - international cooperation, peacekeeping activity and arms control representatives of the ministry of defence of ukraine as part of the ukrainian delegation participated in two high - level meetings of the nato - ukraine joint working group on military reform ( february and april, brussels, belgium ). chief of the general staff - commander - in - chief of the armed forces of ukraine",688,118,130,270,ukraine_2017_WhiteBook.md,2025-01-28 18:56:25
690,"participated in nato consultations on the implementation of defence reform plans during the meetings of the nato - ukraine military committee ( january, brussels, belgium ). the state programme for the development of the armed forces of ukraine until 2020 was developed ; the mod budget programmes have been optimized and streamlined in accordance with the existing procedure for allocating expenditures in nato countries, as well as the transition to capability - based defence planning has been implemented. participation of the armed forces of ukraine in the pfp planning and review process ( parp ), and extended implementation of the 26 partnership goals identified at the partnership and collective security committee ( pcsc ) session",740,115,130,270,ukraine_2017_WhiteBook.md,2025-01-28 18:56:25
