chunk_id,text,char_length,word_count,token_count,section_index,source_file,processed_date
204,"# # # # # # the new impetus was given by the management decisions related to the implementation of internal control standards in the ministry of defence of ukraine and the armed forces of ukraine starting from january 1, 2017 and the division of tasks of internal audit conduct and activities of internal control introduction coordination ( monitoring ) between the department of internal audit and the inspector general ’ s department of the ministry of defence of ukraine. the new impetus was given by the management decisions related to the implementation of internal control standards in the ministry of defence of ukraine and the armed forces of ukraine starting from january 1, 2017 and the division of tasks of internal audit conduct and",744,125,130,101,ukraine_2017_WhiteBook.md,2025-01-28 18:56:25
205,activities of internal control introduction coordination ( monitoring ) between the department of internal audit and the inspector general ’ s department of the ministry of defence of ukraine. in pursuance of the annual national programme of ukraine - nato cooperation for 2017 familiarization courses on application of the departmental internal control standards were held for the command staff of the ministry of defence and the armed forces of ukraine at ivan chernyakhovsky national defence university. the unified list ( catalogue ) of capabilities of the ministry of defence of ukraine and the armed forces of ukraine included the requirements regarding the acquirement of capabilities for conducting internal control at all levels of command by all structural units of,775,119,130,101,ukraine_2017_WhiteBook.md,2025-01-28 18:56:25
206,"the ministry of defence, the general staff, command and control agencies, military units and institutions of the armed forces of ukraine.",137,21,27,101,ukraine_2017_WhiteBook.md,2025-01-28 18:56:25
207,"# # # # # # the risk management system became an integral element of the cbp and cba system. the risk management system became an integral element of the cbp and cba system. directors of concerns and state enterprises were provided with recommendations on the introduction of іso 9001, іso 31000 national standards of quality and risk management to their activities. the positions of officers - auditors were introduced to the operational ( air ) commands ’ services in 2017 to build - up capabilities of c2 agencies as for the internal control on the initiative of the general staff of the armed forces of ukraine foreign advisers from nato member countries, mainly",666,114,130,102,ukraine_2017_WhiteBook.md,2025-01-28 18:56:25
208,"from the usa and united kingdom were actively involved in introducing the western model of internal control and provided assistance in promoting the best practices of financial management not only in the defence sector, but also initiated a number of activities to solve challenged issues at the governmental level. the measures were taken for the information support of the internal control development. the topical section was created on the informational resources of the ministry of defence of ukraine as part of these efforts.",531,83,90,102,ukraine_2017_WhiteBook.md,2025-01-28 18:56:25
209,"# # # # # # the risk management system became an integral element of the cbp and cba system. - - - - - results of the armed forces of ukraine reform in 2017 and participation in the anti - terrorist operation according to the results of the internal control assessment in 2017, the issue was raised to revise regulations on some structural units of the ministry of defence of ukraine, as well as a number of normative acts of the ministry of defence of ukraine with a view to strengthen internal control in the most risky areas of activity related to the use of financial and material resources.",595,110,120,103,ukraine_2017_WhiteBook.md,2025-01-28 18:56:25
210,"# # # # # # in general, given the first year of implementing the internal control standards, the level of maturity of the internal control and risk management within the ministry of defence and the armed forces of ukraine is assessed as the initial one. the internal control procedures and regulations require further development and intensified attention from leadership and command at all levels. in general, given the first year of implementing the internal control standards, the level of maturity of the internal control and risk management within the ministry of defence and the armed forces of ukraine is assessed as the initial one. the internal control procedures and regulations require further development and intensified attention from leadership and command",770,121,130,104,ukraine_2017_WhiteBook.md,2025-01-28 18:56:25
211,at all levels.,14,3,6,104,ukraine_2017_WhiteBook.md,2025-01-28 18:56:25
212,"# # # # # # prevention and counteraction of corruption entrenchment and proliferation of corruption in all domains of state administration and military command is one of the immediate threats to the defence reform process in ukraine. the urgency of this problem is still relevant for the ministry of defence and the armed forces of ukraine. one of the priorities defined by the minister of defence includes urgent actions and finding productive solutions to reduce the level of corruption and the related criminal activity, especially under conditions of anti - terrorist operation. main directions of implementing the state anti - corruption policy in 2017 the main directions of implementing the state anti - corruption policy within the ministry",748,119,130,105,ukraine_2017_WhiteBook.md,2025-01-28 18:56:25
213,"of defence and the armed forces of ukraine were determined as follows : - creation of an effective institutional mechanism to prevent corruption in the military administration, military units and state enterprises ; - integrity building among military and civilian personnel, developing negative attitude towards corruption, ensuring personnel security during the decisionmaking process ; - intolerance for corruption offenses during the enforcement objectives of protection of sovereignty and territorial integrity of ukraine ; - elimination of corruption factors and reforming state procurement procedures ; - strengthening the effectiveness of financial resources management, transparency of budget programmes, the development and maintenance of internal control ; - ensuring conditions to report the facts of violations of anti - corruption legislation, the",861,119,130,105,ukraine_2017_WhiteBook.md,2025-01-28 18:56:25
214,"use of effective and deterrent measures to persons involved in corruption ; - ensuring openness and transparency, public participation in the prevention of corruption according to the law. - - - - - results of the armed forces of ukraine reform in 2017 and participation in the anti - terrorist operation main achievements in prevention and counteraction of corruption in the ministry of defence and the armed forces of ukraine in 2017 the efforts of the mod were focused on implementing tasks and activities provided by the state programme on implementation of the state anti - corruption policy in ukraine ( the anti - corruption strategy ) for 2015 - 2017, the anti - corruption programme of the ministry of defence",718,121,130,105,ukraine_2017_WhiteBook.md,2025-01-28 18:56:25
215,"of ukraine for 2017, and organizational and methodological instructions of the minister of defence of ukraine on implementation of the state anti - corruption policy.",166,25,30,105,ukraine_2017_WhiteBook.md,2025-01-28 18:56:25
216,"# # # # # # during the year five period territorial groups on prevention and counteraction of corruption were established. currently these groups are in the process of completing the acquisition of functional capabilities. the authorized persons responsible for ensuring and monitoring prevention of corruption activities were appointed and started their work in command and control agencies, military units, institutions and state enterprises. during the year five period territorial groups on prevention and counteraction of corruption were established. currently these groups are in the process of completing the acquisition of functional capabilities. the authorized persons responsible for ensuring and monitoring prevention of corruption activities were appointed and started their work in command and control agencies,",825,116,130,106,ukraine_2017_WhiteBook.md,2025-01-28 18:56:25
217,"military units, institutions and state enterprises. a unified system of planning and organization of the corruption prevention tasks and measures was introduced. the ministry of defence activities corruption risks assessment committee was established [ 21 ] and started its operation. the anti - corruption activities were updated for the action plan of the defence reform implementation in 2016 - 2020 ( the road map of the defence reform ). in 2017 the department of public procurement and supply of material resources and the main directorate of the logistic support development were in the process of acquiring modern capabilities. the operation of the tender committee of the ministry of 21 the order of the ministry of defence of ukraine no. 550",751,120,130,106,ukraine_2017_WhiteBook.md,2025-01-28 18:56:25
218,as of 23. 10. 2017,18,5,9,106,ukraine_2017_WhiteBook.md,2025-01-28 18:56:25
219,"# # # # # # during the year five period territorial groups on prevention and counteraction of corruption were established. currently these groups are in the process of completing the acquisition of functional capabilities. the authorized persons responsible for ensuring and monitoring prevention of corruption activities were appointed and started their work in command and control agencies, military units, institutions and state enterprises. - - - - - results of the armed forces of ukraine reform in 2017 and participation in the anti - terrorist operation defence was reorganized in view of new principles. tender procedures were accelerated and their transparency was ensured due to the public e - procurement system prozorro. the expert anti -",750,117,130,107,ukraine_2017_WhiteBook.md,2025-01-28 18:56:25
220,"corruption advisory committee established to provide independent monitoring of the mod ’ anti - corruption activities, is in the process of completing the acquisition of functional capabilities. the memorandum of cooperation with the independent anti - corruption committee of defence ( naco ), established on the initiative of the transparency international ukraine international non - governmental organization, was signed. cooperation with law enforcement agencies in corruption prevention and detection operations cooperation with law enforcement agencies in corruption prevention and detection operations was intensified. according to the national police, in 2017 the data on 64 persons ( in 2016 – 64 ) was included into the unified register of pre - trial investigations, and 38 administrative corruption offenses were registered",836,119,130,107,ukraine_2017_WhiteBook.md,2025-01-28 18:56:25
221,. the sentences ( decisions ) legally entered into force in relation to 81 persons ( in 2016 – 20 ).,100,21,24,107,ukraine_2017_WhiteBook.md,2025-01-28 18:56:25
222,"# # # # # # due to the detected corruption offenses it was possible to prevent losses to the state to the amount of uah 22 million ( in 2016 – 22 uah million official investigations and anti - corruption inspections were conducted regarding violations of anti - corruption legislation. 32 official investigations and anti - corruption inspections were conducted ( in 2016 – 119 ). due to the detected corruption offenses it was possible to prevent losses to the state to the amount of uah 22 million ( in 2016 – uah 67, 64 million ). the state - owned enterprises ’ managerial personnel was inspected for the conflict of interests related to their possession of private enterprises",681,120,130,108,ukraine_2017_WhiteBook.md,2025-01-28 18:56:25
223,"or corporate rights ( 370 people were audited, among them 8 people worked in two or more jobs and 46 people ( 16 % ) had privately owned enterprises ).",151,30,35,108,ukraine_2017_WhiteBook.md,2025-01-28 18:56:25
224,"# # # # # # due to the detected corruption offenses it was possible to prevent losses to the state to the amount of uah 22 million ( in 2016 – 22 uah 67, 64 million ). uah million * * diagram 1. 3. the dynamics of auditing draft legal * * acts for signs of corruption in 2014 - 2017 materials in relation to 54 people were sent over law enforcement agencies, 17 people were dismissed from their jobs. 1 130 draft legal acts of the ministry of defence were audited for signs of corruption ( in 2016 – 1 395 ). 149 appeals relating to the prevention of corruption in the ministry of",580,116,130,109,ukraine_2017_WhiteBook.md,2025-01-28 18:56:25
225,"defence and the armed forces were processed ( in 2016 – 162 ) ( diagram 1. 3 ). the chief of the general staff – the commanderin - chief of the armed forces of ukraine approved the algorithm of work of the armed forces of ukraine officials in case of committing corruption offences related to the receipt of illegal proceeds on may 05, 2017, aimed at reducing corruption risks. 1600 * * 1395 * * 1200 * * 1130 * * * * 1014 * * * * 941 * * 800 400 0 2014 2015 2016 2017 - - - - - results of the armed forces of ukraine reform in 2017 and participation in the anti",562,118,130,109,ukraine_2017_WhiteBook.md,2025-01-28 18:56:25
226,"- terrorist operation building integrity among leaders, officials and civil servants training and building integrity among leaders and officials was provided through the delivery of advanced training certification courses on prevention and counteraction of corruption at the ivan chernyakhovsky national defence university of ukraine ( hereafter – ndu ) under the training programme prepared by transparency international organization with support of the uk ministry of defence. in total in 2017, 40 training activities were held, 1 305 people were trained, of which 805 people trained at * * diagram 1. 4. training of the mod and the afu * * the ndu and 485 people trained by anti -",683,109,130,109,ukraine_2017_WhiteBook.md,2025-01-28 18:56:25
227,"corruption senior leaders and officials responsible for preventing experts of the nato representation to ukraine corruption at anti - corruption courses in the ndu. ( diagram 1. 4 ). the first deputy minister of defence of ukraine 1000 approved job descriptions and job specifications for the graduates of the anti - corruption courses. * * 827 * * * * 805 * * 800 20 - 22 november 2017, the third international anti - corruption week was held at the ndu with the 600 participation of the first deputy minister of defence of ukraine, leading foreign experts in counteraction 400 to corruption, the nato representation to ukraine, foreign advisors of the ministry of defence",673,114,130,109,ukraine_2017_WhiteBook.md,2025-01-28 18:56:25
228,"of 200 * * 155 * * ukraine, representatives of the nsdc of ukraine, central executive authorities, heads of structural units of the ministry of defence and the general 0 staff of the armed forces of ukraine, higher 2015 2016 2017 military educational institutions, media and civil organizations. 1000 * * 827 * * * * 805 * * 800 600 400 200 * * 155 * * 0 2015 2016 2017 the implementation of the action plan to minimize the conflict of interests of persons authorized to perform state functions is under way. candidates for executive positions, persons who have access to financial and material resources and state secrets, civil servants also undergo polygraph",661,115,130,109,ukraine_2017_WhiteBook.md,2025-01-28 18:56:25
229,"testing. over the period from 2015, 727 officials were interviewed, of which 334 in 2016, and 238 in 2017. screening of officials is under way. screening procedures started with respect to 62 017 people, of which 42 567 people being verified. - - - - - results of the armed forces of ukraine reform in 2017 and participation in the anti - terrorist operation",358,64,77,109,ukraine_2017_WhiteBook.md,2025-01-28 18:56:25
230,# # # # # # implementation of the project for reducing corruption risks in the human resources management system continued in 2017 jointly with the centre for integrity in the defence sector ( cids ) of the ministry of defence of the kingdom of norway under the framework of eu support ( sigma ). the minister of defence of ukraine with participation of cids centre approved the code of good conduct and professional ethics for military personnel and civil servants of the ministry of defence of ukraine and the armed forces of ukraine. this is the basic code of ethics document on building integrity in the ministry of defence. implementation of the project for reducing corruption risks in the human resources management,722,123,130,110,ukraine_2017_WhiteBook.md,2025-01-28 18:56:25
231,system continued in 2017 jointly with the centre for integrity in the defence sector ( cids ) of the ministry of defence of the kingdom of norway under the framework of eu support ( sigma ). the minister of defence of ukraine with participation of cids centre approved the code of good conduct and professional ethics for military personnel and civil servants of the ministry of defence of ukraine and the armed forces of ukraine. this is the basic code of ethics document on building integrity in the ministry of defence.,522,91,98,110,ukraine_2017_WhiteBook.md,2025-01-28 18:56:25
232,# # # # # # implementation of the project for reducing corruption risks in the human resources management system continued in 2017 jointly with the centre for integrity in the defence sector ( cids ) of the ministry of defence of the kingdom of norway under the framework of eu support ( sigma ). the minister of defence of ukraine with participation of cids centre approved the code of good conduct and professional ethics for military personnel and civil servants of the ministry of defence of ukraine and the armed forces of ukraine. this is the basic code of ethics document on building integrity in the ministry of defence. * * ensuring systemic cooperation with civil society representatives * * in 2017,709,123,130,111,ukraine_2017_WhiteBook.md,2025-01-28 18:56:25
233,", the action plan for implementing the state policy strategy for supporting the development of civil society was developed and implemented to resolve the current problems related to the implementation of the state anti - corruption policy within the framework of cooperation with civil society representatives. the new composition of the public council of the ministry of defence of ukraine was formed. the issues of the status of anti - corruption activities of the ministry of defence of ukraine were reviewed at its meetings. in order to provide for the right of citizens to receive and provide information, the ministry of defence established a call centre, the public reception office of the minister of defence and 8 regional reception offices at oblast military",768,123,130,111,ukraine_2017_WhiteBook.md,2025-01-28 18:56:25
234,"recruitment offices. - - - - - results of the armed forces of ukraine reform in 2017 and participation in the anti - terrorist operation telephone hotlines of the armed forces of ukraine military law enforcement service, the division for preventing and detecting corruption and the department of internal audit of the ministry of defence operate. this system allows receiving in real - time mode data about corruption offences and taking respective actions openness and transparency in the activity of the ministry of defence of ukraine the activities of the ministry of defence related to the prevention of corruption take place based on the principles of legality and transparency. the narodna armiya newspaper and the viysko",727,116,130,111,ukraine_2017_WhiteBook.md,2025-01-28 18:56:25
235,"ukrainy magazine systematically publish materials on anti - corruption topics. this includes 7 interviews with the minister of defence of ukraine for the media, meetings with representatives of international non - governmental organization transparency international and the independent anti - corruption committee of defence ( naco ). in total, 8 briefings, 6 press conferences, 17 interviews and commentaries were given by the management of the ministry of defence with regard to countering corruption. the central tv and radio studio of the ministry of defence prepared 9 tv programs. the senior leaders",606,91,106,111,ukraine_2017_WhiteBook.md,2025-01-28 18:56:25
236,"# # # # # # anti - corruption activities in the ministry of participated in the tv programs at channel 5, 112",109,23,26,112,ukraine_2017_WhiteBook.md,2025-01-28 18:56:25
237,"# # # # # # defence and the armed forces of ukraine ukraina, 1 + 1 and in the newspapers golos ukrainy, are conducted according to the nato fakty, den and narodna armiya. the official web - site of international anti - corruption programs, the mod is being constantly updated with information in the following sections : “ prevention of corruption ”",349,63,80,113,ukraine_2017_WhiteBook.md,2025-01-28 18:56:25
238,# # # # # # namely : “ purification of power ”. informational events were held,78,17,21,114,ukraine_2017_WhiteBook.md,2025-01-28 18:56:25
239,"# # # # # # • the annual national programme under in the armed forces of ukraine on the international the auspices of the ukraine - nato anti - corruption day ( december 9 ). anti - corruption activities in the ministry of defence and the armed forces of ukraine are conducted according to the nato international anti - corruption programs, namely : - the annual national programme under the",391,71,75,115,ukraine_2017_WhiteBook.md,2025-01-28 18:56:25
240,"# # # # # # integrity, transparency, good faith and auspices of the ukraine - nato commission for 2017 ; reducing corruption risks in the work of the action plan ( road map ) for ukraine on implementation of the nato bi initiative programme",240,45,49,116,ukraine_2017_WhiteBook.md,2025-01-28 18:56:25
241,"# # # # # # • the partnership goal g0204 of the aimed at building integrity, transparency, good faith and reducing corruption risks in the work of",146,28,35,117,ukraine_2017_WhiteBook.md,2025-01-28 18:56:25
242,# # # # # # nato / pfp bi initiative aimed at building defence and security institutions ;,90,19,22,118,ukraine_2017_WhiteBook.md,2025-01-28 18:56:25
243,"# # # # # # integrity, transparency, good faith and - the partnership goal g0204 of the nato / pfp bi",101,22,30,119,ukraine_2017_WhiteBook.md,2025-01-28 18:56:25
244,"# # # # # # reducing corruption risks in the work initiative aimed at building integrity, transparency,",103,18,22,120,ukraine_2017_WhiteBook.md,2025-01-28 18:56:25
245,# # # # # # of defence and security institutions good faith and reducing corruption risks in the as part of implementing the integrity work of defence and security institutions as part of implementing the integrity development programme. the self - assessment of the security and defence sector structures with respect to the detection of corruption risks and threats under the framework of the nato programme was conducted in the selected structural units of the ministry of defence and the general staff of the armed forces of ukraine.,537,89,93,121,ukraine_2017_WhiteBook.md,2025-01-28 18:56:25
246,"# # # # # # anti - corruption activities in the ministry of defence and the armed forces of ukraine are conducted according to the nato international anti - corruption programs, namely : • the annual national programme under the auspices of the ukraine - nato commission for 2017 ; • the action plan ( road map ) for ukraine on implementation of the nato bi initiative programme aimed at building integrity, transparency, good faith and reducing corruption risks in the work of defence and security institutions ; • the partnership goal g0204 of the nato / pfp bi initiative aimed at building integrity, transparency, good faith and reducing corruption risks in the work of defence and security",694,119,130,122,ukraine_2017_WhiteBook.md,2025-01-28 18:56:25
247,institutions as part of implementing the integrity development programme. * * in 2017 the armed forces of ukraine continued to perform operational ( combat ) missions in ongoing * * * * operations along with the defence reform activities related to the improvement of organizational structure of * * * * the armed forces of ukraine and command and control system with the aim of bringing them in line with nato * * * * structure. the defence planning cycle launched in may 2014 was accomplished with the approval of the state * * * * programme of development of the armed forces of ukraine for the period until 2020. * * - - - - -,630,117,122,122,ukraine_2017_WhiteBook.md,2025-01-28 18:56:25
248,# # # # # # chapter 2,21,8,10,123,ukraine_2017_WhiteBook.md,2025-01-28 18:56:25
249,"# # # # # command and control system of the armed forces, their structure and manpower management of many is the same as management of few. it is a matter of n 2017, the c2 system of the armed forces continued to operate with the beginning organization. of russian aggression and ensured a reliable, steady and continuous command and # # i control at home bases, areas of missions, and, in particular, in the area of anti - terrorist _ sun tzu _ operation. in addition, optimization and gradual transition of command and control structures into the nato standard structures continued as well as the re - equipment and building up of communication systems.",655,115,130,124,ukraine_2017_WhiteBook.md,2025-01-28 18:56:25
