chunk_id,text,char_length,word_count,token_count,section_index,source_file,processed_date
1,# # # # counter - terrorism white paper,39,9,11,0,australia_2010_CounterterrorismWhitePaper.md,2025-01-28 18:55:23
2,# # securing australia | protecting our community,49,8,10,1,australia_2010_CounterterrorismWhitePaper.md,2025-01-28 18:55:23
3,"# 2010 - - - - - published by the department of the prime minister and cabinet designed by papercut pty ltd, canberra printed by new millennium print pty ltd to independently assessed, high environmental standards on mondi colour copy, an fsc certified paper isbn 978 - 1 - 921385 - 96 - 4 ( hardcopy ) isbn 978 - 1 - 921385 - 99 - 5 ( pdf ) © commonwealth of australia 2010 this work is copyright. apart from any use as permitted under the copyright act 1968, no part may be reproduced by any process without prior written permission from the department of the prime minister and cabinet.",589,111,130,2,australia_2010_CounterterrorismWhitePaper.md,2025-01-28 18:55:23
4,"requests and enquiries concerning reproduction should be addressed to the commonwealth copyright administration, attorney - general ’ s department, 3 – 5 national circuit, barton act 2600 or at www. ag. gov. au / cca. - - - - -",227,40,53,2,australia_2010_CounterterrorismWhitePaper.md,2025-01-28 18:55:23
5,"# # # prime minister ’ s foreword terrorism continues to pose a serious security challenge to australia. the australian government remains resolute in its commitment to protect australia, its people and interests from this threat. the government is committed to concrete action to combat terrorism. we will continue to ensure that agencies are appropriately resourced, that responses are agile and can meet changing threats, and that all necessary and practical action is taken to protect australia and australians. the policy outlined in this white paper delivers an effective and balanced approach that further strengthens our domestic counter - terrorism efforts and makes a strong contribution to international counter ‑ terrorism efforts. the government has made",767,116,130,3,australia_2010_CounterterrorismWhitePaper.md,2025-01-28 18:55:23
6,"a number of important changes to the way australia responds to terrorism. this white paper sets out our strengthened approach to aviation security, and improves the coordination of our counter - terrorism efforts. it also sets out for the first time a strategy to counter violent extremism in australia. the government has taken and will continue to take all necessary measures to combat terrorism and those who plan or perpetrate such acts. this white paper reiterates the government ’ s commitment to provide the necessary resources to australia ’ s law enforcement, intelligence, security and border protection agencies to enable them to operate effectively. at the same time, we have also taken steps",704,113,130,3,australia_2010_CounterterrorismWhitePaper.md,2025-01-28 18:55:23
7,"to ensure that australia ’ s response to terrorism does not inadvertently undermine the principles that we seek to uphold. no government can guarantee that australians will be free from the threat of terrorist attack. but this government can guarantee that we will take all necessary and practical measures to combat the threat. this white paper forms part of the government ’ s national security reform agenda. it is a further step in delivering a safer, more secure australia. the hon kevin rudd mp prime minister of australia - - - - -",538,93,101,3,australia_2010_CounterterrorismWhitePaper.md,2025-01-28 18:55:23
8,"# # # executive summary the first responsibility of government is the protection of australia, australians and australian interests. so a key government priority is to protect australia from terrorism. the threat of terrorism to australia is real and enduring. it has become a persistent and permanent feature of australia ’ s security environment. the main source of international terrorism and the primary terrorist threat to australia and australian interests is from a global violent jihadist movement – extremists who follow a distorted and militant interpretation of islam that espouses violence as the answer to perceived grievances. this extremist movement comprises al ‑ qa ’ ida, groups allied or associated",717,110,130,4,australia_2010_CounterterrorismWhitePaper.md,2025-01-28 18:55:23
9,"with it, and others inspired by a similar worldview. while the threat is persistent, the challenge has evolved since the last counter - terrorism white paper in 2004 in two respects. first, while there have been counter - terrorism successes ( most notably pressure on al ‑ qa ’ ida ’ s core leadership in afghanistan and pakistan, and action against terrorists in south - east asia ), these successes have been offset by the rise of groups affiliated with, or inspired by, al ‑ qa ’ ida ’ s message and methods, with new areas such as somalia and yemen joining existing areas of concern in south asia, south - east asia,",621,113,130,4,australia_2010_CounterterrorismWhitePaper.md,2025-01-28 18:55:23
10,"the middle east and the gulf. a second shift apparent since 2004 has been the increase in the terrorist threat from people born or raised in australia, who have become influenced by the violent jihadist message. the bombings in london on 7 july 2005, which were carried out by british nationals, brought into stark relief the real threat of globally - inspired but locally generated attacks in western democracies, including australia. a number of australians are known to subscribe to this message, some of whom might be prepared to engage in violence. many of these individuals were born in australia and they come from a wide range of ethnic backgrounds. the pool of those",675,114,130,4,australia_2010_CounterterrorismWhitePaper.md,2025-01-28 18:55:23
11,"committed to violent extremism in australia is not static – over time some move away from extremism while others become extreme. we have seen terrorist planning within australia. since 2001, numerous terrorist attacks have been thwarted in australia. thirty - eight people have been prosecuted or are being prosecuted as a result of counter - terrorism operations and 20 people have been convicted of terrorism offences under the criminal code. over 40 australians have had their passports revoked or applications denied for reasons related to terrorism. the government ’ s counter - terrorism strategy is informed by a number of core judgements. we must take a comprehensive and layered approach. our counter - terrorism measures",730,115,130,4,australia_2010_CounterterrorismWhitePaper.md,2025-01-28 18:55:23
12,"must be informed by strategic judgements about the nature of the threat and australia ’ s vulnerability to it. and we must conduct our activities in a manner which harnesses our capabilities, upholds our principles and mitigates the risk of attack or failure in our response. - - - - - the strategy has four key elements : 1. * * analysis : an intelligence - led response to terrorism driven by a properly connected and properly informed * * national security community. 2. * * protection : taking all necessary and practical action to protect australia and australians from terrorism at * * home and abroad. 3. * * response : providing an immediate",649,115,130,4,australia_2010_CounterterrorismWhitePaper.md,2025-01-28 18:55:23
13,"and targeted response to specific terrorist threats and terrorist attacks * * should they occur. 4. * * resilience : building a strong and resilient australian community to resist the development of any form of * * violent extremism and terrorism on the home front. analysis australia ’ s counter - terrorism efforts are intelligence - led and focused on prevention. this approach hinges on strong partnerships and cooperation at the national level, effective engagement at the international level, and effective information sharing. over recent years, there has been significant growth in australia ’ s security, intelligence and law enforcement agencies and the government has taken steps to improve their capabilities and enhance",732,113,130,4,australia_2010_CounterterrorismWhitePaper.md,2025-01-28 18:55:23
14,"information sharing. the establishment of the national intelligence coordination committee has ensured that australia ’ s intelligence effort, both domestically and internationally, is better integrated into the new national security arrangements. the creation of a new counter - terrorism control centre will also ensure that we better integrate our overall counter - terrorism intelligence capabilities. protection the government is committed to taking strong action to protect australians and reduce the risk of attack. this approach involves efforts at a number of complementary levels, including : strong border management arrangements to prevent the movement of individuals who try to enter or transit australia to conduct terrorism - related activities by introducing a new biometric - based visa system for certain non",826,120,130,4,australia_2010_CounterterrorismWhitePaper.md,2025-01-28 18:55:23
15,"- citizens – making it harder for terrorists to evade detection ; preventing australians suspected of involvement in terrorism from travelling overseas by revoking or denying passports ; improving the security of our airports to enhance protection of the travelling public ; continued cooperation and collaboration with the states and territories through comprehensive national counter - terrorism arrangements ; working in partnership with the business community to protect our critical infrastructure, including information and communications technology ; and strengthened collaboration with international partners, both bilaterally and multilaterally, to contribute to international counter - terrorism efforts and create an international environment that is hostile to terrorism. - - - - - response the government ’ s ability to prevent and",844,119,130,4,australia_2010_CounterterrorismWhitePaper.md,2025-01-28 18:55:23
16,"disrupt terrorist attacks within australia relies on coordinated and cooperative relationships between our intelligence, security and law enforcement agencies nationally. this collaborative approach ensures that we have a robust and effective national capacity to respond to terrorist threats. australia ’ s comprehensive national response uses the full array of commonwealth, state and territory counter - terrorism capabilities. it is underpinned by a legal regime that provides effective powers for our agencies and the ability to prosecute people who seek to conduct terrorist acts. the government will keep these powers under review against any further need to expand them or tailor them to deal with any changes in the nature of the threat in the future. resilience",771,116,130,4,australia_2010_CounterterrorismWhitePaper.md,2025-01-28 18:55:23
17,"australia ’ s counter - terrorism efforts are supported by our open democratic society. there are inherent strengths in our society that make australia resilient to the divisive worldview of al - qa ’ ida and like - minded groups. however, we know from experience that the terrorist narrative may resonate with a small number of australians. it is incumbent upon all australians to work together to reject ideologies that promote violence, no matter from where they arise or to what purpose they aspire. we must all support and protect the values and freedoms from which all australians benefit. by reducing disadvantage, addressing real or perceived grievances and",665,108,130,4,australia_2010_CounterterrorismWhitePaper.md,2025-01-28 18:55:23
18,"encouraging full participation in australia ’ s social and economic life, government policies can help to mitigate any marginalisation and radicalisation that may otherwise occur within the australian community. terrorism will continue to pose challenges to australia ’ s national security for the foreseeable future. the government is committed to the continuous improvement of australia ’ s counter - terrorism efforts, and will pursue a range of measures to protect australia, its people and interests from terrorism. our coordinated, multilayered approach is aimed at ensuring that counter - terrorism efforts are effective and conducted in a manner that enhances our wider national security. the government remains committed to taking all necessary and",757,112,130,4,australia_2010_CounterterrorismWhitePaper.md,2025-01-28 18:55:23
19,practical action to keep australia safe. - - - - -,50,11,14,4,australia_2010_CounterterrorismWhitePaper.md,2025-01-28 18:55:23
20,# # # table of contents executive summary ii 1 introduction 1 2 the threat 5 3 australia ’ s counter - terrorism strategy 17 4 analysis 25 an intelligence - led response to terrorism driven by a properly connected and properly informed national security community 5 protection 33 taking all necessary and practical action to protect australia and australians from terrorism at home and abroad 6 response 53 providing an immediate and targeted response to specific terrorist threats and terrorist attacks should they occur 7 resilience 63 building a strong and resilient australian community to resist the development of any form of violent extremism and terrorism on the home front 8 conclusion 69 glossary 73 - - - - -,719,121,130,5,australia_2010_CounterterrorismWhitePaper.md,2025-01-28 18:55:23
21,- - - - -,9,5,7,5,australia_2010_CounterterrorismWhitePaper.md,2025-01-28 18:55:23
22,# # # introduction,18,4,6,6,australia_2010_CounterterrorismWhitePaper.md,2025-01-28 18:55:23
23,# 01 - - - - - - - - - -,24,12,14,7,australia_2010_CounterterrorismWhitePaper.md,2025-01-28 18:55:23
24,"# # # 1 introduction terrorism is the use of violence by groups or individuals pursuing political objectives. terrorists are frequently indiscriminate in their attacks and can deliberately target civilians and non - combatants, often seeking to inflict mass casualties. the purpose of this counter - terrorism white paper, securing australia – protecting our community, is to : explain the nature of the terrorist threat to australia within australia ’ s broader national security context ; set out the australian government ’ s strategy for countering terrorism ; and detail the policy settings by which the government will implement its counter - terrorism strategy. this white paper reflects a number of improvements to australia ’ s",736,116,130,8,australia_2010_CounterterrorismWhitePaper.md,2025-01-28 18:55:23
25,"approach to counter - terrorism. it brings together for the first time, in a comprehensive manner, australia ’ s response to terrorism both domestically and internationally. the strategy outlined in this white paper sets out a comprehensive response to terrorism while upholding the fundamental rights and freedoms of all australians. preventing terrorist acts, and dissuading those who might seek to commit them, is a complex challenge for all levels of government and the australian community more broadly. the responses and measures outlined in this white paper are targeted and proportionate, and take into account the evolving strategic environment and the lessons we have learnt over recent years. australia ’ s counter - terrorism",737,113,130,8,australia_2010_CounterterrorismWhitePaper.md,2025-01-28 18:55:23
26,"policies form part of the government ’ s comprehensive national security strategy. australia faces a range of complex, dynamic and evolving security challenges. the national security statement of 2008 set out the government ’ s vision for a coherent approach to addressing these challenges. australia must be clear in its analysis of the threats and challenges we face, actively manage them, and seize opportunities to enhance our overall national security. this white paper sets out australia ’ s counter - terrorism objectives and the means by which the government will pursue them. the nature of the threat is explained in chapter two and the government ’ s counter ‑ terrorism strategy is detailed in chapter three. the various elements",740,119,130,8,australia_2010_CounterterrorismWhitePaper.md,2025-01-28 18:55:23
27,of our strategy are detailed in chapters four to seven. following page : members of the australian defence force tactical assault group ( east ) in black hawk helicopters over melbourne. - - - - - - - - - -,206,41,45,8,australia_2010_CounterterrorismWhitePaper.md,2025-01-28 18:55:23
28,# # # the threat,16,5,7,9,australia_2010_CounterterrorismWhitePaper.md,2025-01-28 18:55:23
29,# 02 - - - - - - - - - -,24,12,14,10,australia_2010_CounterterrorismWhitePaper.md,2025-01-28 18:55:23
30,"# # # 2 the threat the threat of terrorism to australia and our interests is real. terrorism has become a persistent and permanent feature of australia ’ s security environment. it threatens australians and australian interests both at home and overseas. the government ’ s intelligence agencies assess that further terrorist attacks could occur at any time. over the past century the world has seen a succession of terrorist campaigns supporting various ideological or nationalist causes. methods of attack have evolved and terrorists have proved innovative, adaptive and ruthless in pursuing their goals. terrorism affected australia before the 11 september 2001 attacks against the united states. various overseas terrorist groups have long had a presence in australia – focused",781,120,130,11,australia_2010_CounterterrorismWhitePaper.md,2025-01-28 18:55:23
31,"largely on fundraising and procurement, occasionally escalating to violence. but prior to the rise of self - styled jihadist [ 1 ] terrorism fostered by al - qa ’ ida, australia itself was not a specific target. we now are. terrorist attacks in australia before 2001 terrorist attacks conducted in australia before 2001 include : the 1972 bombing of the yugoslav general trade agency in sydney ; the 1978 bombing of the sydney hilton hotel during a commonwealth heads of government regional meeting ; the 1980 assassination of the turkish consul - general in sydney ; the 1982 bombing of the israeli consulate and the hakoah club in sydney ; and the 1986 bombing at the",669,116,130,11,australia_2010_CounterterrorismWhitePaper.md,2025-01-28 18:55:23
32,"turkish consulate in melbourne. since 2001, more than 100 australians have been killed in terrorist attacks overseas. numerous other attacks have been thwarted in australia. thirty - eight people have been prosecuted or are being prosecuted as a result of counter - terrorism operations, 35 of whom were prosecuted for terrorism offences pursuant to the _ criminal code act 1995 _ ( the criminal code ). a number of these prosecutions are ongoing. twenty people have been convicted of terrorism offences under the criminal code. more than 40 australians have had their passports revoked or applications denied for reasons related to terrorism. 1 the term ‘ jihadist ’ is an imperfect descriptor that has multiple",712,115,130,11,australia_2010_CounterterrorismWhitePaper.md,2025-01-28 18:55:23
33,"meanings. it is, however, a term that has been appropriated by many terrorist groups to describe their activities, and it is commonly used by security services and public commentators across the world to describe them. - - - - - 2. 1 the current threat the main source of international terrorism and the primary terrorist threat to australia and australian interests today comes from people who follow a distorted and militant interpretation of islam that calls for violence as the answer to perceived grievances. this broad movement comprises al ‑ qa ’ ida, groups allied or associated with it, and others inspired by a similar worldview but not formally linked to al ‑ qa",673,114,130,11,australia_2010_CounterterrorismWhitePaper.md,2025-01-28 18:55:23
34,"’ ida networks. their constituency, while small in global terms, shows every sign of persisting even if al - qa ’ ida ’ s current senior leadership were to be killed or captured. al - qa ’ ida has been the vanguard of an international movement of like - minded groups and influences its direction through both propaganda and actions. its extremist ideology, goals and interpretations of world events allow local grievances to be worked into its global vision. this message resonates with jihadist terrorists around the world and continues to attract new adherents. their activities challenge governments and communities globally, and threaten prosperity and security in various parts",683,109,130,11,australia_2010_CounterterrorismWhitePaper.md,2025-01-28 18:55:23
35,"of the world. al - qa ’ ida remains a significant, but not the only, threat. it has links to other extremist groups operating in various parts of the world. some of these have entered into a formal association with core al - qa ’ ida and adopted names that reflect this, such as ‘ al - qa ’ ida in iraq ’ and ‘ al - qa ’ ida in the arabian peninsula ’. others have remained independent but have ongoing operational, training, propaganda or logistic cooperation with al - qa ’ ida. ‘ lone wolf ’ attackers with no group affiliation but motivated by the same ideology can",569,110,130,11,australia_2010_CounterterrorismWhitePaper.md,2025-01-28 18:55:23
36,"emerge at any time. a distorted narrative many distinct terrorist networks with differing and often local objectives share a broadly common set of beliefs that narrowly and simplistically interprets history and current affairs through the lens of the alleged oppression of muslims, principally by the west. groups like al ‑ qa ’ ida want people to believe : the west, led by the united states of america, is engaged in the systematic exploitation and repression of muslims ; governments in muslim majority countries are illegitimate, corrupt and un ‑ islamic ; the solution is the removal of western interference in muslim majority countries and the establishment of ‘ truly islamic ’ systems of governance ; and it",715,117,130,11,australia_2010_CounterterrorismWhitePaper.md,2025-01-28 18:55:23
37,"is the religious duty of all muslims individually to use violence to attack the political, military, religious and cultural enemies of islam anywhere around the world. 2. 1. 1 a persistent threat personal and social connections between groups and networks have been central to the rise of the so called ‘ global jihad ’. these connections form the platform for the planning and execution of terrorist attacks. it is in these extra - organisational networks that much of the current threat subsists. this relative lack of formal structure contributes to the movement ’ s resilience and complicates counter ‑ terrorism efforts. while fragmentation and autonomy impose certain operational constraints on terrorist",710,111,130,11,australia_2010_CounterterrorismWhitePaper.md,2025-01-28 18:55:23
38,"groups, it also makes it easier for them to evade detection by security agencies and to adjust their tactics in response to successful counter - terrorism measures. - - - - - figure 1 : timeline of terrorism - related incidents involving australia or australian citizens | col1 | col2 | col3 | col4 | 2008 mbai attacks. stralians killed | | - - - | - - - | - - - | - - - | - - - | | round july. lled. | rants in killed | is. arrests elbourne lanning | | | | 05 derg on 7 lian ki | 05 estau",489,108,130,11,australia_2010_CounterterrorismWhitePaper.md,2025-01-28 18:55:23
39,alians | 05 denn nd m ack p | | mu 3 au | | 20 london un bombings 1 austra | 20 bombing of r bali. 4 austr | 20 operation pen in sydney a disrupt att | | | | 2003 australian killed in riyadh | 2003 disrupted let planning for attack in australia | 2003 willie brigitte : early plans for an attack in australia | | - - - | - - - | - - - | | 2001 church / mosque arson attacks | 2001 disrupted planning for attack in singapore | 2001 australian woman killed by bomb inturkey | 2001 us september 11 attacks. 10 australians killed,525,114,130,11,australia_2010_CounterterrorismWhitePaper.md,2025-01-28 18:55:23
40,". | | - - - | - - - | - - - | - - - | - - - - - figure 2 : terrorist attacks since 2001 in which australians have been killed - - - - - although damaged by the death or capture of many of its leading figures, al - qa ’ ida has shown the capacity to regenerate quickly. as the al - qa ’ ida core leadership in the border areas of pakistan and afghanistan has come under increasing pressure, its ability to train new terrorists, move them to the west and successfully launch attacks has been degraded. but it still has a substantial pool of operatives capable in their",566,119,130,11,australia_2010_CounterterrorismWhitePaper.md,2025-01-28 18:55:23
41,"own right of planning and conducting attacks and helping other like ‑ minded extremists across the globe. it continues to run a global propaganda campaign and remains an inspiration to other like - minded networks and individuals operating outside its direct control. any reduction of the ability of core al - qa ’ ida to project terrorism beyond its immediate region has been offset by the rise of those affiliated with, or inspired by, its message and methods. the ability of some of these to reach into the west is increasing. we are seeing more real and potential threats to the west from countries such as somalia and yemen. a major concern is that this represents a",671,117,130,11,australia_2010_CounterterrorismWhitePaper.md,2025-01-28 18:55:23
