chunk_id,text,char_length,word_count,token_count,section_index,source_file,processed_date
77,"measures terrorism requires an active, preventive and adaptive response across the full range of government counter ‑ terrorism measures. it presents challenges across all levels of government and our response involves a broad range of government agencies. over recent years, there has been significant growth in australia ’ s security, intelligence and law enforcement agencies designed to enhance australia ’ s counter - terrorism capacity. the government has also taken steps to enhance information sharing. the newly established nicc ensures that australia ’ s intelligence effort, both domestically and internationally, is better integrated into the new national security arrangements. the national approach to counter - terrorism is based upon strong, cooperative, coordinated and consultative",799,114,130,14,australia_2010_CounterterrorismWhitePaper.md,2025-01-28 18:55:23
78,"relationships between our agencies. the agencies cooperate to conduct preventive operations. 3. 2. 3 a risk - informed and layered approach intelligence plays a critical role in identifying, investigating and anticipating threats, developing preventive responses and determining the areas of greatest need for our counter - terrorism efforts. it also provides the basis to identify opportunities to more effectively focus counter ‑ terrorism efforts, disrupt terrorist acts or make changes to our counter - terrorism measures on the basis of risk ‑ informed assessments. no one counter - terrorism measure can protect all of our interests or preclude attack. as a result, australia ’ s approach to counter - terrorism relies on complementary",741,113,130,14,australia_2010_CounterterrorismWhitePaper.md,2025-01-28 18:55:23
79,"security layers designed on the basis of assessments of risk, involving threat, vulnerability and the potential consequences of attack. these layers collectively strengthen australia ’ s national security. 3. 2. 4 a lawful, proportionate and accountable response to be effective, australia must pursue a principled and proportionate response that promotes and upholds the values we seek to protect. the government does not support the use of torture or other unlawful methods in response to terrorism. terrorism is a crime and the government will pursue terrorists within proper legal frameworks and in accordance with the rule of law. a response based on our democratic values and universal human rights serves to undermine the",728,112,130,14,australia_2010_CounterterrorismWhitePaper.md,2025-01-28 18:55:23
80,"narrative of terrorist groups that seek to portray our actions, and those of our allies, as oppressive. in recognition of the importance of our counter ‑ terrorism and security legislation, the government has introduced legislation to establish an independent national security legislation monitor to regularly and independently review the operation of australia ’ s counter ‑ terrorism laws. 3. 2. 5 effective national arrangements cooperative federalism is a vital part of australia ’ s counter - terrorism strategy. australian governments have overlapping responsibility for protecting our communities, infrastructure and assets and the interests of australia as a whole against terrorism. australia ’ s national approach to counter ‑ terrorism is coordinated through a comprehensive set of arrangements",806,117,130,14,australia_2010_CounterterrorismWhitePaper.md,2025-01-28 18:55:23
81,". the national counter ‑ terrorism plan sets out arrangements and responsibilities for dealing with terrorism. the commonwealth and the states and territories routinely conduct multi - jurisdictional exercises to enhance australia ’ s national counter ‑ terrorism and emergency management capabilities. these exercises test national and jurisdictional counter - terrorism arrangements with a focus on consequence management, including the simulation of large - scale and multiple - site mass casualty incidents. opposite page : boat assault force members of the australian defence force tactical assault group ( east ) conduct a boarding during counter - terrorism exercises. - - - - - 3. 2. 6 cooperation between governments, business and communities as the owners and operators of",782,118,130,14,australia_2010_CounterterrorismWhitePaper.md,2025-01-28 18:55:23
82,"infrastructure that may be targeted by terrorists, the business community has a key role to play in australia ’ s response to terrorism and in supporting resilience within our economy and community. communities also play a leading role in rejecting extremist ideologies and supporting individuals who are at risk of marginalisation, or who might be attracted to the use of violent expression to achieve political, social or ideological goals. communities can also assist our law enforcement and security agencies to help prevent acts of terrorism. - - - - -",557,90,105,14,australia_2010_CounterterrorismWhitePaper.md,2025-01-28 18:55:23
83,# # # analysis an intelligence - led response to terrorism driven by a properly connected and properly informed national security community,139,22,24,15,australia_2010_CounterterrorismWhitePaper.md,2025-01-28 18:55:23
84,# 04 - - - - - - - - - -,24,12,14,16,australia_2010_CounterterrorismWhitePaper.md,2025-01-28 18:55:23
85,"# # # 4 analysis an intelligence - led response to terrorism driven by a properly connected and properly informed national security community terrorist networks are clandestine. they hide and obfuscate their activities to avoid detection and disruption. to be effective against terrorism, the government needs access to intelligence that will uncover terrorists, their methods and plans. an intelligence - led approach as australia confronts an evolving and increasingly complex national security environment, the importance of intelligence to inform our responses to challenges will increase. intelligence is information, obtained covertly or otherwise, that provides insight and advantage. it is by its nature sensitive information. it can be a single piece of information, or",778,113,130,17,australia_2010_CounterterrorismWhitePaper.md,2025-01-28 18:55:23
86,"a conglomerate of fused, corroboratory material from various sources that is the result of careful analysis and assessment. intelligence is collected in many forms by agencies across the national security community including, but not limited to, the intelligence collection agencies of the australian intelligence community. numerous agencies utilise this intelligence to identify emerging threats and determine operational or policy responses. 4. 1 an effective intelligence capability the ability to collect, analyse and share information expeditiously is critical to protecting australia and its people from attack. the australian intelligence community comprises agencies charged with collecting human intelligence, signals intelligence and imagery, and assessment agencies which analyse and interpret",805,107,130,17,australia_2010_CounterterrorismWhitePaper.md,2025-01-28 18:55:23
87,"intelligence and data from other sources. both arms of the intelligence community – collection and assessment – contribute to all aspects of our counter - terrorism effort. the terrorist threat demands close cooperation between australia ’ s foreign intelligence, security intelligence, law enforcement, financial intelligence and criminal intelligence agencies, and also with international partners. our intelligence capabilities must also evolve to ensure that they keep pace with changes in the operational security methods of terrorist groups or their use of new technologies. the nature of intelligence, which is often fragmentary or imprecise, is such that there can be no guarantee of prior warning of terrorist attacks. 4. 1. 1 a new approach",750,112,130,17,australia_2010_CounterterrorismWhitePaper.md,2025-01-28 18:55:23
88,"to counter - terrorism intelligence coordination the government has moved to strengthen australia ’ s counter - terrorism intelligence activities by better integrating and coordinating capabilities across the national intelligence community through the establishment of a counter - terrorism control centre. - - - - - the counter - terrorism control centre the government has decided to reshape the way it manages its counter - terrorism work. a multi - agency counter - terrorism control centre will be established in the australian security intelligence organisation ( asio ) to set and manage counter - terrorism priorities, identify intelligence requirements, and ensure that the processes of collecting and distributing counter ‑ terrorism information are fully harmonised and effective across the spectrum",811,120,130,17,australia_2010_CounterterrorismWhitePaper.md,2025-01-28 18:55:23
89,"of australia ’ s counter - terrorism activity. it will support the established roles of federal and state law enforcement authorities. it will be the key commonwealth body for evaluating and integrating counter ‑ terrorism intelligence. by strengthening the integration of our counter - terrorism capabilities, the centre will improve the ability of agencies to operate against terrorism and to detect and prevent terrorist threats to australians and australia ’ s interests. 4. 1. 2 working in partnership australia ’ s response to terrorism is driven by our understanding of current and emerging threats and the intent, capability and operational methods of terrorist groups. intelligence underwrites australia ’ s understanding of terrorism. it can play a",758,116,130,17,australia_2010_CounterterrorismWhitePaper.md,2025-01-28 18:55:23
90,"vital role in preventing and disrupting the activities of terrorists threatening to attack australia and our interests. it can also drive preventive operational responses across australia ’ s national security community. intelligence assessments are often built from fragmentary pieces of information. for this reason, our agencies work collaboratively and share information to ensure that all of the capabilities of australian agencies are leveraged to minimise the risk of intelligence failure. the establishment of the national intelligence coordination committee ( nicc ) in 2009 has strengthened cooperation across australia ’ s intelligence agencies and the broader national security community. the national intelligence coordination committee the national intelligence coordination committee ( nicc ) is chaired by",821,114,130,17,australia_2010_CounterterrorismWhitePaper.md,2025-01-28 18:55:23
91,"the national security adviser and comprises the heads of the office of national assessments, the australian secret intelligence service, the australian security intelligence organisation, the defence imagery and geospatial organisation, the defence intelligence organisation, the defence signals directorate, the afp, the australian crime commission, and customs and border protection. the departments of defence, foreign affairs and trade, immigration and citizenship, and attorney - general ’ s are also represented at the deputy secretary level. the nicc enhances the ability of australia ’ s security agencies to share information, coordinate effort and identify opportunities to improve the whole - of - government response to terrorism and other national security",769,108,130,17,australia_2010_CounterterrorismWhitePaper.md,2025-01-28 18:55:23
92,"challenges. - - - - - australia ’ s relationships with foreign partners are also vital to prevent terrorist acts from occurring within australia. these relationships maximise the capabilities of our agencies and increase our access to information and shared intelligence to support international counter - terrorism efforts. our relationships with key intelligence allies, the united states, the united kingdom, canada and new zealand, as well as wider partnerships and exchanges including within the asia ‑ pacific region, south asia, the middle east and europe, continue to enhance australia ’ s own capabilities, and add to the contestability and robustness of our intelligence product. the australian intelligence community the office of national assessments",762,113,130,17,australia_2010_CounterterrorismWhitePaper.md,2025-01-28 18:55:23
93,"( ona ) provides all - source assessments on international political, strategic and economic developments to the prime minister and senior ministers in the national security committee of cabinet. the australian security intelligence organisation ( asio ) collects security intelligence and identifies and investigates threats to australia ’ s security, wherever they arise, and provides assessments and advice to protect australia, its people and its interests. the australian secret intelligence service ( asis ) is australia ’ s overseas secret human intelligence ( humint ) collection agency. asis ’ s mission is to protect and promote australia ’ s vital interests through the provision of unique foreign intelligence services as directed by the government. the",765,115,130,17,australia_2010_CounterterrorismWhitePaper.md,2025-01-28 18:55:23
94,"defence intelligence organisation ( dio ) is an intelligence assessment agency that supports defence and government decision - making and assists with the planning and conduct of australian defence force ( adf ) operations. the defence imagery and geospatial organisation ( digo ) provides geospatial intelligence, from imagery and other sources, in support of australia ’ s defence and national interests. the defence signals directorate ( dsd ) supports australian government decision - makers and the adf with high quality foreign signals intelligence products and services. dsd also plays a key role in protecting australian official communications and information systems. australia ’ s national counter - terrorism effort also requires",741,110,130,17,australia_2010_CounterterrorismWhitePaper.md,2025-01-28 18:55:23
95,"strong partnerships between relevant agencies and the public. information from the public has been vital in assisting our agencies to conduct successful investigations into terrorist activities in the past. knowledge and information about potential threats needs to flow between all sections of the community and our law enforcement and security agencies. the national security hotline has operated 24 hours a day since december 2002 as a direct point of contact for the public to report possible indications of terrorism. the hotline is one of the ways members of the public can work with governments to protect australia from terrorism. as every piece of information can be critical, its role in providing leads against terrorist threats is widely recognised across australia",777,120,130,17,australia_2010_CounterterrorismWhitePaper.md,2025-01-28 18:55:23
96,"’ s national security and law enforcement agencies. the national security hotline number is 1800 123 400. - - - - - the national threat assessment centre the multi - agency national threat assessment centre ( ntac ) is located within asio and assesses intelligence and information from a wide range of sources to prepare threat assessments in relation to specific people, places, and events. these assessments inform the risk management decisions made by operational agencies, the implementation of protective security measures and the travel advisories regarding potential threats when travelling overseas that are prepared by the department of foreign affairs and trade for the australian public. asio also provides protective security advice to australian",758,115,130,17,australia_2010_CounterterrorismWhitePaper.md,2025-01-28 18:55:23
97,"government agencies and, with the approval of the attorney - general, to state and territory governments and private sector companies to protect vulnerable facilities. 4. 1. 3 financial intelligence financial intelligence is an important tool in australia ’ s operational counter - terrorism response. the australian transaction reports and analysis centre ( austrac ) is both australia ’ s financial intelligence unit and the regulator of australia ’ s anti - money laundering and counter - terrorism financing regime. austrac cooperates closely with law enforcement agencies and provides unique, expert advice on suspicious movements of funds, both domestically and offshore. it analyses this data to develop financial intelligence that is provided to law",757,113,130,17,australia_2010_CounterterrorismWhitePaper.md,2025-01-28 18:55:23
98,"enforcement and national security agencies, and to international counterparts as appropriate. the use of sophisticated technology to draw links between otherwise unconnected transactions and personal information strengthens the australian law enforcement community ’ s ability to detect and disrupt groups that pose a threat to australia ’ s security. financial intelligence austrac collects, analyses, and disseminates financial intelligence to 34 australian law enforcement, national security, revenue and social justice agencies, and to 56 overseas counterparts. this financial intelligence comes from a range of financial transaction reports that are submitted to austrac. financial intelligence can play an instrumental role in identifying and prosecuting individuals involved in terrorist financing,",805,107,130,17,australia_2010_CounterterrorismWhitePaper.md,2025-01-28 18:55:23
99,"both in australia and overseas. austrac works cooperatively with counterpart agencies overseas to share and develop expertise and contribute to global action against money laundering, serious crime and terrorism. - - - - - 4. 1. 4 enhanced information sharing the government has also implemented new initiatives designed to strengthen information sharing across the australian government national security community. this includes the appointment of a national security chief information officer ( nscio ) to provide strategic coordination of the national security community ’ s information management arrangements. a key element of the nscio ’ s work is the development of a roadmap detailing key measures to achieve by 2020 a more secure, coordinated",752,113,130,17,australia_2010_CounterterrorismWhitePaper.md,2025-01-28 18:55:23
100,"and effective national security information management environment. 4. 2 international intelligence cooperation intelligence cooperation with international partners forms a critical element of collective counter ‑ terrorism efforts. australia ’ s intelligence agencies have a broad network of international partners around the world. these relationships provide the basis to share intelligence, assessments, expertise and capabilities. they also enable us to collectively ‘ join the dots ’ and take action to disrupt terrorist networks and activities around the globe. this cooperation is essential to countering terrorism – a crime that transcends borders and requires intelligence capabilities that are flexible, dynamic and integrated. effective intelligence cooperation assists significantly in australia ’ s ability to disrupt terrorist planning and",854,115,130,17,australia_2010_CounterterrorismWhitePaper.md,2025-01-28 18:55:23
101,"operations before they can target australians or australia ’ s interests, and to implement a range of measures to mitigate emerging threats or to inform and contribute to international counter - terrorism efforts. an understanding of a potential threat allows our agencies to respond appropriately – whether through increased or changed protective security measures, or more targeted operational responses. australia also works to develop the capacity of security services in countries where australia has counter ‑ terrorism interests. a tangible example of the value of international intelligence cooperation is australia ’ s counter ‑ terrorism intelligence training program ( ctitp ), established in 2005. it delivers counter ‑ terrorism training and capacity building. ctitp contributes",791,115,130,17,australia_2010_CounterterrorismWhitePaper.md,2025-01-28 18:55:23
102,"to the development of trusted, cooperative relationships with counterpart agencies. 4. 3 a commitment to open and accountable oversight the inspector - general for intelligence and security ( igis ) provides independent assurance to the government and parliament that the six agencies comprising australia ’ s intelligence community act legally and with propriety. the igis has broad powers to review, inspect, and inquire into the activities of the intelligence agencies and report on their performance, including their counter - terrorism activities. effective oversight and accountability of the intelligence community remains crucial to ensure that the closer integration between intelligence agencies and their partners remains consistent with our values and democratic traditions. in recognition of",804,114,130,17,australia_2010_CounterterrorismWhitePaper.md,2025-01-28 18:55:23
103,"the joint operational relationships between intelligence and law enforcement agencies in counter - terrorism investigations, the government is progressing legislative amendments to allow inquiries by the igis to extend as necessary to other commonwealth agencies that are not members of the australian intelligence community. next page : australian federal police officers on duty. - - - - - - - - - -",401,63,69,17,australia_2010_CounterterrorismWhitePaper.md,2025-01-28 18:55:23
104,# # # protection taking all necessary and practical action to protect australia and australians from terrorism at home and abroad,129,21,23,18,australia_2010_CounterterrorismWhitePaper.md,2025-01-28 18:55:23
105,# 05 - - - - - - - - - -,24,12,14,19,australia_2010_CounterterrorismWhitePaper.md,2025-01-28 18:55:23
106,"# # # 5 protection taking all necessary and practical action to protect australia and australians from terrorism at home and abroad no government can guarantee that australians will be free from the threat of terrorist attack. the government ’ s commitment to combat the threat by taking all necessary and practical measures requires action at a range of levels to reduce the risk of attack. in addition to an effective intelligence capability, australia ’ s approach hinges on effective border management and transport security practices, strong relationships between the commonwealth and the states and territories, collaborative relationships with business to protect our critical infrastructure and cooperative international relationships. as the nature of the threat and our capabilities have evolved, the",810,121,130,20,australia_2010_CounterterrorismWhitePaper.md,2025-01-28 18:55:23
107,"government has taken specific steps to improve the measures we take to protect australians. following the recent announcement of a $ 200 million investment in aviation and border security, the government will invest a further $ 69 million to introduce a biometric - based visa system for certain non - citizens. 5. 1 a strong border as recent events such as the attempted bombing on christmas day 2009 of northwest airlines flight 253 in the united states and the 2008 mumbai attacks demonstrate, terrorists are willing and able to cross borders to conduct or support attacks. the ability to identify and prevent the movement of individuals who try to enter or transit australia to conduct terrorist acts or terrorism - related",727,121,130,20,australia_2010_CounterterrorismWhitePaper.md,2025-01-28 18:55:23
108,"activities is vital to australia ’ s security. each year a number of visa applicants are refused entry to australia on the basis of adverse security assessments – sometimes because of suspected links to terrorist activity. and unauthorised arrivals who seek to remain in australia are subject to security checking. australia ’ s approach to border management is intelligence - led and risk - based. this means that interventions are focused on high risk movements of people or goods, while low risk movements are facilitated smoothly. robust risk management strategies focus on reducing the chance of people or goods presenting a risk to australia reaching our shores. our arrangements and measures focus on verifying and assessing the",735,117,130,20,australia_2010_CounterterrorismWhitePaper.md,2025-01-28 18:55:23
109,"identity and intent of people entering or leaving australia, to prevent the movement of people who may engage in terrorism - related or other criminal activity. the government is determined to ensure that australia ’ s border management processes are world class. the government has endorsed a strategic border management plan to guide our border management arrangements into the future, and has recently taken significant steps to enhance australia ’ s approach to securing the border. the key shift has been to change the way we think about our borders. australia ’ s border management agencies now devote far greater effort well beyond our shores to prevent terrorists, and other persons of concern, from reaching our territory. - -",735,119,130,20,australia_2010_CounterterrorismWhitePaper.md,2025-01-28 18:55:23
