chunk_id,text,char_length,word_count,token_count,section_index,source_file,processed_date
139,"critical infrastructure protection modelling and analysis capability, which shows the potential impacts of terrorist attacks and other disasters on our communities, our infrastructure, and the economy. this resource employs a range of tools, including highly complex computer models, to assist business and government decision makers involved in counter - terrorism, critical infrastructure protection and emergency management. - - - - - - - - - - asio ’ s business liaison unit ( blu ) also provides reporting and advice on national security threats relevant to the private sector to improve their ability to respond to such threats, both in australia and internationally. government agencies are also continuing to work with industry to limit the opportunities for",766,117,130,20,australia_2010_CounterterrorismWhitePaper.md,2025-01-28 18:55:23
140,", and enhance the detection of, the illegal or unauthorised use of security - sensitive cbrn materials, to establish a financial environment hostile to the financing of terrorism, money laundering and other crime, and to give effect to australia ’ s border and transport security regime. 5. 4. 1 cyber security information and communications technology permeates much of australia ’ s critical infrastructure and underpins our economy. it is vulnerable to exploitation by state or non ‑ state actors seeking to damage australia ’ s economy and necessitates an effective and coordinated response. the government recently released a cyber security strategy ( www. ag. gov. au",673,106,130,20,australia_2010_CounterterrorismWhitePaper.md,2025-01-28 18:55:23
141,"/ cybersecurity ), which details how the government is harnessing a broad range of resources to assist and protect government, business and individual australians in the online environment. although terrorists have not shown a strong interest in conducting cyber attacks, the government has implemented a range of measures to reduce the risk and consequences of any such attack on australia ’ s national interests. working in partnership with the private sector – particularly in the banking and finance, telecommunications and utilities sectors – the government, through cert australia ( www. cert. gov. au ), provides regular briefings on cyber security. cert australia will ensure that all australians and",708,108,130,20,australia_2010_CounterterrorismWhitePaper.md,2025-01-28 18:55:23
142,"australian businesses have access to information on how to better protect their information technology environments from cyber - based threats and vulnerabilities. information for all australian internet users, including the simple steps they can take to secure themselves online, is available at www. staysmartonline. gov. au. the government has also established a cyber security operations centre to improve awareness of cyber threats and to coordinate responses to cyber security incidents of national importance. the attorney - general, the hon robert mcclelland mp, launching the australian government cyber security strategy, november 2009. opposite page : cyber security operations centre, defence signals directorate, february 2010. - -",744,105,130,20,australia_2010_CounterterrorismWhitePaper.md,2025-01-28 18:55:23
143,"- - - hazardous materials of security concern terrorists have demonstrated an interest in acquiring chemical, biological, radiological or nuclear materials that could be used against australia or its interests. governments across australia are implementing practical measures, particularly those recommended in the council of australian governments review of hazardous materials, to limit opportunities for, and enhance detection of, illegal or unauthorised use of chemical, biological and radiological materials by terrorists. 5. 5 working with the science and innovation community australia has significant capabilities for science and innovation that can be applied to our counter ‑ terrorism efforts. we undertake world - leading national security science and innovation through publicly funded research agencies",816,112,130,20,australia_2010_CounterterrorismWhitePaper.md,2025-01-28 18:55:23
144,", universities, national security agencies and industry. it is important that we encourage relevant work that can build our counter ‑ terrorism and other national security capabilities. to this end, it is vital that we have effective methods to identify, share and apply relevant knowledge and technologies as they emerge. national security science and innovation the government has developed a national security science and innovation strategy ( nssis ) to enhance the application of science and innovation to national security, including our counter ‑ terrorism efforts. the nssis will build on the expertise and capabilities available within australian government agencies, universities and private sector organisations and ensure that australia ’ s national security science and innovation efforts",801,117,130,20,australia_2010_CounterterrorismWhitePaper.md,2025-01-28 18:55:23
145,are informed by a list of priorities that reflect the areas of greatest need. australia also works with a number of international partners through bilateral and multilateral arrangements to develop new technologies and to share technical knowledge and information which can enhance our counter - terrorism capabilities. the department of the prime minister and cabinet manages two of these agreements with the united states of america – a memorandum of understanding with the us department of defense technical support working group ( tswg ) and a treaty - level agreement administered with the us department of homeland security. these agreements provide australia with access to national security research and technology that is being developed by the united states. they have facilitated information,802,122,130,20,australia_2010_CounterterrorismWhitePaper.md,2025-01-28 18:55:23
146,"sharing in a number of important areas for counter - terrorism, including chemical, biological, radiological and nuclear materials, improvised explosive device components, and x - ray technologies that can help trace the origin of hazardous and illegal substances. - - - - - 5. 6 working with international partners australia operates in concert with a range of international partners in almost every aspect of our response to terrorism. these relationships are critical to our efforts to protect australia ’ s security, enhance security and stability internationally, and to identify and respond to the challenges of international terrorism. active diplomacy underwrites our international activities. the terrorist threat is dynamic and resilient and",751,111,130,20,australia_2010_CounterterrorismWhitePaper.md,2025-01-28 18:55:23
147,"australia will need to contribute to international counter - terrorism efforts for the foreseeable future. the interdependence of our economy and security on worldwide events cannot be ignored and we will need to continue to work with other nations to develop robust and effective counter - terrorism measures and create an international environment that is hostile to terrorism. australians are likely to continue to be more at risk of a terrorist attack overseas than at home. australians can be exposed to threats abroad as direct targets, as was the case in the 2002 bali bombings in indonesia, or more broadly as indirect targets overseas. the danger of this threat is recognised in the travel advisory system",714,116,130,20,australia_2010_CounterterrorismWhitePaper.md,2025-01-28 18:55:23
148,"for australians travelling overseas, managed by the department of foreign affairs and trade. security for major international sporting events is the responsibility of the host nation. however, australia ’ s security, law enforcement and intelligence agencies work closely with host nations to ensure security risks to australian athletes and spectators are minimised. the government provides accurate and up - to - date information about the risks australians might face attending such events through the department of foreign affairs and trade ’ s travel advice to assist them to make well - informed decisions about their attendance. government agencies also work closely with australian sporting bodies to provide information about security surrounding overseas events. 5. 6. 1",780,116,130,20,australia_2010_CounterterrorismWhitePaper.md,2025-01-28 18:55:23
149,"working within the international system australia works within the international system to establish a coherent international legal regime to reduce access by terrorist groups to funding and safe haven. australia plays an active role in building the united nations ’ unique capacity to condemn and confront terrorism in all its forms. the united nations security council has played a key role in global counter - terrorism by creating new obligations on member states to counter terrorism. these agreed norms are pivotal in creating a global environment inimical to terrorist groups. australia is committed to all united nations counter ‑ terrorism agreements. australia ’ s security can be affected directly by activities in regional countries, so we have a clear interest",773,120,130,20,australia_2010_CounterterrorismWhitePaper.md,2025-01-28 18:55:23
150,"in effective legal frameworks across our region that deal with terrorism. we work with other states in meeting their international obligations to counter terrorism and we assist our neighbours in developing and maintaining robust criminal laws and effective law enforcement and judicial processes. in addition to australia ’ s active work within the united nations, the department of foreign affairs and trade also manages australia ’ s counter - terrorism engagement through the group of 8 counter - terrorism action group. we are active in building practical region ‑ wide action through asia - pacific economic cooperation ( apec ), the association of south east asian nations ( asean ), the asean regional forum and the pacific islands forum.",746,119,130,20,australia_2010_CounterterrorismWhitePaper.md,2025-01-28 18:55:23
151,"building trust and reaching agreement on our objectives and action to counter - terrorism with other countries is vital to our interests. we have so far concluded a number of agreements specifically on combating international terrorism with key partners. these provide frameworks to develop a sense of common purpose, to share information and to set up practical counter ‑ terrorism activities. australia now has such agreements - - - - - with indonesia, the philippines, malaysia, cambodia, thailand, brunei, fiji, papua new guinea, east timor, india, pakistan, afghanistan, turkey and bangladesh. australia has an enduring strategic interest in our immediate region, and south - east asia remains of",701,108,130,20,australia_2010_CounterterrorismWhitePaper.md,2025-01-28 18:55:23
152,"particular importance to australia ’ s counter - terrorism efforts. it is a popular destination for australians on holiday, and many australians live in or have family ties to the region. australia has significant trade, investment and diplomatic interests in south - east asia and an abiding stake in its security. the region has been the site of previous terrorist attacks against australians and australian interests, and we have a clear interest in supporting a stable and secure immediate neighbourhood. 5. 6. 2 the ambassador for counter - terrorism the australian ambassador for counter - terrorism plays a key role in coordinating international policy cooperation for counter - terrorism. in recognition of the complexity of the",736,116,130,20,australia_2010_CounterterrorismWhitePaper.md,2025-01-28 18:55:23
153,"range of australia ’ s international counter - terrorism measures, and to improve policy coherence and effectiveness, the government has enhanced the role of the ambassador for counter ‑ terrorism. the ambassador for counter - terrorism the ambassador for counter - terrorism coordinates australia ’ s international counter - terrorism efforts by building international linkages and ensuring that the separate efforts of australian government agencies internationally are consistent, prioritised, well - focused and effective. the ambassador leads negotiation of australia ’ s counter - terrorism agreements with partner countries, and advises on international developments to ensure that australia has access to best international practice. the ambassador is a member of the national counter - terrorism",804,115,130,20,australia_2010_CounterterrorismWhitePaper.md,2025-01-28 18:55:23
154,"committee. from the 2010 – 11 budget, the ambassador, through the minister for foreign affairs, will recommend annually to the national security committee of cabinet a list of policy priorities for international counter ‑ terrorism engagement. this will increase coherence in the delivery of australia ’ s international counter - terrorism efforts. it will also inform the national security priorities which support the national security adviser ’ s consideration of a coordinated national security budget. 5. 6. 3 regional initiatives regional security forces have made considerable progress in countering local terrorist groups over recent years. however, the threat of terrorist attack in our region remains and australia must continue to support our regional partners",771,114,130,20,australia_2010_CounterterrorismWhitePaper.md,2025-01-28 18:55:23
155,"in their efforts to improve and sustain their counter ‑ terrorism capabilities. australia ’ s international counter - terrorism efforts have been and will continue to be focused mainly in south - east asia, and our regional partners and allies expect australia to make a leading contribution there. we will seek to build on the progress achieved in south ‑ east asia to make an appropriate contribution in other regions. the government has set out clearly the direct interests australia has in countering terrorism in south asia, particularly through operations in and assistance to afghanistan and pakistan. australia has a vital stake in ensuring that there are no safe - havens in south asia for the terrorist groups that have",729,120,130,20,australia_2010_CounterterrorismWhitePaper.md,2025-01-28 18:55:23
156,"targeted australia and other countries. the government has committed significant resources – diplomatic, military, law enforcement - - - - - and civilian efforts in governance, reconstruction and development – in afghanistan for this purpose, and we are continuing to examine ways to work with the government of pakistan and other nations to provide assistance to pakistan ’ s counter ‑ terrorism efforts. in their 12 november 2009 joint declaration on security cooperation, the prime ministers of australia and india committed to strengthening bilateral cooperation on counter - terrorism, including through the joint working group on counter - terrorism. 5. 6. 4 international law enforcement terrorism is a unique crime that requires an effective law enforcement response",774,117,130,20,australia_2010_CounterterrorismWhitePaper.md,2025-01-28 18:55:23
157,". the australian federal police ( afp ) works cooperatively with police services in our region to strengthen their counter ‑ terrorism capabilities, develop cohesive multilateral law enforcement strategies and maintain collaborative operational relationships. areas of focus include investigations, operations, intelligence, forensics, disaster victim identification, surveillance and response capabilities. collaboration between law enforcement agencies internationally provides a vital mechanism to share information, investigate and prevent terrorist offences and prosecute offenders. the afp works closely with regional counterparts, including through regional cooperation teams with the national police services in indonesia, thailand and the philippines, to make a valuable contribution to the success of the regional law enforcement response to",851,108,130,20,australia_2010_CounterterrorismWhitePaper.md,2025-01-28 18:55:23
158,"terrorism. the afp has also actively investigated allegations of terrorism offences both in australia and offshore as part of its preventive policing strategy. the jakarta centre for law enforcement cooperation as a leading international law enforcement agency, the afp is well placed to assist our partners to develop a suite of sophisticated law enforcement tools to aid their investigative capacities and to identify, locate and prosecute those responsible for terrorist offences. australia and indonesia have jointly developed the jakarta centre for law enforcement cooperation ( jclec ), which is a police training facility that has trained approximately 5000 regional law enforcement personnel through over 200 programs. the jclec is a successful example of",763,113,130,20,australia_2010_CounterterrorismWhitePaper.md,2025-01-28 18:55:23
159,"australia ’ s cooperation with a regional counterpart to enhance regional law enforcement capabilities, share information and develop personal and institutional networks between contributing agencies. the afp continues to be heavily involved in the development and delivery of the curriculum and a range of other australian government agencies also contribute advice and expertise on operational and strategic issues, including investment in supporting infrastructure. australia is also working with police services from other parts of the world, including afghanistan, iraq, pakistan and africa, to enhance cooperation and develop law enforcement capabilities in the areas of investigations and forensics. and the afp also operates an offshore exercise program which strengthens regional preparedness to respond to major",821,114,130,20,australia_2010_CounterterrorismWhitePaper.md,2025-01-28 18:55:23
160,"terrorist incidents. two exercises are conducted annually in countries within the asia - pacific region, and offer participants the opportunity to practise their response arrangements and identify opportunities for improvement. australia will continue to make a valuable contribution to the technical capabilities of regional law enforcement agencies. the afp has helped to establish regional bomb data centres in indonesia, the philippines, malaysia - - - - - and thailand to strengthen those police services ’ forensic capabilities to support bomb blast investigation, and has also helped to establish a dna laboratory in indonesia to enable large scale disaster victim identification and crime scene and post - blast investigations. australia also maintains a dedicated rapid deployment capability within",807,117,130,20,australia_2010_CounterterrorismWhitePaper.md,2025-01-28 18:55:23
161,"the afp to enable the deployment of forensic, technical, intelligence and investigative experts across the region in response to incidents or to undertake contingency planning for major events affecting australian interests. 5. 6. 5 supporting international legal frameworks robust international legal frameworks are an important part of the global response to terrorism and other security challenges. strengthened legal frameworks in our region serve our interests by promoting a stable, peaceful, and rules ‑ based region, and thereby supporting a collective response to terrorism. australia ’ s regional engagement on law and justice furthers these objectives and provides the framework for investigating and prosecuting terrorism and other serious crime, and",762,109,130,20,australia_2010_CounterterrorismWhitePaper.md,2025-01-28 18:55:23
162,"also underpins much of our broader operational engagement. the government ’ s efforts are aimed at building sound criminal legal infrastructure and governance frameworks, and contributing to strengthened regional stability and security. primarily through the attorney ‑ general ’ s department, australia is working with a number of countries to assist them to develop and implement effective terrorism laws consistent with key international standards. the government focuses particularly on assisting regional partners to implement legal frameworks that meet obligations contained in 16 united nations counter - terrorism instruments and associated united nations security council resolutions. the government also provides technical legal assistance to countries to develop anti - money laundering and terrorist financing arrangements, and supports countries in",861,118,130,20,australia_2010_CounterterrorismWhitePaper.md,2025-01-28 18:55:23
163,"their efforts to confiscate the financial proceeds of terrorism and other crime. australia is also working with a number of partner countries to develop their capacity to investigate, detain and prosecute the perpetrators of terrorism offences, particularly where evidence or suspects are beyond their borders. it is important that we assist other countries to develop the legal processes through which they can bring those responsible for terrorist acts to account. strengthening laws and legal practice in these countries, especially in the criminal and law enforcement fields, is crucial to redress this weakness and complements the capacity building activities of the afp. such work could also assist in the conduct of australian terrorism",743,112,130,20,australia_2010_CounterterrorismWhitePaper.md,2025-01-28 18:55:23
164,"investigations and prosecutions by providing or enhancing mutual assistance and extradition arrangements. 5. 6. 6 defence engagement australia has to be prepared to contribute as necessary to military operations that support international efforts to uphold global security and a rules - based international order. the australian defence force ( adf ) provides the government with a sophisticated military capability that can be deployed in response to a range of contingencies. the 2009 defence white paper defending australia in the asia pacific century : force 2030 set out the government ’ s vision for an adf that has the capabilities to protect australia and its interests. where necessary, these capabilities may be used to contribute",740,114,130,20,australia_2010_CounterterrorismWhitePaper.md,2025-01-28 18:55:23
165,"to international counter - terrorism efforts. australia ’ s counter ‑ terrorism efforts will continue to be enhanced by defence engagement and bilateral cooperation with other countries in our immediate region, particularly in south ‑ east and south asia. australia has a clear interest in assisting other countries to develop effective counter ‑ terrorism capabilities and the adf works closely with regional partners to provide expert advice and training to regional military forces, including in areas such as counter ‑ hijack and hostage recovery ; countering improvised explosive devices ; - - - - - consequence management ; and intelligence. given the important role of defence forces in maintaining national security, regional defence engagement also focuses on governance and",783,119,130,20,australia_2010_CounterterrorismWhitePaper.md,2025-01-28 18:55:23
166,"professionalism to strengthen regional counter ‑ terrorism structures and institutions. 5. 6. 7 afghanistan australia ’ s current commitment to afghanistan is an important part of international efforts to support the government of afghanistan to deny terrorists safe haven. most of the major anti - western terrorist attacks of recent years, including those with the most direct impact on australians, were perpetrated by terrorists who had links to, or had trained in, afghanistan or neighbouring pakistan. australian agencies, together with our international partners, are working cooperatively with afghan authorities through combined military, police and civilian efforts. we are committed to assisting afghan authorities to develop their capacity to provide security for",775,111,130,20,australia_2010_CounterterrorismWhitePaper.md,2025-01-28 18:55:23
167,"the people of afghanistan. the mentoring of the afghan national army by the adf and of the afghan national police by the afp, focused on oruzgan province, is an investment in afghanistan ’ s capacity to secure its own future. these security efforts are complemented by a range of other activities that aim to strengthen the capacity of afghan institutions to provide basic services and increase economic and other opportunities for the afghan people. australia also contributes to international efforts to counter afghanistan ’ s narcotics trade. australia ’ s efforts in afghanistan are complemented by increased engagement with pakistan, recognising that our efforts to achieve security and stability in afghanistan are",721,112,130,20,australia_2010_CounterterrorismWhitePaper.md,2025-01-28 18:55:23
168,"linked to both countries. the government has increased assistance to the government of pakistan through police and military training. we are also working cooperatively to develop ways to improve health, governance and economic opportunities for the pakistani people and to increase trade opportunities between pakistan and australia. through the appointment of a special envoy to afghanistan and pakistan, the government has reaffirmed its commitment to ensure that australia ’ s approach is coordinated and integrated into international efforts in afghanistan and the region. special air service regiment ( sasr ) members in a rigid hull inflatable boat ( rhib ) alongside hmas kanimbla conduct water operations as part of exercise mercury",740,111,130,20,australia_2010_CounterterrorismWhitePaper.md,2025-01-28 18:55:23
