chunk_id,text,char_length,word_count,token_count,section_index,source_file,processed_date
110,"- - - strengthening the border – biometric - based visas the government will invest $ 69 million over four years to introduce a biometric - based visa system for certain non - citizens. from 2010 – 11 the department of immigration and citizenship ( diac ) will collect biometrics ( fingerprints and facial images ) from visa applicants initially in ten overseas locations. this data will be matched against diac ’ s biometric database and against the biometric databases of our international partners. this initiative will reduce the risk of terrorists, criminals and other persons of concern entering australia undetected. this measure complements a number of other enhancements recently announced",698,111,130,20,australia_2010_CounterterrorismWhitePaper.md,2025-01-28 18:55:23
111,"following the review of aviation security, including the development of : an enhanced passenger assessment and clearance program, to enable customs and border protection to assess a larger number of passengers earlier and faster and to store, analyse and share relevant data with intelligence, border management and law enforcement agencies ; and a next generation border security initiative, to use advanced data analysis and risk profiling to better identify visa applicants who may present national security risks to our intelligence agencies. 5. 1. 1 identity and intent management the ability to confirm the identity of individuals travelling to australia is of vital importance to a range of australia ’ s security interests. individuals involved in terrorism or",768,117,130,20,australia_2010_CounterterrorismWhitePaper.md,2025-01-28 18:55:23
112,"serious organised crime have previously assumed false identities and used forged or fraudulently obtained documentation in an effort to circumvent border management arrangements. the government is strengthening australia ’ s borders by moving towards the collection of biometric information from non ‑ citizens as part of visa processing. this information will be checked against immigration and law enforcement biometric databases in australia and a number of partner countries overseas. determining the reasons for an individual ’ s travel to australia, before granting a visa or clearing the border, is also a key element of australia ’ s border management. a small proportion of potential visitors to australia attempt to deliberately misrepresent the intent",762,113,130,20,australia_2010_CounterterrorismWhitePaper.md,2025-01-28 18:55:23
113,"of their travel, and efforts to increase our ability to determine intent protect australia from the entry of individuals who may pose a threat to our security or other interests. the government is working on new and innovative technologies to better identify and prevent high risk travellers from entering australia, while smoothly facilitating the movement of genuine travellers. just as australia collaborates closely with international partners to identify foreign nationals of security concern who may seek to travel to australia, the government is also committed to preventing australian nationals from engaging in terrorism - related activity overseas. the government uses all available avenues to prevent people from australia who are of security concern from travelling internationally. this includes revoki",815,119,130,20,australia_2010_CounterterrorismWhitePaper.md,2025-01-28 18:55:23
114,"##ng or denying passports. over 40 australians have had their passports revoked or denied for reasons related to terrorism. - - - - - the border continuum movements across australia ’ s border are managed through a layered approach within the border continuum : overseas ; within our maritime zone ; at our physical border ; and within australia. activities at each layer contribute to the integrity of australia ’ s border, and australia ’ s border management processes seek to pursue complementary activities at each layer to strengthen our arrangements. preventive work overseas to mitigate risks at the point of origin is supported by our activities in australia ’ s maritime zone to detect or interdict risks en route",722,120,132,20,australia_2010_CounterterrorismWhitePaper.md,2025-01-28 18:55:23
115,"to, or departing from, australia. both types of activities support our physical border ( at airports and maritime ports ) before people or materials arrive in australia. robust processes at our points of entry and exit are similarly targeted to identify and prevent risks from entering or leaving australia, and are further supported by our domestic compliance and investigative regime. australian agencies also actively monitor imports and exports to prevent goods of security concern transiting our border. customs and border protection utilises an intelligence - led approach to guide cargo assessment, examination and seizure activities. this approach is supported by a strong legislative framework to enable seizure of materials that are connected, directly or indirectly",776,115,130,20,australia_2010_CounterterrorismWhitePaper.md,2025-01-28 18:55:23
116,", to terrorism - related activities, or where the material may prejudice australian or international security. 5. 1. 2 working ahead of the border to identify and manage risks the physical border is increasingly becoming a secondary layer for risk assessment and intervention. australian agencies work closely with international counterparts to ensure that risks to australia ’ s security, including from terrorism, are identified and preventive measures are implemented before arrival at the australian border. australian agencies are working cooperatively to push border clearance processes back as far as possible to the point of origin. this means that checking and screening commences well before people, cargo, vessels and aircraft cross australia ’ s physical",766,114,130,20,australia_2010_CounterterrorismWhitePaper.md,2025-01-28 18:55:23
117,"border. this approach strengthens australia ’ s border and limits interruptions to legitimate travel and trade. the department of immigration and citizenship ( diac ) manages the universal visa system and, in close cooperation with other agencies, particularly asio, establishes the identity and intent of travellers to australia, assesses their security risk, and confirms they have a valid authority to travel to and enter australia. customs and border protection is working to develop mutual recognition of border processes with other countries, including pre - export examination upon request and access to pre - departure and pre ‑ arrival data. this approach increases the security of movements to australia prior to their departure.",739,112,130,20,australia_2010_CounterterrorismWhitePaper.md,2025-01-28 18:55:23
118,"5. 1. 3 enhancing our ability to conduct traveller risk assessments increasing the level of certainty about the relative risk that travellers represent as early as possible in the traveller pathway, enables border protection, law enforcement and intelligence agencies to make risk - based interventions and resource deployment decisions. government agencies are working to enhance traveller risk assessment, which is crucial to address the forecast growth in traveller numbers, and current and emerging risks. underpinning traveller risk assessment is certainty about a person ’ s identity and their intentions when planning and undertaking travel to and from australia. - - - - - - - - - - while the current traveller risk assessment regime is sound",750,117,130,20,australia_2010_CounterterrorismWhitePaper.md,2025-01-28 18:55:23
119,", the approach can be better integrated. recent advances in technology will provide opportunities to fuse biometric and biographical information together with intelligence to improve risk assessment, watch list and intervention outcomes. along with the collection, storage and appropriate sharing of advance traveller information, this capability can be deployed earlier and faster to support the identification and assessment of potential persons of interest before a visa is granted, before boarding, en route, and at the physical border. this in turn better informs whole of government decision - making about the appropriate intervention response, and the point at which that intervention might take place. 5. 1. 4 engagement with and building the capacity of our",767,114,130,20,australia_2010_CounterterrorismWhitePaper.md,2025-01-28 18:55:23
120,"international partners an effective regional border management regime can play an important role in thwarting terrorists and disrupting the illicit movement of people, materials and finances across borders. international engagement also strengthens australia ’ s border by contributing to the development and implementation of security policy frameworks and border management processes overseas. this is particularly important given the interdependence of border management and transport security regimes worldwide. australian agencies are working closely with counterpart border management agencies in indonesia, the philippines, malaysia, thailand, vietnam and in the pacific to increase their capacity to identify and mitigate security risks, enhance border management processes – such as screening and detection capabilities",828,109,130,20,australia_2010_CounterterrorismWhitePaper.md,2025-01-28 18:55:23
121,"– and strengthen inter - agency cooperation across the region. australia is also helping to build the capacity of border and law enforcement officials in the region to detect, deter and prevent illicit financial flows across borders. diac is working bilaterally with indonesia ’ s direktorat jenderal imigrasi to strengthen borders through the border management capacity building partnership ( cekal ). this initiative facilitates the detection of people of immigration concern and assists in preventing people smuggling and irregular migration across the indonesian archipelago. diac ’ s capacity building programs are aimed at assisting countries in the region to strengthen their ability to curb illegal and irregular transborder movements",742,109,130,20,australia_2010_CounterterrorismWhitePaper.md,2025-01-28 18:55:23
122,". 5. 2 aviation security transport systems are inherently vulnerable to terrorist attack because they are open systems that gather large numbers of people at predictable times in predictable places. the attacks in the united states on 11 september 2001, in madrid in 2004, london in 2005, and the attempted attacks against transatlantic flights departing from the united kingdom in 2006 and in the united states on 25 december 2009, highlight the vulnerability of the transport system as both a target of, and potential weapon for, terrorist groups. australia ’ s transport security is based upon an intelligence - led, risk - based, preventive and layered approach to increase the security of travel and reduce the",715,116,130,20,australia_2010_CounterterrorismWhitePaper.md,2025-01-28 18:55:23
123,"risk of a terrorist attack. opposite page : customs and border protection marine unit, april 2008. - - - - - strengthening australia ’ s aviation security on christmas day 2009, nigerian national umar farouk abdulmutallab attempted to detonate an improvised explosive device onboard north west airlines flight 253 ( nw253 ). in response to this incident, the government will invest $ 200 million over four years to further enhance and strengthen australia ’ s aviation and border security regime. the government will assist industry to introduce a range of new screening technologies at airports, including : body scanners at international gateway airports ; next generation multi - view x - ray",695,112,130,20,australia_2010_CounterterrorismWhitePaper.md,2025-01-28 18:55:23
124,"machines ; bottle scanners capable of detecting liquid - based explosives ; and x - ray screening, and increased explosive trace detection technology for air cargo. the government is also : introducing aviation security screening programs at more regional airports ; increasing by 50 % the number of firearms and explosives detector dogs at international airports ; and expanding the last ports of call program to improve the security of international flights travelling to australia. given australia ’ s dependence on international and long distance domestic aviation and the interest terrorist groups have shown in targeting this form of transport, our transport security efforts are closely integrated with our border management arrangements. border agencies, the afp and state and territory",794,120,130,20,australia_2010_CounterterrorismWhitePaper.md,2025-01-28 18:55:23
125,"police work closely together, and with airport operators, to deter or respond to acts of terrorism in the aviation environment. the office of transport security ( ots ) is responsible for preventive transport security policy and planning, and plays a leading role in the national provision of best practice transport security risk and mitigation advice to the owners and operators of transport services through the government ’ s critical infrastructure protection ( cip ) program. in particular, ots works closely with border protection, law enforcement and emergency response agencies to ensure a coordinated approach to mitigating the risk posed to transport systems by terrorism. furthermore, the commonwealth is responsible for prevent",740,111,130,20,australia_2010_CounterterrorismWhitePaper.md,2025-01-28 18:55:23
126,"##ive security measures in the offshore maritime domain, particularly in relation to the prevention of and response to terrorism - related matters. commonwealth cooperation with the business community is also a critical part of the transport ( aviation and maritime ) security regime. this engagement is undertaken in coordination with relevant state and territory agencies. industry is responsible for its own preventive security measures and bears the cost of these measures. industry participants best understand their local environment and operating circumstances and are well placed to make the most effective decisions regarding sustainable mitigations and security outcomes to protect the people and assets upon which it depends. through effective engagement with industry, ots not only supports business",811,117,133,20,australia_2010_CounterterrorismWhitePaper.md,2025-01-28 18:55:23
127,"growth and viability within the transport sector but works towards strengthening domestic security arrangements and addressing areas of vulnerability. - - - - - layers of aviation security australia ’ s approach to aviation security relies on activities across the following complementary layers : intelligence to identify threats ; effective and targeted mitigation strategies at last ports of call ( the point of departure ) to detect and interdict risks before they depart for australia ; law enforcement measures ; security measures at airports, including preventive physical and identity security measures and access control ; passenger, baggage and cargo screening ; and aircraft security. this approach provides flexibility within our aviation security efforts to adjust the layers as necessary",801,119,130,20,australia_2010_CounterterrorismWhitePaper.md,2025-01-28 18:55:23
128,"in response to changes in the nature of threat, technological advances and international arrangements. australia will continue to refine its approach to transport security, both domestically and internationally, to take into account anticipated long - term growth in the aviation and maritime transport sector and changes in the nature of the terrorist threat. as part of this approach, regular reviews of transport security are conducted. the government has recently reviewed its aviation security settings within the context of the national aviation policy statement, and is separately reviewing the provisions of the maritime security identification card scheme. the purpose of these reviews is to ensure that australia ’ s border and transport security arrangements continue to be appropriate,",797,117,130,20,australia_2010_CounterterrorismWhitePaper.md,2025-01-28 18:55:23
129,"comprehensive and cost - effective. 5. 3 a cooperative national approach cooperative federalism is a vital part of australia ’ s counter - terrorism strategy. terrorism often presents cross - jurisdictional challenges. cooperation between the commonwealth and the states and territories ensures robust national capabilities to prevent terrorist attacks from occurring, to prosecute those who seek to conduct them and to recover in the event of an attack. australia ’ s domestic response to terrorism hinges on the national counter ‑ terrorism arrangements which outline the complementary roles of the commonwealth and the states and territories. coordination between jurisdictions was formalised in 2002 through the inter ‑ governmental agreement on australia ’ s national counter - terrorism",792,117,130,20,australia_2010_CounterterrorismWhitePaper.md,2025-01-28 18:55:23
130,"arrangements. there are inherent strengths in australia ’ s federal system. all jurisdictions recognise that we must work together to protect australia and its people. across the jurisdictions our agencies are committed to continuous improvement and work in partnership to identify opportunities to further develop our counter - terrorism arrangements, and allocate resources strategically to deliver comprehensive national capabilities. the key to making these national arrangements and processes work are the relationships between the policy areas, law enforcement and intelligence across all jurisdictions and the ability to share information. australia is well served by cooperative and coordinated counter ‑ terrorism arrangements that utilise the strengths of all governments. - - - - - the national counter",813,116,130,20,australia_2010_CounterterrorismWhitePaper.md,2025-01-28 18:55:23
131,- terrorism committee the national counter - terrorism committee ( nctc ) was established in 2002 and reflects australia ’ s national approach. it facilitates cooperation between the australian government and state and territory governments by meeting twice a year to discuss matters regarding australia ’ s counter ‑ terrorism strategy. the objectives of the nctc are to contribute to the security of the australian community by : maintaining the national counter - terrorism plan and associated documentation ; providing expert strategic and policy advice to heads of government and other relevant ministers ; coordinating an effective national counter - terrorism capability ; maintaining effective arrangements for the sharing of relevant intelligence and information between all relevant agencies and jurisdictions ; and providing advice,842,124,130,20,australia_2010_CounterterrorismWhitePaper.md,2025-01-28 18:55:23
132,"in relation to the administration of the special fund to maintain and develop national capabilities, administered by the australian government on the basis of advice from the nctc. specific policies adopted by individual jurisdictions will sometimes vary to suit local circumstances, but the nctc, which comprises senior officials from all australian governments, provides the mechanism to agree common standards, share information on best practice models and contest policy development to ensure that our policy and operational responses are robust and effective. all australian governments are responsible for protecting their communities, infrastructure and assets and the interests of australia as a whole against terrorism. australia ’ s national approach to counter ‑ terrorism is coordinated through a comprehensive",822,117,130,20,australia_2010_CounterterrorismWhitePaper.md,2025-01-28 18:55:23
133,"set of arrangements. 5. 3. 1 national counter - terrorism arrangements the national counter ‑ terrorism plan sets out arrangements and responsibilities for dealing with terrorism as agreed by the commonwealth and the states and territories. the plan outlines effective national arrangements to prevent, investigate, respond to, and recover from a terrorist incident ; a comprehensive and complementary legal regime ; and robust cooperation, coordination and consultation between all relevant agencies and jurisdictions. the plan is reviewed by the nctc at least every three years to ensure that the arrangements remain effective. within the plan, the australian government has a range of responsibilities including : a central role in the management of intelligence ; setting national",784,116,130,20,australia_2010_CounterterrorismWhitePaper.md,2025-01-28 18:55:23
134,"counter - terrorism alert levels ; declaring – in consultation with affected jurisdictions – a national terrorist situation ; coordinating the maintenance of national counter ‑ terrorism capabilities, plans and legislation ; and providing support and assistance to a jurisdiction affected by a terrorist incident. - - - - - the states and territories play a critical role in australia ’ s domestic security and have developed policies and dedicated resources to prevent, respond to and recover from a terrorist incident. australia ’ s national counter - terrorism arrangements recognise that most emergencies in australia are dealt with by the affected state or territory, with additional support provided by the australian government as necessary. under the national arrangements, states and territories",804,121,130,20,australia_2010_CounterterrorismWhitePaper.md,2025-01-28 18:55:23
135,"have primary operational responsibility for responding to terrorist incidents within their jurisdictions ; the maintenance of local counter ‑ terrorism capabilities, plans and legislation. they also work jointly with commonwealth agencies on preventive strategies and operational responses to terrorist threats. in the event of a terrorist attack, the operational response would be controlled by the jurisdiction in which the attack occurred, ensuring that resources could be deployed quickly and appropriately for local circumstance. as in the case of a major natural disaster, the commonwealth would work closely with the affected jurisdiction to provide additional support as necessary, or take a more active role in the event that a national terrorist situation is declared. in all cases the underlying",806,118,130,20,australia_2010_CounterterrorismWhitePaper.md,2025-01-28 18:55:23
136,"principle is close cooperation between governments. the commonwealth and the states and territories routinely conduct multi - jurisdictional exercises to enhance australia ’ s national counter - terrorism and emergency management capabilities. these exercises test national and jurisdictional counter - terrorism arrangements with a focus on consequence management, including the simulation of large - scale and multiple - site mass casualty incidents. 5. 4 protecting infrastructure the business community plays an important role in protecting australia ’ s infrastructure from terrorism. australian governments work with the business community to pursue common security interests, while acknowledging separate public and private responsibilities. as the owners and operators in a range of areas that are potentially vulnerable to exploitation or attack",854,118,130,20,australia_2010_CounterterrorismWhitePaper.md,2025-01-28 18:55:23
137,"by terrorist groups – such as the transport sector, financial markets and utilities – the business community has a key role to play in australia ’ s response to terrorism. we know from experience that mass transport systems, places where people gather in large numbers, and critical infrastructure have been the target of terrorist attack overseas, and it is likely that these will remain attractive targets. critical infrastructure is a complex network of physical facilities, supply chains and information technology, which is owned and operated by the private sector and commonwealth and state and territory governments. australian governments work with the business community to ensure that adequate levels of protective security are in place at critical infrastructure, based",780,118,130,20,australia_2010_CounterterrorismWhitePaper.md,2025-01-28 18:55:23
138,"on assessed risk. this also involves ensuring minimal single points of failure, and developing rapid, tested recovery arrangements. these arrangements are the subject of ongoing review of their effectiveness. the critical infrastructure protection program ensures that australia ’ s critical infrastructure will be better protected from, and be better able to continue to operate in the face of, all threats and hazards, including terrorism. work is underway to broaden this focus to include greater consideration of the resilience of our essential services. the trusted information sharing network for critical infrastructure protection provides a valuable mechanism for the government and business to collaborate and identify solutions to common security challenges. another key measure is the",795,114,130,20,australia_2010_CounterterrorismWhitePaper.md,2025-01-28 18:55:23
