chunk_id,text,char_length,word_count,token_count,section_index,source_file,processed_date
1,- - - - - - - - - -,19,10,12,0,czechrepublic_2015_LongTermPerspectiveOnDefense.md,2025-03-25 11:21:26
2,# # # # # # ministry of defence of the czech republic,53,13,15,1,czechrepublic_2015_LongTermPerspectiveOnDefense.md,2025-03-25 11:21:26
3,# the long term perspective for defence 2030,44,8,11,2,czechrepublic_2015_LongTermPerspectiveOnDefense.md,2025-03-25 11:21:26
4,# # # # # # prague 2015 - - - - - - - - - -,43,18,20,3,czechrepublic_2015_LongTermPerspectiveOnDefense.md,2025-03-25 11:21:26
5,# # # contents,14,4,6,4,czechrepublic_2015_LongTermPerspectiveOnDefense.md,2025-03-25 11:21:26
6,# # # # # # i. introduction...................................................................... ii. background..............................................,158,10,130,5,czechrepublic_2015_LongTermPerspectiveOnDefense.md,2025-03-25 11:21:26
7,.......................... iii. future security and operational environment............................ iv. engagement in future operations............................................. v. implications of military capability development.........,244,18,130,5,czechrepublic_2015_LongTermPerspectiveOnDefense.md,2025-03-25 11:21:26
8,................ 1 vi. prerequisites for the achievement of military capabilities............ 1 vii. conclusions....................................................................... 1 list of abbreviations.......,214,17,130,5,czechrepublic_2015_LongTermPerspectiveOnDefense.md,2025-03-25 11:21:26
9,............................................................ 20 - - - - -,73,7,68,5,czechrepublic_2015_LongTermPerspectiveOnDefense.md,2025-03-25 11:21:26
10,"# # # i. introduction “ the long term perspective for defence 2030 ” represents the framework for fulfilling the political and military ambitions of the czech republic. it serves as a guideline for defence planning, particularly in developing five - year medium term plans. based on an analysis of trends in the strategic environment, it outlines the basic direction for military capabilities development and provides guidance for the “ concept of the czech armed forces development 2025 ”, and other conceptual documents. the long term perspective stems from the legal system and the strategic policy documents of the czech republic, and takes into account the principles of nato and eu security policies and military documents.",729,116,130,6,czechrepublic_2015_LongTermPerspectiveOnDefense.md,2025-03-25 11:21:26
11,# # # # # # 4 - - - - -,23,12,14,7,czechrepublic_2015_LongTermPerspectiveOnDefense.md,2025-03-25 11:21:26
12,"# # # ii. background defence comprises three pillars : ( 1 ) responsible approach by the state to the defence of the czech republic and commitments to allies. ( 2 ) capable armed forces. ( 3 ) national defence as a civic duty. it is supported by czech foreign policy, the economy and the willingness of the citizens to defend their country. the government of the czech republic ’ s approach to safeguarding defence is stated in : ( a ) the defence strategy, which is based on the security strategy of the czech republic ; ( b ) the decisions of the government of the czech republic proposed by the minister of defence on the structure and personnel",648,120,130,8,czechrepublic_2015_LongTermPerspectiveOnDefense.md,2025-03-25 11:21:26
13,"strength of the czech armed forces ( adopted in 2007 and 2012 ). these documents define czech political and military ambitions, and set out the political assignments for the armed forces of the czech republic in order to ensure their development, obligations and tasks : n in the event of an armed conflict of a scale that would threaten czech sovereignty, its territorial integrity and vital interests, all forces and assets of the czech armed forces, including liability to conscription, will be employed ; n for collective defence under article 5 of the north atlantic treaty, if its territory is not directly endangered, the czech republic will provide, if necessary, land and air forces assigned for this",709,117,130,8,czechrepublic_2015_LongTermPerspectiveOnDefense.md,2025-03-25 11:21:26
14,"purpose to nato, whose core comprises a brigade task force on a mechanized brigade basis ; n for international operations intended to cope with threats and crises, the czech republic will, depending on the situation, be able to concurrently or progressively assign : ( a ) a battalion task force, ( b ) a land company task force ( or air force equivalent ), ( c ) forces up to battalion level assigned for standby duty in the nato response force or eu battle group, ( d ) small specialist or expert groups, including special forces task teams ; n the armed forces of the czech republic can deploy in all climatic zones except the arctic areas. in",646,118,130,8,czechrepublic_2015_LongTermPerspectiveOnDefense.md,2025-03-25 11:21:26
15,"relation to these duties, the czech armed forces should have up to 27 thousand military servicemen. personnel strength was temporarily decreased to 22 thousand military servicemen during the period 2013 - 15, while the tasks remained unchanged.",244,37,43,8,czechrepublic_2015_LongTermPerspectiveOnDefense.md,2025-03-25 11:21:26
16,# # # # # # 5 - - - - -,23,12,14,9,czechrepublic_2015_LongTermPerspectiveOnDefense.md,2025-03-25 11:21:26
17,"# # # iii. future security and operational environment over the next 20 years, the czech republic, as well as nato and the eu, will be facing serious persistent threats. changes will be dynamic and can be expected in all crucial aspects of security with complex and interconnected trends.",288,49,58,10,czechrepublic_2015_LongTermPerspectiveOnDefense.md,2025-03-25 11:21:26
18,"# # # # # # predominant trends n * * the distribution of political power and economic and military potential around the world * * * * will be more diversified. this will cause instability in the form of an increased number of conflicts * * and a direct military threat to the allies. the warning time for major conventional conflicts, even in the proximity of nato and eu states, has decreased to weeks or months. n * * at the same time, globalization will continue. deepening of differences between international * * players will have a negative impact. the misuse of information technologies and the media will increasingly contribute to the sudden shift in the perception",674,118,130,11,czechrepublic_2015_LongTermPerspectiveOnDefense.md,2025-03-25 11:21:26
19,"of events in terms of time and space and, therefore, will also lead to the spread of instability. the intentional misuse of the media for information warfare will grow significantly. interconnected economies and financial systems will also simplify and accelerate the “ transfer ” of the symptoms of crises to more distant countries. increasing mobility, together with a high population density in some areas, will also expedite the spread of infectious diseases which can then lead to pandemic situations. n * * defence expenditures will grow in non - european regions and in the russian federation. * * this will enable a more intensive use of modern military technologies. when military",689,111,130,11,czechrepublic_2015_LongTermPerspectiveOnDefense.md,2025-03-25 11:21:26
20,"force are used as a political tool, we can expect increased aggressive ambitions from regional superpowers. n besides conventional military threats, there will be an increase in enforcing these interests * * by a combination of military and non - military means, including the use of non - state players * * ( hybrid warfare ). utilizing the service of militants without insignia and paramilitary militias will become a more serious problem. n * * there will be an increase in the influence and autonomy of non - state players in the inter * * * * national arena, such as, private security companies, the economic power of private economic * * and financial entities, terrorist",677,116,130,11,czechrepublic_2015_LongTermPerspectiveOnDefense.md,2025-03-25 11:21:26
21,"groups, organized crime and paramilitary groups. n * * weak and unstable governance, failed states, the spreading of extremism, the “ foreign * * * * fighter ” phenomenon, and ethnic and religious conflicts will lead to regional crises with * * the potential of having a negative impact on global security and stability.",320,54,65,11,czechrepublic_2015_LongTermPerspectiveOnDefense.md,2025-03-25 11:21:26
22,"# # # # # # 6 - - - - - n * * the demand for strategic resources, water and sources of energy, especially for fossil fuel, * * * * will grow. an effort to get privileged assured access to these resources and to gain control * * over transport routes will increase. europe will compete for resources from the middle east, the russian federation, africa, central asia, and southeast asia including china. a major and persistent decrease of supplies from the russian federation could be expected in the medium term. a shortage of resources in the world market due to natural, technical, economic or political reasons, and / or conflicts",633,114,130,12,czechrepublic_2015_LongTermPerspectiveOnDefense.md,2025-03-25 11:21:26
23,"cannot be ruled out either. n * * dynamic development of science and technologies will lead to higher availability * * * * of advanced technologies. the availability of information, nanotechnology and biotechnology, * * coupled with easier production and automation, will contribute to enhancing the capabilities of potential enemies. the importance of directed energy weapons, remote controlled and autonomous weapon systems and so - called counter - intervention systems, e. g. missile and air defence systems, ballistic missile defence systems etc., will grow. proliferation of weapons of mass destruction and missile technologies will continue. the number of countries possessing these weapons and means of delivery will increase. n *",738,110,130,12,czechrepublic_2015_LongTermPerspectiveOnDefense.md,2025-03-25 11:21:26
24,"* society will become increasingly dependent on information technologies. cyber - attacks * * could significantly threaten the functionality of states in all areas, including the armed forces. a number of state and non - state entities are currently building offensive cyber capabilities to target the electronic systems of state and non - state institutions, as well as the critical information infrastructure. n * * we will be confronted with an unbalanced demographic growth. a boost of the world ’ s * * population will occur, especially in developing countries, and will be accompanied by rapid urbanization. an increased proportion of young, unemployed and the disillusioned will pose a threat to stability",712,112,130,12,czechrepublic_2015_LongTermPerspectiveOnDefense.md,2025-03-25 11:21:26
25,", and populations in developed countries will continue to age. n * * a threat will be posed by waves of migration due to various factors such as, conflicts, * * insufficient access to resources and food, population explosion, climate changes, etc. n * * habitat destruction and environmental changes can potentially lead to a worsened security * * situation.",358,60,70,12,czechrepublic_2015_LongTermPerspectiveOnDefense.md,2025-03-25 11:21:26
26,"# # # # # # the nature of a future security environment will require : – rapid force projection, including strategic distances ; – ability to conduct major military operations on corps level ; – flexibility, enhanced force readiness and mobility ; – international cooperation, particularly greater nato and eu responsiveness ; – comprehensive approach – the capability of all military branches and services to conduct joint operations, as well as combined operations with the involvement of intelligence, military and civilian elements, both in the traditional battlefield, and the cyberspace and media environment.",615,94,106,13,czechrepublic_2015_LongTermPerspectiveOnDefense.md,2025-03-25 11:21:26
27,# # # # # # 7 - - - - -,23,12,14,14,czechrepublic_2015_LongTermPerspectiveOnDefense.md,2025-03-25 11:21:26
28,"# # # iv. engagement in future operations the tasks of the czech armed forces are set out in the act no. 219 / 1999 coll., on the czech armed forces. furthermore, they stemmed from nato and eu membership. the primary objective of the czech armed forces is to be prepared to defend czech territory in the context of the collective defence of nato and the eu common security and defence policy, as well as supporting civilian authorities on the territory of the czech republic. at the same time, it is necessary to ensure efficient air defence as part of nato ’ s integrated air and missile defence system ( natinamds ), including",628,113,130,15,czechrepublic_2015_LongTermPerspectiveOnDefense.md,2025-03-25 11:21:26
29,"the national air defence system using their own supersonic capability. the assignment of the czech armed forces to nato and eu rapid response forces will prove a valuable method of implementing the czech republic ’ s international commitments, as well as an efficient form of forces training. furthermore, the czech armed forces will contribute to nato ’ s collective defence capabilities with increased participation in air policing and exercises. the czech armed forces could also be engaged in international operations to protect security interests and manage crises. they can participate in conflict prevention and assist other countries in building their defence capabilities. in principle, these operations would be in the form of peace enforcement, peace support or peacekeeping",785,118,130,15,czechrepublic_2015_LongTermPerspectiveOnDefense.md,2025-03-25 11:21:26
30,"operations, and humanitarian and rescue missions. as well as cooperating with and supporting education and training, these activities may also include support for partners ’ efforts in transforming and developing their defence sector. units and / or individuals can be deployed as part of an international effort, or on a bilateral basis. these activities can take place both on the territory of the host nation, on the territory of third countries, or on the territory of the czech republic. the most likely and frequent example of the employment of the czech armed forces in the next twenty years will be their participation in international operations outside the czech republic. the deployment of the czech armed forces will",728,117,130,15,czechrepublic_2015_LongTermPerspectiveOnDefense.md,2025-03-25 11:21:26
31,"be primarily based on task forces composed of organic units complemented, according to mission requirements, by specific capability modules, particularly by combat support and combat service support elements. in most circumstances, the czech armed forces will be deployed as part of a broader international effort, particularly nato, eu and the un, and ad hoc coalitions in compliance with international law principles. these operations could also be of a long - term nature. in accordance with the czech constitution, the participation of the czech armed forces in these operations should be bound by an adequate international and national mandate. there might also be purely national ( or as part of ad hoc coalitions )",721,113,130,15,czechrepublic_2015_LongTermPerspectiveOnDefense.md,2025-03-25 11:21:26
32,"operations aimed at evacuating and rescuing citizens, or evacuating czech diplomatic missions from a crisis area.",113,16,24,15,czechrepublic_2015_LongTermPerspectiveOnDefense.md,2025-03-25 11:21:26
33,"# # # # # # 8 - - - - - article 5 and the crisis management operations in which the czech armed forces could be deployed will lead to increased requirements to guarantee air superiority and close air support capabilities, fire superiority, maximum force protection, informational superiority, real - time battle space situational awareness, force flexibility and mobility, the joint action of all services deployed, individual specialist capabilities and the provision of logistic support over long distances.",509,79,92,16,czechrepublic_2015_LongTermPerspectiveOnDefense.md,2025-03-25 11:21:26
34,# # # # # # 9 - - - - -,23,12,14,17,czechrepublic_2015_LongTermPerspectiveOnDefense.md,2025-03-25 11:21:26
35,"# # # v. implications of military capability development based on the predictions of the security environment and the types of operations assumed, it is apparent that the requirements for the military capabilities of the czech republic will continue to grow in the future even if national political - military ambitions remains at the current level.",349,56,61,18,czechrepublic_2015_LongTermPerspectiveOnDefense.md,2025-03-25 11:21:26
36,"# # # # # # basic principles of the czech armed forces development the czech republic will continue to maintain the foundation of a balanced czech armed forces that will be capable of building up and reinforcing its capabilities in the event of a worsening security environment. in a crisis situation, before attaining wartime force structure, the peacetime structure must be able to strengthen its forces, as well as establishing conditions for the creation of a division - level command. it will be necessary to permanently maintain and increase the technological level of the czech armed forces and to increase personnel preparedness. therefore, the defence education system of military personnel and citizens will be enhanced",729,116,130,19,czechrepublic_2015_LongTermPerspectiveOnDefense.md,2025-03-25 11:21:26
37,". to provide flexibility in using armed forces personnel, a system of active reserve will be implemented. if necessary, a mobilization scheme will be employed to augment the czech armed forces on the basis of liability to conscription. a material augmentation system will be regularly revised depending on changes in the security environment. the czech armed forces must be ready to perform its tasks across the full spectrum of military operations and intensity scale as part of the allied efforts. emphasis will be put on ensuring the capability of a rapid and flexible response to unexpected events. to this end, the system for providing materiel support and supply of directly accessible operational stocks will be adapted",726,116,130,19,czechrepublic_2015_LongTermPerspectiveOnDefense.md,2025-03-25 11:21:26
38,"accordingly. priority will be given to the necessary level of stocks required in compliance with nato standards, including live and training ammunition. the principle of force modularity will be used to enable the formation of task forces for specific operations on the basis of organic units ( including their rotations ). a single set of forces will continue to be used for conducting tasks on the territory of the czech republic, as well as abroad for missions and operations led by nato, the eu or other international organizations the czech republic is a member of. the forces deployed outside the czech territory will routinely be part of a multinational formation. forces will be trained for deployment on the",716,118,130,19,czechrepublic_2015_LongTermPerspectiveOnDefense.md,2025-03-25 11:21:26
39,"basis of the “ jointness ” principle. the czech armed forces must be able to perform their tasks without geographical restrictions, except the arctic areas and in unusual environments. they must be prepared to operate in extremely varied cultural environments, including ethnicity, language and religion. they must be * * mobile, * *",333,53,63,19,czechrepublic_2015_LongTermPerspectiveOnDefense.md,2025-03-25 11:21:26
40,"# # # # # # 10 - - - - - * * highly efficient and accurate, resilient, deployable, sustainable, flexible and interoperable, * * * * be provided with relevant intelligence, surveillance, target acquisition, reconnaissance * * * * ( istar ), and fire support. in the development of capabilities, an emphasis will be put on the real * * time coverage of the operational area and on the shortest possible reaction time of the command, control, communication and computers, intelligence, and surveillance and reconnaissance ( c4isr ) systems. priority will be given to the development of capabilities of the deploy",609,103,130,20,czechrepublic_2015_LongTermPerspectiveOnDefense.md,2025-03-25 11:21:26
41,"##able forces assigned for standby, both within nato and the eu ( nato response force ( nrf ), natinamds and eu battle group ), aimed at achieving the corresponding interoperability with allied forces. staff affiliations of units and individuals of international commands within nato, the eu and multilateral cooperation will be used effectively to that end. enhancement of these capabilities will be supported by the implementation of modernization projects aimed at meeting nato and eu requirements. in order to enhance operational effectiveness, deployed units and staffs will actively use the ex perience gained from previous operations ( lessons learned ) and expert consultations through the reach back [",710,108,132,20,czechrepublic_2015_LongTermPerspectiveOnDefense.md,2025-03-25 11:21:26
42,"1 ] systems. the czech armed forces must be able to operate and sustain multiple * * concurrent operations * * at a national or international level, including strategic distances. the czech armed forces, in cooperation with armed forces of other countries, and with commercial organizations, will * * sustain its deployed capabilities related to operations for a given period. * * the stocks of materiel and equipment will be tailored according to the units ’ allocation and their rotation needs, by using outsourcing ( depending agreed limits ). in respect of military capabilities development, an emphasis will be placed on the preparedness * * for warfare in urban areas and their immediate vicinity",702,114,130,20,czechrepublic_2015_LongTermPerspectiveOnDefense.md,2025-03-25 11:21:26
43,". it requires the provision of adequate force * * protection, reconnaissance capabilities, precise engagement ( lethal and non - lethal force in order to avoid collateral damage ), and relevant training. the czech armed forces will develop multipurpose military capabilities, with the objective of being able of to re - focus rapidly between different operations. at the same time, they will further develop * * specializations ( niche capabilities ) important for deployment in operations, adding considerable * * value to the national commitments to nato. this is particularly relevant in the protection against weapons of mass destruction and passive surveillance systems in the istar domain. the capabilities for the support of civil",737,114,130,20,czechrepublic_2015_LongTermPerspectiveOnDefense.md,2025-03-25 11:21:26
44,"authorities in a national crisis situation will be maintained at the necessary level. emphasis will be placed on supporting the integrated rescue system functions during search - and - rescue activities and consequence management functions. the czech armed forces will be prepared to protect critical infrastructure, reinforce the police of the czech republic in its efforts to preserve internal order and security including border security. the active reserve force can also be called upon to perform these tasks. * * 1 * * a reach back information support system is a capability which provides the commander and the staff of operationally deployed units with timely and reliable expert information from external sources.",722,112,121,20,czechrepublic_2015_LongTermPerspectiveOnDefense.md,2025-03-25 11:21:26
45,"# # # # # # 11 - - - - - the ministry of defence will further coordinate the development of * * the state defence system, * * as part of the state security system, with state administrations and municipal authorities. a close link to the alliance will be maintained by using the already established processes of defence and operational planning, including the nato crisis response system ( ncrs ). in order to sustain the mobilization capability of the czech armed forces, the following must be ensured : planning and implementation measures concerning the operational preparation of the state territory ; mobilization preparations, including the defence education system, material security of mobilization using the system of economic",735,119,130,21,czechrepublic_2015_LongTermPerspectiveOnDefense.md,2025-03-25 11:21:26
46,measures for crisis situations ; mobilization supplies ; material resources and the transfer of military material from units undergoing modernization. an analysis of trends in the security environment and their impacts on the czech republic ’ s defence status will be conducted as part of annual review of the czech national defence.,333,52,56,21,czechrepublic_2015_LongTermPerspectiveOnDefense.md,2025-03-25 11:21:26
47,"# # # # # # key capabilities of the czech armed forces the czech armed forces will be developed within the framework of seven key capability areas : prepare, project, engage, sustain, consult, command and control, and protect and inform [ 2 ]. interoperability as the common denominator of all key capabilities will grow in significance. these capabilities are essential for the accomplishment of the most important tasks and com mitments to nato, and they will continue to be the determining basis for the build - up of all the components of the czech armed forces.",566,97,114,22,czechrepublic_2015_LongTermPerspectiveOnDefense.md,2025-03-25 11:21:26
48,# # # # # basic trends in the development of the czech armed forces,67,15,17,23,czechrepublic_2015_LongTermPerspectiveOnDefense.md,2025-03-25 11:21:26
