chunk_id,text,char_length,word_count,token_count,section_index,source_file,processed_date
49,"# # # # # # military intelligence in order to ensure the early identification of strategic threats to the czech republic, the capabilities of the * * military intelligence will be developed in cooperation with other intelligence services * * in order to allow sufficient time for the reinforcement and further build - up of defence capacities. at the same time, the strategic warning and risk and crisis response system will be developed in connection with nato and the eu [ 3 ]. an emphasis will be put on the development of source and analytical capabilities and timely reporting to the authorized recipients. this will require investment in technology in all intelligence - related fields. * * 2 * * key",706,122,130,24,czechrepublic_2015_LongTermPerspectiveOnDefense.md,2025-03-25 11:21:26
50,"capabilities ( former essential operational capabilities ) are defined under the title “ main capability areas ” in mc 400 / 3 art. 67 of mc guidance on the military implementation of nato ’ s strategic concept. * * 3 * * ncrs, eu early warning system.",252,47,54,24,czechrepublic_2015_LongTermPerspectiveOnDefense.md,2025-03-25 11:21:26
51,# # # # # # 12 - - - - -,24,12,14,25,czechrepublic_2015_LongTermPerspectiveOnDefense.md,2025-03-25 11:21:26
52,"# # # # # # command structure and command and control * * the command structure of the czech armed forces will be developed according to its ambitions * * within the scope necessary to provide joint, enduring and reliable command and control in operations, including multinational operations, with concurrent efficient fulfilment of day - to - day tasks within the czech republic. therefore, commanders and staff will be sent to operate in international environments within the nato command structure and the nato force structure, primarily as part of an affiliation effort. this allows for the acquirement of skills that cannot be gained within the national system due to the absence of a command structure higher",714,117,130,26,czechrepublic_2015_LongTermPerspectiveOnDefense.md,2025-03-25 11:21:26
53,"than brigade level. besides the peacetime system of command and control, the czech armed forces will have a * * command and control system for operations with rapid build - up capability conducted * * inside / or outside the territory of the czech republic. the deployable system of command and control will be built up to mechanized brigade level. as a matter of priority, a modern and flexible system using state - of - the - art technology will be developed. the system will enable communication with other players in the area of operations and coordination of joint activities. national logistic, administrative * * and operational processes of command and control will be compatible with those",698,117,130,26,czechrepublic_2015_LongTermPerspectiveOnDefense.md,2025-03-25 11:21:26
54,of nato and the eu. * * the network enabled capability ( nec ) concept will be implemented into the czech armed forces.,119,23,27,26,czechrepublic_2015_LongTermPerspectiveOnDefense.md,2025-03-25 11:21:26
55,"# # # # # # cyber defence information security, intelligence and command and control ( c2 ) systems will be ensured by an intensive build - up of * * cyber defence capabilities ( as part of cyber defence and information * * assurance activities ) in the form of passive, preventive and reactive measures in the areas of technology and personnel. military intelligence and the armed forces will develop cyber warfare capabilities while ensuring the principle of “ jointness ”. investments are planned for personnel recruitment and training, as well as technology.",562,94,104,27,czechrepublic_2015_LongTermPerspectiveOnDefense.md,2025-03-25 11:21:26
56,"# # # # # # land forces * * land forces will primarily consist of mechanized brigades equipped with various types of combat * * vehicles ( wheeled and tracked ), including tanks to ensure the execution of the different combat activities. the comprehensive “ 21st century soldier ” program is the main tool for achieving interoperability on a tactical level. automated and remote controlled systems and devices without direct human involvement will be used increasingly to protect lives during operations. their importance will continue to grow, and legislation will be adopted accordingly. priority will be given to comprehensive, real - time situational awareness capabilities in a current area * * of interest. ground and air",727,117,130,28,czechrepublic_2015_LongTermPerspectiveOnDefense.md,2025-03-25 11:21:26
57,"reconnaissance, and surveillance capabilities will be developed, and nato * * projects focusing on the establishment of a complete structure supported up to strategic level. * * military reconnaissance and electronic warfare will remain one of the crucial components * * of combat support for the successful planning and execution of combat activity. this development will be centred on advanced systems of monitoring, evaluation and transfer of situational awareness information, active engagement, use of robotic systems, autonomous / unmanned sensors ( including drones ), and passive surveillance systems. the czech republic will continue its fully - fledged participation in the nato alliance ground surveillance ( ags ) and nato airborne early warning and control system (",778,116,130,28,czechrepublic_2015_LongTermPerspectiveOnDefense.md,2025-03-25 11:21:26
58,naew & c ) programmes.,22,5,9,28,czechrepublic_2015_LongTermPerspectiveOnDefense.md,2025-03-25 11:21:26
59,"# # # # # # 13 - - - - - * * artillery development will focus on enhancing fire support, including precision engagement, * * precise target acquisition and evaluation, and the capability of fire support over a range of 40 km as required by nato. to this end, the adequate parameters for equipment, fire control systems and general operational support need to be achieved. * * engineer corps capabilities will primarily focus on developing a wide range of operations by setting * * up engineer task forces consisting of specialized modules to support operations in difficult climatic and terrain conditions as well as urban terrain operations. a capability of adequate force protection against improvised explosive devices (",723,120,130,29,czechrepublic_2015_LongTermPerspectiveOnDefense.md,2025-03-25 11:21:26
60,"c - ied ) will be provided in conjunction with chemical, biological, radiological, nuclear ( cbrn ) defence capabilities. capabilities for the support of the functions of the integrated rescue system will be maintained. in cbrn defence, impetus will be given to the development of specific capabilities of cbrn units in the field of detection and decontamination with the aim of maintaining a considerable contribution to the allied capabilities within nrf, as well as to the development of a joint czech - british cbrn defence brigade command for allied rapid reaction corps ( arrc ). attention will be paid to the development of capabilities necessary for the effective protection",682,109,130,29,czechrepublic_2015_LongTermPerspectiveOnDefense.md,2025-03-25 11:21:26
61,"of civilians, critical infrastructure and consequence management in humanitarian crisis and natural disasters. the build - up of the nato cbrn reach - back capability will continue at the joint cbrn defence centre of excellence ( coe ) in vyskov. emphasis will be placed on the effective use of cbrn defence experts, both in czech units and international structures. biological defence capabilities will be developed in cooperation with the ministry of health at the centre of biological protection in techonin.",511,80,95,29,czechrepublic_2015_LongTermPerspectiveOnDefense.md,2025-03-25 11:21:26
62,"# # # # # # air defence and air force it will be necessary to maintain and further develop the structure of surveillance comprising radars, including 3d models, passive surveillance systems, high - quality command and control system technology and communications, active ground - to - air assets, subsonic and supersonic air capabilities. the minimum standard will be to provide air defence within the framework of the natinamds and in the performance of national air defence system missions. with respect to nato ’ s needs and trends concerning military science and strategy, * * a close air * * * * support to land forces will be developed. the aim of the",657,113,130,30,czechrepublic_2015_LongTermPerspectiveOnDefense.md,2025-03-25 11:21:26
63,"supersonic air force development will * * be the * * ability to participate in a wide range of operations, as well as full interoperability * * within nato. besides air - policing missions, the capability of sending at least two aircraft to operations outside the czech republic will be required. in order to improve the development * * of the supersonic air force capabilities the l - 159 aircraft will be used for pilot training. * * when developing training programmes further emphasis will be placed on the strengthening of international cooperation. * * air force transport systems will maintain passenger and cargo aircraft ranging from light to medium * * aircraft capable of transporting personnel and",709,118,130,30,czechrepublic_2015_LongTermPerspectiveOnDefense.md,2025-03-25 11:21:26
64,"some combat equipment up to strategic distances. priority will be given to the acquisition of at least two medium sized transport aircraft after 2020. strategic air transport involvement will be guaranteed when participating in multinational programmes ( e. g. the strategic airlift interim solution program ( salis ) or others ). * * helicopter air force will remain an indispensable part of the czech armed forces, and it will be * * key contributing factor to carrying out foreign missions. helicopter forces will be further developed in order to fulfil a wide range of operational missions, including tasks in support of the special forces and the integrated rescue system. the biggest share will",700,113,130,30,czechrepublic_2015_LongTermPerspectiveOnDefense.md,2025-03-25 11:21:26
65,be medium sized transport helicopters and,41,6,8,30,czechrepublic_2015_LongTermPerspectiveOnDefense.md,2025-03-25 11:21:26
66,"# # # # # # 14 - - - - - multipurpose helicopters. training, maintenance and modernization capability will be developed to meet the needs of the czech armed forces and of the alliance. priority will be given to operations training at the multinational aviation training centre ( matc ) focusing on standardization and the efficient training of helicopter crew and ground technical specialist.",392,65,74,31,czechrepublic_2015_LongTermPerspectiveOnDefense.md,2025-03-25 11:21:26
67,"# # # # # # special forces * * special forces will be developed according to the principle of maintaining strategic relevance. * * they must be capable of carrying out joint operations with allied forces and other components of the czech armed forces. emphasis will be placed on flexibility in performing various types of operations, on acquiring strategic information in complex environments and the support of security units and components in an authorised area of operation. the priority is to maintain the high standard of special forces personnel, and to equip them with state - of - the - art weapons and other high level technological materiel.",651,109,120,32,czechrepublic_2015_LongTermPerspectiveOnDefense.md,2025-03-25 11:21:26
68,"# # # # # # logistics an effort will be made to focus on supporting the function of stationary logistics and its effective link with mobile logistics. in order to achieve this objective, it will be necessary to provide personnel training, progressively modernize logistic infrastructure, and intensively use various functions of the logistics information system. to coordinate multinational logistics in operational deployment conditions, the activities of the multinational logistics coordination centre ( mlcc ) will continue. within the framework of collective defence, host nation support ( hns ) guidelines and regulations will be further developed. the ministry of defence will play a coordination role at national level.",727,108,125,33,czechrepublic_2015_LongTermPerspectiveOnDefense.md,2025-03-25 11:21:26
69,"# # # # # # military healthcare * * military healthcare will concentrate on the development of field hospitals, services of garrisons and * * military healthcare facilities, medical material storage and the corresponding healthcare personnel training, focusing on possible deployment in a wide range of operations. the activities of military healthcare in the protection of public health will continue.",402,61,69,34,czechrepublic_2015_LongTermPerspectiveOnDefense.md,2025-03-25 11:21:26
70,"# # # # # # military police * * military police will have the capability of police force protection in areas of their operational * * deployment, as well as the capability of stabilization and post - conflict operations. within the czech republic, it will maintain the ability to provide police protection of personnel, units and defence department facilities. the military police will strengthen its capability of assigning its units to the different components of nato, eu, and un police forces, while non - lethal capabilities and biometrics will be further developed and implemented into the czech armed forces. military police will be prepared to reinforce the police of the czech republic.",695,113,128,35,czechrepublic_2015_LongTermPerspectiveOnDefense.md,2025-03-25 11:21:26
71,# # # # # # 15 - - - - -,24,12,14,36,czechrepublic_2015_LongTermPerspectiveOnDefense.md,2025-03-25 11:21:26
72,# # # vi. prerequisites for the achievement of military capabilities,68,11,17,37,czechrepublic_2015_LongTermPerspectiveOnDefense.md,2025-03-25 11:21:26
73,"# # # # # # the success of the czech national political and military ambitions is reliant on : – the medium - term financial perspective of the resource framework for the defence budget and an adequate annual budget ; – a stable environment for the czech armed forces personnel development ; – support to the czech defence industry and utilization of the research, development and innovation outcome, which in turn will help the czech armed forces to achieve its required capabilities ; – an amendment of legislation with respect to the act on public procurement.",563,97,104,38,czechrepublic_2015_LongTermPerspectiveOnDefense.md,2025-03-25 11:21:26
74,"# # # # # # defence budget and budget outlook the basic prerequisite for ensuring an efficient state of defence will be the establishment of the mid - term perspective of the resource framework for the mod. only if this condition is met, can the implementation of the most important military capabilities be assured in an efficient, conceptual and timely way. this approach is also essential for respecting the principles of fair burden sharing within nato and the eu. besides the mid - term budgetary perspective, the size of the annual defence budget is important in achieving political - military ambitions. based on factual and financial analyses, and on the mid - term mod planning,",687,116,130,39,czechrepublic_2015_LongTermPerspectiveOnDefense.md,2025-03-25 11:21:26
75,"the minimum defence budget for initiating military capability development is 50 billion czk ( at 2014 figures ). should key modernization projects be implemented, the required stocks of military materiel created, the expenses for completing military personnel covered and the other measures taken, the defence budget will have to have progressively reached, by the mid - term perspective ( year 2020 ), the amount of 55 to 60 billion czk ( at 2014 figures ), which represents approximately 1. 4 % of gdp. the key prerequisite is to secure predictable long - term funding which allows for the efficient long - term planning and capability development of the czech armed forces.",676,111,130,39,czechrepublic_2015_LongTermPerspectiveOnDefense.md,2025-03-25 11:21:26
76,"the optimum amount for defence expenditure needed to achieve the political and military ambitions and commitments of the czech republic is, however, 2 % of gdp level, the amount which has also been set out in nato ’ s political guidance and reaffirmed at the wales summit in 2014 by nato heads of state and governments, including the czech republic.",349,60,70,39,czechrepublic_2015_LongTermPerspectiveOnDefense.md,2025-03-25 11:21:26
77,"# # # # # # 16 - - - - - the third basis for ensuring military capabilities development is to allocate 20 % of total defence expenditure to the acquisition or modernization of major weapon systems, including related research. at the same time, it is necessary to respect the premise that personnel expenditure does not exceed 50 % of the defence budget.",353,64,72,40,czechrepublic_2015_LongTermPerspectiveOnDefense.md,2025-03-25 11:21:26
78,"# # # # # # personnel development a key factor in achieving the capabilities of the armed forces is personnel, and implementation of adequate legislative measures. recruitment, education and training of highly qualified military servicemen and civilian personnel and welfare are a priority. from the available demographical analyses, it is evident that in the next ten years the number of citizens of the ideal recruitment age, 18 to 25 years, will decrease. it is therefore important that the mod is perceived as a responsible, reliable and attractive employer able to compete in the labour market. the university of defence will play a key role in the education system of the czech armed forces. other national",712,116,130,41,czechrepublic_2015_LongTermPerspectiveOnDefense.md,2025-03-25 11:21:26
79,"educational institutions and training institutions, as well as the key regional partners, and nato will play an important role in education. in a period when the czech republic is not facing a direct threat to its security, the czech armed forces will continue to function with peacetime military capabilities and personnel strength. the crucial role for augmenting personnel to the required manning levels will be played by an active reserve of up to five thousand people. the mod will also educate czech citizens for state defence and provide training for civil servants of state administrations, municipalities, and citizens in the event of the mobilization of the czech armed forces.",687,109,123,41,czechrepublic_2015_LongTermPerspectiveOnDefense.md,2025-03-25 11:21:26
80,"# # # # # # defence industry and research a significant area for the development and maintenance of national defence capabilities is the do mestic defence and security industry. the mod, in cooperation with defence industries, must strive to preserve key industry capacities whose role is to safeguard the essential security interests of the czech republic. for this reason, the mod entered into an agreement with the defence and security industry association of the czech republic in 2010.",490,79,88,42,czechrepublic_2015_LongTermPerspectiveOnDefense.md,2025-03-25 11:21:26
81,"# # # # # # this ongoing policy for the mod ’ s cooperation with industry is based on the following presumptions : – the domestic market is crucial for the czech defence industry in order to be able to provide the necessary support with respect to basic national security interests ; – priority is given to joint acquisition of products that meet the interoperability requirements of other international partners, especially nato and eu allies ; – for economic sustainability, business potential and competitiveness, it is essential that the defence industries are also competitive in foreign markets ;",602,99,110,43,czechrepublic_2015_LongTermPerspectiveOnDefense.md,2025-03-25 11:21:26
82,"# # # # # # 17 - - - - - – in order to sustain multinational cooperation development regionally and in a wider context, it is vital to seek out opportunities where the czech defence industry can participate in the supply chain of multinational projects central europe is currently one of the czech republic core interests in this respect ; – in order to meet the specific requirement of the czech armed forces, it is essential to further develop state enterprises that have been established by the ministry of defence. this document sets out the framework for defence capabilities that the mod and the czech armed forces will build - up in the coming decades according to the approved level of ambition",702,124,130,44,czechrepublic_2015_LongTermPerspectiveOnDefense.md,2025-03-25 11:21:26
83,"and operational requirements. the mod will support the development of research and industrial capabilities based on the needs of the czech armed forces and the czech defence industry to support competition, not only in the czech market but also in the european and global markets, in order to maintain and develop its competitiveness in the medium term. dialogue is an important tool in enhancing the development of capabilities and competitiveness in the domestic defence industry, and an intrinsic area of such dialogue will be the annual national armament conference which focuses on the mid and long term acquisition plans of the mod. cooperation with the relevant nato and eu agencies, such as the nato support and procurement agency (",740,119,130,44,czechrepublic_2015_LongTermPerspectiveOnDefense.md,2025-03-25 11:21:26
84,nspa ) and the european defence agency ( eda ) will remain an indispensable part of the process to achieving the necessary military capabilities.,145,24,32,44,czechrepublic_2015_LongTermPerspectiveOnDefense.md,2025-03-25 11:21:26
85,# # # # # # 18 - - - - -,24,12,14,45,czechrepublic_2015_LongTermPerspectiveOnDefense.md,2025-03-25 11:21:26
86,"# # # vii. conclusions the long term perspective was developed to represent the period up to 2030. a review may be carried out after four years. should the defence strategy of the czech republic and political and military ambitions change, or should qualitative changes occur in the security environment which would then have a significant impact on the czech republic ’ s defence position then the long term perspective will be reviewed earlier. a follow - up document to the long term perspective titled the concept of the czech armed forces development 2025 will be issued in the future which will translate the contents of the long term perspective into specific military solutions and procedures in order to",712,119,130,46,czechrepublic_2015_LongTermPerspectiveOnDefense.md,2025-03-25 11:21:26
87,achieve these ambitions.,24,3,6,46,czechrepublic_2015_LongTermPerspectiveOnDefense.md,2025-03-25 11:21:26
88,"# # # # # # the long term perspective for defence 2030 was approved by the governmental resolution of 15 june 2015, nr. 466 19 - - - - - * * 4 * * compiled using ap - 6 nato glossary of terms and definitions and aap - 15 nato glossary of abbreviations used in nato documents and publications.",292,61,72,47,czechrepublic_2015_LongTermPerspectiveOnDefense.md,2025-03-25 11:21:26
89,"# # # # # # 20 | list of abb | breviations 4 | | - - - | - - - | | ags | alliance ground surveillance | | arrc | allied rapid reaction corps | | c2 | command and control | | c4isr | command control communication and computers, intelligence, surveillance and reconnaissance | | cbrn | chemical, biological, radiological, nuclear | | coe | centre of excellence | | c - ied | counter improvised explosive device | | eda | european defence agency | | hns | host nation support | | istar | intelligence, surveillance, target acquisition,",532,105,130,48,czechrepublic_2015_LongTermPerspectiveOnDefense.md,2025-03-25 11:21:26
90,and reconnaissance | | matc | multinational aviation training centre | | mlcc | multinational logistics coordination centre | | naew & c | nato airborne early warning and control system | | natinamds | nato integrated air and missile defence system | | ncrs | nato crisis response system | | nec | network enabled capability | | nrf | nato response force | | nspa | nato support and procurement agency | | salis | strategic airlift interim solution | - - - - -,460,87,99,48,czechrepublic_2015_LongTermPerspectiveOnDefense.md,2025-03-25 11:21:26
91,"# # # # the long term perspective for defence 2030 published by the ministry of defence of the czech republic - military history institute ( mhi ) address : vojensky historicky ustav praha, u pamatniku 2, 135 00 praha 3 http : / / www. army. cz http : / / www. vhu. cz for print prepared by graphic section of presentation and promotion department mhi address : rooseveltova 23, 161 05 praha 6 − dejvice editor - in - chief : petr simunek ( defence policy and strategy division ) layout : libora",495,95,130,49,czechrepublic_2015_LongTermPerspectiveOnDefense.md,2025-03-25 11:21:26
92,"schulzova released for print : july 2015 printed by : presentation and promotion department mhi 1st edition © ministry of defence of the czech republic - military history institute, 2015 isbn : 978 - 80 - 7278 - 667 - 1 ( english edition ) isbn : 978 - 80 - 7278 - 666 - 4 ( czech edition ) - - - - - - - - - -",310,70,83,49,czechrepublic_2015_LongTermPerspectiveOnDefense.md,2025-03-25 11:21:26
