chunk_id,text,char_length,word_count,token_count,section_index,source_file,processed_date
1,# national security concept of estonia - - - - -,48,11,13,0,estonia_2023_NationalSecurityConcept.md,2025-01-28 18:54:52
2,# # table of contents,21,5,7,1,estonia_2023_NationalSecurityConcept.md,2025-01-28 18:54:52
3,# # # # 1. introduction 2. principles of estonian security policy 3. security environment 4. areas of activity in estonia ’ s security policy 4. 1. social cohesion and resilience of the state 4. 2. economic security and critical services 4. 3. internal security and public order 4. 4. military defence 4. 5. international cooperation,333,56,75,2,estonia_2023_NationalSecurityConcept.md,2025-01-28 18:54:52
4,# # # # # 2,11,6,8,3,estonia_2023_NationalSecurityConcept.md,2025-01-28 18:54:52
5,# # # # # 4,11,6,8,4,estonia_2023_NationalSecurityConcept.md,2025-01-28 18:54:52
6,# # # # # 6,11,6,8,5,estonia_2023_NationalSecurityConcept.md,2025-01-28 18:54:52
7,# # # # # 9,11,6,8,6,estonia_2023_NationalSecurityConcept.md,2025-01-28 18:54:52
8,# # # # # 10,12,6,8,7,estonia_2023_NationalSecurityConcept.md,2025-01-28 18:54:52
9,# # # # # 11,12,6,8,8,estonia_2023_NationalSecurityConcept.md,2025-01-28 18:54:52
10,# # # # # 12,12,6,8,9,estonia_2023_NationalSecurityConcept.md,2025-01-28 18:54:52
11,# # # # # 13,12,6,8,10,estonia_2023_NationalSecurityConcept.md,2025-01-28 18:54:52
12,# # # # # 15 - - - - -,22,11,13,11,estonia_2023_NationalSecurityConcept.md,2025-01-28 18:54:52
13,"# # 1. introduction this document has three core aims : to describe the security environment as of early 2023 ; to outline estonia ’ s objectives in light of the deterioration of the security environment ; and to describe the steps that need to be taken in order to achieve the objectives that have been set. it is a framework document serving as a guideline for sector - specific strategies and development plans. the 2023 edition of the national security concept is the fifth estonian national security concept. it draws on the previous concept, devised in 2017. the national security concept is drafted by the government and approved by the riigikogu ( estonian parliament )",677,116,130,12,estonia_2023_NationalSecurityConcept.md,2025-01-28 18:54:52
14,. the document is updated at least once every four years or in response to changes in the security environment or in estonia ’ s ability to ensure its security. - - - - -,170,35,38,12,estonia_2023_NationalSecurityConcept.md,2025-01-28 18:54:52
15,"# # 2. principles of estonian security policy the aim of estonia ’ s security policy is to guarantee the sovereignty and independence of the republic of estonia, the preservation of the estonian people, language and culture, its territorial integrity, constitutional order, safety of the population and the functioning of society. the foundation of estonia ’ s security is a social order that centres on respect for human dignity, the fundamental rights and freedoms of individuals, democratic governance and the rule of law. estonia is a member of a community of democratic countries, and estonia ’ s aim is that this community is united and enduring. estonia ’ s security is underpinned by a",693,114,130,13,estonia_2023_NationalSecurityConcept.md,2025-01-28 18:54:52
16,"system of international relations based on respect for international law. estonian security policy is guided by the principles set out in the charter of the united nations ( un ) and by the right and freedom of every nation to choose its own security solutions. the safeguarding of estonia ’ s security is not directed against any other state. estonia will defend itself in any event and against any threat, regardless of its origin or the time and place in which it emerges, and however overwhelming the adversary ; estonia will never surrender. estonia ’ s aim is to render any aggression against the estonian state unfeasible. security is all - encompassing. estonia ’ s security",682,116,130,13,estonia_2023_NationalSecurityConcept.md,2025-01-28 18:54:52
17,"policy is based on a broad security concept, which includes all trends and factors affecting national security. the implementation of estonia ’ s security policy is based on a holistic approach to society and the state. estonia ’ s security begins with ourselves, including with the readiness and actions of every individual. based on estonia ’ s comprehensive national defence concept, the defence of the nation and preparations for it draw on all available military and non - military capabilities and resources, involving also the public, private and third sector. estonia ’ s security is underpinned by its membership in the north atlantic treaty organization ( nato ) and the european union ( eu ) and",706,116,130,13,estonia_2023_NationalSecurityConcept.md,2025-01-28 18:54:52
18,"by close cooperation with allies and other international partners. estonia considers the security of itself and its allies to be indivisible. - - - - - due to the significant deterioration in the international security environment, estonia as a whole must make efforts to reinforce its security at a greater scale and speed. for a safer and more crises - proof environment, security issues must be factored into the development of laws, policies, working processes, supply chains, infrastructure, international cooperation and more. ensuring security and crisis preparedness for the state and society is a comprehensive, continuous and purposeful process. it must be reflected in the mindset, readiness",702,107,130,13,estonia_2023_NationalSecurityConcept.md,2025-01-28 18:54:52
19,", actions and cooperation of constitutional institutions, the executive, local governments, businesses, organisations, communities and individuals. the state promotes and supports volunteer activity in boosting crisis preparedness and crisis management. in preparing for and dealing with crises, estonia is guided by the principle of the continuity of duties : everyone fulfils their role both under ordinary circumstances as well as at times of crisis and war. by preparing for war and the most serious crises, we are also prepared to deal with crises of lesser impact. the basis of estonian security is a cohesive and united society. in estonia, human and civil rights are protected. estonia ensures that all",710,109,130,13,estonia_2023_NationalSecurityConcept.md,2025-01-28 18:54:52
20,"people have equal opportunities and a living environment in which they are cared for, live long lives and are as healthy as possible, in which inequality and poverty are reduced and people enjoy working lives of notable length and quality. estonia ’ s economic environment is attractive. education, research and development form the basis of a successful and future - oriented estonia. - - - - -",395,67,75,13,estonia_2023_NationalSecurityConcept.md,2025-01-28 18:54:52
21,"# # 3. security environment the greatest strategic challenge in the current security environment is an increasing confrontation between various political, economic and social systems. the sphere of values based on democracy, market economy, rule of law and human rights is under pressure, ideological opposition to it is growing. authoritarian regimes have grown more aggressive and are increasingly collaborating to undermine democratic values. veiled competition has turned into an open confrontation, with war once again being waged in europe. a new international security architecture is being shaped through this confrontation. for estonia, the survival of the world order based on rules and democratic values is of existential importance. the greatest security threat",773,112,130,14,estonia_2023_NationalSecurityConcept.md,2025-01-28 18:54:52
22,"to estonia is the russian federation, whose objective is to dismantle and rewrite europe ’ s security architecture and the rules - based international order, and to restore the politics of spheres of influence. the threat to estonia based on these objectives is an existential one. the russian federation has repeatedly carried out acts of aggression, occupying, annexing, and committing war crimes on the territory of neighbouring countries. the threat the russian federation poses to estonia is a long - term one. the military threat to nato, including to estonia and the baltic states as members of the alliance, has increased over the last year. the aggression of the russian federation",690,111,130,14,estonia_2023_NationalSecurityConcept.md,2025-01-28 18:54:52
23,"against ukraine shows that it is willing to take risks, therefore we must also be prepared for miscalculations on its part. the russian federation is increasingly using military means, including nuclear threats, to achieve its political objectives. the military threat to the baltic states and nato is further increased by the expanding influence and military presence of the russian federation in belarus. the growing influence of the russian federation and further attempts to increase it in the balkans, moldova and georgia compounds the threat that it poses to security and stability. the strategic importance of africa and the arctic has also increased for the russian federation. the russian federation makes continuous use of hybrid attacks to",750,116,130,14,estonia_2023_NationalSecurityConcept.md,2025-01-28 18:54:52
24,"achieve its political objectives. these attacks are designed to influence political and social choices in a way that is favourable to the russian federation and to undermine trust and unity both within and between countries. asymmetric means, such as information - - - - - influence activities, energy dependency, engineered migration or destabilising activities in cyberspace, are systematically and simultaneously employed to achieve the desired effect. herein, cyberspace is both an independent domain and an enabler of other domains, and the accompanying risks must not be underestimated. orchestrating hybrid attacks is a task of the russian federation ’ s intelligence and security services. a hybrid",706,105,130,14,estonia_2023_NationalSecurityConcept.md,2025-01-28 18:54:52
25,"attack could lead to the triggering of nato ’ s article 5. the russian federation actively conducts information influence activities against estonia and the rest of democratic nations. attitudes shaped by the long - term impact of the russian information sphere are a threat to the constitutional order of estonia. the russian federation employs a variety of social groups, including the pro - russian population, to amplify polarising issues in society and divide estonian society. neither the existing security system nor international law have sufficiently deterred or prevented the aggression of the russian federation nor its use of asymmetric means against its neighbouring countries. such tendency becoming the norm represents a threat to security and",758,115,130,14,estonia_2023_NationalSecurityConcept.md,2025-01-28 18:54:52
26,"undermines the international order. the war against ukraine and the annexation of crimea by the russian federation are evidence of this and demand an unequivocal response from the democratic world. the democratic nations ’ response to the russian federation ’ s full - scale war against ukraine has been robust, underscoring the importance of unity and determination in shaping the security environment. solidarity within the european union, strong transatlantic relations, and the prioritisation of collective defence in nato are at the heart of condemning the aggression of the russian federation, imposing sanctions, and supporting ukraine. estonia ’ s influence on the international arena has grown, inter alia as a",719,109,130,14,estonia_2023_NationalSecurityConcept.md,2025-01-28 18:54:52
27,"vocal advocate of helping ukraine. the clout and influence of the people ’ s republic of china have grown on the international arena. the main challenge to estonia ’ s security arising from the people ’ s republic of china is its aim to reshape the norms of international engagement and its wish to influence decisions and achieve control of strategic domains. china employs asymmetric means to this end. intensifying confrontation on the international arena is also evident in economic, industrial and technological spheres. countries that do not share democratic values and companies acting in their interests are becoming a threat via weaponizing connectivity and the model of open governance. malevolent",707,111,130,14,estonia_2023_NationalSecurityConcept.md,2025-01-28 18:54:52
28,"actors could utilise estonia ’ s digital services for money laundering, financing terrorism or other unlawful activities. other strategic challenges include climate change, migratory pressure, food security, pandemics, terrorism, extremism, energy security and risks to the global economy, all of which have a direct or indirect impact on national and international security. as a member of both the european union and nato, estonia may become a target for - - - - - terrorist organisations and adherents of their ideology. there are no good solutions to these challenges within national borders, but increasing rivalry and political polarisation are making it more difficult to solve them through international cooperation",723,108,130,14,estonia_2023_NationalSecurityConcept.md,2025-01-28 18:54:52
29,". the fight for vital resources – drinking water, food, arable land and energy – is increasing the threat of global instability, conflicts and mass migration. climate change, in turn, is accelerating the likelihood of these threats materialising. - - - - -",256,43,54,14,estonia_2023_NationalSecurityConcept.md,2025-01-28 18:54:52
30,"# # 4. areas of activity in estonia ’ s security policy estonia is facing the most tense security situation of the reindependence period. as a society and a nation, we must be prepared for risks that previously seemed unthinkable. to strengthen our security, estonia acts within five main domains, which are interlinked and mutually supportive, and which together form a whole where each part is of equal value :",412,70,88,15,estonia_2023_NationalSecurityConcept.md,2025-01-28 18:54:52
31,"# # # social cohesion and resilience of the state economic security and critical services internal security and public order military defence international cooperation in a deteriorating security situation, we must improve the resilience of the entire state and its population. to achieve this, it is necessary to ensure targeted long - term development of non - military national defence capabilities through permanent funding in the state budget strategy. due to the increased military threat of the russian federation, the required estonian military defence spending is at least 3 % of gdp ; estonia ’ s host nation support costs will come on top of it. similarly to military defence spending, the state budget strategy will",727,116,130,16,estonia_2023_NationalSecurityConcept.md,2025-01-28 18:54:52
32,"ensure permanent funding for the development of civil protection, taking into account investment needs based on threat scenarios. - - - - -",139,23,27,16,estonia_2023_NationalSecurityConcept.md,2025-01-28 18:54:52
33,"# # # 4. 1. social cohesion and resilience of the state estonia is a society with a shared identity and shared values whose cohesion stems from its language, culture, democratic norms and values. estonia has a vibrant population and cultural space. in a cohesive society, all fundamental rights and freedoms are protected. there is less conflict and dissatisfaction in such a society, as well as fewer vulnerable people and risk groups, and less radicalisation. maintaining and increasing social cohesion in estonia requires a constant focus on issues that divide society, on reducing their impact and eliminating their causes. opportunities must be created for everyone to thrive on",683,108,130,17,estonia_2023_NationalSecurityConcept.md,2025-01-28 18:54:52
34,"their own. to prevent the population from being influenced in a way that leads to conflicts threatening the constitutional order, information influence activities, including disinformation, must be promptly identified and stopped from spreading. to this end, estonia uses strategic communication to ensure that constitutional values are embraced as widely as possible in society. estonia is increasing its population ’ s ability to adapt and cope in a complex, high - risk environment. learning skills that contribute to positive mental health and self - efficacy begins in childhood and it is available to all ages and socioeconomic groups. for the preservation of the estonian state and people, particular attention should be paid to children",744,113,130,17,estonia_2023_NationalSecurityConcept.md,2025-01-28 18:54:52
35,"and their protection. arrangements should be in place for providing education, childcare and other services, and ensuring child safety in times of crisis. estonia ’ s demographic situation may become a security risk if the population declines and ages. global demographic trends are moving in the opposite direction, and potential negative changes in the living environment, economic downturn, radicalisation, conflicts and crises may cause an increase in migration that affects estonia. estonia will continue to reinforce the crisis preparedness of its social and healthcare systems according to threats and in line with the lessons of the covid - 19 pandemic, with a particular focus on the crisis preparedness of",715,109,130,17,estonia_2023_NationalSecurityConcept.md,2025-01-28 18:54:52
36,"health infrastructure and social infrastructure. the continued provision of healthcare, social services and emergency social care services in the required volume will ensure the society is able to cope in crises and at a time of war. estonia values open and inclusive governance. one of the aims of this is to boost the level of trust in the state among residents. trust, a strong civil society, risk awareness, defence resolve, and the readiness to volunteer for the resolution of crises all enhance social resilience. - - - - - estonia enhances resilience in a comprehensive and coordinated manner. to improve the preparedness of constitutional institutions, the executive and local governments",696,110,130,17,estonia_2023_NationalSecurityConcept.md,2025-01-28 18:54:52
37,"and the continuity of critical services estonia must have a national risk assessment, coordinated management and planning, up - to - date crisis plans and regular exercises at every level. the main prerequisites for implementing plans are cooperation between the different parties, the resilience of each individual part, and the necessary resources.",350,52,65,17,estonia_2023_NationalSecurityConcept.md,2025-01-28 18:54:52
38,"# # # 4. 2. economic security and critical services estonia ’ s economic success and security depend on fair and open trade, a transparent rules - based international economic environment, solid national finances, trusted connectivity in both the physical and digital world, emerging technologies, supply chains and access to resources. in terms of economic security, estonia ’ s aim is to prevent and exclude dependence on authoritarian states, and unreliable companies under their control, including by boosting the effectiveness of supervision. in parallel, estonia is developing innovative technological solutions that could be offered to democracies, including for increasing the value of the mineral resources of the future, which are",740,110,130,18,estonia_2023_NationalSecurityConcept.md,2025-01-28 18:54:52
39,"needed for energy production and completing the green transition. estonia ensures secure supply chains and the transparency of foreign investments in strategic areas. in addition, estonia assesses the risks involved in public procurements to exclude products, services and tenderers that could pose a risk to critical services. energy security is the cornerstone of security and economic activity. estonia ’ s aim is to achieve and maintain complete energy independence from the russian federation and to diversify its energy mix. to reduce risks to the security of supply of electricity, controlled generation capacity will be ensured to the necessary extent. estonia, along with latvia and lithuania, is in the process of reinforcing",735,111,130,18,estonia_2023_NationalSecurityConcept.md,2025-01-28 18:54:52
40,"its electricity systems, and once completed, the baltic states will be able to desynchronize from the russian - belarusian grid and connect to the electricity system of continental europe. estonia ’ s economic model must be sustainable, competitive and future - proof. to this end, we are increasing the proportion of renewable energy in our energy mix and implementing a strategically managed green transition in the country. estonia ’ s goal is to have its renewable electricity production equal its total annual consumption by 2030. the basis of a functioning resilient society and crisis preparedness is ensuring the continuity of critical services, which includes being prepared for the most difficult scenarios",716,111,130,18,estonia_2023_NationalSecurityConcept.md,2025-01-28 18:54:52
41,", including war. in case of a crisis or war, estonia will ensure the functioning - - - - - of the state ’ s finance system and state cash flow. all levels of society must have stocks to ensure crisis readiness. to keep the society functioning in a crisis, estonia keeps sufficient national stocks of fuel and natural gas, in accordance with risk scenarios, as well as reserves of food and medicinal products supplied through pharmacies. to boost security of supply and ensure flexibility of response, we are developing a network - based model for the cooperation of the public and private sector. estonia ’ s security and economic success depend on the sustainable development",676,116,130,18,estonia_2023_NationalSecurityConcept.md,2025-01-28 18:54:52
42,"of its digital society. when it comes to digital transformation and technological choices, the state and the private sector must be mindful of the security environment and global trends in technology. in digital space, we must plan for cybersecurity and information security in all information systems, organisations and processes. estonia supports the leading role of democratic countries in developing new and emerging technologies. it is in estonia ’ s security interests to support national companies operating in these strategic areas.",540,80,94,18,estonia_2023_NationalSecurityConcept.md,2025-01-28 18:54:52
43,"# # # 4. 3. internal security and public order estonia staunchly defends its constitutional order and internal peace. an open, humane and effective way of guaranteeing public order and security increases public trust in government. estonia acts decisively to prevent and counter the actions of hostile special services and non - state actors. in line with the principles of the rule of law and as a deterrent to the russian federation, information concerning activities directed against the state is made public if possible. estonia prevents and combats corruption, radicalisation, violent extremism, terrorism and its financing, money laundering and organised crime. prevention and rehabilitation of offenders",710,106,130,19,estonia_2023_NationalSecurityConcept.md,2025-01-28 18:54:52
44,", ensured through an effective penal policy and cooperation between various stakeholders, is an important part of ensuring security. effective control of external borders, including customs and tax control, is vital in a deteriorating security situation, as it helps to prevent illegal migration or migration organised with a hostile purpose. identifying dangerous persons and hazardous substances at the border increases security throughout the schengen area. the state uses all legal means to protect estonia, the schengen area, the european union and nato. given estonia ’ s reliance on digital services, the state ensures the availability of public - - - - - services and the integrity and confidentiality of data, including",728,111,130,19,estonia_2023_NationalSecurityConcept.md,2025-01-28 18:54:52
45,"during crises. both under ordinary circumstances and in crises, experts in public order, internal security, border control, cybersecurity and strategic communication, as well as volunteers supporting them, are among those who react to the first signs of danger to prevent the situation from escalating into a threat to constitutional order. maintaining and developing this ability requires technologically advanced, scenario - based, and timely capacity development that takes into account the creation of reserves, as well as long - term and stable funding. the deteriorating security environment requires an increase in the population ’ s crisis resilience and a more systematic implementation of civil protection. the aim of",727,107,130,19,estonia_2023_NationalSecurityConcept.md,2025-01-28 18:54:52
46,"civil protection is to support people in a crisis, including in wartime, and to increase their self - resilience in a crisis. civil protection at a time of crisis means that both the state and the society are prepared for early warning and alerts, rescue operations, evacuation, sheltering, first aid and disaster medicine, essential social assistance, psychosocial crisis assistance and other forms of essential assistance for the population. the basis for civil protection is people ’ s ability to protect themselves during a crisis until help arrives, and to assist each other if necessary. achieving this requires a joint effort of various parts of society, including individuals, communities",696,108,130,19,estonia_2023_NationalSecurityConcept.md,2025-01-28 18:54:52
