chunk_id,text,char_length,word_count,token_count,section_index,source_file,processed_date
47,", volunteers, local government units, and various state institutions. estonia develops social protection measures to address threats to the population, along with risk communication and training, including to enhance institutional capacity.",240,31,39,19,estonia_2023_NationalSecurityConcept.md,2025-01-28 18:54:52
48,"# # # 4. 4. military defence the aim of military defence is to prevent military threats and, if necessary, to successfully defend the country and win the war. in order to deter any potential adversary from launching a military aggression, estonia adopts a forward defence posture, which combines national military defence capability and collective defence. estonia ’ s national defence system is based on the principle of democratic civilian control. to ensure credible deterrence, nato must be prepared for an immediate collective defence operation anywhere on allied territory. nato ’ s forward defence posture on its eastern flank must be based on deterrence by denial – the aim of which is to convince",705,114,130,20,estonia_2023_NationalSecurityConcept.md,2025-01-28 18:54:52
49,"the aggressor that achieving its objectives through military means is impossible. credible deterrence by denial consists of estonia ’ s own strong military defence, combat - ready allied presence integrated with estonian military defence, designated reinforcement forces, effective command and control, prepositioned equipment, high - quality defence plans that are regularly exercised, and the resolve and ability of allies to rapidly deploy additional forces, capabilities and equipment in case of a crisis. - - - - - estonia ’ s military defence is structured around the principle of territorial defence. estonia is guided by the understanding that the baltic states are one area of operations. to strengthen estonian military defence,",738,110,130,20,estonia_2023_NationalSecurityConcept.md,2025-01-28 18:54:52
50,"we are developing, on the basis of military advice and in an expedited manner, complete military units and capabilities that are manned, armed, equipped, trained, regularly exercised and that have sufficient supplies. based on both units in reserve and those at permanent readiness, estonia is developing manoeuvre units and territorial defence units capable of blocking and countering the adversary. situational awareness, advanced early warning, capable intelligence, counterintelligence and a shared threat perception amongst allies are key to ensuring efficient national defence planning and pre - empt military threats. early warning supports timely decision - making and rapid implementation of decisions, which are of",724,103,130,20,estonia_2023_NationalSecurityConcept.md,2025-01-28 18:54:52
51,"primary importance not only to achieve defence readiness but also to prepare the state as a whole for countering a threat. estonia must achieve defence readiness before a threat materialises. to that end, freedom of action is ensured as early as possible for the estonian defence forces and allied forces, including, if necessary, in the regional area of operations – the baltic states and the baltic sea. regularly conducted defence readiness exercises, including at short notice, aim to make the mobilisation system more efficient. conscript service is the main instrument for building reserve units, maintaining combat readiness and providing a recruitment pool for active duty. estonia ’ s defence capability is",715,111,130,20,estonia_2023_NationalSecurityConcept.md,2025-01-28 18:54:52
52,"enhanced by boosting the attractiveness of conscription and reserve service, and a greater participation of women. the estonian defence league contributes to preparing the national defence capability and ensuring security. the bedrock of estonia ’ s defence is a strong defence resolve. strengthening defence resolve is a joint effort involving many sectors, and national defence education is among its contributing elements. estonia values the defenders of the state and the contributions to national defence by the citizens, the private sector and the general society. to reinforce this, more opportunities for both a military and non - military contribution to national defence are being created, while raising awareness of these opportunities. the contribution of allies to",777,115,130,20,estonia_2023_NationalSecurityConcept.md,2025-01-28 18:54:52
53,"nato ’ s defence in estonia and in the baltic states as well as the militarily meaningful allied presence are an important part of estonian defence. allied military presence and activities in estonia should be continuous and planned. those forces must be fully equipped, supplied and capable of operating together with the estonian units. to strengthen the security of all allies, estonia takes part in collective defence operations and other international military operations. these operations reinforce - - - - - international security. moreover, participating in them contributes to developing relations and interoperability between allies, and provides the estonian defence forces with valuable experience.",710,104,120,20,estonia_2023_NationalSecurityConcept.md,2025-01-28 18:54:52
54,"# # # 4. 5. international cooperation active involvement in international organisations, dynamic regional cooperation and close and effective bilateral relations with allies and partners form the cornerstone of estonia ’ s foreign policy. this applies to europe as a whole, the wider transatlantic community and the global context but, more narrowly, also to the baltic sea region. mutual solidarity between countries and the unity of their positions are important in achieving goals and make the implementation of decisions more efficient. estonia ’ s foreign policy is active, constructive and confident. it focuses on issues threatening the survival of the estonian state and society, as well as those that strengthen estonia ’ s statehood and society",754,116,130,21,estonia_2023_NationalSecurityConcept.md,2025-01-28 18:54:52
55,"and make them more resilient. at the heart of estonia ’ s foreign and security policy are nato and the european union, through which members states ensure their common and national interests. the purposefulness, strength and unity of nato and the european union are of utmost importance. estonia supports close, result - oriented cooperation between nato and the european union. in maintaining and developing relations with the union and allies, estonia aspires to be at the core of decision making, fulfilling its obligations and contributing to security in different parts of the world to this end. in the crises that have occurred over the last five years – the migration crisis, the",686,112,130,21,estonia_2023_NationalSecurityConcept.md,2025-01-28 18:54:52
56,"covid pandemic and russia ’ s aggression against ukraine – the european union has consolidated and targeted its actions more effectively. the union ’ s strength lies in the solidarity of its member states, which is manifested, among other things, in coping with the current crises. the european union ’ s consensus - based decision - making process for foreign policy is in the interests of the union itself and of all of its member states and ensures the implementation of decisions. the core task of nato – credible collective defence – is ensured by the strengthened deterrence and defence posture agreed by the alliance ; increased defence spending and investments by all allies ; swift political and",704,118,130,21,estonia_2023_NationalSecurityConcept.md,2025-01-28 18:54:52
57,"military decision - making process ; and nato ’ s deterrence and defence posture that stands on a threat - based mix of conventional, missile defence and nuclear capabilities. nato ’ s strength lies in allied unity and in the strength of the transatlantic link. estonia is an advocate of eu enlargement and nato ’ s open door policy and supports initiatives that assist countries aspiring to become members in preparing for accession and in ensuring their compliance with accession criteria. - - - - - following the russian federation ’ s aggression against ukraine, all like - minded countries need to continue supporting ukraine politically, militarily and economically in a sustained manner and to the required",713,117,130,21,estonia_2023_NationalSecurityConcept.md,2025-01-28 18:54:52
58,"extent. it is in estonia ’ s interests to help ukraine win the war, retain its independence and restore its territorial integrity. estonia supports ukraine ’ s accession to both the european union and nato. estonia will be diplomatically active in ukraine ’ s reconstruction process, provide military assistance, contribute to the restoration of infrastructure destroyed during the war, offer its knowhow for the development of the ukrainian state and economy and assist with the treatment of war casualties. estonia is also providing humanitarian aid to ukraine. in the united nations ( un ), the organisation for security and co - operation in europe ( osce ) and the council of europe, estonia works",702,114,130,21,estonia_2023_NationalSecurityConcept.md,2025-01-28 18:54:52
59,"to ensure the validity of the principles of global and regional peace and security, the prevention and peaceful resolution of conflicts and, where necessary, the legitimate use of force as agreed in the un charter, the helsinki final act and the universal declaration of human rights. these organisations have their part to play in finding a solution to the aggression of the russian federation against ukraine and to frozen conflicts in europe. through development cooperation, humanitarian aid and by achieving the un ’ s sustainable development goals, estonia contributes to the promotion of global stability and to reducing the risk of crises and conflicts. promoting and defending estonia ’ s interests on global issues requires a positive image and",754,119,130,21,estonia_2023_NationalSecurityConcept.md,2025-01-28 18:54:52
60,"considerable influence on the international arena. a proactive and constructive contribution to the digital, cyber, human rights, climate, energy and connectivity agenda increases estonia ’ s involvement and allows to better protect its interests in these areas, but also creates other opportunities. participation in global crises management builds cohesion beyond estonia ’ s circle of closest allies, enhances solidarity with estonia and increases estonia ’ s own ability to act effectively in any crisis. bilateral and regional cooperation with countries in other regions around the world creates the necessary preconditions and backdrop for finding support for estonia ’ s positions when key decisions are made in the un and other international organisations.",764,112,130,21,estonia_2023_NationalSecurityConcept.md,2025-01-28 18:54:52
61,"relationships with allies and partners empower estonia ’ s security. bilateral and regional initiatives and cooperation within international organisations strengthen unity and increase mutual ties and trust. therefore, estonia must find new ways to promote its interests as well as continue in tried and tested formats. the baltic sea region is considered one of the most stable, most integrated and most effectively organised regions in europe. the aggression of the russian federation against ukraine has revealed a number of challenges in the region, but at the same time opened up new avenues. the accession of finland and sweden to nato will strengthen the region ’ s security, and estonia is actively engaged in formulating the new unified",745,117,130,21,estonia_2023_NationalSecurityConcept.md,2025-01-28 18:54:52
62,"regional security arrangements. - - - - - one component of international security and confidence is arms control. it implies that all parties adhere to international law, fulfil their agreed obligations, and respect the territorial integrity of other countries. the basis of effective international arms control is abiding by the principles of transparency, trust and verification. it is important that arms control have a negative impact on collective defence and deterrence, estonia ’ s independent defence capabilities or lead to the creation of special regional arrangements. in the significantly deteriorated security environment, the relevance of restriction and control regimes of nuclear arms and other weapons of mass destruction has become more pronounced,",766,112,130,21,estonia_2023_NationalSecurityConcept.md,2025-01-28 18:54:52
63,and estonia must be involved in shaping these regimes. - - - - - - - - - -,74,19,22,21,estonia_2023_NationalSecurityConcept.md,2025-01-28 18:54:52
