chunk_id,text,char_length,word_count,token_count,section_index,source_file,processed_date
349,"# # 2. politica de defensa : componentes de financiamiento el diseno de una politica de financiamiento dentro de una politica de defensa congruente, comprende un componente fijo y uno variable : el componente fijo del presupuesto de la defensa, esta en funcion porcentual del pib para el cumplimiento de la mision constitucional. el componente variable, esta determinado por la legislatura para cada ano o para",410,66,130,87,guatemala_2003_NationalDefenceBook_noneng.md,2025-01-28 18:57:01
350,"cada periodo de gobierno, sujeto a cambios en funcion de las circunstancias de emergencia o de otro tipo que demanden erogaciones extraordinarias o recortes presupuestarios. este monto de recursos se vincula a las funciones de transicion o a nuevas competencias sustentadas por las politicas de estado y su adecuacion a las necesidades cambiantes del desarrollo.",362,55,120,87,guatemala_2003_NationalDefenceBook_noneng.md,2025-01-28 18:57:01
351,"# # 3. inversion en defensa como parte de la seguridad nacional en terminos generales la inversion en defensa se refiere a los recursos necesarios para fortalecer las areas politicas, economicas, sociales y militares del accionar de la nacion, y en terminos especificos significa la inversion vinculada al ministerio de la defensa nacional, la cual se determina en funcion del analisis de los indicadores macroeconomicos, especialmente los fiscal",446,68,130,88,guatemala_2003_NationalDefenceBook_noneng.md,2025-01-28 18:57:01
352,"##es, el ingreso per capita, el producto interno bruto, el nivel general de los precios internos, entre otros. la proyeccion del presupuesto para la defensa nacional, esta basada en el ordenamiento de la politica respectiva, cumpliendo con los contenidos del pacto fiscal. en todo caso, los recursos asignados a la defensa, no deben rebasar los limites que puedan presionar la estabilidad macroeconomic",402,62,132,88,guatemala_2003_NationalDefenceBook_noneng.md,2025-01-28 18:57:01
353,"##a, y estar acorde a los indicadores establecidos para cada ejercicio fiscal, en relacion con el nivel de endeudamiento interno y externo del pais. la inversion en defensa, es un componente del gasto publico, destinado a contribuir con la seguridad y estabilidad de la nacion, constituyendose en una de las condiciones para el logro del bienestar economico social. por lo anterior, esta debe estar inter",404,65,132,88,guatemala_2003_NationalDefenceBook_noneng.md,2025-01-28 18:57:01
354,"##relacionada con las actuaciones de los diferentes organismos de la administracion publica, principalmente con los sectores de educacion, salud e infraestructura nacional para alcanzar el desarrollo de la nacion. por ello, guarda concordancia con las prioridades de las politicas gubernamentales en materia social y por lo dispuesto en los acuerdos de paz. de esa cuenta, el gasto en defensa establecido en un 0. 66 % del pi",425,67,133,88,guatemala_2003_NationalDefenceBook_noneng.md,2025-01-28 18:57:01
355,"##b de conformidad con el compromiso 63. c. del acuerdo sobre el fortalecimiento del poder civil y funcion del ejercito en una sociedad democratica, ha pasado a ser en orden de prioridades, menor al de educacion y salud, lo cual se ilustra en la siguiente grafica. para cumplir con la mision constitucional, las autoridades responsables de la defensa nacional deben orientar el gasto atendiendo criterios tales como",415,67,132,88,guatemala_2003_NationalDefenceBook_noneng.md,2025-01-28 18:57:01
356,": garantizar el poder disuasivo del estado, fortaleciendo la capacidad tactica y operacional con base en las diferentes hipotesis de amenaza a la seguridad nacional, a traves de la defensa de los espacios terrestre, aereo y maritimo ; asi como por medio de las reservas militares. en congruencia con la politica de modernizacion del estado, se deben fortalecer los programas de capacitacion y entrenamiento",406,64,130,88,guatemala_2003_NationalDefenceBook_noneng.md,2025-01-28 18:57:01
357,"del recurso humano, con el fin de cumplir con las diferentes actividades en forma calificada y profesional, a traves de las escuelas de formacion, centros de profesionalizacion de educacion vocacional, instruccion y entrenamiento militar, tanto en guatemala como en el extranjero. ademas, considerar las demandas provenientes del apoyo a otras instituciones vinculadas con los temas emergentes. los gastos para",410,59,130,88,guatemala_2003_NationalDefenceBook_noneng.md,2025-01-28 18:57:01
358,"la defensa, comprenden : costos laborales, operaciones y mantenimiento, adquisicion de material belico, investigacion y desarrollo, construccion, fondos de pensiones, agregadurias militares ( terrestre, naval y aerea ), programas de relaciones publicas, instituciones de salud y educacion, inteligencia, radiocomunicaciones y programas civicos, y las contribuciones a instituciones internacionales cast",402,49,130,88,guatemala_2003_NationalDefenceBook_noneng.md,2025-01-28 18:57:01
359,"##renses como la conferencia de fuerzas armadas de centroamerica cfac y la conferencia de ejercitos americanos cea, entre otras.",128,19,44,88,guatemala_2003_NationalDefenceBook_noneng.md,2025-01-28 18:57:01
360,"# # 4. controles para el gasto en defensa con relacion a la definicion y conceptualizacion de los controles descritos en capitulos anteriores, para el caso de la fiscalizacion del gasto en defensa, se consideran los siguientes controles del estado :",249,41,75,89,guatemala_2003_NationalDefenceBook_noneng.md,2025-01-28 18:57:01
361,"# # 4. 1. controles externos el gasto de defensa es una decision politica y cuenta con sus respectivos controles, siendo el organismo legislativo el responsable de aprobar, modificar o improbar, el presupuesto de ingresos y egresos del estado. en este caso el ejecutivo envia el proyecto de presupuesto al congreso, el cual podra ser modificado o ajustado por este mismo organismo para",385,63,130,90,guatemala_2003_NationalDefenceBook_noneng.md,2025-01-28 18:57:01
362,"responder a los objetivos trazados en la constitucion politica de la republica. el congreso de la republica, de acuerdo con su ley organica, a traves de la comision de apoyo tecnico puede verificar la consistencia programatica con el objeto de buscar la transparencia en la programacion y ejecucion del presupuesto del estado, al igual que los diputados y en particular cada una de las comisiones que fiscalizan y supervis",422,69,130,90,guatemala_2003_NationalDefenceBook_noneng.md,2025-01-28 18:57:01
363,"##an, asi como solicitan informacion sobre el gasto en defensa y en todo caso apoyan o se oponen a iniciativas para cubrir sus prioridades. ademas la comision de finanzas da seguimiento a la ejecucion presupuestaria en esta y otras materias. otro control estatal es ejercido por la contraloria general de cuentas de la nacion, quien audita el presupuesto general de ingresos y egresos del minister",397,65,132,90,guatemala_2003_NationalDefenceBook_noneng.md,2025-01-28 18:57:01
364,"##io de la defensa nacional, asignado para cada ano fiscal. esta actividad es realizada por una delegacion de esta institucion, quienes con caracter permanente se ubican en el departamento de finanzas del ejercito para el ejercicio de su funcion fiscalizadora.",260,40,83,90,guatemala_2003_NationalDefenceBook_noneng.md,2025-01-28 18:57:01
365,"# # 4. 2. controles internos el ministerio de la defensa nacional, como ente constitucional responsable de la defensa, mantiene sus propios controles a traves de la auditoria militar de cuentas, quien fiscaliza a los comandos y dependencias militares. asimismo, la auditoria interna del departamento de finanzas del ejercito, es la encargada de ejercer controles sobre la ejecucion presupuestaria de este minister",413,62,130,91,guatemala_2003_NationalDefenceBook_noneng.md,2025-01-28 18:57:01
366,"##io. a su vez, la inspectoria general del ejercito, por medio de la inspectoria de control tecnico, bienes muebles e inmuebles ; es responsable de supervisar el manejo de los fondos asignados a las diferentes dependencias militares, e informar al estado mayor de la defensa nacional los resultados de la ejecucion de estas asignaciones.",337,54,106,91,guatemala_2003_NationalDefenceBook_noneng.md,2025-01-28 18:57:01
367,"# # 5. destino de los recursos para la defensa determinar el destino de los recursos para la defensa debe responder a las prioridades que demanda la sociedad, tomando en cuenta la mision, asi como las politicas de estado consensuadas con base a un sistema solido de principios y flexible para ajustarse a los imperativos de un mundo cambiante. al establecer metas del gasto en defensa, vinculadas a las prioridad",412,70,130,92,guatemala_2003_NationalDefenceBook_noneng.md,2025-01-28 18:57:01
368,"##es acordadas con la sociedad, se fortalece la confianza ciudadana ante la politica de defensa como contribucion al bien comun establecido en la constitucion politica de la republica. el gasto implementado de esta manera, expresa la convergencia de los planes de desarrollo del pais, las posibilidades de la economia y los imperativos de las amenazas. en la practica, el gasto en defensa se orienta al",402,65,132,92,guatemala_2003_NationalDefenceBook_noneng.md,2025-01-28 18:57:01
369,"fortalecimiento de las capacidades para realizar operaciones tanto militares como de aquellas no tradicionales, tales como el apoyo para la restauracion del orden publico provocado por desordenes sociales y la contribucion orientada a mitigar el efecto nocivo de los desastres naturales o antropogenicos. uno de los enfoques principales del presupuesto es lo referido a la capacitacion del recurso humano, lo cual abarca program",428,63,130,92,guatemala_2003_NationalDefenceBook_noneng.md,2025-01-28 18:57:01
370,"##as de apoyo derivados de los tratados nacionales e internacionales de los cuales el estado de guatemala es signatario, por lo que tiene potestad de participar en programas de cooperacion en materia de defensa. actualmente, los recursos provenientes de la cooperacion para la defensa, se dan en el area academica, principalmente en la profesionalizacion y la capacitacion de oficiales del ejercito, en las diferentes especializaciones que implica la",450,68,132,92,guatemala_2003_NationalDefenceBook_noneng.md,2025-01-28 18:57:01
371,"carrera militar tanto en guatemala como en el exterior. es importante mencionar, que como parte de los programas de cooperacion, se ha capacitado a personal de la sociedad civil guatemalteca en temas de seguridad y defensa, esto a traves de diferentes cursos y seminarios. la capacitacion del personal civil se hace con el proposito de fortalecer la cultura y comunidad de defensa, para crear conciencia en cada uno de ellos que la def",435,73,130,92,guatemala_2003_NationalDefenceBook_noneng.md,2025-01-28 18:57:01
372,"##ensa de la nacion no es una exclusividad de las fuerzas armadas, sino que es responsabilidad de todos los guatemaltecos.",122,20,45,92,guatemala_2003_NationalDefenceBook_noneng.md,2025-01-28 18:57:01
373,"# # 6. requerimientos de los recursos para defensa la asignacion de recursos para la implementacion de programas y proyectos, se basa en la planificacion del presupuesto en materia de defensa que, como cualquier otro presupuesto del estado, se hace dentro del marco juridico establecido, y debe responder a los objetivos de la nacion, trazados en la politica de defensa. la adquisicion de",388,63,130,93,guatemala_2003_NationalDefenceBook_noneng.md,2025-01-28 18:57:01
374,"un bien nacional es una decision politica, con base a criterios tecnicos, ejecutada por administradores publicos. actualmente, los procedimientos para llevar a cabo las adquisiciones de bienes o servicios para la defensa, se hacen de acuerdo a las necesidades y por medio de directivas elaboradas por el ministerio de la defensa nacional, las cuales norman el uso de los recursos economicos, humanos, materiales y energetic",423,65,130,93,guatemala_2003_NationalDefenceBook_noneng.md,2025-01-28 18:57:01
375,"##os. estas directivas son constantemente revisadas, actualizadas y supervisadas de acuerdo con los avances tecnologicos e institucionales ; tomando como referencia la ley de compras y contrataciones del estado. el presupuesto para la defensa, toma en cuenta tres aspectos. el primero de ellos es el aspecto politico donde entran en juego las politicas de seguridad y defensa nacional, es decir, la definicion",409,62,132,93,guatemala_2003_NationalDefenceBook_noneng.md,2025-01-28 18:57:01
376,"de instituciones que participan en la ejecucion de la politica de la defensa y las amenazas identificadas por las mismas. el segundo es el aspecto tecnico que abarca el marco conceptual, la metodologia, las caracteristicas administrativas y legales de la legislacion presupuestaria vigente. finalmente, el aspecto financiero, que toma en cuenta las prioridades, capacidad financiera del estado",393,57,130,93,guatemala_2003_NationalDefenceBook_noneng.md,2025-01-28 18:57:01
377,", propuestas y demandas de la sociedad y el costo de los programas a desarrollar en el contexto de la defensa nacional. en la actualidad los recursos para la defensa se dividen en cuatro grandes categorias programaticas, siendo estas : la defensa de la soberania nacional e integridad territorial, la educacion militar, la salud militar y servicio social, y la de ingenieria militar. ( ver grafica )",399,67,126,93,guatemala_2003_NationalDefenceBook_noneng.md,2025-01-28 18:57:01
378,"# # 7. industria militar la produccion de recursos materiales para la defensa en guatemala parte de una epoca de dependencia de paises amigos desarrollados, quienes a traves de programas de cooperacion contribuyeron con estos insumos, hasta periodos que, por aspectos de coyuntura politica, originaron una reduccion en el apoyo, para proveer al pais de estos recursos. esta situacion condujo al nacimiento y en al",413,65,130,94,guatemala_2003_NationalDefenceBook_noneng.md,2025-01-28 18:57:01
379,"##gunos casos, al fortalecimiento de la industria militar guatemalteca, con el unico proposito de obtener los recursos materiales necesarios para la defensa de la nacion. esta industria militar, se entiende como el proceso de elaboracion y produccion de los recursos necesarios para materializar la defensa, principalmente habiendo producido equipo, vestuario, armamento y municiones para us",391,55,132,94,guatemala_2003_NationalDefenceBook_noneng.md,2025-01-28 18:57:01
380,##o del ejercito.,17,3,11,94,guatemala_2003_NationalDefenceBook_noneng.md,2025-01-28 18:57:01
381,"# # 8. vision del presupuesto y gasto para la defensa la politica de defensa incluye la idea que el gasto y presupuesto de defensa sean continuamente revisados por los sectores academicos y politicos, promoviendose de esta forma investigaciones y contribuciones acerca de los metodos para evaluar los recursos asignados a la defensa enmarcado en la tematica de desarrollo, la economia y",386,62,130,95,guatemala_2003_NationalDefenceBook_noneng.md,2025-01-28 18:57:01
382,"las amenazas. los aportes analiticos provenientes de la incorporacion de los sectores mencionados, elaborados con independencia del sistema de defensa, generaran propuestas objetivas traducidas en valor agregado y en calidad de toma de decisiones, utiles para el mejoramiento continuo de la gestion de defensa. en este sentido, la politica de defensa considera que es posible la diversificacion del gasto",404,59,130,95,guatemala_2003_NationalDefenceBook_noneng.md,2025-01-28 18:57:01
383,"de defensa en tres areas : una de ellas, los recursos para la defensa nacional en la cual se involucra a todas las instituciones del estado en materia de defensa. una segunda area, la constituye los recursos para el ministerio de la defensa nacional. finalmente, la tercera area esta conformada por los recursos para el ejercito de guatemala o gasto militar. en todo caso, el origen y destino de los recursos para la",416,73,130,95,guatemala_2003_NationalDefenceBook_noneng.md,2025-01-28 18:57:01
384,"defensa nacional no es un patrimonio exclusivo del ambito militar, en ella deben participar todos los componentes de la sociedad, para lo cual sera necesario desarrollar las capacidades nacionales que confluyan para generar una adecuada politica de defensa de la nacion. en consecuencia, para el fortalecimiento de la democracia, el estado fomentara la actividad economica y financiera encaminada a sat",402,60,130,95,guatemala_2003_NationalDefenceBook_noneng.md,2025-01-28 18:57:01
385,"##isfacer las necesidades de la poblacion para garantizar el bien comun de sus habitantes y cumplir con los objetivos permanentes, trazados en la constitucion politica de la republica.",184,28,61,95,guatemala_2003_NationalDefenceBook_noneng.md,2025-01-28 18:57:01
386,"# # apreciacion politico - estrategica : analisis sistematico de la situacion interna e internacional para identificar las potencialidades y vulnerabilidades del pais, asi como las interferencias que podria encontrar en la consecucion de los objetivos nacionales. de ella se derivan oportunidades e hipotesis de conflicto. es un documento basico en la elaboracion de las politicas de seguridad y de defensa.",407,61,128,96,guatemala_2003_NationalDefenceBook_noneng.md,2025-01-28 18:57:01
387,"# # concepto estrategico nacional : enuncia en terminos amplios el comportamiento conveniente de la nacion en presencia del problema de seguridad y desarrollo nacional, es decir, traza los rumbos de la politica de defensa, seguridad y desarrollo.",246,38,81,97,guatemala_2003_NationalDefenceBook_noneng.md,2025-01-28 18:57:01
388,"# # concepto estrategico de desarrollo : idea general de accion estrategica en el campo de la politica general, derivada del plan nacional de desarrollo, y concebida por el ejecutivo de la nacion, para orientar las acciones necesarias a la consecucion de sus propios objetivos estrategicos.",290,46,94,98,guatemala_2003_NationalDefenceBook_noneng.md,2025-01-28 18:57:01
389,"# # concepto estrategico militar : idea general de accion estrategica en el campo de la politica militar, derivado del plan de defensa y seguridad nacional y concebido por el estado mayor de la defensa nacional y enunciado por el ministro de la defensa nacional, para orientar las acciones necesarias a la consecucion de sus propios objetivos estrategicos.",356,58,113,99,guatemala_2003_NationalDefenceBook_noneng.md,2025-01-28 18:57:01
390,"# # controles democraticos : estos controles se concretan en un conjunto de procedimientos, cuyo proposito es que el estado lleve a cabo sus funciones en condiciones de eficacia, eficiencia, legalidad y legitimidad ; debiendose entender los controles como un sistema integral, no como acciones aisladas de los entes que los componen.",333,52,109,100,guatemala_2003_NationalDefenceBook_noneng.md,2025-01-28 18:57:01
391,"# # cooperacion integral : se entiende como el conjunto de medidas que se establecen en un pais, con el fin de garantizar la seguridad del sistema del estado en todo tiempo, en toda circunstancia y contra todas las formas de agresion, asi como, contra la accion de los fenomenos de la naturaleza. este conjunto de medidas conducen al establecimiento de un sistema politico - administrativomilitar funcional",406,67,130,101,guatemala_2003_NationalDefenceBook_noneng.md,2025-01-28 18:57:01
392,", que permite coordinar y hacer converger los esfuerzos para contribuir al logro de los objetivos de la cooperacion integral. el establecimiento de este sistema depende entre otros factores, de la situacion geografica del pais, su superficie, su regimen politico, sus amenazas eventuales, la organizacion del estado, su demarcacion administrativa y",348,51,111,101,guatemala_2003_NationalDefenceBook_noneng.md,2025-01-28 18:57:01
393,"# # cultura de defensa : expresa el conocimiento, interes y deseo de incidencia en el tema de seguridad y defensa, por parte de diversos actores sociales y del estado, promoviendo a su vez en los ciudadanos el percibir como propias las cuestiones relacionadas con seguridad, libertad y la defensa de sus intereses.",314,53,105,102,guatemala_2003_NationalDefenceBook_noneng.md,2025-01-28 18:57:01
394,"# # desarrollo politico : proceso de cambio progresivo en el sistema y las instituciones politicas del estado hacia un perfeccionamiento, en el cual dentro de un marco juridico establecido ; se garantizan el libre juego de las instituciones y la libre participacion de los ciudadanos en el quehacer del estado. se sustenta en el dialogo permanente entre los poderes del estado.",377,62,121,103,guatemala_2003_NationalDefenceBook_noneng.md,2025-01-28 18:57:01
395,"# # desarrollo sostenible : es un proceso de cambio progresivo en la calidad de vida del ser humano, que lo coloca como centro y sujeto primordial del desarrollo, por medio del crecimiento economico con equidad social, transformacion de los metodos de produccion y de los patrones de consumo ; sustentandose en el equilibrio ecologico y el soporte vital de la region. este proceso implica el respeto a la divers",411,70,130,104,guatemala_2003_NationalDefenceBook_noneng.md,2025-01-28 18:57:01
396,"##idad etnica y cultural local, nacional y regional, asi como el fortalecimiento y la plena participacion ciudadana, en convivencia pacifica y en armonia con la naturaleza, sin comprometer la calidad de vida de las generaciones futuras.",236,36,69,104,guatemala_2003_NationalDefenceBook_noneng.md,2025-01-28 18:57:01
397,"# # despliegue : asignacion de unidades en las diferentes areas o sectores estableciendoles sus misiones ofensivas o defensivas, los mecanismos de coordinacion y la delegacion expresa o tacitamente de las responsabilidades derivadas de las ordenes de operaciones.",263,38,89,105,guatemala_2003_NationalDefenceBook_noneng.md,2025-01-28 18:57:01
398,"# # directiva : comunicacion militar, oral o escrita, en la cual se establece una politica y se ordena una accion especifica.",125,22,47,106,guatemala_2003_NationalDefenceBook_noneng.md,2025-01-28 18:57:01
399,# # dispositivo estrategico : distribucion de las fuerzas para ser empleadas en el teatro de guerra y en los teatros de operaciones de modo que puedan actuar en forma coordinada y conjunta como una sola unidad.,210,37,73,107,guatemala_2003_NationalDefenceBook_noneng.md,2025-01-28 18:57:01
400,"# # disuasion : actividades emprendidas por un estado o grupo de estados para desalentar a otros a que prosigan politicas indeseables para los disuasores. incluye el aumento de las capacidades militares, celebracion de alianzas y persuasion para las partes a quienes se dirige la certeza del empleo de la fuerza de ser",318,53,104,108,guatemala_2003_NationalDefenceBook_noneng.md,2025-01-28 18:57:01
401,"# # doctrina militar : conjunto armonico y sistematizado de principios, propositos, educacion, adiestramiento y equipamiento militar de las fuerzas armadas, con la finalidad de garantizar el entendimiento mutuo entre sus integrantes, para obtener dentro de un marco de congruencias con nuestra filosofia politica, mayor eficiencia en el cumplimiento de las misiones que les marcan",380,55,130,109,guatemala_2003_NationalDefenceBook_noneng.md,2025-01-28 18:57:01
402,la ley y reglamentos correspondientes.,38,5,13,109,guatemala_2003_NationalDefenceBook_noneng.md,2025-01-28 18:57:01
403,"# # doctrina militar del ejercito de guatemala : es el conjunto de principios, valores, normar y sistemas que gobiernan la conducta del ejercito de guatemala en su participacion en la busqueda, consecucion y preservacion de los objetivos nacionales, en particular los relativos a la seguridad y defensa de la soberania, independencia e integridad territorial de la republica. esta fundamentada en el respeto a",409,64,130,110,guatemala_2003_NationalDefenceBook_noneng.md,2025-01-28 18:57:01
404,"la constitucion de la republica y demas leyes internas asi como en los tratados internaciones que en materia de seguridad y defensa ha ratificado el estado de guatemala. tambien se inspira en el estudio de la historia de las guerras nacionales y en el analisis e incorporacion de las lecciones derivadas de sus propias experiencias o las de otras fuerzas armadas, que puedan adecuarse a las condiciones particulares del",419,69,130,110,guatemala_2003_NationalDefenceBook_noneng.md,2025-01-28 18:57:01
405,"pais. esta basada fundamentalmente en una politica de defensa. esta se caracteriza por ser preventiva, desarrollando esfuerzos para evitar el enfrentamiento y el uso de las armas, empleando medidas persuasivas y disuasivas. todo ello, en permanente observancia y respeto de los derechos humanos y en concordancia con el acuerdo de paz firme y duradera.",352,54,119,110,guatemala_2003_NationalDefenceBook_noneng.md,2025-01-28 18:57:01
406,"# # especialista militar : personal tecnico calificado para ejecutar una tarea militar especifica, basado en capacitacion y experiencia.",136,19,50,111,guatemala_2003_NationalDefenceBook_noneng.md,2025-01-28 18:57:01
407,# # especies estancadas : toda aquella materia prima con la cual se elaboran materiales explosivos.,99,16,35,112,guatemala_2003_NationalDefenceBook_noneng.md,2025-01-28 18:57:01
408,"# # estado de apresto : estado de equipamiento, personal, abastecimiento y adiestramiento, de una fuerza o unidad aerea o naval, para entrar en combate en caso de recibirse la orden. tambien conocido como estado de listeza operacional.",235,38,78,113,guatemala_2003_NationalDefenceBook_noneng.md,2025-01-28 18:57:01
409,"# # hipotesis de conflicto : escenario eventual o prospectivo de colision entre dos o mas estados, donde se amenaza con el empleo o se emplea la fuerza y que se funda, sobre dispar idad de interes y determinantes historicas, geograficas ideologicas y de otro tipo. su probabilidad de ocurrencia es variable. por una parte depende de la calidad del analisis prospectivo ; por otra, de la capacidad de manejo y control",416,72,130,114,guatemala_2003_NationalDefenceBook_noneng.md,2025-01-28 18:57:01
