chunk_id,text,char_length,word_count,token_count,section_index,source_file,processed_date
1,fecha : 01 / 11 / 2003 idioma : espanol libro de la defensa nacional de la republica de guatemala indice prologo presentacion primera parte : guatemala descripcion geografica poblacion patrimonio nacional segunda parte : fundamentos de la defensa capitulo i : el estado de guatemala 1. definicion del estado 2. configuracion del estado 2. 1. identidad nacional 2. 2. estado de derecho y democracia 2. 3. territorio nacional 3,425,70,130,0,guatemala_2003_NationalDefenceBook_noneng.md,2025-01-28 18:57:01
2,. funciones del estado 4. objetivos nacionales 5. objetivos nacionales actuales capitulo ii : entornos de la defensa 1. el escenario internacional 1. 1. la dinamica del escenario 1. 2. la interrelacion e interdependencia de los estados 2. la dinamica hemisferica 2. 1. el sistema interamericano 2. 2. la democracia y la seguridad continental 3. la dimension regional 3. 1. el ambito regional 3.,394,64,130,0,guatemala_2003_NationalDefenceBook_noneng.md,2025-01-28 18:57:01
3,2. centroamerica : zona de paz y cooperacion 4. la estrategia internacional 4. 1. principios de la estrategia 4. 2. operaciones de mantenimiento de la paz 4. 3. comision de seguridad de centroamerica 4. 4. conferencia de las fuerzas armadas centroamericanas 5. panorama de riesgos 5. 1. la nueva fisonomia del conflicto 5. 2. los temas emergentes tercera parte : la defensa capitulo iii : la defensa nacional,408,68,130,0,guatemala_2003_NationalDefenceBook_noneng.md,2025-01-28 18:57:01
4,1. politica de estado : el desarrollo y la seguridad 1. 1. politica de estado 1. 2. el desarrollo 1. 3. la seguridad 2. la defensa nacional 2. 1. objetivos de la defensa nacional 2. 2. caracteristicas de la defensa 2. 3. funciones de la defensa ` ` ` capitulo iv : politica de defensa 1. politica de defensa 2. fundamento de la politica de def,343,66,130,0,guatemala_2003_NationalDefenceBook_noneng.md,2025-01-28 18:57:01
5,##ensa 3. fines de la politica de defensa 4. caracteristicas de la politica de defensa 5. contenido de la politica de defensa 6. politica de defensa y politica exterior capitulo v : controles democraticos 1. controles democraticos y la defensa nacional 2. control legislativo 3. auditoria social 4. cultura de defensa ` ` ` capitulo vi : organizacion general de la defensa 1. estructura superior de la defensa 1,411,69,132,0,guatemala_2003_NationalDefenceBook_noneng.md,2025-01-28 18:57:01
6,. 1. presidencia de la republica 1. 2. ministerio de la defensa nacional 1. 3. estado mayor de la defensa nacional capitulo vii : movilizacion y servicio civico 1. movilizacion 2. situacion de reserva para la defensa nacional 3. servicio civico 3. 1. objetivos 3. 2. formas de prestacion del servicio civico cuarta parte : medios para la defensa capitulo viii : ejercito de guatemala 1. ins,390,67,130,0,guatemala_2003_NationalDefenceBook_noneng.md,2025-01-28 18:57:01
7,##titucionalizacion 2. fines y funciones del ejercito 3. organizacion y despliegue del ejercito de guatemala 3. 1. organizacion 3. 2. estado mayor de la defensa nacional 3. 3. el dispositivo de las fuerzas 4. participacion del ejercito en operaciones de mantenimiento de la paz y operaciones humanitarias capitulo ix : fuerzas de tierra 1. generalidades 2. creacion 3. mis,372,59,132,0,guatemala_2003_NationalDefenceBook_noneng.md,2025-01-28 18:57:01
8,##ion 4. organizacion 4. 1. unidades de combate 4. 2. unidades de apoyo de combate 4. 3. unidades de apoyo de servicio de combate 4. 4. reserva terrestre 5. capacidades capitulo x : fuerzas de aire 1. generalidades 2. creacion 3. mision 4. organizacion 4. 1. comandos aereos 4. 2. escuelas de formacion 4. 3. reserva aerea 5. cap,329,59,132,0,guatemala_2003_NationalDefenceBook_noneng.md,2025-01-28 18:57:01
9,##acidades capitulo xi : fuerzas de mar 1. generalidades 2. creacion 3. mision 4. organizacion 4. 1. unidades de comando 4. 1. 1. comando naval 4. 1. 2. bases navales 4. 1. 3. reserva naval 4. 1. 4. escuela naval 4. 2. unidades operacionales 4. 2. 1. escuadra 4. 2. 2. comando de infanteria de marina 4. 2. 3. cuerpo de policia naval 5,335,64,131,0,guatemala_2003_NationalDefenceBook_noneng.md,2025-01-28 18:57:01
10,. capacidades capitulo xii : la modernizacion : un desafio 1. generalidades 2. profesionalizacion 3. educacion militar 3. 1. formacion vocacional 3. 2. formacion del personal de oficiales 3. 3. profesionalizacion del personal de oficiales 3. 4. capacitacion del personal de especialistas 3. 5. instruccion del personal de tropa 4. la doctrina 4. 1. definicion 4. 2. criterios basicos para,388,60,130,0,guatemala_2003_NationalDefenceBook_noneng.md,2025-01-28 18:57:01
11,la formulacion de la doctrina 5. comando de educacion y doctrina,64,11,22,0,guatemala_2003_NationalDefenceBook_noneng.md,2025-01-28 18:57:01
12,# quinta parte : recursos para la defensa capitulo xiii : recursos para la defensa 1. los recursos 2. politica de defensa : componentes de financiamiento 3. inversion en defensa como parte de la seguridad nacional 4. controles para el gasto en defensa 4. 1. controles externos 4. 2. controles internos 5. destino de los recursos para la defensa 6. requerimientos de los recursos para defensa 7. indus,400,68,130,1,guatemala_2003_NationalDefenceBook_noneng.md,2025-01-28 18:57:01
13,##tria militar 8. vision del presupuesto y gasto para la defensa glosario proceso de diseno y formulacion de la politica de defensa acuerdo gubernativo 456 - 2001 fuente : ministerio de la defensa nacional republica de guatemala,228,37,74,1,guatemala_2003_NationalDefenceBook_noneng.md,2025-01-28 18:57:01
14,"# # prologo la guatemala de los acuerdos de paz, es un pais que ha ido consolidando la democracia, la vigencia del estado de derecho, el respeto de los derechos humanos y la inclusion de todos los pueblos que componen la nacion. esa es la base para proseguir la gestion para disminuir la pobreza, aumentar el acceso de todos los guatemaltecos y guatemaltecas a la salud, la educacion y",385,69,130,2,guatemala_2003_NationalDefenceBook_noneng.md,2025-01-28 18:57:01
15,"el empleo, desterrar la discriminacion, garantizar la seguridad ciudadana, y en ultima instancia construir la cultura de paz. las grandes transformaciones derivadas de los acuerdos de paz han incluido la reforma y democratizacion del estado. la gestion publica debe ser no solamente mas eficiente y eficaz, sino mas transparente y participativa, para que los ciudadanos y ciudadanas la sientan como propia. en es",412,63,130,2,guatemala_2003_NationalDefenceBook_noneng.md,2025-01-28 18:57:01
16,"##e espiritu, ofrecemos hoy por primera vez en la historia del estado, un libro de la defensa nacional, que sienta las bases para el diseno de una politica de defensa nacional, y que como todas las politicas publicas, debe ser conocida y debatida por los ciudadanos. el texto es producto de un ejercicio abierto, participativo y transparente, que permitio a representantes gubernamentales y de la sociedad civil analizar",420,68,132,2,guatemala_2003_NationalDefenceBook_noneng.md,2025-01-28 18:57:01
17,"con profundidad las acciones en la busqueda del desarrollo de nuestra sociedad, identificar vulnerabilidades y capacidades del estado ; hacer explicitos los objetivos nacionales permanentes y proponer la organizacion de acciones para cumplir el mandato constitucional de garantizar la vida, la libertad, la paz y el desarrollo integral de la persona humana, asi como observar el cumplimiento de los compromisos",410,60,130,2,guatemala_2003_NationalDefenceBook_noneng.md,2025-01-28 18:57:01
18,"emanados de la paz. debo destacar, asimismo, el acompanamiento de la comunidad internacional a este proceso, en particular de el sistema de las naciones unidas y de la organizacion de los estados americanos. el libro de la defensa nacional tiene como objetivo : transparentar a la comunidad internacional nuestro concepto y finalidades de la defensa nacional, entendida en el entorno de nuestros compromisos regionales centroamericanos, con el",443,67,130,2,guatemala_2003_NationalDefenceBook_noneng.md,2025-01-28 18:57:01
19,"sica, hemisfericos con la organizacion de los estados americanos y mundiales con la organizacion de las naciones unidas y sus espacios derivados, aportando asi a las medidas de confianza mutua. nuestra idea de defensa no es aislada, sino es parte de la arquitectura de defensa y seguridad de nuestro tiempo, colectiva, cooperativa ; para la defensa conjunta de la democracia, la paz,",383,62,130,2,guatemala_2003_NationalDefenceBook_noneng.md,2025-01-28 18:57:01
20,"la cooperacion y el tratamiento de los riesgos de esta epoca, entre los cuales destaca el terrorismo y el crimen internacional organizado. por esa razon, el libro incorpora los compromisos internacionales en el entorno de seguridad y defensa del hemisferio occidental y mundial. buscamos iniciar con este documento un debate sostenido sobre la defensa nacional entre el estado y la sociedad civil, a fin de que la determinacion de",430,69,130,2,guatemala_2003_NationalDefenceBook_noneng.md,2025-01-28 18:57:01
21,"nuestras necesidades de defensa y los medios de atenderla, sean comprendidos por todos. a la larga esperamos que se conforme una comunidad de defensa, que permita la interiorizacion de sus temas en forma permanente en el intercambio social. este es un paso necesario en la consolidacion de la profesionalizacion de nuestras fuerzas armadas en el nuevo entorno surgido de la paz y de los cambios internacionales. el libro",420,68,130,2,guatemala_2003_NationalDefenceBook_noneng.md,2025-01-28 18:57:01
22,"es el primer paso para constituir una politica publica en materia de defensa nacional. posteriormente se deberan tomar las acciones necesarias para institucionalizar y legalizar sus enunciados. el libro, es asi un ejemplo mas de un estado y un pais renovados. hagamos entre todos y todas un esfuerzo sostenido para concluir esa tarea. alfonso portillo cabrera presidente constitucional de la republica",401,61,130,2,guatemala_2003_NationalDefenceBook_noneng.md,2025-01-28 18:57:01
23,de guatemala.,13,2,5,2,guatemala_2003_NationalDefenceBook_noneng.md,2025-01-28 18:57:01
24,"# # presentacion como resultado de las tendencias mundiales, se ha identificado la necesidad de elaborar e intercambiar documentos en donde se plasmen las aspiraciones de los pueblos en su legitimo derecho a la defensa, ademas de ser un util mecanismo de fomento de las medidas de confianza y transparencia para la promocion de la seguridad entre los paises que conforman el concierto de naciones. el libro de",409,68,130,3,guatemala_2003_NationalDefenceBook_noneng.md,2025-01-28 18:57:01
25,"la defensa nacional de guatemala, marca el inicio de una nueva epoca en el quehacer de la defensa nacional y de igual forma para la region centroamericana en la vision de un futuro a compartir, pleno de desafios y oportunidades para todo el istmo. esto es el resultado de un proceso de construccion de consensos, el cual se matiza de elementos fundamentales como la tolerancia, la legalidad, la legitimidad y la transparencia",425,72,130,3,guatemala_2003_NationalDefenceBook_noneng.md,2025-01-28 18:57:01
26,"de su desarrollo, a traves de una serie de eventos que fueron construyendo el andamiaje necesario para la cristalizacion de este proyecto que me permito presentar a mis compatriotas y a los estados amigos, como el primer esfuerzo conjunto realizado por un grupo de guatemaltecas y guatemaltecos alrededor de los temas de la defensa. el proceso de diseno y formulacion de la politica de defens",392,65,130,3,guatemala_2003_NationalDefenceBook_noneng.md,2025-01-28 18:57:01
27,"##a, es el testimonio fehaciente de una nueva etapa de la dinamica de las relaciones entre la sociedad y el estado guatemalteco, partiendo del reconocimiento de la unidad en la diversidad. el ambiente favorable y la discusion objetiva dentro de una atmosfera de respeto, permitieron superar divergencias a traves de un dialogo sustentado en la confianza y comunicacion sincera entre los diversos actores, que lograron transform",427,66,132,3,guatemala_2003_NationalDefenceBook_noneng.md,2025-01-28 18:57:01
28,"##ar la critica en propuesta concreta, mejorando los acuerdos alcanzados y fortaleciendo el proceso en si, el cual desemboca en lineas generales para la formulacion de una politica de estado orientada a resguardar nuestros intereses nacionales. el espectro en torno a la defensa es complejo, vinculante y fundamental para la pervivencia del estado, su tratamiento requiere de una comprension integral, incluyente y pre",418,63,132,3,guatemala_2003_NationalDefenceBook_noneng.md,2025-01-28 18:57:01
29,"##visora como fue este ejercicio intersectorial de dialogo del cual se logro un producto de incalculable valor para la maduracion de nuestra comunidad de defensa. dentro de este proceso, se desarrollaron diversas actividades orientadas a dar cumplimiento a compromisos politicos adquiridos, tanto a nivel nacional como internacional, tomando en cuenta necesidades del estado y considerando lineamientos sugeridos por organismos regionales como",443,61,132,3,guatemala_2003_NationalDefenceBook_noneng.md,2025-01-28 18:57:01
30,"la organizacion de los estados americanos, para discutir una politica de defensa, acorde a las necesidades nacionales ; de esta cuenta el ministerio de la defensa nacional, durante el mes de marzo del ano 2000, condujo el primer seminario internacional concerniente al tema, con participacion de civiles y militares, nacionales y extranjeros. continuando con el proceso de modernizacion del estado, el gobierno en el mes de julio de",432,68,130,3,guatemala_2003_NationalDefenceBook_noneng.md,2025-01-28 18:57:01
31,"2000, presento ante la sociedad guatemalteca la matriz de seguridad y defensa, en la cual declaro que : ""... la formulacion de la politica de defensa, para su desarrollo convocara a una mesa de consenso politico y social con la participacion de instituciones gubernamentales, la sociedad guatemalteca y el congreso de la republica, para su aprobacion y difusion asi como su evaluacion periodic",393,63,130,3,guatemala_2003_NationalDefenceBook_noneng.md,2025-01-28 18:57:01
32,"##a "". la secretaria de politica de defensa del ministerio de la defensa nacional, como instancia organizadora de todas las actividades inherentes al tema de la defensa nacional, inicio sus labores el 1 de agosto de 2001, integrada por civiles y militares que a partir de ese momento realizaron reuniones primarias de trabajo con el proposito de disenar el proyecto de acuerdo gubernativo que permitiria iniciar el proces",421,68,132,3,guatemala_2003_NationalDefenceBook_noneng.md,2025-01-28 18:57:01
33,"##o de diseno y formulacion de la politica de defensa nacional de la republica de guatemala, el cual se promulgo el 20 de noviembre de 2001. el acuerdo gubernativo 456 - 2001, institucionalizo dicho proceso declarando dentro de sus considerandos que * * ""... el estado de guatemala se * * organiza para proteger a la persona y a la familia ; que su fin supremo es la realizacion del bien comun, debiendo garantiza",413,74,132,3,guatemala_2003_NationalDefenceBook_noneng.md,2025-01-28 18:57:01
34,"##r a los habitantes de la republica la vida, la libertad, la justicia, la seguridad, la paz y el desarrollo integral "" de la misma forma que al iniciar un proceso orientado a * * ""... hacer explicita la politica de defensa nacional de guatemala. * * contribuyendo a la consolidacion y fortalecimiento de la democracia ; a generar mayores espacios de participacion ciudadana ; a fortalecer el proceso de moderniza",413,71,132,3,guatemala_2003_NationalDefenceBook_noneng.md,2025-01-28 18:57:01
35,"##cion y reforma del estado dentro de un ambiente de pluralismo, tolerancia, respeto mutuo y de reciprocidad para con los estados vecinos y, en general dentro del orden democratico mundial prevaleciente "". se instituyo a los miembros que integrarian el comite superior de conduccion colegiada cscc y del comite ejecutivo del proceso cep, responsables de cumplir con la tarea que finalizaria con la en",400,64,133,3,guatemala_2003_NationalDefenceBook_noneng.md,2025-01-28 18:57:01
36,"##trega del libro de la defensa nacional. en el transcurso de los meses de enero a septiembre de 2002, el comite ejecutivo del proceso, llevo a cabo reuniones ordinarias para delinear aspectos como bases para la convocatoria, listado de convocados y conferencistas. paralelo a esto el cep realizo acercamientos a diversas organizaciones de gobierno, grupos sociales, politicos y no gubernamentales,",398,60,132,3,guatemala_2003_NationalDefenceBook_noneng.md,2025-01-28 18:57:01
37,"incluidos los de derechos humanos, para sensibilizarlos sobre la importancia de la participacion de todos los sectores de la sociedad guatemalteca en este proceso. se consolidaron y concluyeron las bases de la convocatoria, propuestas de candidatos a moderadoresrelatores, conferencistas, programa preliminar y sesiones de trabajo. se integro el equipo de asesoria tecnica al proceso,",384,54,130,3,guatemala_2003_NationalDefenceBook_noneng.md,2025-01-28 18:57:01
38,"denominado equipo de seguimiento, desarrollo y redaccion, con participacion de profesionales civiles y militares. responsables de disenar las guias para los moderadoresrelatores y de debate de la tematica general para el desarrollo, las cuales se emplearon en las sesiones ordinarias y extraordinarias de que constaria el ejercicio academico que estaba por realizarse ; cubriendo a cabalidad la tematica general",411,59,130,3,guatemala_2003_NationalDefenceBook_noneng.md,2025-01-28 18:57:01
39,"propuesta. con el trabajo anteriormente descrito y con motivo de celebrar el lviii aniversario de la revolucion, el 20 de octubre de 2002, el senor presidente de la republica, hizo la formal convocatoria para participar en la mesa de politica de defensa ; resultado de esta convocatoria, surgieron las bases para el desarrollo del debate y fue designado un representante presidencial para la convocatoria a la socied",416,67,130,3,guatemala_2003_NationalDefenceBook_noneng.md,2025-01-28 18:57:01
40,"##ad civil. los objetivos generales trazados fueron disenar, formular, definir y adoptar una politica publica orientada al sector defensa, con el respaldo y legitimidad politico - social a traves del consenso y concertacion de voluntades e intereses nacionales, fortaleciendo la institucionalidad de organismos del estado en el quehacer de la defensa nacional. dentro de los grupos sociales convocados se pueden mencionar a organiza",432,63,132,3,guatemala_2003_NationalDefenceBook_noneng.md,2025-01-28 18:57:01
41,"##ciones del sector publico, universitario, representantes de pueblos indigenas, partidos politicos, profesionales, obrero - campesinopatronales, derechos humanos, medios de comunicacion, academicos y analistas independientes. de esta forma, de noviembre de 2002 hasta finales de mayo del presente ano, se realizaron diversas actividades. la sesion solemne de inauguracion, veinte sesiones ordinarias y dos extra",412,53,132,3,guatemala_2003_NationalDefenceBook_noneng.md,2025-01-28 18:57:01
42,"##ordinarias, que contaron con la participacion de expositores de paises amigos como argentina, brasil, chile, espana, mexico y peru, coadyuvando con el esfuerzo de cuarenta y cuatro expositores nacionales, contando tambien con la participacion de veintiun moderadores, especialistas en los diversos temas abordados en la tematica general y que permitieron producir los insumos empleados para redactar el presente libro.",420,59,132,3,guatemala_2003_NationalDefenceBook_noneng.md,2025-01-28 18:57:01
43,"el diseno y formulacion de la politica de defensa de la republica de guatemala, persigue obtener resultados en diferentes plazos, producto del consenso y del dialogo intersectorial, lo cual permitira en el futuro inmediato, estudiar y analizar los temas vinculados al ambito de la defensa nacional ; consolidando la "" comunidad de defensa "" con los actores de los diversos sectores de la sociedad guatemalteca. el li",416,67,130,3,guatemala_2003_NationalDefenceBook_noneng.md,2025-01-28 18:57:01
44,"##bro de la defensa nacional de guatemala, se inscribe en el marco del funcionamiento de la mesa intersectorial de dialogo sobre la politica de defensa, que conto con la facilitacion del sistema de las naciones unidas y la organizacion de los estados americanos en consulta con el gobierno de guatemala. las mesas intersectoriales de dialogo, surgen del mandato que el sistema de las naciones unidas y la organizacion de los estados americanos, rec",448,73,132,3,guatemala_2003_NationalDefenceBook_noneng.md,2025-01-28 18:57:01
45,"##iben del grupo consultivo para guatemala en febrero de 2002, en la ciudad de washington, d. c. esta reunion es el principal foro para el dialogo entre guatemala y la comunidad internacional, asi como para la coordinacion de la asistencia externa aportada desde la firma de los acuerdos de paz. uno de los principales temas que se analizan, es el progreso logrado por guatemala en sus esfuerzos por acelerar la marcha de los acuerdos de paz de 1996. la mesa",458,80,132,3,guatemala_2003_NationalDefenceBook_noneng.md,2025-01-28 18:57:01
46,"como espacio de dialogo estado - sociedad amplio y valido los debates y contenido final del libro de la defensa nacional de guatemala, en el reconocimiento de la incorporacion de la participacion, opinion y corresponsabilidad ciudadana en la formulacion y el diseno de la politica de defensa nacional. hoy mas que nunca, quienes conformamos esta gran nacion no podemos aislarnos del conocimiento, la participacion y la respon",425,67,130,3,guatemala_2003_NationalDefenceBook_noneng.md,2025-01-28 18:57:01
47,"##sabilidad de la defensa, debido a lo anterior, este libro nos facilita ver con mayor claridad, profundidad y alcance nuestras capacidades y medios para enfrentar los riesgos, las oportunidades y las amenazas de este tercer milenio, donde se desvanecen en forma vertiginosa los modelos y dogmas del pasado. el valor agregado de este proyecto es el grado de convergencia de los multiples componentes de la",405,65,132,3,guatemala_2003_NationalDefenceBook_noneng.md,2025-01-28 18:57:01
48,"sociedad guatemalteca, el reconocer como un punto de partida este dialogo sincero y fructifero en un tema de trascendencia nacional como lo es la defensa y el logro del bien comun de todos y cada uno de nuestros conciudadanos. el libro permite hoy por hoy a sus lectores en general visualizar la tematica de la defensa, con una integracion de ideas y conceptos de facil comprension, con el objet",395,69,130,3,guatemala_2003_NationalDefenceBook_noneng.md,2025-01-28 18:57:01
49,"##ivo de desarrollar una conciencia nacional en forma individual y colectiva de la responsabilidad que conlleva el resguardo de la nacion y sus intereses. el tema de la defensa abordado desde diversas corrientes y perspectivas, despliega un abanico de posiciones que coinciden y se plasman en las paginas de esta publicacion, como la preocupacion constante de mantener una defensa adecuada y acorde a las posi",409,65,132,3,guatemala_2003_NationalDefenceBook_noneng.md,2025-01-28 18:57:01
50,"##bilidades del estado de guatemala para alcanzar los objetivos nacionales permanentes. logrando con ello una convivencia con nuestros vecinos dentro de un marco de cooperacion, desarrollo e integracion. mas alla de los logros tangibles de este libro, se encuentran abiertas las oportunidades de fortalecer este proceso de diseno y formulacion de la politica de defensa, en los pasos sucesivos y necesarios para complementar el",427,64,132,3,guatemala_2003_NationalDefenceBook_noneng.md,2025-01-28 18:57:01
51,"estadio referente al andamiaje juridico nacional y regional de este tema. con este esfuerzo se genero una medida de confianza hacia el interior de la sociedad guatemalteca, al tener acceso a la arquitectura de su proteccion, en resguardo de su identidad y el ejercicio de su soberania. finalmente, deseo reconocer a los representantes de la sociedad guatemalteca que participaron activamente y que aceptaron el reto",415,65,130,3,guatemala_2003_NationalDefenceBook_noneng.md,2025-01-28 18:57:01
52,"de dar vida a este proceso, ya que sin ellas no hubiera sido posible enfrentar los desafios que conlleva un ejercicio de esta naturaleza y magnitud, en una sociedad como la nuestra, que aun se recupera de largos anos de enfrentamiento interno y transita el camino hacia la reconciliacion de nuestra nacion. pueblo de guatemala la defensa es responsabilidad de todos. general de division y licenciado robin mac",409,68,130,3,guatemala_2003_NationalDefenceBook_noneng.md,2025-01-28 18:57:01
53,##loni moran munoz ministro de la defensa nacional,50,8,17,3,guatemala_2003_NationalDefenceBook_noneng.md,2025-01-28 18:57:01
54,# primera parte : guatemala,27,5,8,4,guatemala_2003_NationalDefenceBook_noneng.md,2025-01-28 18:57:01
55,"# # guatemala la republica de guatemala situada en el centro del continente americano, limita al norte y al oeste con los estados unidos mexicanos ; al sur con el oceano pacifico y al este con las republicas de el salvador y honduras, el mar caribe y el estado de belice, con el que sostiene un diferendo territorial pendiente de resolver. los limites con los estados unidos mexicanos y con las republicas de el salvador y honduras estan definidos en los respectivos tratados de limites",486,85,130,5,guatemala_2003_NationalDefenceBook_noneng.md,2025-01-28 18:57:01
56,"en los cuales se fijaron los mismos. la division politico - administrativa del pais esta constituida por 22 departamentos, dividiendose en municipios que hacen un total de 331, organizandose estos a su vez en aldeas y caserios.",227,37,77,5,guatemala_2003_NationalDefenceBook_noneng.md,2025-01-28 18:57:01
