chunk_id,text,char_length,word_count,token_count,section_index,source_file,processed_date
112,"# # 2. la dinamica hemisferica 2. 1. el sistema interamericano en el contexto del sistema interamericano, se ha contribuido al diseno de una agenda de seguridad regional, perfilando una nueva institucionalidad sobre la base de la cooperacion y de la transparencia en las relaciones de defensa ( libros blancos, metodologia comun de medicion del gasto en defensa ), generando un clima de distension y un",402,66,130,17,guatemala_2003_NationalDefenceBook_noneng.md,2025-01-28 18:57:01
113,"ambiente de confianza. contribuye a ello, el tratamiento adecuado del tema de las armas de destruccion masiva ( tratado de tlatelolco, compromiso de mendoza, tratados de armas quimicas y bacteriologicas ) y la valoracion comun de la democracia y los derechos humanos recogida en la declaracion de la oea de santiago de 1991. asi como en la carta interamericana democratica de 2001. se establecio un marco de",407,67,130,17,guatemala_2003_NationalDefenceBook_noneng.md,2025-01-28 18:57:01
114,"dialogo que ha permitido crear instancias de reflexion y negociacion, tales como la comision de seguridad hemisferica, la comision de seguridad de centro america y las conferencias de ministros de defensa, con el objeto de monitorear el tema de la seguridad. en relacion a los nuevos riesgos y desafios que se potencian en la epoca de la globalizacion, se perfila la necesidad de que los estados y gobiernos de las americas",423,71,130,17,guatemala_2003_NationalDefenceBook_noneng.md,2025-01-28 18:57:01
115,"encuentren una sintonia entre sus politicas exteriores y de defensa, que coopere en la consecucion de objetivos comunes de paz, seguridad y desarrollo. ademas, que les permita adecuarse al desarrollo de una agenda internacional global de parametros similares que emergio con fuerza desde el termino de la guerra fria. con ese marco de referencia, tanto la cumbre hemisferica como la conferencia anual de la oea del an",417,67,130,17,guatemala_2003_NationalDefenceBook_noneng.md,2025-01-28 18:57:01
116,"##o 1998, acogieron la idea de materializar la conferencia especial de seguridad, que se llevo a cabo en mexico en octubre de 2003. en la conferencia se consolida, el concepto de la seguridad multidimensional, alcanzado en la asamblea de la oea, bridgetown : "" nuestra nueva concepcion de la seguridad en el hemisferio es de alcance multidimensional, incluye las amenazas tradicionales y las nuevas amenazas",407,65,132,17,guatemala_2003_NationalDefenceBook_noneng.md,2025-01-28 18:57:01
117,", preocupaciones y otros desafios a la seguridad de los estados del hemisferio, incorpora las prioridades de cada estado, contribuye a la consolidacion de la paz, al desarrollo integral y a la justicia social, y se basa en valores democraticos, el respeto, la promocion y defensa de los derechos humanos, la solidaridad, la cooperacion y el respeto a la soberania nacional. la paz es un valor y un principio",407,69,130,17,guatemala_2003_NationalDefenceBook_noneng.md,2025-01-28 18:57:01
118,"en si mismo y se basa en la democracia, la justicia, el respeto a los derechos humanos, la solidaridad, la seguridad y el respeto al derecho internacional. nuestra arquitectura de seguridad contribuira a preservarla a traves del fortalecimiento de los mecanismos de cooperacion entre nuestros estados para enfrentar las amenazas tradicionales, las nuevas amenazas, las preocupaciones y otros desaf",397,59,130,17,guatemala_2003_NationalDefenceBook_noneng.md,2025-01-28 18:57:01
119,"##ios que confronta nuestro hemisferio "".",41,6,17,17,guatemala_2003_NationalDefenceBook_noneng.md,2025-01-28 18:57:01
120,"# # 2. 2. la democracia y la seguridad continental la "" carta democratica interamericana "", enfatiza el compromiso con la democracia y la renovacion del sistema interamericano, a fin de precisar las disposiciones de la carta de la organizacion de los estados americanos y de otros instrumentos relacionados, para mejorar la preservacion y defensa de las instituciones democraticas. debe mencionarse la importancia que tie",421,65,130,18,guatemala_2003_NationalDefenceBook_noneng.md,2025-01-28 18:57:01
121,"##nen, asimismo, las medidas de confianza mutua implementadas en diversas experiencias en el hemisferio, que entre otros origenes tienen el plan de accion de la tercera cumbre de las americas y que han contribuido al mantenimiento de la estabilidad y la paz. la tendencia a la resolucion de los conflictos territoriales y de otra indole que existe en el continente, ha permitido que se avance en el diseno de regimenes de segur",427,72,133,18,guatemala_2003_NationalDefenceBook_noneng.md,2025-01-28 18:57:01
122,"##idad compartida y que se apoyen operaciones de mantenimiento de la paz, establecidas por organismos internacionales y regionales. sin embargo, persisten focos de conflictos armados complejos y que pueden amenazar la estabilidad lograda.",238,33,76,18,guatemala_2003_NationalDefenceBook_noneng.md,2025-01-28 18:57:01
123,"# # 3. la dimension regional 3. 1. el ambito regional el ambito regional para guatemala abarca el area en que se desenvuelven sus relaciones politicas, economicas y socioculturales mas cercanas y que comprende centroamerica, parte del caribe y el sur de mexico. el istmo centroamericano, como puente entre los mercados regionales de los hemisferios norte y sur, origina una dinamica distintiva por su ubicacion geoestrategica que lo convier",440,69,130,19,guatemala_2003_NationalDefenceBook_noneng.md,2025-01-28 18:57:01
124,"##te en zona de transito, y que puede derivar en problemas de seguridad para guatemala. 3. 2. centroamerica : zona de paz y cooperacion guatemala es parte del sistema de seguridad regional contenido en el tratado marco de seguridad democratica en centroamerica, suscrito en 1995. este tratado, partiendo de un entendimiento de seguridad cooperativa, establece un modelo de seguridad unico, integral e indivisible, sustentado en la su",433,67,132,19,guatemala_2003_NationalDefenceBook_noneng.md,2025-01-28 18:57:01
125,"##premacia y fortalecimiento del poder civil, con balance razonable de fuerzas, centrando su accionar en la seguridad de las personas ; identificando a su vez elementos como la pobreza, el subdesarrollo, la depredacion del medio ambiente y de los bienes culturales, asi como, la violencia, la corrupcion, la impunidad, la narcoactividad, el trafico de armas y el terrorismo. estos principios gui",395,61,132,19,guatemala_2003_NationalDefenceBook_noneng.md,2025-01-28 18:57:01
126,"##an la politica de seguridad del estado de guatemala. en la actualidad, centroamerica es una region de paz en la cual no estan presentes amenazas tradicionales a la seguridad, por lo que el esfuerzo compartido se dirige al tratamiento de los nuevos riesgos, en particular los de seguridad ciudadana y la prevencion de los desastres naturales. guatemala, habiendo superado un conflicto que duro mas de tres decadas, esta inserta en un proces",441,72,132,19,guatemala_2003_NationalDefenceBook_noneng.md,2025-01-28 18:57:01
127,"##o de consolidacion de la democracia, consciente de que la misma solamente puede darse en un ambiente de paz y reconciliacion. por ello, valora la expansion de ideales democraticos en el continente adhiriendose al compromiso de santiago de junio de 1991 y a la carta democratica interamericana de 2001. el estado de guatemala como signatario de tratados y convenios internacionales es un ente activo del sistema de seguridad colectiva, liderado por",449,71,132,19,guatemala_2003_NationalDefenceBook_noneng.md,2025-01-28 18:57:01
128,"la organizacion de las naciones unidas onu, participa a su vez en el sistema de defensa interamericano a traves de la oea y coparticipa en la cohesion regional que se impulsa por medio del sistema de integracion centroamericana sica. y la conferencia de las fuerzas armadas de centroamerica cfac.",296,49,96,19,guatemala_2003_NationalDefenceBook_noneng.md,2025-01-28 18:57:01
129,"# # 4. la estrategia internacional 4. 1. principios de la estrategia los principios generales de la estrategia internacional de guatemala se vinculan al fortalecimiento del multilateralismo, a la promocion de la paz, al impulso de la plena vigencia de los derechos humanos, al fortalecimiento de la democracia, a los procesos de integracion, al aprovechamiento de las posibilidades que brinda la globalizacion y al combate del crimen",433,67,130,20,guatemala_2003_NationalDefenceBook_noneng.md,2025-01-28 18:57:01
130,"organizado y el terrorismo. la base de dichos principios es el respeto irrestricto a la carta de naciones unidas, la carta de la organizacion de los estados americanos, el protocolo de tegucigalpa que instituye el sica, los tratados y convenciones de ellas derivadas y suscritas por guatemala. se presta especial atencion a los entendidos en materia de medidas de confianza mutua, los regimenes para",399,64,130,20,guatemala_2003_NationalDefenceBook_noneng.md,2025-01-28 18:57:01
131,"control de armamento, asi como la transparencia de la politica de defensa, a traves de la elaboracion del libro de la defensa nacional, como compromiso de paz con el continente.",177,30,55,20,guatemala_2003_NationalDefenceBook_noneng.md,2025-01-28 18:57:01
132,"# # 4. 2. operaciones de mantenimiento de la paz la manifestacion de integracion o insercion en el sistema mundial de seguridad, se realiza por medio de la participacion en operaciones de mantenimiento de la paz, cooperando en la implementacion de las fuerzas multinacionales que en ella participan, con la legitimacion de los organismos internacionales. este tipo de operaciones se suma a las medidas de confianza mutua y a",424,69,130,21,guatemala_2003_NationalDefenceBook_noneng.md,2025-01-28 18:57:01
133,"los entendimientos regionales y subregionales sobre el tema de seguridad. las acciones que en este marco se generan, incluyen la diplomacia preventiva como paso inicial, para luego en un orden ascendente emprender operaciones de pacificacion, mantenimiento, aplicacion o construccion de la paz, al ser desbordada la accion diplomatica ; es por ello que la participacion del estado no se limita al empleo de contingentes militares.",430,65,129,21,guatemala_2003_NationalDefenceBook_noneng.md,2025-01-28 18:57:01
134,"# # 4. 3. comision de seguridad de centroamerica la comision de seguridad es una instancia contemplada en el tratado marco de seguridad democratica de centroamerica, cuya funcion es la ejecucion, coordinacion, evaluacion y seguimiento, de elaboracion de propuestas, asi como de recomendaciones de alerta temprana, y cuando proceda, de pronta accion, subordinada a la reunion de presidentes y al consejo de",405,62,130,22,guatemala_2003_NationalDefenceBook_noneng.md,2025-01-28 18:57:01
135,"ministros de relaciones exteriores. esta compuesta por las delegaciones de los estados centroamericanos integradas por los viceministros de relaciones exteriores y viceministros o autoridades competentes en los ramos de defensa y seguridad publica. los viceministros de relaciones exteriores presidiran las delegaciones de cada estado. la comision de seguridad organiza sus trabajos en subcomisiones sectoriales, las cuales son :",429,58,130,22,guatemala_2003_NationalDefenceBook_noneng.md,2025-01-28 18:57:01
136,"defensa, de seguridad publica, juridica o intersectoriales. dicho organo se reune ordinariamente con la periodicidad que establecen sus miembros y extraordinariamente, en cumplimiento de una decision de la reunion de presidentes o del consejo de ministros de relaciones exteriores o cuando asi lo solicite uno o varios de sus miembros, para examinar un asunto con caracter de urgencia. el quorum requerido para las se",417,64,130,22,guatemala_2003_NationalDefenceBook_noneng.md,2025-01-28 18:57:01
137,"##siones sera la totalidad de sus miembros. la falta de consenso en la adopcion de una decision, facultara a la presidencia de la comision de seguridad, a elevar el tema al conocimiento del consejo de ministros de relaciones exteriores para su resolucion. 4. 4. conferencia de las fuerzas armadas centroamericanas en el marco de la seguridad democratica, las instituciones armadas subordinadas al poder civil",408,64,132,22,guatemala_2003_NationalDefenceBook_noneng.md,2025-01-28 18:57:01
138,", se desempenan como parte integral de la sociedad, contribuyendo a impulsar y consolidar procesos de paz, libertad, desarrollo y democracia en la region, por medio de las medidas de confianza y cooperacion mutua entre ellas. en ese contexto, el 11 de junio de 1997, funcionarios de gobierno centroamericanos, con rango de ministro de la defensa nacional o comandante en jefe de las fuerzas",390,64,130,22,guatemala_2003_NationalDefenceBook_noneng.md,2025-01-28 18:57:01
139,"armadas, acordaron la propuesta de creacion de la conferencia de las fuerzas armadas centroamericanas cfac cuya mision es contribuir a la seguridad, el desarrollo e integracion militar de la region. asimismo, su finalidad es el impulso permanente y sistematico de cooperacion y apoyo mutuo entre las fuerzas armadas, para el estudio colegiado de asuntos de interes comun y asi proporcionar",389,60,130,22,guatemala_2003_NationalDefenceBook_noneng.md,2025-01-28 18:57:01
140,"un nivel optimo de defensa contra amenazas a la democracia, la paz y la libertad.",81,15,31,22,guatemala_2003_NationalDefenceBook_noneng.md,2025-01-28 18:57:01
141,"# # 5. panorama de riesgos 5. 1 la nueva fisonomia del conflicto la globalizacion ha obligado a un rediseno politico estrategico para adecuar mecanismos con los cuales los estados enfrentan las situaciones de riesgos, de una manera distinta a lo que privo durante la denominada epoca de la guerra fria. el caracter transnacional que han adquirido algunos conflictos no originados o promovidos por estados en contra de otra",422,69,130,23,guatemala_2003_NationalDefenceBook_noneng.md,2025-01-28 18:57:01
142,"nacion, hace mas complejo el escenario aunado al hecho de las implicaciones sociales que tienen las manifestaciones de este tipo de actividad conflictiva. las mas frecuentes amenazas transnacionales son : a ) el trafico ilicito de estupefacientes y sustancias psicotropicas, b ) el terrorismo y c ) el deterioro ambiental.",322,50,105,23,guatemala_2003_NationalDefenceBook_noneng.md,2025-01-28 18:57:01
143,"# # 5. 2 los temas emergentes los riesgos y amenazas constituyen condiciones que adversan la consecucion de los intereses del estado, diferenciandose por la capacidad de oposicion que manifiestan. por ello se considera * * riesgo * * cuando existe la intencion o la capacidad de una fuerza antagonica de hacer dano. al existir una combinacion de ambas, se denomina * * amenaza * *, la cu",387,68,130,24,guatemala_2003_NationalDefenceBook_noneng.md,2025-01-28 18:57:01
144,"##al atenta contra la supervivencia del estado o contra la consecucion de los objetivos nacionales vinculados con la seguridad de la nacion. las * * fuerzas antagonicas * * pueden ser de origen natural, o provenir de grupos de personas o de paises, que dificultan o impiden al estado lograr y mantener los objetivos nacionales. el antagonismo puede comprender : * * factores adversos * * que carecen de act",406,70,132,24,guatemala_2003_NationalDefenceBook_noneng.md,2025-01-28 18:57:01
145,"##itud desafiante ( los de origen natural ) o por medio de * * presiones * *, las cuales tienen capacidad para contraponerse al estado. el grado de afeccion que cualquiera de estos antagonismos infrinja al estado se da en la medida en que la fuerza se focalice hacia una * * vulnerabilidad * *, entendiendose esta como la condicion de estar expuesto a recibir un dano en un aspecto o area",388,72,132,24,guatemala_2003_NationalDefenceBook_noneng.md,2025-01-28 18:57:01
146,"de interes. los riesgos y las amenazas tradicionales se refieren a problemas geopoliticos, ante los cuales se ha desarrollado el derecho internacional y la creacion de instancias supranacionales que regulan los conflictos, pero cuya ocurrencia persiste. dentro de las amenazas al estado, la guerra constituye la mas grave y compleja de todas las que pueden cernirse sobre la nacion. en la actualidad,",400,62,130,24,guatemala_2003_NationalDefenceBook_noneng.md,2025-01-28 18:57:01
147,"para guatemala se considera la guerra como poco probable de conformidad con los mecanismos internacionales que se han desarrollado ; frente a ello y sin descartarla, ha cobrado mayor relevancia ante la agenda nacional la atencion sobre los denominados temas emergentes. estos temas versan sobre las amenazas no tradicionales, cuyo abordaje se determina en forma autonoma por el estado, asi como con la adopcion de medidas sujetas a la situ",439,70,130,24,guatemala_2003_NationalDefenceBook_noneng.md,2025-01-28 18:57:01
148,"##acion de las relaciones con otros bloques o paises. dentro de los temas emergentes de la agenda internacional y que podrian constituirse en una amenaza para el estado, se mencionan las actividades relacionadas con el narcotrafico, el crimen organizado en general y el terrorismo, sin obviar lo concerniente a la degradacion ambiental. en ese orden de ideas, el combate al terrorismo ha cobrado especial importancia, debido a la pre",433,69,133,24,guatemala_2003_NationalDefenceBook_noneng.md,2025-01-28 18:57:01
149,"##eminencia que se le da en la agenda mundial, que a partir de la resolucion 1773 ( 2001 ) del consejo de seguridad de las naciones unidas, obliga a todas las naciones a poner enfasis en el seguimiento a esa amenaza. los presidentes centroamericanos en la resolucion "" centroamerica unida contra el terrorismo "" de 2001, instruyeron para acompanar esa accion mundial, y la comision de seguridad de centroamerica elab",416,70,132,24,guatemala_2003_NationalDefenceBook_noneng.md,2025-01-28 18:57:01
150,"##oro el plan centroamericano de cooperacion integral para prevenir y combatir el terrorismo y actividades conexas. capitulo iii : la defensa nacional 1. politica de estado : el desarrollo y la seguridad 1. 1. politica de estado para alcanzar los objetivos nacionales permanentes, el estado genera y ejecuta politicas que orientan la toma de decisiones, asi como la priorizacion y asignacion de recursos, teniendo la sociedad",425,66,132,24,guatemala_2003_NationalDefenceBook_noneng.md,2025-01-28 18:57:01
151,"el derecho y la responsabilidad de participar en el diseno de las politicas. la politica publica de defensa nacional se formula a partir de dos grandes ejes de politicas de estado : el desarrollo y la seguridad, las cuales se vinculan de forma integral para la consecucion del bien comun.",288,50,92,24,guatemala_2003_NationalDefenceBook_noneng.md,2025-01-28 18:57:01
152,"# # 1. 2. el desarrollo considerando el desarrollo, como el mejoramiento progresivo en la calidad de vida del ser humano, el estado de guatemala adquiere el compromiso de su consecucion por medio de la ejecucion de politicas sociales y economicas, en un ambiente de gobernabilidad democratica, respetando la interculturalidad, fortaleciendo la participacion ciudadana y preservando el patrimonio cultural y natural de la nacion",427,64,130,25,guatemala_2003_NationalDefenceBook_noneng.md,2025-01-28 18:57:01
153,". las caracteristicas e historia de cada pais exigen metodologias y tiempos propios para alcanzar las metas de desarrollo ; debiendo enfatizarse en que sus propositos requieren del mantenimiento de la paz por medio de la prevencion y tratamiento de los conflictos en el marco de la promocion de una cultura de paz. la eficiencia de las politicas orientadas al desarrollo, requieren del apoyo de la politica",406,67,130,25,guatemala_2003_NationalDefenceBook_noneng.md,2025-01-28 18:57:01
154,"de seguridad, estando ambas inmersas dentro del mismo proceso de diseno, en conjuncion con las restantes politicas de estado dentro del esquema de la planificacion nacional.",173,26,54,25,guatemala_2003_NationalDefenceBook_noneng.md,2025-01-28 18:57:01
155,"# # 1. 3. la seguridad la seguridad como condicion, se alcanza a traves de un conjunto de acciones y medidas, que previenen y dan respuesta efectiva a los riesgos, amenazas y vulnerabilidades, para alcanzar los objetivos nacionales. el termino seguridad se adjetiva de acuerdo a su enfasis, tal es el caso de la seguridad humana, la seguridad publica, la seguridad integral",373,62,130,26,guatemala_2003_NationalDefenceBook_noneng.md,2025-01-28 18:57:01
156,", la seguridad cooperativa, la seguridad hemisferica, la seguridad global, la seguridad nacional y la seguridad democratica, concepto que desarrolla el tratado marco de seguridad democratica en centroamerica. dicho tratado se basa en el estado de derecho, la seguridad de las personas y sus bienes, la seguridad de la region y considera, ademas, la organizacion e institucionalidad necesaria para el funcionamiento del",418,62,130,26,guatemala_2003_NationalDefenceBook_noneng.md,2025-01-28 18:57:01
157,"modelo y se inspira en los logros alcanzados en el proceso de pacificacion e integracion regional. este modelo, describe elementos de riesgo que afectan las condiciones de bienestar de la sociedad al socavar la base del libre ejercicio de derechos y libertades publicas de todos los ciudadanos. en adiciones posteriores a su concepcion, se aborda el tema del fortalecimiento de los mecanismos de coordinacion relacionados a los",427,67,130,26,guatemala_2003_NationalDefenceBook_noneng.md,2025-01-28 18:57:01
158,"desastres naturales, incluyendo la creacion de un fondo permanente para el financiamiento de actividades vinculadas al tema. tomando como marco la concepcion de seguridad antes descrita, para guatemala se define la seguridad nacional como el estado de vida de la nacion, en el cual se garantizan la dignidad del ser humano y el desarrollo pleno de sus potencialidades en sus manifestaciones politicas, economicas, sociales y culturales ; asi mismo",447,69,130,26,guatemala_2003_NationalDefenceBook_noneng.md,2025-01-28 18:57:01
159,", se contrarrestan las amenazas a la soberania e institucionalidad democratica del estado y a la integridad del territorio. dentro de este esquema, la politica generada por el estado en materia de seguridad se basa en consideraciones como la concrecion de los intereses nacionales y del proyecto de nacion que se aspira construir ; la percepcion y jerarquizacion de los riesgos, amenazas y vulnerabilidades",406,64,130,26,guatemala_2003_NationalDefenceBook_noneng.md,2025-01-28 18:57:01
160,"que debe enfrentar para la consecucion de dichos intereses ; y las condiciones objetivas y subjetivas a partir de las cuales pueda, o no, hacer funcionales los mecanismos de prevencion, control y resolucion de las amenazas. la seguridad, como condicion esencial para el desarrollo del orden democratico y para la convivencia pacifica de los habitantes, es garantizada por el estado y sus institu",395,63,130,26,guatemala_2003_NationalDefenceBook_noneng.md,2025-01-28 18:57:01
161,"##ciones, involucrando a los diferentes sectores de la sociedad guatemalteca, principalmente con la participacion ciudadana a traves del poder local, en la planificacion, ejecucion, incidencia y control de las acciones que en ese sentido se realizan.",250,36,80,26,guatemala_2003_NationalDefenceBook_noneng.md,2025-01-28 18:57:01
162,"# # 2. la defensa nacional para mantener y garantizar la condicion de seguridad, el estado a traves de su defensa, dispone de un conjunto de medidas y acciones destinadas a enfrentar distintos tipos de amenazas y riesgos potenciales que vulneren la pervivencia del estado y atenten contra los objetivos nacionales permanentes. la organizacion, la normativa y la asignacion de recursos de",387,62,130,27,guatemala_2003_NationalDefenceBook_noneng.md,2025-01-28 18:57:01
163,"la defensa es responsabilidad del estado, y es coordinada por las instituciones pertinentes, aunado al compromiso constitucional de todo ciudadano de servir y defender a la patria. la defensa nacional de guatemala, se concibe dentro de un contexto de paz y respeto a los derechos e intereses de los individuos y la nacion, con la resolucion firme de alcanzar el bien comun, venciendo los antagonism",398,65,130,27,guatemala_2003_NationalDefenceBook_noneng.md,2025-01-28 18:57:01
164,"##os y obstaculos que se contrapongan a dicha meta. 2. 1 objetivos de la defensa nacional ante la posibilidad de amenazas que afecten el logro de los objetivos nacionales, el estado implementa medidas que permiten subsanar tal situacion, siendo su deber ineludible el articular la defensa como un bien publico en funcion de la proteccion de sus objetivos. las actividades de la defensa nacional emprendidas",406,65,132,27,guatemala_2003_NationalDefenceBook_noneng.md,2025-01-28 18:57:01
165,"con miras a satisfacer lo anteriormente descrito, tienen como formas de accion, la diplomacia, la participacion del ejercito de guatemala y el apoyo solidario de la poblacion en situaciones de guerra y catastrofes naturales. derivado de los articulos constitucionales 140 y 244 se enuncian como objetivos de la defensa los siguientes : o mantener la libertad, independencia, soberania y el honor de la nacion.",409,64,130,27,guatemala_2003_NationalDefenceBook_noneng.md,2025-01-28 18:57:01
166,o mantener la integridad territorial. o asegurar condiciones de seguridad externa e interna para el bien comun. o mantenimiento y fortalecimiento de la paz y seguridad nacional e internacional.,193,29,60,27,guatemala_2003_NationalDefenceBook_noneng.md,2025-01-28 18:57:01
167,"# # 2. 2 caracteristicas de la defensa la defensa se caracteriza por funcionar en tiempo de paz o de guerra, por lo tanto es permanente, ademas es flexible para adaptarse a los cambios e integral para involucrar a todos los ciudadanos, obteniendo de ello la legitimidad como base de su accionar. su organizacion debe ser adecuada a las necesidades del pais, a su dinamica propia y previsora en cu",396,70,130,28,guatemala_2003_NationalDefenceBook_noneng.md,2025-01-28 18:57:01
