chunk_id,text,char_length,word_count,token_count,section_index,source_file,processed_date
77,"# # # 21 to provide appropriate defence resources including personnel, equipment, logistics support and funding to fulfill ireland ’ s commitments to overseas peace support, crisis management and humanitarian operations under un authority. continue representation by defence personnel, civil and military, to the psc and eumc, and associated working groups, working proactively to advance national interests within the union, together with colleagues from the department of foreign affairs. - - - - - strategy statement 2008 – 2010 | department of defence & defence forces continue to engage positively, in the framework of esdp, in the ongoing development of military and civilian crisis management capabilities, including eda capability",738,109,130,25,ireland_2008_StrategyStatement.md,2025-01-28 18:56:08
78,"development initiatives. continue our active participation in the eu rapid response / battlegroup concept. conduct a review of our participation in the nbg to identify lessons learned. continue our positive engagement with nato / pfp, in the partnership goal process and with parp in order to enhance defence forces interoperability in multi - national operations and to contribute to the development of military capabilities in accordance with international standards. to further develop appropriate military capabilities required to implement these strategies.",562,80,95,25,ireland_2008_StrategyStatement.md,2025-01-28 18:56:08
79,"# # # defence policy, military advice and corporate services",60,10,13,26,ireland_2008_StrategyStatement.md,2025-01-28 18:56:08
80,"# # # # policy / advice this area comprehends the work of civil and military personnel in the formulation of defence policy and military advice. it also includes the corporate support functions for the defence organisation and the support provided by the oep to the government task force on emergency planning. clearly, the policy and advice functions feed back directly into the development and maintenance of capabilities discussed above. the key strategies and outputs here are : ongoing review of the defence and security environment and the provision of timely and relevant advice to the minister and to government, including advice in respect of international security, peace support and defence developments generally. in this context, the national",755,118,130,27,ireland_2008_StrategyStatement.md,2025-01-28 18:56:08
81,security committee continues to meet on a regular basis and receives security briefings from the garda commissioner and the chief of,132,21,25,27,ireland_2008_StrategyStatement.md,2025-01-28 18:56:08
82,"# # # 22 staff. in line with the programme for government we will prepare a new white paper on defence for the period 2011 - 2020. - - - - - strategy statement 2008 – 2010 | department of defence & defence forces develop and maintain a capability planning process and multi - annual equipment and infrastructure plans. in line with the programme for government, ensure that investment in the defence forces continues to grow, with the full commercial value of all defence property disposals to be invested in capital projects and new equipment pending publication of the new white paper on defence as set out in the programme for government, we will continue implementation of the current white paper",700,121,130,28,ireland_2008_StrategyStatement.md,2025-01-28 18:56:08
83,"and seek to advance the recommendations of the review of the white paper ( april 2007 ). many of the recommendations in the review are now included in the pay agreement and modernisation agenda for the defence forces, agreed in the context of towards 2016. emergency planning – continue to provide the necessary supports to the government task force on emergency planning, chaired by the minister for defence and the inter departmental working group on emergency planning ; oversee the emergency planning arrangements in government departments and public authorities under their aegis ; co - ordinate the publication of an annual review of emergency plans ; continue the annual programme of major simulated exercises and support sustained public awareness and",759,120,130,28,ireland_2008_StrategyStatement.md,2025-01-28 18:56:08
84,reassurance.,12,1,6,28,ireland_2008_StrategyStatement.md,2025-01-28 18:56:08
85,# # # # corporate and support services * * decentralisation * * we are committed through the mechanism of the defence decentralisation implementation group ( military / civilian ) to implementing the government decision on decentralisation. this is being progressed as quickly as possible in conjunction with the office of public works ( opw ). we will support government policy in implementing energy - efficient and environmentallyfriendly initiatives and will take the opportunity afforded by the provision of new buildings under decentralisation to implement these initiatives in consultation with the opw.,610,92,110,29,ireland_2008_StrategyStatement.md,2025-01-28 18:56:08
86,"# # # 23 * * value for money ( vfm ) and policy reviews * * the department of defence and the defence forces are fully committed to ensuring value for money in defence expenditure. the broadening of the former expenditure review initiative ( eri ) to include other policy reviews that - - - - - strategy statement 2008 – 2010 | department of defence & defence forces impact on value for money is particularly welcome. this is consistent with the approach that has been taken over recent years in defence, where the white paper on defence and other significant reviews ( air corps, naval service ) were recognised as elements of the eri. the approach we",652,119,130,30,ireland_2008_StrategyStatement.md,2025-01-28 18:56:08
87,"have taken is to continuously monitor the defence and security environment to ensure the continued relevance of white paper objectives. allied to that, we continuously monitor and report on implementation targets ( e. g. a detailed review of white paper implementation was published in 2007 ). this approach is complemented by vfm and other reviews of specific sub - elements of the major programmes in order to seek out further vfm improvements and engender a culture of continuous evaluation. in that context, the two remaining vfm reviews in the current programme approved by government will be completed on schedule by the end of 2008. these relate to naval service vessel maintenance and the use",700,114,130,30,ireland_2008_StrategyStatement.md,2025-01-28 18:56:08
88,"of military training lands. * * customer service * * given the nature of the activities we are engaged in, the defence organisation does not provide services to external ‘ customers ’ in the classic sense. for example, there are no public offices, public counters or call - centres where the individual citizen can request services on demand. indeed, services are typically provided to the community collectivley rather than to citizens as individuals. notwithstanding this, we are committed to the provision of a quality customer service to those individuals and organisations with whom we deal. the current customer charter and customer service action plan were published in 2004. we believe that it is our duty",713,115,130,30,ireland_2008_StrategyStatement.md,2025-01-28 18:56:08
89,"to serve the people of ireland to the best of our ability and that customers are entitled to expect high standards. these values have shaped successive strategy statements and the annual planning process. following approval of this strategy statement work will commence immediately on a revised customer service action plan. the results of customer focus groups held earlier in the year will provide valuable input to this, together with the fitzpatrick associates report “ evaluation of customer charters ”.",508,79,86,30,ireland_2008_StrategyStatement.md,2025-01-28 18:56:08
90,"# # # 24 consistent with the policy of enhancing the customer service ethos in the wider public service, we will support the development of a customer charter and customer service action plan for the civil defence board. defence will actively participate in the task force on customer service. - - - - - strategy statement 2008 – 2010 | department of defence & defence forces * * finance services * * finance services are provided through the department ’ s finance branch, located in galway. the emphasis here will be on a continuation of quality service provision to all internal and external customers, including the preparation of payrolls for all employees, both military and civil, granting and",700,118,130,31,ireland_2008_StrategyStatement.md,2025-01-28 18:56:08
91,"payment of pensions and gratuities to retired members of the defence forces and the dependants of deceased personnel, formulation and development of pensions policy, payment of all accounts for goods and services provided to the defence forces and the department, maintaining financial records, preparing the department ’ s annual appropriation accounts and supporting the management information framework ( mif ). * * mif - implementation of phase 2 of the management information framework * * will be completed throughout the department and the defence forces during the lifetime of this strategy statement. the focus in phase 2 is on enhancing the management reporting aspects of systems implemented in phase 1 and using mif to",730,114,130,31,ireland_2008_StrategyStatement.md,2025-01-28 18:56:08
92,"support performance management and evidence - based decision making. * * information and communications technologies ( ict ’ s ) * * ict in the defence organisation operates within a highly controlled and structured framework, the chief elements of which are the joint military / civil it steering committee, which co - operatively develops agreed hardware, software and telecommunications policy across the defence forces and the department. we will continue to invest in the upgrading and modernisation of the ict infrastructure with a planned programme of replacement of hardware across the department and the implementation of the latest versions of key software applications. ict future proofing forms an important part of the overall planning for decentralisation.",770,116,130,31,ireland_2008_StrategyStatement.md,2025-01-28 18:56:08
93,the department has implemented the iso7799 standard for ict security and achieved full certification. we will focus also on the strategic use of technology and online services.,176,27,35,31,ireland_2008_StrategyStatement.md,2025-01-28 18:56:08
94,"# # # 25 * * regulatory reform * * an appropriate and effective legislative and regulatory framework is an important facilitator for continuous improvement in the delivery of defence services. the defence organisation will continue with a programme of work on the simplification and reform of legislation and regulations. elements of this - - - - - strategy statement 2008 – 2010 | department of defence & defence forces are included in the pay agreement and modernisation agenda for the defence forces and the towards 2016 action plan for civil staff. as regards regulatory impact analysis ( ria ), the department of defence is not a regulatory authority as commonly understood. the defence acts and",700,116,130,32,ireland_2008_StrategyStatement.md,2025-01-28 18:56:08
95,"regulations made thereunder are, for the most part, focused on the defence forces only and do not apply to the ordinary citizen or to business. notwithstanding this, the department applies the principles set out in the ria guidelines where appropriate. * * partnership and conciliation & arbitration * * building on the progress made to date, the department and the defence forces will continue to invest time and resources in the development of partnership structures. there are active partnership structures in place involving civil service staff, the department ’ s civilian employees and the defence forces. benefits of the process include a greater shared understanding of the business of defence and how that can",718,114,130,32,ireland_2008_StrategyStatement.md,2025-01-28 18:56:08
96,"be progressed, better internal and external communications, the development of customer service planning and implementation, better environmental planning, and the creation of fora in which issues of concern can be resolved in a bilateral and non - confrontational way. the aim is to continue to build on the progress made, principally on internal and external communications and customer service. the defence forces conciliation and arbitration ( c & a ) scheme provides a range of fora for defence management to discuss with the defence forces representative associations, within the scope of representation, the impact of the implementation of our strategic objectives, including implementation of the white paper, elements of which are",739,111,130,32,ireland_2008_StrategyStatement.md,2025-01-28 18:56:08
97,now comprehended in the pay agreement and modernisation agenda and associated action plan agreed in the context of towards 2016. * * towards 2016 * *,149,26,31,32,ireland_2008_StrategyStatement.md,2025-01-28 18:56:08
98,# # # 26 the department will fully cooperate with the implementation of towards 2016 and the associated action plan agreed through the partnership process and will provide timely and accurate reports to the civil service performance verification group ( cspvg ). the department and the defence forces are also committed to implementing the pay agreement and modernisation agenda and associated action plan for the defence forces. - - - - - strategy statement 2008 – 2010 | department of defence & defence forces * * the human resources strategy * * the human resources strategy for civil service staff of the department will be reviewed in 2009 in line with ongoing developments in the public sector. this strategy will support,727,121,130,33,ireland_2008_StrategyStatement.md,2025-01-28 18:56:08
99,"the organisation ’ s high level goals and will address the issues that emerge from the changing staffing profile of the department postdecentralisation. the integration of the performance management and development system with hr policies and processes was implemented from 1 january 2007 in accordance with general council agreement 1452. the implementation of this agreement will be monitored to ensure ongoing compliance and effectiveness. * * training & development * * the department will revise its training strategy for civil service staff in 2008. in addition to ongoing investment in our people, we will seek to develop initiatives to identify training and development opportunities that enable participation from both the civil and military sides of the",763,116,130,33,ireland_2008_StrategyStatement.md,2025-01-28 18:56:08
100,"department, leading to enhanced cooperation in this area. we will work to retain the iso 9001 : 2000 accreditation achieved by the training & development section. the excellence through people ( etp ) scheme is run by fas as ireland ’ s national human resource management standard. the department was first awarded the standard in 2000 and has been successful in having it renewed since then. the scheme has been revised since our last award and now comprises an assessment across the full range of human resources functions. in december 2007 the department achived accreditation at standard level for a further two years. the etp standard is also an organisational priority for the defence",690,114,130,33,ireland_2008_StrategyStatement.md,2025-01-28 18:56:08
101,"forces to attain during the coming years in that it benchmarks defence forces human resource practices against evolving best practice in the private and public sectors within the state. fas consider the cadet school to be at the leading edge nationally ( the best applicant assessed in 2006 ), with a number of other units achieving a very high * * 27 * * standard in their applications and results of the fas assessments. to date, nineteen units / sub - units of the defence forces have applied for and / or been granted etp recognition. over the lifetime of this strategy statement it is anticipated that all units will attain the standard. - - - - -",652,118,130,33,ireland_2008_StrategyStatement.md,2025-01-28 18:56:08
102,"strategy statement 2008 – 2010 | department of defence & defence forces * * equality issues * * disability - the defence organisation is committed to the implementation of the codes of practice on accessibility and the employment of people with disability in the public service, in so far as they relate to the staff of the department and the defence forces. the department will continue to meet or exceed the government 3 % target for the recruitment and employment of people with disabilities and to provide training and development appropriate to the needs of all staff including those with a disability. we will carry out access audits to ensure that services are accessible for people with disabilities. [ the defence forces are",733,123,130,33,ireland_2008_StrategyStatement.md,2025-01-28 18:56:08
103,"excluded from part 3 of the disability act, 2005. ] the department ’ s role in relation to part 3 of the act relates to the civilian employees employed by the department on behalf of the defence forces and to the civil staff of the department together with the staff of the civil defence board, office of the ombudsman for the defence forces, coiste an asgard and the army pensions board. * * age and gender * * as outlined in this strategy statement both the department of defence and the defence forces are committed to implementing best practice human resource strategies and policies. this will support us in maintaining an environment that guards against age and",667,117,130,33,ireland_2008_StrategyStatement.md,2025-01-28 18:56:08
104,"gender related discrimination in the workplace. * * internal audit * * the department ’ s internal audit section is an independent unit reporting directly to the secretary general. the section works to an annual programme of audits, approved by the secretary general. its work is reviewed on an ongoing basis by the department ’ s audit committee. the section has facilitated the introduction of the risk assessment process that is now an integral part of the annual business planning cycle. both the internal audit",515,85,94,33,ireland_2008_StrategyStatement.md,2025-01-28 18:56:08
105,"# # # 28 section and the audit committee operate in accordance with the standards outlined in the mullarkey report. - - - - - strategy statement 2008 – 2010 | department of defence & defence forces * * data / statistics strategy * * given the nature of its activities, the defence organisation is not a significant producer of data / statistics and does not have a significant requirement for data / statistics from external sources. internal data needs tend to be specific and narrowly focused. the improvement of internal data systems and capabilities has been the priority for the department and defence forces to date. this will continue to be the focus in the period comprehended by this",692,120,130,34,ireland_2008_StrategyStatement.md,2025-01-28 18:56:08
106,"strategy statement with particular focus on systems supporting the mif. where relevant, internal data sources that can be made available will be classified and coded in line with central statistics office recommendations to enhance standardisation and compatibility, facilitate analysis, and ensure that the potential of such data is harnessed. where needs are identified through pmds, support will be provided to develop the statistical competence of staff. * * official languages act, 2003 * * in accordance with the act, schemes have been published for both the civil and military elements of the defence organisation. during the lifetime of this strategy statement, we will continue to focus on meeting the commitments set out in",733,113,130,34,ireland_2008_StrategyStatement.md,2025-01-28 18:56:08
107,"these schemes. * * cross - departmental issues * * there are important cross - departmental dimensions to the work of the defence organisation and mission success is often critically dependent, for example, on the inputs and co - operation of other departments and state agencies. it is sometimes the case also that the mission success of other departments and agencies is equally dependent on the inputs and co - operation of the defence organisation. as outlined above, these interdependent relationships are increasingly being expressed in slas and mous. we will continue to develop this framework where appropriate. part of the success of the modernisation process in the department of defence and the defence",713,114,130,34,ireland_2008_StrategyStatement.md,2025-01-28 18:56:08
108,"forces to date can be attributed to the good working * * 29 * * relationships with the department of the taoiseach and the department of finance. the support of both in relation to the rebalancing of resources and the development and support of equipment and infrastructure programmes was particularly important. it is, of course, equally important that the non - pay funding generated by pay savings and asset sales is protected in future years and that the improvement in capabilities and services is consolidated. there are also important procurement projects imminent e. g. ship replacement. we will - - - - - strategy statement 2008 – 2010 | department of defence & defence forces",685,115,130,34,ireland_2008_StrategyStatement.md,2025-01-28 18:56:08
109,"continue to work closely with both departments on these matters and in relation to defence modernisation and the wider public service modernisation programme. ireland ’ s contribution to international peace and security has been outlined in detail in sections 2 and 3 above. our relationship with the un, eu, nato, osce etc. is an evolving one. we will continue to work very closely with the department of foreign affairs in this area. we will continue to support the department of foreign affairs in implementing other aspects of ireland ’ s foreign policy and the specific commitments in the programme for government. the office of the attorney general is an important enabler in ensuring that our",699,115,130,34,ireland_2008_StrategyStatement.md,2025-01-28 18:56:08
110,"work takes place within a sound legal and constitutional framework. during the lifetime of this strategy statement we will consider, together with the attorney general ’ s office, whether there is scope for enhancing the working relationship of that office with the department. the question of protocols along the lines agreed with other government departments will be considered. a key cross - organisational area of activity for the department and the defence forces, on which we will continue to focus, is the work of the government task force on emergency planning and the interdepartmental working group ( idwg ) on emergency planning. this is an important area of government policy, highlighted in the",707,113,130,34,ireland_2008_StrategyStatement.md,2025-01-28 18:56:08
111,programme for government. planning for the 1916 centenary commemoration is also proceeding on a crossdepartmental basis. the defence organisation has a key role to play and is committed to working with others to develop and implement a successful commemorative programme. it is anticipated that the all - party oireachtas consultation group that had met in the lifetime of the 29th dail will be reestablished and will continue consideration of the centenary commemoration. there are a number of long - term projects currently being pursued as part of the centenary commemorations. the military history archives project will be progressed. the department will actively participate in the cross - departmental arrangements for implementing the national,750,113,130,34,ireland_2008_StrategyStatement.md,2025-01-28 18:56:08
112,"women ’ s strategy 2007 - 2014. - - - - - strategy statement 2008 – 2010 | department of defence & defence forces * * implementing the strategy statement * * the department and the defence forces are determined to implement this strategy statement and will continue to report on progress annually to the minister as required under the public service management act and to publish those reports. we believe that our objectives, strategies and performance indicators are results - focused and specific so that implementation can be more easily measured and corrective action taken, if necessary. in many cases they are set out in formal agreements with our customers ( e. g. mous and slas )",688,118,130,34,ireland_2008_StrategyStatement.md,2025-01-28 18:56:08
113,". our objectives, strategies and indicators are specified in greater detail in the annual business planning process, civil and military. key aspects of this include the preparation of annual business plans in consultation with staff interests, approval at secretary general or chief of staff level as appropriate, the ongoing monitoring and review of progress, and regular reporting to the minister. the drafting of annual plans will proceed against the background of the ongoing assessment of the defence and security environment as outlined above. | key performance indicators ( kpis ) | col2 | | - - - | - - - | | programme : | kpi : | | contingent capability | implementation of white paper",694,117,130,34,ireland_2008_StrategyStatement.md,2025-01-28 18:56:08
