chunk_id,text,char_length,word_count,token_count,section_index,source_file,processed_date
114,"targets. | | | meet capability development targets. | | on island security & support to other agencies | meet all atcp / aca approved requests. | | | meet all sla & mou commitments. | | international peace & security | meet all government requirements for overseas peace support. | | | meet mission sponsor ’ s standards and requirements. | | defence policy, military advice & corporate services | provide high quality and timely defence policy advice and military advice. | | | provide high quality corporate services. | | | complete decentralisation to newbridge and the curragh. | - - - - - strategy statement 2008",617,109,130,34,ireland_2008_StrategyStatement.md,2025-01-28 18:56:08
115,– 2010 | department of defence & defence forces,47,9,11,34,ireland_2008_StrategyStatement.md,2025-01-28 18:56:08
116,"# # appendix 1 defence – legislative background, structure, roles",65,10,14,35,ireland_2008_StrategyStatement.md,2025-01-28 18:56:08
117,"# # # statutory framework the constitution of ireland vests the right to raise and maintain military or armed forces exclusively in the oireachtas and expressly prohibits the raising and maintenance of any other military or armed force for any purpose whatsoever. the department of defence was established by the ministers and secretaries act, 1924 and the act assigns to the department “ the administration and _ business of the raising, training, organisation, maintenance, equipment, _ _ management, discipline, regulation and control according to law of the _ _ military defence forces ”. _ the act provides that the minister is ‘ head ’ of the department. the minister is assisted in",688,112,130,36,ireland_2008_StrategyStatement.md,2025-01-28 18:56:08
118,"discharging his functions by the civil and military elements of the department. the secretary general is the “ principal officer ” of the department and is also appointed by the minister for finance as the accounting officer for all defence expenditure in accordance with the exchequer and audit departments act 1866. the authority, responsibility and accountability of the secretary general are further elaborated in the comptroller and auditor general ( amendment ) act, 1993 and the public service management act, 1997. the 1997 act also requires the secretary general to prepare a strategy statement for the minister ’ s approval and an annual report on performance. the defence acts 1954 to 2007 provide the legislative basis for",734,117,130,36,ireland_2008_StrategyStatement.md,2025-01-28 18:56:08
119,"the defence forces ( oglaigh na heireann ). the legislation provides that defence forces headquarters ( dfhq ) is the military element of the department of defence. the chief of staff of the defence forces heads dfhq. as provided for in the act the minister has assigned duties to the chief of staff. the chief of staff is directly accountable to the minister for the performance of these duties, which include responsibility for the military effectiveness, efficiency, organisation and economy of the defence forces. as provided for in the act and with the approval of the minister, the chief of staff has, in turn, delegated responsibility",641,106,130,36,ireland_2008_StrategyStatement.md,2025-01-28 18:56:08
120,"for certain duties to the deputy chief of staff ( operations ) and to the deputy chief of staff ( support ). the act also provides for delegation by the minister of military command to general officers commanding the brigades, the defence forces training centre, the naval service and the air corps. in practice, matters relating to command are normally channelled through the chief of staff. in effect, this means that day - to - day operational control of the defence forces rests with the chief of staff for which he is directly responsible to the minister. - - - - - strategy statement 2008 – 2010 | department of defence & defence forces",642,114,125,36,ireland_2008_StrategyStatement.md,2025-01-28 18:56:08
121,"# # # the white paper on defence 2000 the white paper was approved by government and published in february 2000. it deals with all aspects of defence provision and organisation and sets out the policy on defence for the period to 2010. the objective of the white paper is to ensure an appropriate level of defence capability, having regard to the changing defence and security environment. the white paper has been of central importance in informing department of defence and defence forces strategic objectives since its publication. the white paper sets out the roles of the defence forces as follows : to defend the state against armed aggression ; this being a contingency, preparations for its implementation will depend",725,120,130,37,ireland_2008_StrategyStatement.md,2025-01-28 18:56:08
122,"on an ongoing government assessment of the security and defence environment ; to aid the civil power ( meaning in practice to assist, when requested, the garda siochana, who have primary responsibility for law and order, including the protection of the internal security of the state ) ; to participate in multinational peace support, crisis management and humanitarian relief operations in support of the united nations and under un mandate, including regional security missions authorised by the un ; to provide a fishery protection service in accordance with the state ’ s obligations as a member of the eu ; and, to carry out such other duties as may be assigned to them from time to time,",693,117,130,37,ireland_2008_StrategyStatement.md,2025-01-28 18:56:08
123,"e. g. search and rescue, air ambulance service, ministerial air transport service, assistance on the occasion of natural or other disasters, assistance in connection with the maintenance of essential services, assistance in combating oil pollution at sea.",255,37,48,37,ireland_2008_StrategyStatement.md,2025-01-28 18:56:08
124,"# # # the programme for government 33 the commitments in relation to defence in the programme for government provide that we will : prepare a second white paper on defence for the period 2011 - 2020. the second white paper will consider expanding the roles of the air corps and the naval service. this will include increasing the size of the navy flotilla and developing an air corps ’ airlift capability. - - - - - strategy statement 2008 – 2010 | department of defence & defence forces remain firmly committed to maintaining irish neutrality and opposing any changes to the triple lock as enshrined in our law. in accordance with this, we will ensure that participation by the",678,120,130,38,ireland_2008_StrategyStatement.md,2025-01-28 18:56:08
125,"defence forces in any overseas peace support missions continue to be based on the triple - lock mechanism of un mandate, government and dail approval. ensure that investment in the defence forces continues to grow, with the full commercial value of all defence property disposals to be received by the department of defence for investment in capital projects and new equipment. continue the ongoing policy of annual recruitment and maintain the present establishment. this will enable the permanent defence forces to maintain a strength of 10, 500 fully trained personnel with an additional provision from 2008 onwards for up to 350 troops to be in training at any given time. fast - track the civilianisation of all outstanding agreed",735,119,130,38,ireland_2008_StrategyStatement.md,2025-01-28 18:56:08
126,"posts. ensure that our troops have the most modern and effective range of protective equipment, weaponry and training available. fully execute the reserve defence forces ( rdf ) implementation plan by the 2009 target, including improving rdf interoperability with the pdf, and the introduction of procedures to allow suitably qualified rdf personnel serve on overseas duties. continue the ongoing policy of recruitment to the rdf through regular and targeted recruitment campaigns. develop the role and contribution of the medical corps and expand its capacity to deliver a range of medical facilities on un mandated missions. develop the commissioning from the ranks programme, both for enlisted personnel under 28 by way of the",729,112,130,38,ireland_2008_StrategyStatement.md,2025-01-28 18:56:08
127,cadet programme and by way of regular cfr competitions for ncos.,64,11,16,38,ireland_2008_StrategyStatement.md,2025-01-28 18:56:08
128,# # # 34 conduct regular reviews of the operation of the equality and antibullying measures in the military. ensure the defence forces are intrinsically involved in all future 1916 commemorations. - - - - - strategy statement 2008 – 2010 | department of defence & defence forces provide annual subventions to support and encourage the excellent work of the officially recognised veterans groups onet and iunva. continue to support the excellent work of civil defence through the ongoing provision of new equipment and encourage increased membership of civil defence through regular and targeted recruitment programmes. ensure that the office of emergency planning coordinates the publication of an annual review of the emergency plans,734,114,130,39,ireland_2008_StrategyStatement.md,2025-01-28 18:56:08
129,"of each functional department, outlining achievements and improvements across all sectors. continue the annual programme of major simulated exercises and use these structured exercises to support sustained public awareness and reassurance. promote greater cooperation and knowledge sharing between the coast guard, the navy and air corps to ensure that the water surrounding this island are safe for seafarers and coastal communities.",434,61,73,39,ireland_2008_StrategyStatement.md,2025-01-28 18:56:08
130,"# # # organisational structures * * department of defence * * the department of defence comprises civil and military elements with a total of 650 personnel. of this number 380 ( whole time equivalents ) are civil servants and 270 are military personnel. the military personnel constitute defence forces headquarters. in addition, in the order of 850 civilian employees are employed throughout the defence forces. these civilian employees provide a range of general operative, trades and other services in military installations. the primary role of the department is to support the minister as head of the department, in particular by providing policy advice and support on defence matters. this includes assistance with policy formulation and the",747,117,130,40,ireland_2008_StrategyStatement.md,2025-01-28 18:56:08
131,# # # 35 implementation of policy as directed by the minister. the secretary general is the minister ’ s principal defence policy advisor and the chief of staff is the minister ’ s principal military adviser. - - - - - strategy statement 2008 – 2010 | department of defence & defence forces * * defence forces * * the defence forces are organised on conventional military lines providing a sufficiently flexible structure to carry out all the roles assigned by government. the defence forces consist of a permanent defence force ( pdf ) and a reserve defence force ( rdf ). the former is a standing force and provides the primary capabilities for military operations at home and military peace support,701,123,130,41,ireland_2008_StrategyStatement.md,2025-01-28 18:56:08
132,"operations abroad. the rdf provides the necessary contingent conventional military capability to augment and assist the pdf, when necessary.",140,19,26,41,ireland_2008_StrategyStatement.md,2025-01-28 18:56:08
133,"# # # permanent defence force the permanent defence force consists of the army, the air corps and the naval service. the authorised permanent defence force strength is 10, 500. the programme for government contains a commitment to the maintenance of an additional 350 troops in training at any one time. * * army * * the army is structured into three all - arms brigades, consisting of combat, combat support and combat service support elements. each brigade is designated a territorial area of responsibility with specific garrison locations. the defence forces ’ training centre ( dftc ) and defence forces ’ logistics base in the curragh, co kildare support the training and logistics",687,114,130,42,ireland_2008_StrategyStatement.md,2025-01-28 18:56:08
134,"functions for the permanent defence force ( pdf ) and the reserve defence force ( rdf ). * * air corps * * the air corps, based at casement aerodrome, baldonnel, co. dublin, consists of an operational headquarters, two operational wings, two support wings, the air corps training college, and a communication and information services squadron. the operational wings consist of a training / light strike squadron,",412,67,85,42,ireland_2008_StrategyStatement.md,2025-01-28 18:56:08
135,"# # # 36 helicopter squadrons, a maritime squadron, a transport squadron and a fixed wing reconnaissance squadron. the support wings are tasked with specialist maintenance of the aircraft fleet and administration and logistical support for the air corps. - - - - - strategy statement 2008 – 2010 | department of defence & defence forces * * naval service * * the naval service, based at haulbowline, co. cork, has a flotilla of eight ships, an operational headquarters, an operations command, a logistical support command and a naval service college. the flotilla consists of a helicopter patrol vessel squadron, large patrol vessel squadron, an offshore patrol vessel squadron and a coastal",691,112,130,43,ireland_2008_StrategyStatement.md,2025-01-28 18:56:08
136,"patrol vessel squadron. the support command is responsible for personnel and all logistical, engineering, and maintenance functions. formation geographic deployments",165,20,27,43,ireland_2008_StrategyStatement.md,2025-01-28 18:56:08
137,"# # # reserve defence force the rdf is at present undergoing reorganisation and reform under phase 2 of the reserve defence force review implementation plan ( rdfrip ). the rdf consists of the army reserve and naval service reserve : * * army reserve * * the army reserve will be organised into integrated and non - integrated elements. a reserve brigade has been established in each pdf brigade area, mirroring the pdf brigade. * * naval service reserve * * the naval service reserve is divided into two groups known as the eastern group and the southern group. each group consists of two companies : dublin and waterford in the eastern group and cork and limerick",665,118,130,44,ireland_2008_StrategyStatement.md,2025-01-28 18:56:08
138,in the southern group. - - - - - strategy statement 2008 – 2010 | department of defence & defence forces,104,21,24,44,ireland_2008_StrategyStatement.md,2025-01-28 18:56:08
139,# # appendix 2 members of the permanent defence force serving overseas as of 01 july 2008,89,17,19,45,ireland_2008_StrategyStatement.md,2025-01-28 18:56:08
140,"# # # 1. un missions ( i ) * * unifil ( united nations interim force in lebanon ) hq * * 7 ( ii ) * * untso ( united nations truce supervision * * organisation ) - israel, syria and lebanon 12 ( iii ) * * minurso ( united nations mission for * * the referendum in western sahara ) 3 ( iv ) * * unmik ( united nations interim * * administration mission in kosovo ) 4 ( v ) * * monuc ( united nations mission in * * democratic republic of the congo ) 3 ( vi ) * * unoci ( united nations mission in ivory coast",507,116,130,46,ireland_2008_StrategyStatement.md,2025-01-28 18:56:08
141,) * * 2 * * total * * 31 * * un mandated missions * * ( vii ) * * eufor ( eu - led operation in bosnia and herzegovina ) * * 47 ( viii ) * * eufor tchad / rca ( eu - led operation in chad and * * the central african republic ) ohq - paris 18 * * eufor tchad / rca ( eu - led operation in chad * * and the central african republic ) fhq - chad 21 * * eufor tchad / rca ( eu - led operation in chad * * and the central african republic ) 97th inf battalion 371 (,460,115,130,46,ireland_2008_StrategyStatement.md,2025-01-28 18:56:08
142,ix ) * * kfor ( international security presence * * in kosovo ) framework nation 61 * * kfor ( international security presence in kosovo ) hq * * 11 * * kfor ( international security presence in * * kosovo ) 38th inf group 214 ( x ) * * isaf ( international security assistance force in afghanistan ) * * 7 * * total number of personnel serving with un missions * * * * 781 * * - - - - - strategy statement 2008 – 2010 | department of defence & defence forces,459,98,106,46,ireland_2008_StrategyStatement.md,2025-01-28 18:56:08
143,"# # # 2. organisation for security and co - operation in europe ( osce ) ( i ) osce mission to bosnia & herzegovina 2 ( ii ) osce mission in belgrade - serbia 1 ( iii ) osce mission in skopje - macedo 1 ( iv ) staff officer, higher level planning group, vienna 1 * * total number of personnel serving osce * * * * 5 * *",319,72,83,47,ireland_2008_StrategyStatement.md,2025-01-28 18:56:08
144,# # # 3. eu military staff brussels 7 new york 1,48,12,15,48,ireland_2008_StrategyStatement.md,2025-01-28 18:56:08
145,"# # # 4. hq eu nordic battlegroup 12 5. military representatives / advisers / staff ( i ) military adviser, permanent mission to un, new york 1 ( ii ) military adviser, irish delegation to osce, vienna 1 ( iii ) military representatives to eu ( brussels ) 4 ( iv ) liaison office of ireland, nato / pfp ( brussels ) 2 ( v ) military representative to nato / pfp co - ordination cell / supreme headquarters allied powers europe ( shape ), mons, belgium 1 * * 39 * * * * total number defence forces * * * * personnel serving overseas * * * * 815 * *",547,114,130,49,ireland_2008_StrategyStatement.md,2025-01-28 18:56:08
146,- - - - - strategy statement 2008 – 2010 | department of defence & defence forces - - - - -,91,22,24,49,ireland_2008_StrategyStatement.md,2025-01-28 18:56:08
