chunk_id,text,char_length,word_count,token_count,section_index,source_file,processed_date
1,# # department of defence and defence forces,44,8,10,0,ireland_2008_StrategyStatement.md,2025-01-28 18:56:08
2,"# strategy statement 2008 - 2010 - - - - - parkgate, infirmary road, dublin 7. tel : ( 01 ) 804 2000 fax : ( 01 ) 670 3399 lo - call : 1890 251 890 © 2008 copyright department of defence and defence forces issn : 1649 - 1203 prn : a8 / 1354 cover image : parkgate - - - - - strategy statement 2008 – 2010 | department of defence & defence forces",345,77,92,1,ireland_2008_StrategyStatement.md,2025-01-28 18:56:08
3,"# # foreword i welcome the publication of this new strategy statement for the period 2008 2010. it sets out the high level goals for defence and outlines key strategies and outputs, on a programme basis, over this timeframe. my main objective is to ensure that we have flexible, modern defence forces with the capabilities to meet all roles assigned, at home and overseas, by government. the significant progress in developing and modernising defence over the past decade has been widely acknowledged. these advances are a model of successful public sector reform and have been achieved through the dedication of our staff, both civil and military. it is also critical that we continuously strive for",700,115,130,2,ireland_2008_StrategyStatement.md,2025-01-28 18:56:08
4,"further improvements and greater value for money and this strategy statement incorporates relevant provisions from towards 2016 and the public service modernisation agenda. over the period of this strategy statement, i intend to initiate a comprehensive review of the capacity of the defence organisation to meet emerging and future challenges within the defence and security environment and within the broader public service environment generally. this review will inform the development of the next white paper on defence, which will encompass the period 2011 - 2020. the implementation of the oecd review recommendations, the decentralisation to newbridge and the curragh, and the continued development and implementation of the management information framework, provide a",775,112,130,2,ireland_2008_StrategyStatement.md,2025-01-28 18:56:08
5,"catalyst and an opportunity for improved management, greater integration, and for the further modernisation and transformation of the defence organisation as a whole. the government decision of 8th july 2008 has set out a requirement for payroll and other savings that must be achieved. this will present certain challenges for the defence organisation. it will be necessary to delay certain defence commitments in the programme for government. the government remains fully committed to implementing these commitments within the timeframe of the programme for government i. e. 2007 – 2012, and action on these commitments will be kept under review during the period encompassed by this strategy statement. consistent with ireland ’ s traditional policy of military",764,116,130,2,ireland_2008_StrategyStatement.md,2025-01-28 18:56:08
6,"neutrality and ireland ’ s longstanding commitment to the primacy of the united nations in international relations, the provision of up to 850 defence forces personnel in support of un authorised peace support operations will continue. the government is committed to continuing ireland ’ s participation in the development of european security and defence policy under the common foreign and security policy. the recent deployment of the defence forces to the un mandated eufor mission to chad and the central african republic, is indicative of this continued commitment and highlights the important role of the eu in supporting un mandated peace support operations. - - - - - strategy statement 2008 – 2010 | department of defence & defence forces",748,120,130,2,ireland_2008_StrategyStatement.md,2025-01-28 18:56:08
7,"the measures set out in this strategy statement for the office of emergency planning underline the importance that the government places on emergency planning. as chairman of the government task force on emergency planning, i have responsibility for the coordination and oversight of emergency planning. the goal continues to be that state bodies will react quickly and effectively to any large - scale emergency and that response arrangements must continue to be characterised by effective management of all aspects of emergency planning. the opening of the national emergency coordination centre as a dedicated facility, which is available at all times to the government and the agencies of the state, for managing major emergencies, represented the culmination of much",771,118,130,2,ireland_2008_StrategyStatement.md,2025-01-28 18:56:08
8,"hard work. it is a key facility within the overall architecture being put in place by government to ensure a high readiness response capacity within the state ’ s overall emergency framework and to support public confidence in the state ’ s emergency arrangements. this strategy statement covers both the department of defence and the defence forces. achieving the outlined high level goals will require a concerted effort from all staff, both civil and military, in the defence organisation. i am confident that this will be achieved under the leadership of the secretary general and the chief of staff and they have my full support with its implementation. * * willie o ’ dea t. d. * *",687,118,130,2,ireland_2008_StrategyStatement.md,2025-01-28 18:56:08
9,minister for defence august 2008 * * willie o ’ dea t. d. * * - - - - - strategy statement 2008 – 2010 | department of defence & defence forces,143,32,36,2,ireland_2008_StrategyStatement.md,2025-01-28 18:56:08
10,"# # introduction this strategy statement sets out the vision and mission of the department of defence and defence forces for the next three years : * * vision : * * in the period 2008 - 2010 we will continue to work to develop and sustain our vision of a defence organisation that formulates and implements effective policy, provides timely and accurate advice and is capable of deploying a modern, interoperable, sustainable force that can deliver flexible military capabilities at home and abroad. * * mission : * * to provide for the military defence of the state, contribute to national and international peace and security and fulfil all other roles assigned by government. *",680,116,130,3,ireland_2008_StrategyStatement.md,2025-01-28 18:56:08
11,"* michael howard * * _ secretary general _ * * lt. general dermot earley * * _ chief of staff _ embracing our vision and achieving our mission will require great effort and dedication in the next three years. the environment in which we operate is dynamic and challenging. meeting the needs of government and the public will require that all elements of the organisation, civil and military, develop and maintain a very broad range of capabilities and deliver a variety of services and other outputs, both at home and overseas. this calls for flexibility, adaptability, innovation and hard work from all our staff. the strategy statement sets targets that we are confident can",676,115,130,3,ireland_2008_StrategyStatement.md,2025-01-28 18:56:08
12,"be achieved. our confidence is based on the track record of the defence organisation and the knowledge that we have the people and the structures to deliver. notwithstanding this, we will continue to further improve the organisation as set out in the white paper on defence and the programme for government. defence is an organisation in which all staff, civil and military are expected and enabled to achieve their full potential and where merit and effort are acknowledged. we will maintain these values and continue to support our staff in the work they do. - - - - - strategy statement 2008 – 2010 | department of defence & defence forces decentralisation will be a major challenge for us",692,119,130,3,ireland_2008_StrategyStatement.md,2025-01-28 18:56:08
13,"in the lifetime of this strategy statement. we will complete the relocation of civil and military staff from dublin to newbridge and the curragh in line with government policy. we look forward to working with colleagues, civil and military, as we face the challenges of the coming years. * * michael howard * * * * lt. general dermot earley * * _ secretary general _ _ chief of staff _ august 2008 august 2008 - - - - - strategy statement 2008 – 2010 | department of defence & defence forces",491,92,105,3,ireland_2008_StrategyStatement.md,2025-01-28 18:56:08
14,"# # contents * * section 1 : * * defence – vision, mission statement, high level goals 6 * * section 2 : * * security and defence environmental analysis 9 * * section 3 : * * achieving our goals – strategies and outputs 2008 - 2010 19 contingent capabilities 19 on - island security and support to other agencies 20 international peace and security 21 defence policy, military advice and corporate support services 22 * * appendix 1 : * * defence – legislative background, structure, roles 32 * * appendix 2 : * * defence forces personnel serving overseas 38 - - - - - strategy statement 2008 – 2010 | department of defence & defence forces",640,121,128,4,ireland_2008_StrategyStatement.md,2025-01-28 18:56:08
15,"# # section 1 : defence [ 1 ] – vision, mission statement, high level goals",75,16,20,5,ireland_2008_StrategyStatement.md,2025-01-28 18:56:08
16,"# # # vision * * in the period 2008 - 2010 we will continue to work to develop and sustain our * * * * vision of a defence organisation that formulates and implements effective * * * * policy, provides timely and accurate advice and is capable of deploying a * * * * modern, interoperable, sustainable force that can deliver flexible military * * * * capabilities at home and abroad. * *",387,76,86,6,ireland_2008_StrategyStatement.md,2025-01-28 18:56:08
17,"# # # mission statement * * to provide for the military defence of the state, contribute to national and * * * * international peace and security and fulfil all other roles assigned by * * * * government. * *",208,42,48,7,ireland_2008_StrategyStatement.md,2025-01-28 18:56:08
18,"# # # high level goals to provide for the defence of the state against armed aggression, by maintaining and developing appropriate military capabilities. to contribute to on - island security and stability by providing, on request, aid to the civil power ( atcp ), aid to the civil authority ( atca ) and other emergency and non - emergency services. to contribute to the maintenance of international peace and security through participation in approved un - mandated peace support, crisis management and humanitarian relief operations. to provide the best possible defence policy advice and military advice to the minister in order to support management of all aspects of defence provision and facilitate planning for future needs.",732,117,130,8,ireland_2008_StrategyStatement.md,2025-01-28 18:56:08
19,"the primary role of the department is to support the minister as head of the department, in particular by providing policy advice and support on defence matters. this includes assistance with policy formulation and the implementation of policy as set out in the programme for government and as directed by the minister. 1 the terminology used in this strategy statement is as follows : the term “ defence ” is used to refer in a broad sense to defence provision in ireland comprising civil and military elements ; “ defence organisation ” refers to the civil and military organisation ; the “ defence forces ” refers to the military organisation. - - - - - strategy statement 2008 – 2010 | department of defence",711,124,130,8,ireland_2008_StrategyStatement.md,2025-01-28 18:56:08
20,"& defence forces in addition to the commitments in the programme for government the white paper on defence ( 2000 ) is the key policy document on defence. as well as articulating defence policy, it deals with structural, organisational and funding issues for the period up to 2010. the goal of the white paper is to ensure an appropriate level of defence capability, having regard to the changing defence and security environment. the white paper has been of central importance in informing the strategic objectives of the department of defence and the defence forces since its publication. the roles of the defence forces are set out in the white paper : to defend the state against armed aggression",700,118,130,8,ireland_2008_StrategyStatement.md,2025-01-28 18:56:08
21,"; this being a contingency, preparations for its implementation will depend on an ongoing government assessment of the security and defence environment ; to aid the civil power ( meaning in practice to assist, when requested, the garda siochana, who have primary responsibility for law and order, including the protection of the internal security of the state ) ; to participate in multinational peace support, crisis management and humanitarian relief operations in support of the united nations and under un mandate, including regional security missions authorised by the un ; to provide a fishery protection service in accordance with the state ’ s obligations as a member of the eu ; and to carry out such",709,116,130,8,ireland_2008_StrategyStatement.md,2025-01-28 18:56:08
22,"other duties as may be assigned to them from time to time, e. g. search and rescue, air ambulance service, ministerial air transport service, assistance on the occasion of natural or other disasters, assistance in connection with the maintenance of essential services and assistance in combating oil pollution at sea. the office of emergency planning ( oep ) was established as a joint civil / military office in the department in 2001. the function of the oep is to take the lead role in supporting emergency planning. this includes ongoing co - ordination of the responses of various agencies and exercising an oversight role in relation to peacetime planning, in order to ensure",681,113,130,8,ireland_2008_StrategyStatement.md,2025-01-28 18:56:08
23,the best possible use of resources and compatibility between planning requirements. responsibility for specific,111,14,17,8,ireland_2008_StrategyStatement.md,2025-01-28 18:56:08
24,"# # # 7 emergency planning and response functions remains with the relevant lead government departments and agencies. the white paper, together with the review of implementation ( april 2007 ) and the programme for government, are of central importance in guiding defence strategic and business planning. consistent with this, the key strategies fundamental to the success of the defence organisation are the - - - - - strategy statement 2008 – 2010 | department of defence & defence forces development and maintenance of appropriate military capabilities and commitment to the ongoing analysis of the defence and security environment to facilitate planning for the future and ongoing investment in equipment, infrastructure and training. delivering on the mission statement and achieving the",792,121,130,9,ireland_2008_StrategyStatement.md,2025-01-28 18:56:08
25,"high level goals require the development and maintenance of a very broad range of capabilities and the delivery of a variety of services and other outputs, both at home and overseas. this is achieved through the civil and military elements of the defence organisation acting in concert. it is important also that the defence organisation continues to provide an input to the wider government agenda, in conjunction with other government departments. section 3 of this strategy statement sets out the strategies, outputs and actions that will be pursued in the period covered by this strategy statement. this approach comprehends the full range of defence activities and outputs. the structure and organisation of the department of defence and the defence",754,119,130,9,ireland_2008_StrategyStatement.md,2025-01-28 18:56:08
26,forces are set out in appendix 1. - - - - - strategy statement 2008 – 2010 | department of defence & defence forces,115,24,27,9,ireland_2008_StrategyStatement.md,2025-01-28 18:56:08
27,# # section 2 : security and defence environmental analysis,59,10,12,10,ireland_2008_StrategyStatement.md,2025-01-28 18:56:08
28,"# # # policy context ireland has been an active contributor to un and un - mandated peace keeping and peace enforcement operations for the past fifty years. ireland ’ s experience in these operations has enabled us to play an active part in the development of european security and defence policy ( esdp ). ireland participates where appropriate, and on a case - by - case basis, in humanitarian and crisis management operations in the military and civil areas, including esdp operations, subject to the requirements of un authorisation and government and dail approval ( the ‘ triple - lock ’ ). such participation is consistent with ireland ’ s policy of military neutrality. defence policy",692,117,130,11,ireland_2008_StrategyStatement.md,2025-01-28 18:56:08
29,"and the resourcing and implementation of that policy are grounded on a realistic and ongoing assessment of the defence and security environment. many factors, both national and international, can influence the delivery of the defence mission. chief among these are the defence and security situations at home and abroad.",320,49,58,11,ireland_2008_StrategyStatement.md,2025-01-28 18:56:08
30,"# # # domestic security situation while dissident republican paramilitaries continue to pose a low - level threat in terms of capability and intent, there is no intelligence or indication giving reasonable cause to foresee any significant paramilitary action in the state. in addition, the assessment is that loyalist paramilitaries do not pose a security threat to the state. the threat level in respect of the domestic security environment is assessed as low. notwithstanding these assessments, the defence forces continue to provide static security and atcp services. in the case of significant events requiring increased levels of security, support is provided, on request, to an garda si",692,107,130,12,ireland_2008_StrategyStatement.md,2025-01-28 18:56:08
31,"##ochana up to brigade level in strength. this usually involves military protection tasks, riot control teams, explosive ordnance disposal ( eod ) teams and air and maritime operations. at present, in terms of significant damage and / or casualties, it is considered that the main international threat to domestic security will arise from a terrorist act or an accidental disaster ( nuclear accident / medical epidemic ). however, the direct threat to ireland as a target of international terrorism is currently assessed as low. on the other hand, it is clear that ireland could be used as a base by terrorist organisations. the asymmetric nature of the terrorist threat requires all security agencies",701,113,132,12,ireland_2008_StrategyStatement.md,2025-01-28 18:56:08
32,"to reflect on current counter - terrorism strategies and to develop a fully integrated approach both on island and with international partners. - - - - - strategy statement 2008 – 2010 | department of defence & defence forces military intelligence provides regular assessments, reports and briefings to the chief of staff and the minister for defence on any threats to the security of the state and the national interest from internal or external sources. the national security committee meets on a regular basis and receives security briefings. its role is to ensure that the taoiseach and government are kept informed of high - level security issues and the state ’ s response to them. it receives threat assessments",718,119,130,12,ireland_2008_StrategyStatement.md,2025-01-28 18:56:08
33,"from the garda commissioner and the chief of staff. the committee comprises the secretaries general to the government, and of the departments of justice, equality and law reform, foreign affairs, and defence, the garda commissioner and the chief of staff. oep supports the minister as chairman of the government task force on emergency planning. the task force is the top - level structure providing policy and direction. it co - ordinates and oversees the emergency planning activities of government departments and public authorities. a key area of activity for the oep is the ongoing development of the oversight function in order to improve and develop the process and to increase public confidence",702,112,130,12,ireland_2008_StrategyStatement.md,2025-01-28 18:56:08
34,"in emergency planning. the public information and awareness campaign on emergency planning was launched at the national emergency coordination centre on the 14th april 2008. the main focus of the campaign was the publication and countrywide distribution of a handbook – ‘ preparing for major emergencies ’. emergency planning will remain a key element of security strategy and must be informed by ongoing risk assessment. the scale of international terrorist attacks in the past has shown that the full range of national resources is often called upon to respond to such outrages. the defence organisation has a vital role to play in planning for, and responding to, emergency situations.",688,109,121,12,ireland_2008_StrategyStatement.md,2025-01-28 18:56:08
35,"# # # international security situation the european security strategy ( ess ) adopted by the eu council in 2003 identified that the eu faced security threats “ which are more diverse, less visible and less predictable ”. these threats include :",244,42,47,13,ireland_2008_StrategyStatement.md,2025-01-28 18:56:08
36,"# # # 10 terrorism – movements that are well resourced, connected by electronic networks and are willing to use unlimited violence to cause massive casualities. proliferation of weapons of mass destruction – potentially the greatest threat to european security. regional conflicts – particularly those on the borders of europe. - - - - - strategy statement 2008 – 2010 | department of defence & defence forces state failure – an alarming phenomenon, that undermines global governance and adds to regional instability. organised crime – cross - border trafficking in drugs, women, illegal migrants and weapons accounts for a large part of the activities of criminal gangs. the report of the un secretary general ’",712,115,130,14,ireland_2008_StrategyStatement.md,2025-01-28 18:56:08
37,"s high level panel on threats, challenges and change entitled ‘ a more secure world : our shared responsibility ’ ( 2004 ) emphasises the need for collective security and for security to be addressed at the global, regional and national level. the report identifies six clusters of threats : economic and social threats, including poverty, infectious disease and environmental degradation. inter - state conflict. internal conflict, including civil war, genocide and other large - scale atrocities. chemical, biological, radiological and nuclear ( cbrn ) weapons. terrorism. international organised crime. in its recent publication ( november 2006 ) on a long - term vision for european security and defence policy",714,110,130,14,ireland_2008_StrategyStatement.md,2025-01-28 18:56:08
38,"( esdp ), the eu identified a number of key drivers that will impact on the global context in which esdp will operate in the future. seven key areas were identified : environment : there will be an increased need to train for and conduct disaster relief and / or humanitarian relief operations most of which will be conducted in demanding climatic conditions. healthcare for participating personnel will become increasingly important. environmental legislation will have to be taken into consideration when planning and conducting esdp operations.",547,86,96,14,ireland_2008_StrategyStatement.md,2025-01-28 18:56:08
39,"# # # 11 demography : the increasingly young population within the developing world linked with poor economic prospects, unfulfilled aspirations and uneven regional and local wealth distribution are likely to lead to inter - state / intrastate, inter - communal and inter - ethnic conflict. military organisations will face a serious recruitment problem as a result of near static population growth, an ageing population, disease and direct competition with the commercial sector. extended full - time education and changing social aspirations will also impact on recruitment. - - - - - strategy statement 2008 – 2010 | department of defence & defence forces economy : limited financial resources will impact on military capability",731,114,130,15,ireland_2008_StrategyStatement.md,2025-01-28 18:56:08
40,"development. in order to gain more financial flexibility core military tasks will have to be identified and then possibilities, constraints and conditions for outsourcing will have to be identified. international criminality will cross national boundaries to an ever - increasing extent. energy : political instability in oil production regions is likely to force developed countries to seek political and / or other solutions to improve stability. the spiralling cost of energy may ultimately affect all government spending, including spending on defence capabilities. the need for reducing both fuel consumption and carbon dioxide emissions will impact on armed forces. alternative liquid fuel and fuel cell solutions are likely to be imposed on defence equipment. this will",776,115,130,15,ireland_2008_StrategyStatement.md,2025-01-28 18:56:08
