chunk_id,text,char_length,word_count,token_count,section_index,source_file,processed_date
41,"necessitate equipment retro - fit and will impact on the development of new military capabilities. science and technology : military capabilities will be considerably enhanced through the provision of new power sources, enhanced blast explosives, directed energy weapons, advances in autonomous systems, developments in the field of material sciences and many more areas. however, there are also potential new threats associated with all these emerging technologies. the emergence of biological warfare agents developed by asymmetric opponents with lower ethical standards is but one example. society and culture : troops will increasingly need to be able to cope with multicultural societies including the integration of immigrants into armed forces and be equipped to negotiate in complex",790,115,130,15,ireland_2008_StrategyStatement.md,2025-01-28 18:56:08
42,"situations with many different actors. changing cultural norms and values, ethnically mixed society, pressures on public spending and the lack of a tangible threat may lessen public willingness to provide scarce resources for defence purposes. there will be a greater need to justify the demand for capabilities to be developed and maintained. global governance : future conflicts will involve a more complex set of actors with blurred distinctions between combatants and non - combatants. irregular actors will include terrorists, insurgents, criminals, armed followings, gangs, semi - official militias and private military and security companies. the proliferation of cbrn weapons possession beyond the existing holders, particularly to weak and unstable states,",765,110,130,15,ireland_2008_StrategyStatement.md,2025-01-28 18:56:08
43,will increase risks.,20,3,6,15,ireland_2008_StrategyStatement.md,2025-01-28 18:56:08
44,"# # # 12 all three reports clearly indicate that the global security situation is becoming more interdependent, complex and potentially unstable resulting in a new and challenging security and defence environment. the primacy of the united nations continues to be a cornerstone of ireland ’ s foreign policy. a commitment to collective security through the development of international organisations and regional co - operation is also a central element of that policy. - - - - - strategy statement 2008 – 2010 | department of defence & defence forces * * peace support operations * * a key element of ireland ’ s contribution to international peace and security is the commitment of personnel to international peace support operations",735,120,130,16,ireland_2008_StrategyStatement.md,2025-01-28 18:56:08
45,"( psos ) under un authority. in recent years the defence forces have enhanced their military capabilities enabling them to participate effectively in un chapter vii peace enforcement missions. in the area of logistics, there has been a shift away from traditional reliance on un support for deployed contingents, to an arrangement whereby the defence forces deploy self - sustaining units to green field sites. these developments reflect the increasing capability and capacity of the defence forces. inevitably, these missions are becoming increasingly expensive to mount and to sustain and are placing greater demands on personnel, logistics and finance. an increasing element of ireland ’ s engagement in un operations is the deployment of combined contingents",762,116,130,16,ireland_2008_StrategyStatement.md,2025-01-28 18:56:08
46,"with like - minded nations. unmil and unifil ii are examples of this development and of the increasing need to cooperate with partners in our international peace support operations. ireland ’ s ongoing engagement with nato / pfp, in the partnership goal process and with the planning and review process ( parp ), is a key factor in supporting interoperability and capability development enabling ireland to contribute high - end capabilities to un operations in partnership with other like - minded states. new missions bring new challenges for the irish peacekeeper. psos now have more robust rules of engagement while the peacekeeper remains subject to irish law, the laws of",677,110,130,16,ireland_2008_StrategyStatement.md,2025-01-28 18:56:08
47,"armed conflict and international human rights law. personnel are also required to have an understanding of the complex issues of cultural diversity affecting both the host nation and troops from other contributing nations. these challenges are reflected in the training and preparation of units prior to their deployment. the main overseas missions currently are in chad, kosovo and bosnia and herzegovina. details of current overseas missions are given in appendix 2. * * european security and defence policy ( esdp ) * * * * 13 * * esdp is an integral part of the common foreign and security policy, which encompasses the eu ’ s international obligations to the maintenance of international peace and security. military capabilities",734,118,130,16,ireland_2008_StrategyStatement.md,2025-01-28 18:56:08
48,"are just one element among a wide range of instruments that the eu can deploy in this regard. these include economic, political, administrative and rule of law. the ability of the eu to contribute to conflict prevention, peacekeeping and crisis management continues to be of primary importance to member states and is carried out within the context of esdp. - - - - - strategy statement 2008 – 2010 | department of defence & defence forces based on the provisions of the treaty of european union, ireland continues to participate in the ongoing development of eu military and civilian crisis management capabilities under esdp. participation in esdp takes place within the framework of ireland ’ s commitment",708,117,130,16,ireland_2008_StrategyStatement.md,2025-01-28 18:56:08
49,"to the primacy of the united nations in the maintenance of international peace and security and ireland ’ s policy of military neutrality. the two main structures for the development and implementation of esdp are the political and security committee ( psc ) and the eu military committee ( eumc ). these bodies are supported by the council secretariat and the eu military staff respectively. ireland is represented at ambassadorial level in the psc and by a brigadier general, representing the chief of staff, within the eumc. defence personnel, based in ireland ’ s permanent representation to the eu, work proactively in furthering ireland ’ s national interests within the",676,110,130,16,ireland_2008_StrategyStatement.md,2025-01-28 18:56:08
50,"union in association with colleagues from the department of foreign affairs. * * military capabilities development - eu headline goal * * in may 2004, during the irish presidency, the member states adopted new capability targets - known as headline goal 2010. this takes into account the european security strategy and changes in the international environment, including new threats and challenges, as well as the lessons learned from the first eu - led operations. member states have committed themselves to be able, by 2010, to respond with rapid and decisive action, applying a fully coherent approach to the whole spectrum of crisis management operations covered by the treaty of the european union. this includes joint disar",729,116,130,16,ireland_2008_StrategyStatement.md,2025-01-28 18:56:08
51,"##mament operations, humanitarian and rescue tasks, military advice and assistance tasks, conflict prevention and peacekeeping tasks, tasks of combat forces in crisis management, including peacemaking and post conflict stabilisation. all these tasks may contribute to the fight against terrorism, including by supporting third countries in combating terrorism on their territories. * * eu rapid response / battlegroups * *",422,59,78,16,ireland_2008_StrategyStatement.md,2025-01-28 18:56:08
52,"# # # 14 a key element of headline goal 2010 is the capability to deploy forces at high readiness. the eu battlegroup concept, which is a specific form of rapid response, complements the wider rapid reaction force concept. as of january 2007, the eu has achieved full operational capability, which means that two battlegroups are continually on standby for a period of 6 months at a time. ireland successfully participated in the nordic battlegroup ( nbg ) for a sixmonth period from the 1st january 2008. sweden, as framework nation, took the lead role in the nbg formation. ireland ’ s contribution consisted of",613,105,130,17,ireland_2008_StrategyStatement.md,2025-01-28 18:56:08
53,"an explosive ordnance disposal / improvised explosive device disposal ( eod / iedd ) - - - - - strategy statement 2008 – 2010 | department of defence & defence forces component with its own security detail together with staff posts at the operational headquarters ( ohq ) ( northwood, uk ) and force headquarters ( fhq ) in enkoping, sweden. the total number of irish personnel involved was just under 100. this level of commitment would only have arisen should the nbg have been called on to undertake an operation. the number of personnel deployed in the standby period was 10, based at the ohq and fh",603,108,130,17,ireland_2008_StrategyStatement.md,2025-01-28 18:56:08
54,"##q. joint training of the nbg took place in sweden. * * the eu and nato * * co - operation with nato was foreseen since the outset of esdp. indeed, of the 27 member states of the eu, 21 are members of nato. the relationship with nato is based on the need for the eu to have access to certain nato assets and capabilities ( e. g. strategic lift, headquarters ) for crisis management and peacekeeping missions. permanent arrangements between the eu and nato, known as ‘ berlin plus ’, have evolved in accordance with principles specified by successive european councils since feira in 2000. these principles include",614,109,132,17,ireland_2008_StrategyStatement.md,2025-01-28 18:56:08
55,"full respect for the autonomy of eu decision - making, recognition of the different natures of the eu and nato, and no discrimination against member states of either organisation. it is also accepted that the two organisations have only one set of military forces to draw on for operations. * * nato partnership for peace ( pfp ) * * ireland joined partnership for peace ( pfp ) on 1 december 1999. participation in pfp is entirely voluntary and is based on the principle of self - differentiation, that is, a state selects for itself the nature and scope of its participation in pfp activities. ireland ’ s engagement in pfp is supported through",646,114,130,17,ireland_2008_StrategyStatement.md,2025-01-28 18:56:08
56,ireland ’ s partnership liaison office in brussels. ireland ’ s five priority areas of interest are : co - operation on international peacekeeping ;,148,25,28,17,ireland_2008_StrategyStatement.md,2025-01-28 18:56:08
57,"# # # 15 humanitarian operations ; search and rescue ; co - operation in the protection of the environment ; and, co - operation in marine matters. ireland ’ s annual individual partnership programmes ( ipp ) under nato pfp focus on the enhancement of skills and expertise in such areas as operational and - - - - - strategy statement 2008 – 2010 | department of defence & defence forces generic planning for peacekeeping and peace support, communications, command and control, operational procedures and logistics. activities include training courses, seminars, workshops, conferences, staff exercises and tabletop exercises. ireland, in common with other neutral eu member states who are members of p",702,113,130,18,ireland_2008_StrategyStatement.md,2025-01-28 18:56:08
58,"##fp, also participates in the pfp planning and review process ( parp ) mechanism for planning in relation to peace support operations. ireland ’ s involvement in parp is focused on enhancing interoperability so that defence forces personnel can operate efficiently and effectively in a multi - national environment. * * european defence agency ( eda ) * * ireland joined the eda when it was established during the irish presidency in 2004. the steering board of the agency comprises eu defence ministers of the participating member states. the eda ’ s main aim is to support member states in the area of capability development and to support greater efficiency and competition in the european",693,115,133,18,ireland_2008_StrategyStatement.md,2025-01-28 18:56:08
59,"defence equipment market. ireland is supportive of developments that improve market efficiencies, potentially yielding economies of scale for equipment procurement for the defence forces and providing opportunities for irish enterprise, given the convergence in the research activities of both the civil security sector and the military sector. ireland participates in the framework of the agency and contributes to its operational budget. we will continue to support irish participation in eda programmes on a case by case basis, supporting those programmes that contribute to capability development in the defence forces and provide opportunities of interest to irish - based enterprises and researchers. we will work closely with enterprise ireland to exploit potential research and commercial opportunities arising.",819,116,130,18,ireland_2008_StrategyStatement.md,2025-01-28 18:56:08
60,"# # # organisational analysis 16 as outlined above, the programme for government and the white paper on defence set out the policy context for defence. the white paper has also made a number of recommendations, primarily focused on the defence forces, in the area of funding, structures, organisation, training, etc. a detailed review of progress in implementing the white paper was carried out and published in april 2007. the review found that very good progress has been made and recommended a number of areas upon which to focus in the period to 2010. many of these are now comprehended in the pay agreement and modernisation agenda for the defence forces agreed in the",673,114,130,19,ireland_2008_StrategyStatement.md,2025-01-28 18:56:08
61,"context of - - - - - strategy statement 2008 – 2010 | department of defence & defence forces at the same time, the department continues to meet the challenge of change and modernisation arising from the public service modernisation agenda and the action plans under successive social partnership agreements ( currently _ towards 2016 ). there have been significant achievements in strategic and _ business planning, financial management, human resource management and customer service. the focus now is to sustain these advances through a period of significant change including decentralisation. the defence organisation has many strengths. these include : proven capacity for change and flexibility as illustrated by the variety of services provided and the success",766,117,130,19,ireland_2008_StrategyStatement.md,2025-01-28 18:56:08
62,"of the organisational reform process set out in the white paper and the public service modernisation agenda. proven record in meeting government ’ s national and international security related commitments. an international reputation and acceptance of the defence forces as a professional force capable of delivering an effective response across a broad spectrum of peace support operations. a robust tradition of supporting civil control of the defence forces. positive relationships with our national and international customers ranging from an garda siochana, various government departments and agencies and local authorities, to the un, eu and osce. high levels of professionalism and a commitment to providing life long military education across all ranks in the",767,113,130,19,ireland_2008_StrategyStatement.md,2025-01-28 18:56:08
63,"defence forces ; the resilience of individual and collective morale, unquestioned loyalty and a recognised dedication and service to the state. proactive and open approach to complex human resource issues such as interpersonal relationships, successful development of the partnership process, and health and safety standards. an emphasis on capability development over the longer term ( out to 10 years ) in order to ensure that the defence forces remain well positioned",470,71,84,19,ireland_2008_StrategyStatement.md,2025-01-28 18:56:08
64,"# # # 17 to address the complex and challenging defence and security environment in the future. - - - - - strategy statement 2008 – 2010 | department of defence & defence forces key challenges facing the defence organisation include : responding to the demands of continued defence forces participation in overseas missions. missions are becoming increasingly demanding on our personnel and more expensive to prepare and sustain. the challenge is to deliver the required capability, develop our training and human resources practices and secure the necessary funding in order to deliver the required capabilities. at the same time, we must continue to maintain an on - island contingent capability and provide ongoing support for all of the services delivered by",762,122,130,20,ireland_2008_StrategyStatement.md,2025-01-28 18:56:08
65,"the defence organisation. maintaining the 70 : 30 pay to non - pay ratio. address key infrastructural issues, including military training lands to ensure operational efficiency, value for money and training imperatives are met. continue to plan for and provide the capability and flexibility necessary to respond to the evolving terrorist threat. continue to support our own people, civil and military, through whom all defence services are delivered. support the continued implementation of the public service modernisation agenda and towards 2016. successfully manage the decentralisation of civil and military elements of the department of defence to newbridge and the curragh, co. kildare in line",700,104,130,20,ireland_2008_StrategyStatement.md,2025-01-28 18:56:08
66,"with government policy. this strategy statement identifies the key strategies and actions required to address these challenges and, in so doing, continue the work of implementing the white paper on defence and address the commitments in the programme for government. - - - - - strategy statement 2008 – 2010 | department of defence & defence forces",348,57,63,20,ireland_2008_StrategyStatement.md,2025-01-28 18:56:08
67,"# # section 3 : achieving our goals – strategies and outputs 2008 - 2010 the strategies and outputs are described here at a high level, appropriate to a strategy statement, under four programme headings : 1. contingent capabilities 2. on - island security and support to other agencies 3. international peace and security 4. defence policy, military advice and corporate support services the work required in implementing these strategies and delivering outputs is set out in detail in the annual business planning cycle in both the department of defence and the defence forces.",578,94,105,21,ireland_2008_StrategyStatement.md,2025-01-28 18:56:08
68,"# # # contingent capabilities defence provision is about preparing for and dealing with contingencies. the defence organisation must prepare and maintain the capability to respond to contingencies and threats, based on an assessment of the risks to the security of the state in its broadest sense. when not actually engaged in operations, the focus for the defence forces is on training and preparation. the objective is to maintain an appropriate level of defence capability, in the light of the legitimacy of, and the necessity for, a military response to certain situations. this response must have regard to the current and prospective defence and security environment. capabilities are delivered by the defence forces",722,113,130,22,ireland_2008_StrategyStatement.md,2025-01-28 18:56:08
69,"supported by appropriate investment in equipment, infrastructure, and training. personnel are the key resource. the challenge for the defence organisation is to ensure that our human resource and corporate support systems, civil and military, provide our personnel with the requisite supports as and when required. we must ensure that our planning systems produce capabilities that are developed within an appropriate framework and have the appropriate equipment and infrastructure at the right time. the strategies to be pursued in this area are : the continued implementation of the recommendations of the white paper on defence as reviewed in the review of implementation ( april 2007 ). work will continue towards providing the best possible organisation and structure for the",780,118,130,22,ireland_2008_StrategyStatement.md,2025-01-28 18:56:08
70,"provision of defence and the development of our key resource – our human resources. - - - - - strategy statement 2008 – 2010 | department of defence & defence forces in that context, we will implement best - practice human resource strategies in the organisation, civil and military ; implement the defence forces training concept 2004 - 2009 ; continue to support the representation process and the partnership process in the defence forces ; ensure that the ongoing programme of legislative and regulatory reform is continued ; continue implementation of relevant provisions of the civil and military action plans agreed in the context of towards _ 2016. _ continue the ongoing policy of annual recruitment and maintain the strength of the permanent defence",759,124,130,22,ireland_2008_StrategyStatement.md,2025-01-28 18:56:08
71,"force at 10, 500. the commitment in the programme for government for an additional provision of up to 350 troops in training at any given time will be kept under review during the timeframe of this strategy statement. implementation of multi - annual equipment and infrastructure plans. continue the implementation of the reserve defence force review implementation plan. this will include a commitment to a public awareness and recruitment campaign. further development of special operations capabilities ; continued development of chemical, biological, radiological and nuclear ( cbrn ) capabilities ; development of defence forces intelligence organisation and continued work of defence forces doctrinal committee. to enhance and build on progress already made in the",770,114,130,22,ireland_2008_StrategyStatement.md,2025-01-28 18:56:08
72,"area of joint operations between the army, air corps and naval service by ensuring commonality of doctrine, inter - service training and exercises, improved coordination and integration at the command, operational and tactical levels. a replacement programme for naval service vessels will be a key enabler in this context and will further enhance the utility of new air corps equipment already provided.",404,62,72,22,ireland_2008_StrategyStatement.md,2025-01-28 18:56:08
73,"# # # on island security & support to other agencies 20 activities under this heading involve the development and deployment of capabilities for atcp and atca operations. typical outputs are cash & prisoner escorts, explosive ordnance disposal teams, ceremonial services, fishery protection patrols, ministerial air transport services and air ambulance flights. in addition, it encompasses preparing for and responding to industrial disputes in essential services. - - - - - strategy statement 2008 – 2010 | department of defence & defence forces the key strategies to be pursued here are : development, maintenance and delivery of the capabilities required to meet approved requests for atcp and atca operations. negotiation and monitoring of memo",748,114,130,23,ireland_2008_StrategyStatement.md,2025-01-28 18:56:08
74,"##randa of understanding ( mou ) and service level agreements ( sla ). in line with the programme for government, we will assess how we can contribute to the promotion of greater co - operation and knowledge sharing between the coast guard, the naval service and the air corps. maintenance and delivery of the capabilities required to meet agreed mou and sla targets. continue our participation in inter - agency planning exercises and evaluations ; continued liaison with local authorities and other agencies in relation to services provided by defence. continue to support the civil defence board in accordance with the civil defence act, 2002.",646,105,123,23,ireland_2008_StrategyStatement.md,2025-01-28 18:56:08
75,# # # international peace and security the primacy ireland attaches to the role of the united nations in the maintenance of international peace and security is a cornerstone of ireland ' s foreign policy and is consistent with our traditional policy of military neutrality. collective security through the development of international organisations and regional co - operation are also important elements of that policy. government policy and decisions in relation to ireland ’ s contribution to international peace and security are framed within this overall policy context and ireland ’ s policy of military neutrality. our continued level of participation in peace support operations under un authority is the key driver in the increase in demand on defence resources. key strategies,786,122,130,24,ireland_2008_StrategyStatement.md,2025-01-28 18:56:08
76,to be pursued are :,19,5,7,24,ireland_2008_StrategyStatement.md,2025-01-28 18:56:08
