chunk_id,text,char_length,word_count,token_count,section_index,source_file,processed_date
71,"the lack of structured and coordinated intelligence by the various law enforcement arms of the state leaves an unacceptable gap in the defence of law and order, which is exploited by those who do not share in the national interest. * * threats relating to crime * * * * the rule of law is at risk of collapsing * * the level of crime has increased over the years and consequently the pattern of criminal activities reflects a greater degree of organization and coordination. the situation has worsened by what appears to be an increased tolerance of crime and criminals within the wider society. it should be noted that many define social status by the amount of wealth that one possesses. however",697,123,130,10,jamaica_2006_NationalSecurityStrategy.md,2025-01-28 18:56:03
72,", very little thought is given to the source of wealth. to gain wealth and social status by any means has propelled persons into illegal activities, which are usually financially attractive. in order to protect the gains from these illegal activities, an accompanying system of enforcement has developed where extreme force is used to protect turf, routes and profits as well as to ensure loyalty. these developments and the breakdown of social norms have led to a widespread disrespect for the rule of law and the devaluation of human life. the extremely high homicide rate which the country is experiencing has to be viewed in this context. a generally violent environment along with a",687,114,130,10,jamaica_2006_NationalSecurityStrategy.md,2025-01-28 18:56:03
73,"criminal justice system ( cjs ) which works slowly, causes two things : ( a ) the perception that justice cannot be guaranteed by the state and ( b ) that the only solution for even relatively minor matters is death. - - - - - the high level of violence encourages more violence. the slow working of the cjs leads to a lack of confidence in it, and the perception that some persons are above the law, which further weakens the respect for law. the increased frequency of mob killings is an indication of a growing lack of trust and respect for the law, and lack of confidence in the cjs. * * threats relating",608,116,130,10,jamaica_2006_NationalSecurityStrategy.md,2025-01-28 18:56:03
74,"to crime * * - the rule of law is at risk - the high levels of violence, particularly armed crime and homicide - organized crime - trafficking in narcotics - illicit flow of arms and ammunition - gangs and gang activities / warfare - the effects of violence on communities - extortion - kidnapping - the state of remand facilities and correctional centres - community orders - endemic corruption - white collar crime - human trafficking - cyber crimes abusive behaviour and the use of excessive force by members of the police and the military have not aided the efforts of building respect for law and order. these types of actions have contributed to a growing sense of alienation among",687,121,130,10,jamaica_2006_NationalSecurityStrategy.md,2025-01-28 18:56:03
75,"some persons in the society who feel that they are being denied justice. the sense of alienation manifests itself through illegal road blocks as well as open displays of disrespect and distrust in the constituted authority. as a result, parallel systems of ‘ justice ’ have evolved with the assent of the dons and informal area leaders, as well as vigilante justice and arbitrary community enforcement. the cjs is perceived as being oppressive especially to the less affluent and this perception is perpetuated when the delivery of justice is slow. regarding the witness protection programme, no participant has ever been lost but there still remains a lack of confidence",671,109,130,10,jamaica_2006_NationalSecurityStrategy.md,2025-01-28 18:56:03
76,"in the programme as witnesses, albeit some outside of the programme, have been intimidated and have met untimely deaths. what is required is an ethos of sustained investigation that will lead to the successful prosecution of criminals. it is this outcome that will better engender respect for the rule of law. to prevent the collapse of the rule of law, jamaica needs sufficient capacity to monitor, regulate, investigate, prosecute and penalize criminal activities, with special focus in the area of financial crime, particularly money laundering. - - - - - * * the high levels of violence, particularly armed crime and homicide * * the report of the",651,108,130,10,jamaica_2006_NationalSecurityStrategy.md,2025-01-28 18:56:03
77,"national committee on crime and violence acknowledges that there are no fewer than ten classifications of personal crimes that are continually in the news and to which a significant number of jamaicans would consider themselves vulnerable1. these are property crimes and crimes against the person which include murder, sexual assault, aggravated assault and robbery. the statistics on violent deaths since the decade of the 1970s have revealed a grim picture ; up to april 2004 over 19, 600 cases of homicide have been recorded. this high incidence of homicide and violence is attributable primarily to political tribalism, domestic violence, drug / gang related conflicts, reprisals and mob killings, and breakdown",715,110,130,10,jamaica_2006_NationalSecurityStrategy.md,2025-01-28 18:56:03
78,"in the social order. * * techniques of organized crime * * * * • * * * * learns quickly from its defeats, and is competitive * * * * • * * * * moves assets quickly and is skilled at exploiting the laundering * * * * opportunities of the global financial and property markets * * * * • * * * * aided by technology and the speed of communications * * * * • * * * * has simple, if any, rules ; ruthlessness and success can easily go together. it * * * * threatens or uses violence * * * * • * * * * corrupts law enforcement, governments",533,119,130,10,jamaica_2006_NationalSecurityStrategy.md,2025-01-28 18:56:03
79,"and depletes a weak state ’ s * * * * resources. * * * * organized crime * * in a globalized environment organized criminal syndicates are characterized as ‘ stateless, decentralized networks that move freely, quickly and stealthily across borders, and are powerfully motivated by either religious and political goals or enormous greed and financial gains, to commit acts that threaten global security ’ 2. the caribbean manifestation of criminal networks, at present, is deemed to be motivated by greed and financial gains. the trafficking of illegal drugs, small arms and people has netted enormous profits for a minority at substantial costs for the majority in",664,108,130,10,jamaica_2006_NationalSecurityStrategy.md,2025-01-28 18:56:03
80,"the caribbean. jamaican officials have acknowledged that the drug trade nurtures the violence and lawlessness pervading the society. if allowed to continue and if left unchecked, the very survival of the state will be at grave risk. where organized crime succeeds, the state will ultimately fail ; “ … as drug cartels, street gangs and warlords move from hierarchical to ‘ internetted ’ international criminal actors, they pose an increasingly insidious threat to the legitimacy and even solvency to the state as they are refining their ability to co - opt, corrupt and challenge state institutions ” 3. - - - - - * * illicit trafficking",637,107,130,10,jamaica_2006_NationalSecurityStrategy.md,2025-01-28 18:56:03
81,"in narcotics * * the illicit drug trade in jamaica is part of a wider international network. the geographic location of jamaica makes the island attractive to international traffickers who exploit this location and have made the island one of the key cocaine trafficking routes for south american narcotics en route to north america and europe. the use of maritime vessels provides the primary mode for smuggling large quantities of cocaine through the region. while go - fast boats are common conveyances for the traffickers, bulk cargo freighters and containerized cargo ships are vulnerable to exploitation by drug smugglers. additionally the traffickers also employ the use of single and twin - engine aircraft to land at",725,116,130,10,jamaica_2006_NationalSecurityStrategy.md,2025-01-28 18:56:03
82,"both clandestine and unprotected airstrips or to drop cocaine on land or sea for collection by vehicles and vessels. couriers also provide another mode of smuggling smaller quantities via commercial flights leaving the region for europe and north america. efforts to protect the island and its citizens from the drug trade should include strategies to reduce the level of demand. the need for a comprehensive and integrated strategy that deals with both supply and demand is critical in light of the strategy of south american cocaine traffickers to increasingly pay caribbean drug traffickers in kind, leading to increased distribution and consumption of cocaine in the region. the evidence from seizures indicates that traffickers are",736,114,130,10,jamaica_2006_NationalSecurityStrategy.md,2025-01-28 18:56:03
83,seeking to establish a caribbean transit route for synthetic drugs into north america. the possibility exists that the traffickers may also use these drugs to pay local smugglers and thus increase the distribution and consumption of these drugs in the region. - - - - - * * illicit flow of arms and ammunition * * the illicit movement and proliferation of small arms and light weapons are of particular concern and have a direct bearing on the levels of violence and crimes involving assault. the trafficking of arms and ammunition is an integral element of the illegal drug trade. the availability of large numbers of arms and ammunition poses a direct threat to national security by the mere fact that there,709,122,130,10,jamaica_2006_NationalSecurityStrategy.md,2025-01-28 18:56:03
84,"are so many of these weapons in the hands of unauthorized persons. the sources of illicit arms range from illegal trafficking and smuggling from overseas, the purchase or rental of these arms locally to theft from both licensed and unlicensed firearm holders, and to a lesser extent local manufacturing ( home - made ). the process of issuing firearm licences is corrupt, the result of which is that persons of questionable character have received legal firearms. as an island state, the country needs to ensure that its borders are not porous. although manpower and equipment have an impact on the capacity to secure the borders, effective vigilance by the state agents entrusted with",685,113,130,10,jamaica_2006_NationalSecurityStrategy.md,2025-01-28 18:56:03
85,"border security at authorized air and sea ports can have a significant effect. there should also be sufficient monitoring of nonauthorized entry points. adequate intelligence regarding trafficking, purchases and rentals of firearms as well as adequate security of firearms by licensed holders will help to eliminate jamaica ’ s vulnerability to this threat. there is also concern about the adequacy with which private security firms are monitored especially as it relates to the potential misuse of arms and ammunition held by them. this misuse could occur either because of criminal intent, simple negligence or the arming of persons who are not sufficiently trained to handle firearms. * * gangs and gang",706,111,130,10,jamaica_2006_NationalSecurityStrategy.md,2025-01-28 18:56:03
86,"activities / warfare * * a 1998 study4 of jamaican gangs clearly states that it is a myth to believe that gangs and dons serve a positive social function in the communities in which they operate. the value system of these groups constitutes a sub - culture of violence which is often used as a rite of passage. ‘ making a duppy ’ ( killing an individual ) is used as a means of initiation and to achieve status. the researchers of this study viewed the emergence of area leaders as resulting from the failure of the community and politicians to provide basic necessities. the financial resources of gangs come primarily from extortion, drug smuggling and",654,116,130,10,jamaica_2006_NationalSecurityStrategy.md,2025-01-28 18:56:03
87,"remittances from overseas - based members and supporters. the threat presented by gangs could be minimized if the country significantly reduced the political and social tolerance of criminal dons ; the facilitation of garrison politics and the coercive control of communities with a power base rooted in large financial resources. political and social tolerance of gangs / dons / garrison political communities could eventually lead to a failed state. - - - - - * * the effects of violence on communities * * the world health organization ( who ) report on violence and health has defined violence as “ the intentional use of physical force or power, threatened or actual,",672,112,130,10,jamaica_2006_NationalSecurityStrategy.md,2025-01-28 18:56:03
88,"against oneself, another person, or against a group or community that either results in or has a high likelihood of resulting in injury, death, psychological harm, mal - development or deprivation. 5 the rapid increase in homicides and other acts of violence pose serious security threats and health risks to jamaica and its citizens. the who experts have stated that violence is a major issue for public health. the impact of violence on individuals, communities and the society should therefore not be underestimated. domestic violence is one of the more pervasive and common forms of violence plaguing the society. it contributes to the overall pattern of crime and violence due",681,110,130,10,jamaica_2006_NationalSecurityStrategy.md,2025-01-28 18:56:03
89,"to its debilitating effects on the social fabric and its role in socializing the youths to violence as a means of dispute resolution. women and children are disproportionately at risk from domestic violence. failure to protect the groups that are most vulnerable increases the risk that these groups will remain in or enter long - term poverty, which will help to fuel the cycle of violence and abuse. the organization and administration of the cjs is a critical factor in the effective management of crime and violence. this has to be supported by an understanding of crime and violence as not being purely a law enforcement problem, but also as problems in education",668,113,130,10,jamaica_2006_NationalSecurityStrategy.md,2025-01-28 18:56:03
90,", family, and other spheres. these structures, if dysfunctional, incubate deviance and delinquency, and thus crime and violence. it is important to treat causes and not only the effects of crime and violence. * * extortion * * the crime of extortion manifests itself primarily as part of the protection racket where persons in business are approached by criminals who demand payment for providing protection from criminal victimization. there has been growing evidence within the construction and general business sectors, particularly in the urban areas, that extortion has increased the cost of security, and hence the overall cost of doing business",651,101,130,10,jamaica_2006_NationalSecurityStrategy.md,2025-01-28 18:56:03
91,"in jamaica. this puts jamaica at a competitive disadvantage with its trading partners and serves as a deterrent for investments, social and economic development. additionally, this has caused migration of businesses from high - risk areas, to areas less volatile and not zoned for commercial / industrial use. the victims ’ fear of reprisal on their businesses and low level of confidence in the security forces ’ ability to combat extortion has led to low reporting and little or no prosecution. anecdotal sources suggest that this state of affairs has led to the practice of extortion becoming so pervasive that it has now infiltrated the public transport",657,107,130,10,jamaica_2006_NationalSecurityStrategy.md,2025-01-28 18:56:03
92,"sector as well as the private construction of homes. - - - - - * * kidnapping * * kidnapping is not prevalent in jamaica but has the potential to become a major problem especially as the incidence of kidnapping in other caribbean territories and latin america is a growing problem. in recent years, there have been a few cases of kidnapping for ransom perpetrated mostly by gangs. * * the state of remand facilities and correctional centres * * in 2003, the population in the correctional system in jamaica was 48 % above capacity in the adult institutions. the two major reception institutions ( tower street and st catherine adult correctional centres ) are severely overcrow",677,117,130,10,jamaica_2006_NationalSecurityStrategy.md,2025-01-28 18:56:03
93,"##ded, poorly maintained and inadequately staffed. these are 19th century buildings that are in disrepair, are very costly to secure, and present major challenges for the treatment and care of inmates. as a result, the integrity of the security systems in these institutions can be easily compromised. escape from correctional centres undermines the morale of those involved in the cjs who have worked to remove these criminals from the streets. it also undermines the confidence of the general population in the cjs. * * community orders * * community orders ( non - custodial sentences ) are sometimes violated and often lead to repeat offences and criminal associations in communities. it",691,111,133,10,jamaica_2006_NationalSecurityStrategy.md,2025-01-28 18:56:03
94,"is often due to lack of proper monitoring resulting from poor collection and verification of pre - sentence data on offenders by officers of the court. this is a continued threat to public safety. * * endemic corruption * * in jamaica, corruption in its various forms is a serious threat to the social order and the rule of law. it manifests itself in many ways and inhibits the ability of the state to effectively discharge its responsibilities and obligations. systemic weakness in the organization and management of various functions of government, public and private sectors have contributed to this malaise. examples abound, including the illegal issue of driving permits, motor vehicle licences,",701,113,130,10,jamaica_2006_NationalSecurityStrategy.md,2025-01-28 18:56:03
95,"firearm licences and the bribery of public officials. political institutions and freedoms can also be affected by corruption. this could occur through the corruption of public officials which may not only be encouraged through rewards but may also be coerced through direct threats i. e. through an offer of ‘ gold or lead ’. penetration and weakening by criminal networks of the cjs, government and the political process could eventually lead to the demise of the state. - - - - - * * white collar crime * * the risk and cost to businesses from the theft of intellectual property, financial crimes and the fraudulent use of commodity and service brands run into billions of",674,116,130,10,jamaica_2006_NationalSecurityStrategy.md,2025-01-28 18:56:03
96,"dollars annually. much of the white collar and organized criminality is beyond present public law enforcement capabilities6 and this adds to the levels of insecurity within the society. it also results in a diversion of tax revenues away from the government. * * human trafficking * * the smuggling and trafficking of persons by illegitimate means between countries is of increasing concern in the caribbean region. this is another lucrative source of income for organized criminal networks. * * cyber crimes * * networked information systems play an increasingly important role in our socio - political, economic and financial infrastructure, in terms of critical information services within telecommunications, commerce and banking sectors. the recent",753,114,130,10,jamaica_2006_NationalSecurityStrategy.md,2025-01-28 18:56:03
97,"spate of ‘ hacker attacks ’ on microsoft and other operating systems around the world, have highlighted the weaknesses of existing technology, in offering protection against such attacks. attacks on networked information systems exploit vulnerabilities that arise from flaws in the software systems, from the failure of system administrators to properly configure such software, or from organizational policy failures that leave ‘ back doors ’ ( such as unauthorized modems ) through which intruders can gain access. there needs to be more specific legislation to address this problem, in addition to sufficient skills training and increased awareness of the risks associated with electronic commerce and other internet activities. - -",735,110,130,10,jamaica_2006_NationalSecurityStrategy.md,2025-01-28 18:56:03
98,"- - - * * terrorism * * * * direct threats * * it is widely acknowledged that international terrorism entails the deliberate use of violence or threat of violence against civilians and / or property in order to cause fear and instability in a larger population. jamaica is not immune from the threat of terrorism, as we exist in a global environment where the actions of non - state actors can create instability and insecurity. direct threats of terrorism include hostage taking, hijacking, various narco - terrorism incidents, release of toxic chemicals and biological agents into the environment, and the use of nuclear weapons. the potential for terrorist incidents originating locally is",692,114,130,10,jamaica_2006_NationalSecurityStrategy.md,2025-01-28 18:56:03
99,"real. based on the country ’ s proximity to the united states, groups with terrorist intent could seek to use jamaica for training and as a base from which to launch assaults. overseas economic interests in jamaica, such as investment by multi - national corporations, and foreign states ’ interests, including diplomatic missions and international organizations, could make us indirectly susceptible to terrorist activities. the presence of foreign nationals including overseas visitors and other persons who may be the target of terrorists increases this vulnerability. jamaica has limited ability to identify and monitor individuals entering the country with terrorist intent. this difficulty is particularly acute given that the majority of traffic which passes through the airports is foreign",797,118,130,10,jamaica_2006_NationalSecurityStrategy.md,2025-01-28 18:56:03
100,"tourists ( 70 % ) about which the immigration services would have very little information. jamaica ’ s tourist industry, particularly the resort areas and cruise shipping, has been expanding and could be regarded as a soft target for terrorist attacks aimed at nationals of the major western powers, particularly since the events of september 11, 2001. the security of these areas poses a challenge in light of limited financial, technological, human and other resources. there is a need to improve jamaica ’ s intelligence and monitoring systems. and efforts should be made to better coordinate and share information locally, regionally and internationally. more efficient controls on immigration are also necessary. other resources including",743,114,130,10,jamaica_2006_NationalSecurityStrategy.md,2025-01-28 18:56:03
101,"the legal framework and technology are to be enhanced to identify and monitor persons passing through our borders whether legally or illegally. also of importance are specific legislation and controls designed to prevent and counter terrorism in its various forms. - - - - - the mechanisms to detect and counter the financing of terrorist networks are to be improved. jamaica is to control the flow of illicit arms, explosives, and nuclear, biological and chemical ( nbc ) hazards to reduce the opportunities for terrorist operations. other measures to be implemented include : the improved national identification system ; increased public awareness and knowledge of the potential dangers of terrorism ; as well as adequate preparedness of security agencies and",762,120,130,10,jamaica_2006_NationalSecurityStrategy.md,2025-01-28 18:56:03
102,"key government institutions. a formal operational protocol and agreement should be established between the operational arms of the security sector. the human resources and financing provided are to be adequate. there should be sufficient specialist training in anti - terrorism measures. * * indirect threats * * sustainable development in the areas of tourism, investments and the country ’ s ability to earn foreign exchange are indirectly threatened by terrorist acts committed overseas. the flow of visitors to the island was severely reduced immediately after september 11, 2001. there was a reduction in the volume of exports and foreign exchange earnings as a result of the new security measures associated with the inspection of jamaican exported goods, particularly to",777,119,130,10,jamaica_2006_NationalSecurityStrategy.md,2025-01-28 18:56:03
103,"north america. if the situation exists where a terrorist organization penetrates political institutions, jamaica could become a haven for terrorists and a launch pad for terrorist activity. depending on the extent of this infestation, jamaica could find itself becoming the target of international counter - terrorist activities. the country should therefore ensure that there are sufficient controls on the sources of funding for, political organizations and political representatives. * * military and para - military threats * * * * illegal paramilitary groups * * illegal paramilitary groups may be defined as groups of civilians organized in military fashion ( armed and using organized tactics ), without legitimate authority. in the face of the real danger",763,116,130,10,jamaica_2006_NationalSecurityStrategy.md,2025-01-28 18:56:03
