chunk_id,text,char_length,word_count,token_count,section_index,source_file,processed_date
1,national security strategy for jamaica towards a secure and prosperous nation a green paper revised may 2006 prepared by the national security strategy development working group for the ministry of national security - - - - -,225,37,39,0,jamaica_2006_NationalSecurityStrategy.md,2025-01-28 18:56:03
2,# # table of contents table of contents … … … … … … … … … … … … … … … … … … … … … … … … … … … … i foreword … … … … … … … … … … … … … … … … … … … … … … … … … … … ii message from the minister of national security … … … … … … … … … … … … … … … … … iii executive summary … … … … … … … … … … … … … … … … … … … … … … … … … … … … … … … … iv glossary,342,127,130,1,jamaica_2006_NationalSecurityStrategy.md,2025-01-28 18:56:03
3,… … … … … … … … … … … … … … … … … … … … … … … … … … … … … viii the vision for national security for jamaica … … … … … … … … … ix chapter 1 – strategic environmental analysis … … … … … … … … … 1 introduction … … … … … … … … … … … … … … … … … … … … … … … … … … 1 setting the context … … … … … … … … … … … … … … … … … … … … … … … … … … … … … 1 the impact of international,368,128,130,1,jamaica_2006_NationalSecurityStrategy.md,2025-01-28 18:56:03
4,"geo - politics … … … … … … … … … … … … … … … 2 the global economy … … … … … … … … … … … … … … … … … … … … … … 3 trans - national organized crime … … … … … … … … … … … … … … … … … 3 domestic political maturity and human, social and economic development 3 global environmental hazards and disasters … … … … … … … … … … … … … … 3 summary of jamaica ’ s security concerns … … … … … … … … … … … … … … … 4 chapter 2 – threats to jamaica",430,127,130,1,jamaica_2006_NationalSecurityStrategy.md,2025-01-28 18:56:03
5,’ s national security … … … … … … 5 threats relating to crime … … … … … … … … … … … … … … … … … … … … 5 terrorism … … … … … … … … … … … … … … … … … … … … … … … … … … … 9 military and para - military threats … … … … … … … … … … … … … … … … … 10 disasters & unsustainable loss of natural resources … … … … … … … … … … 11 socio - economic threats … … … … … … … … … … … … … …,371,125,130,1,jamaica_2006_NationalSecurityStrategy.md,2025-01-28 18:56:03
6,… … … … … … … 12 key capabilities … … … … … … … … … … … … … … … … … … … … … … … … 16 - - - - - chapter 3 – the strategy … … … … … … … … … … … … … … … … … … … … 17 the approach … … … … … … … … … … … … … … … … … … … … … … … … … … … … … … 17 jamaica ’ s strategic security goals … … … … … … … … … … … … … … … … 17 cross - cutting issues … …,337,128,130,1,jamaica_2006_NationalSecurityStrategy.md,2025-01-28 18:56:03
7,… … … … … … … … … … … … … … … … … … … … 17 special security initiatives … … … … … … … … … … … … … … … … … … … … 18 action plan for strategic security goals … … … … … … … … … … … … … … 22 goal 1 – to reduce violent crime and dismantle organized criminal networks … … … 22 goal 2 – to strengthen the criminal justice system and promote respect for the rule of law 26 goal 3 – to protect jamaica from terrorism … … … … … … … … … … … … 28 goal 4 – to protect,454,126,130,1,jamaica_2006_NationalSecurityStrategy.md,2025-01-28 18:56:03
8,"and control jamaica ’ s territory … … … … … … … … … 31 goal 5 – to strengthen the integrity of institutions of democratic government 35 goal 6 – to increase jamaica ’ s contribution to regional and international security … … … … … 38 goal 7 – to provide the environment for a stable economy, and an effective delivery of social services … … … … … … … … … … … … 40 goal 8 – to protect jamaica ’ s natural resources and reduce the risks of disasters … … … … … 43 chapter 4 – coordinating and monitoring mechanisms … … … … 47 conceptual framework … … … … … … … … … … …",565,127,130,1,jamaica_2006_NationalSecurityStrategy.md,2025-01-28 18:56:03
9,… … … … … … … … … 47 national security strategy implementation unit … … … … … … … … … … … … 47 specific mechanisms … … … … … … … … … … … … … … … … … … … … … 48 coordination of intelligence … … … … … … … … … … … … … … … … … … … … 48 enhancing programmes to promote community safety and security … … … 48 the public ’ s involvement in implementing the nss … … … … … … … … … … 48 funding priorities … … … … … … … … … … … … … … … … …,429,127,130,1,jamaica_2006_NationalSecurityStrategy.md,2025-01-28 18:56:03
10,… … … … … … 49 - - - - - refrences … … … … … … … … … … … … … … … … … … … … … … … … … … … … … … … … … 50 annex a – nss development process including methodology 1 [ please click here to view the annex - a diagram ( annex a ) ] ( http : / / www. cabinet. gov. jm / docs / pdf / nss _ docs / annex _ a. pdf ) annex b – nss schedule 1 [ please click here to view the annex – b diagram ( annex b ),392,116,130,1,jamaica_2006_NationalSecurityStrategy.md,2025-01-28 18:56:03
11,] ( http : / / www. cabinet. gov. jm / docs / pdf / nss _ docs / annex _ b. pdf ) annex c – committees 1 annex d – stakeholders consulted 4 annex e – matrix – responsibilities [ please click here to view the annex – e diagram ( annex e ) ] ( http : / / www. cabinet. gov. jm / docs / pdf / nss _ docs / annex _ e. pdf ) annex f – jamaica ’ s future security sector [ please click here to view the annex – f diagram ( annex f ) ] ( http : / / www.,446,111,130,1,jamaica_2006_NationalSecurityStrategy.md,2025-01-28 18:56:03
12,cabinet. gov. jm / docs / pdf / nss _ docs / annex _ f. pdf ) - - - - -,71,22,31,1,jamaica_2006_NationalSecurityStrategy.md,2025-01-28 18:56:03
13,"# # foreword * * prime minister the most hon. percival j. patterson, o. n. p. c. q. c. m. p. * * the foremost responsibility of the government is to provide for a secure and safe environment conducive to the wellbeing of the citizens and the development of the country. we face as a nation the monumental task to rid our country of crime and violence. in addressing this most urgent matter the government is aware that the issue of national security encompasses many more factors than domestic crime and violence. however, by addressing the multifaceted aspects of national security, crime and violence should",609,105,130,2,jamaica_2006_NationalSecurityStrategy.md,2025-01-28 18:56:03
14,"also be contained. - - - - - this document presents the government ’ s overarching policies on national security matters through a process of a strategic environmental analysis relating to security, describing the threats that work against the full achievement of the country ’ s security goals, determining jamaica ’ s security priorities in relation to the capabilities and policies required to counter those threats, and establishing the responsibilities, structures, and timelines for implementation. careful attention has been given to providing just enough detail for implementers to have sufficient guidance to understand their responsibilities and how they relate to others involved. the national security strategy aims to enhance coordination and cooperation among the different ministries",798,116,130,2,jamaica_2006_NationalSecurityStrategy.md,2025-01-28 18:56:03
15,"and national security agencies as the new security environment results in a blurring of traditional agency boundaries. whilst maintaining its sovereignty, jamaica will continue to meet its international obligations and play its full role in contributing to the security and development of its partners in the caribbean, americas and the global international community. this includes providing for substantial linkages with the evolving caricom security initiatives endorsed by the heads of government in july 2005, bilateral and multi - lateral security arrangements. together with such partners, it aims to eradicate transnational organized crime, illicit trafficking and international terrorism and move towards international peace and sustainable development. the ministry of national security ( mns",802,112,130,2,jamaica_2006_NationalSecurityStrategy.md,2025-01-28 18:56:03
16,") will not lead on all aspects of the nss implementation, as some of the capabilities that impact on security are outside the direct scope of the mns. most ministries and agencies have specific direct or supporting roles in implementing and sustaining this security strategy. further, notwithstanding the government ’ s role and responsibility to secure the nation, this cannot be achieved without the same focus from every citizen of jamaica. now is the time for all of us to make a stand together. in fulfilling the foremost responsibility of providing for a secure and safe environment conducive to the wellbeing of the citizens and the development of the country, the government is",685,113,130,2,jamaica_2006_NationalSecurityStrategy.md,2025-01-28 18:56:03
17,"committed to making all reasonable effort to provide the necessary resources, the strategic guidance, policies and legislation as determined by the nss and supporting analyses. it is then up to all of us as citizens, individually and collectively, to play our part in ensuring the safe and secure environment for which we yearn. the most hon. percival j. patterson, o. n. p. c. q. c. m. p. prime minister - - - - -",414,74,95,2,jamaica_2006_NationalSecurityStrategy.md,2025-01-28 18:56:03
18,"# message from the minister of national security * * dr. the hon. peter phillips, mp * * national security may be described as the measures taken by a state to ensure its survival, security and protection of its interests. sometimes national security is considered to be synonymous with defence from external threats in particular. in reality, and particularly in the jamaican context, national security includes the maintenance of armed forces ; maintenance of order by non - military agencies, including emergency preparedness ; creation of resilience and redundancy in national infrastructure ; maintenance of intelligence services to deter threats ; protection of sensitive information, and maintenance of law and order internally through",742,113,130,3,jamaica_2006_NationalSecurityStrategy.md,2025-01-28 18:56:03
19,"the police and other arms of the criminal justice system. - - - - - a national security strategy ( nss ) is crucial at this time to pull together the several initiatives already implemented by the government and to put in place other mechanisms that are required to ensure a comprehensive, multifaceted approach to jamaica ’ s security issues. this nss integrates jamaica ’ s major security goals, policies, responsibilities and actions into a cohesive whole, ‘ … to provide an environment in which jamaicans experience freedom and the other benefits guaranteed by the constitution ’ ( vision ), can realize their full potential and enjoy a good quality of life. this",667,113,130,3,jamaica_2006_NationalSecurityStrategy.md,2025-01-28 18:56:03
20,"nss is an overall master plan for accomplishing national security goals through the combined use of the instruments of national power, which are political, economic, social and military in nature. it provides overall strategic guidance and establishes the limits within which security decisions can be made at a lower level. the intention is to make individuals and organizations more aware of their roles as part of a broader security sector and to better coordinate their activities within resource constraints. the nss is not a crime fighting plan or a blueprint for military action in defence of the nation. the nss does not replace current initiatives against crime and violence but is supportive of these and all",718,116,130,3,jamaica_2006_NationalSecurityStrategy.md,2025-01-28 18:56:03
21,"other initiatives aimed at ensuring a safe and secure national environment. at the highest policy level, it is designed to provide for cooperation and collaboration on national endeavors for more coordinated actions through optimum utilization of resources for the best possible results. at the same time, the nss recognizes jamaica ’ s obligations to current caricom security initiatives, bilateral and multi - national arrangements. currently, the local police and military tend to be seen as the only agencies responsible for national security although there are other agencies, such as customs and immigration, which traditionally have not been formally recognized as a part of the national security apparatus. the nss will seek to build",741,113,130,3,jamaica_2006_NationalSecurityStrategy.md,2025-01-28 18:56:03
22,"a more integrated and cohesive national security network encompassing most ministries and several agencies. some of these will have lead and / or coordinating or supporting roles in the implementation of the nss generally and in the achievement of the strategic security goals in particular. it is expected that all government organizations identified as having a part to play in jamaica ’ s national security will embrace this nss, critically examine its directives and conduct their own internal assessment of its implications on their roles and structure, and will take the necessary actions required to contribute to national security efforts. it is also expected that the citizens of jamaica will now further appreciate the important role they have to",756,119,130,3,jamaica_2006_NationalSecurityStrategy.md,2025-01-28 18:56:03
23,"play in their own security and the security of their fellowman. dr. the hon. peter phillips, mp minister of national security - - - - -",135,26,33,3,jamaica_2006_NationalSecurityStrategy.md,2025-01-28 18:56:03
24,"# executive summary security is a public good to be delivered by the state through its agents and institutions. the vision of the government of jamaica for national security is to establish a “ safe and secure environment in which it can focus on achieving a prosperous, democratic, peaceful and dynamic society which upholds the fulfillment of human rights, dignity for all persons, and build continual social progress based on shared values and principles of partnership … ” in essence, the vision is for all jamaicans to enjoy a better quality of life and realize their full potential. national security issues greatly affect the nation ’ s chances of achieving all of its social and economic goals. these",708,118,130,4,jamaica_2006_NationalSecurityStrategy.md,2025-01-28 18:56:03
25,"issues also have local, regional and international dimensions. jamaica must compete within a global economy that demands that goods and services from this country be internationally competitive. open trading practices must be embraced and the smooth transit of goods and movement of persons facilitated through its ports. the trading systems are at risk due to the threat of illicit movement and proliferation of small arms and light weapons. the trafficking of arms and ammunition is also known to be an integral element of the illegal drug trade. this is of particular concern, because it has a direct bearing on the level of violence and crimes involving assault. and, a parallel system of enforcement based upon the use of unlawful",735,119,130,4,jamaica_2006_NationalSecurityStrategy.md,2025-01-28 18:56:03
26,"force has developed to protect the lucrative gains from these illegal activities. not only has the level of violent crime increased over time, but the pattern has also changed and a higher degree of organization and coordination has emerged. over the decades, the police - community relationship has broken down and an unhealthy mutual distrust prevails, with a frequent cry of “ we want justice ” from citizens. the increased frequency of mob killings is indicative of the growing lack of trust or confidence in our criminal justice system and respect for the law. the country is also grappling with an extremely high homicide rate. these homicides are concentrated in known areas",681,112,130,4,jamaica_2006_NationalSecurityStrategy.md,2025-01-28 18:56:03
27,", but the phenomenon of murderous conflicts is robbing jamaica of thousands of citizens in the prime of their youth. the continuous growth in the number of violent incidents causes many jamaicans at home to live in fear, and influences those in the diaspora to abandon their dream of resettling on the ‘ rock ’. it is now conceded that jamaica has spawned a culture of violence in its most negative form, which is abhorrent to its values and stands in the way of every kind of social progress. these developments and the breakdown of social mores have led to a widespread disrespect for the rule of law and the devaluation",622,111,130,4,jamaica_2006_NationalSecurityStrategy.md,2025-01-28 18:56:03
28,"of human life. - - - - - essentially, threats to jamaica include those relating to crime, terrorism, military and para - military concerns, disasters and unsustainable loss of natural resources, and socio - economic issues. following a careful analysis of the many threats to national security and their associated vulnerabilities, it was determined that there are fifteen key capabilities that are required to counter or mitigate the extent of the country ’ s exposure to these threats. these are the capacity to : - control entry and exit through ports of entry and coastline / land of jamaica - monitor, regulate and control use of jamaica ’ s airspace,",656,110,130,4,jamaica_2006_NationalSecurityStrategy.md,2025-01-28 18:56:03
29,"coastal waters and exclusive economic zone ( eez ) - ensure an effective cjs - prevent crime ( including armed groups an insurgents ) - counter corruption to ensure public ownership of and confidence in the cjs - regulate and control arms - dismantle organized criminal networks - gather, assess and use effective intelligence ( major cross cutting priority ) - plan to limit vulnerability and respond effectively to disasters and unsustainable degradation of resources ( cjs ) - maintain a stable and healthy economy - address social and economic causal factors of alienation and crime - implement public education programmes ( important overall cross - cutting issue ) - ensure adequate healthcare and education - influence",725,117,130,4,jamaica_2006_NationalSecurityStrategy.md,2025-01-28 18:56:03
30,"regional and international policies and activities ( important cross cutting priority ) - deter, counter or defeat ‘ traditional military threats ’ many initiatives have been developed to deal with the scourge of crime and violence with varying degrees of success ; but there is now full recognition that national security encompasses much more than concerns about crime and violence, as critical as that is. - - - - - national security may be described as the measures taken by a state to ensure its survival, security and protection of its interests. in the jamaican context, national security takes on a broader meaning beyond military defence from external threats. it encompasses civil defence measures, including emergency preparedness",741,117,130,4,jamaica_2006_NationalSecurityStrategy.md,2025-01-28 18:56:03
31,", and the maintenance of law and order internally through the police and other arms of the criminal justice system. the current challenging security environment locally, coupled with the threat of international terrorism, results in a blurring of traditional agency boundaries with many entities now recognizing that they have a role to play in promoting national security. hence, there is a need to enhance coordination and cooperation among the different ministries and national security agencies. the national security strategy ( nss ) cohesively integrates the country ’ s major security policies, goals, responsibilities and actions into an overall master plan for the fulfillment of the vision for jamaica. the nss outlines the combined",742,113,130,4,jamaica_2006_NationalSecurityStrategy.md,2025-01-28 18:56:03
32,"use of the political, economic, social, informational and security instruments of national power, including the military. it clarifies the institutional framework within which the armed forces and civil institutions of the state will coordinate their activities to create an integrated and cohesive national security network to safeguard national interests. it also prescribes the complementary roles and responsibilities of public and private sectors, as well as members of civil society in supporting national security. all jamaicans must play a part in safeguarding the country ’ s national security. certainly, the jdf and jcf have critical roles to play that are central to the effective implementation of the nss",718,107,130,4,jamaica_2006_NationalSecurityStrategy.md,2025-01-28 18:56:03
33,". notwithstanding, all government ministries, departments and agencies ( mdas ) should critically examine their directives and conduct their own internal assessment of the implications of their roles and structures. individual citizens, the private sector and members of civil society groups are invited to join in this process of transformation and take the necessary steps to contribute to the achievement of the national security goals. the nss approaches this bold process of transformation in a three - fold way, as it requires the transformation first of attitudes, then processes and systems and finally practices. the nss aims to transform attitudes to promote security awareness and zero tolerance. national security is everyone ’ s business!",751,114,130,4,jamaica_2006_NationalSecurityStrategy.md,2025-01-28 18:56:03
34,"national security must have first priority and a culture of zero tolerance for disorderly, corrupt and criminal conduct promoted. the nss aims to transform processes to achieve unity of effort. existing mechanisms must be developed and strengthened to encourage cooperation and collaboration for multi - agency security efforts locally and with international partners. - - - - - the nss aims to transform practices for greater efficiency. capacity must be built and strengthened in all areas of need and the sustained provision of appropriate and affordable resources ensured. the national security strategy has identified eight strategic security goals to effectively address the challenges currently facing the nation. the goals are to : 1. reduce violent crime and",767,117,130,4,jamaica_2006_NationalSecurityStrategy.md,2025-01-28 18:56:03
35,"dismantle organized criminal networks 2. strengthen the criminal justice system and promote respect for rule of law 3. protect jamaica from terrorism 4. protect and control jamaican territory 5. strengthen the integrity of institutions of democratic government 6. increase jamaica ’ s contribution to regional and international security 7. provide the environment for a stable economy and an effective delivery of social services 8. protect jamaica ’ s natural resources and reduce the risks of disasters matters relating to the effective analysis and use of intelligence, and the enhancement of public education and awareness were also identified as crosscutting issues. an action plan has been developed for each of the strategic security goals. the",751,114,130,4,jamaica_2006_NationalSecurityStrategy.md,2025-01-28 18:56:03
36,"plan outlines the specific capabilities, objectives and actions required by named ministries, departments and agencies which contribute significantly to security within given timeframes. an implementation matrix is given as an aide in annex e to allow for the swift identification of primary and supporting responsibilities. as a priority, there are five special security initiatives which underpin the thrust of the nss in establishing that national security is everyone ’ s business. these are : 1. strengthening of the country ’ s national intelligence system 2. conducting strategic reviews of critical national security bodies and accelerating modernization efforts 3. establishing a national task force to strengthen the overall effectiveness of jamaica ’ s criminal justice system",787,115,130,4,jamaica_2006_NationalSecurityStrategy.md,2025-01-28 18:56:03
