chunk_id,text,char_length,word_count,token_count,section_index,source_file,processed_date
272,"the lure of criminality within jamaica. - - - - - * * specific actions – medium term * * a. * * mlgcds will establish effective framework / models, based on domestic and * * international best practices, for the development of regional, parish and community development committees. concurrently, the framework for the implementation of joint public / private sector programmes aimed at the sustained financing of the development committees will also be developed. b. * * mfp and mlss will continue the review and improvement of the public sector * * compensation schemes and seek to improve the working conditions within the public service. additionally, the professional development and training",696,112,130,11,jamaica_2006_NationalSecurityStrategy.md,2025-01-28 18:56:03
273,of public officials will be significantly enhanced to include increased access to tertiary level educational opportunities as well as in - service training. * * capability 2 * * a. effective systems to promote and sustain transparency within the public sector are necessary to tackle the perceived and real lack of transparency in the operations of many of the public sector institutions. these systems would also facilitate improved access by the public to government and other public sector institutions and services. systems implemented must include the necessary checks and balances to ensure their efficacy. there must also be scheduled review periods to facilitate their currency and appropriateness. built into such checks and balances must be the collective responsibility of,783,119,130,11,jamaica_2006_NationalSecurityStrategy.md,2025-01-28 18:56:03
274,"the particular organization, and by extension government, to the society, as well as the individual accountability of the leadership elements for their performance. b. an enhanced code of conduct for ministers, parliamentarians and other public and private sector officials needs to be implemented and enforced. this will ensure that the perceived and actual lack of ethics with respect to government and other public officials as well as members of the private sector will be addressed. * * objective * * * * • * * * * strengthen the integrity of public institutions and eradicate corruption by * * * * preventing, detecting and deterring corruption, and consistently enforcing * * * * law and",694,115,130,11,jamaica_2006_NationalSecurityStrategy.md,2025-01-28 18:56:03
275,"order. * * - - - - - * * specific actions – short term * * * * cabinet office will enhance measures to prevent, detect and deter corruption in the * * public service. the reinforcement of this will include the review of current systems and procedures and the rationalization of staff within a year. effective sanctions and penalties will be introduced and existing ones strengthened in order to adequately and expeditiously deal with breaches. a. * * moj will enhance the analytical and investigative capacity of the commission * * for the prevention of corruption until the establishment of the proposed nia, which is intended to carry out investigations into abuses",667,114,130,11,jamaica_2006_NationalSecurityStrategy.md,2025-01-28 18:56:03
276,"and corrupt practises. this enhancement will address increased staffing and facilitate the review and amendment of the legislative framework over time. the review and necessary implementation will be completed within 6 - 12 months. b. provisions will also be made to protect persons who provide information on corrupt actions which will be done through the passage of legislation and / or the appointment of a ‘ confidential ombudsman ’, and to consider expanding the jurisdiction of the commission beyond the public sector. mns and moj will establish the monitoring framework within a year. there must also be periodic updates of the security vetting system within the public sector, particularly for sensitive",711,111,130,11,jamaica_2006_NationalSecurityStrategy.md,2025-01-28 18:56:03
277,"positions. c. stringent security vetting standards will be enforced for the beneficiaries of government contracts. the review and necessary changes will be completed by the moj in collaboration with the contractor general. d. cabinet office will also aggressively pursue the institutionalization of the performance based management system ( pbms ) within the public sector. mlss will develop standards and performance measurement parameters in order to facilitate the full implementation of the pbms. this will establish a framework to allow for public scrutiny of the operations of mdas, which will serve to complement the access to information act and other goj initiatives aimed at greater disclosure within",710,106,130,11,jamaica_2006_NationalSecurityStrategy.md,2025-01-28 18:56:03
278,"the public sector. * * goal 6 - to increase jamaica ’ s contribution to regional and * * * * international security * * - jamaica is integrally involved in regional and international efforts to promote and maintain international peace and security. in this regard, the country continues to co - operate and to play an active role in the development and implementation of regional and international security initiatives and measures with the primary national security objective being to, secure jamaica ’ s borders, to protect its sovereignty and integrity, to secure its maritime areas of jurisdiction and air space and ultimately to protect its nationals. - - - - - - the state ’ s interests and contributions",710,120,130,11,jamaica_2006_NationalSecurityStrategy.md,2025-01-28 18:56:03
279,"in regional and international security are also viewed with - in the context of the country ’ s need to create a secure environment for its nationals to experience freedom and to effectively contribute to economic growth and development. additionally, the security and economic stability of jamaica ’ s trading partners in the caribbean, the wider hemisphere and the global community are relevant to the country ’ s security and development process. - a caricom regional task force on crime and security has proposed the establishment of a management structure for the regional crime and security agenda. included in this structure is an implementation agency for crime and security ( impacs ) and a co - coordinating authority for",731,119,130,11,jamaica_2006_NationalSecurityStrategy.md,2025-01-28 18:56:03
280,"information management ( cima ), which would both assist in the co - ordination and processing of relevant security information. the nss recognises the importance of these mechanisms and provides for the appropriate linkages at the policy making level and imple - mentation stages. * * capabilities * * a. the wide ranging issues affecting regional and international security require effective and co - ordinated policies and operational measures among countries for improvement in peace and security. jamaica is expected to maintain its leadership role in the region and, as such, will be fully prepared to effectively contribute to regional security with the required capabilities to counter the dynamic security challenges, which",732,112,130,11,jamaica_2006_NationalSecurityStrategy.md,2025-01-28 18:56:03
281,"threaten national and regional security. jamaica should therefore have the necessary capabilities to strengthen its commitment to international efforts in the maintenance of global peace and security and to implement international security measures, including the implementation of relevant un security council resolutions. b. jamaica requires legislation to fully implement the provisions of a number of international legal instruments to which it is a signatory, including the international convention against transnational organized crime and its protocols, the international convention against the illicit trafficking in narcotics and its protocols, and the international convention against terrorist financing. c. the security concerns in the region and the international community are compounded by the potential for increased terrorist activities, the",858,115,130,11,jamaica_2006_NationalSecurityStrategy.md,2025-01-28 18:56:03
282,"illicit trafficking in narcotic drugs, the illegal trade in small arms and ammunition, and the prevalence of money laundering and transnational organized crime. the following capabilities are required : d. security cooperation agreements with regional and international partners e. structured intelligence sharing with partners - - - - - f. comprehensive and up to date laws and regulations g. regional and international security - related agreements h. effective mechanisms to monitor, regulate and enforce agreements. i. enhanced capacity to influence the development of regional and international policies relating to peace and security. j. effective communication systems to heighten public awareness. k. capacity to monitor, assess and respond to",751,108,130,11,jamaica_2006_NationalSecurityStrategy.md,2025-01-28 18:56:03
283,"regional and international security events. l. capacity to contribute to regional and international conflict prevention, crisis management, peace - keeping activities and other interventions including humanitarian assistance. m. regional and international engagement to prevent and reduce instability in neighbouring states. n. improved capacity to process and manage refugees / migrants. * * objectives * * * * • * * * * strengthen regional and multi - lateral cooperation in the promotion of * * * * regional and international peace and security. * * * * specific actions – short term * * a. mfaft supported by the mns will engage states with security problems that can impact negatively on jamaica. b.",704,113,130,11,jamaica_2006_NationalSecurityStrategy.md,2025-01-28 18:56:03
284,"mfaft supported by technical experts from other mdas will actively participate in regional and international security meetings, at all levels, and continue to collaborate with countries within caricom, acs and oas. * * enhance security partnerships and intelligence sharing arrangements. * * * * specific actions – short term * * a. mfaft supported by the mns will initiate consultations to establish intelligence sharing procedures and guidelines with countries that share similar security concerns including building of security profiles on suspect individuals and groups. - strengthen diplomatic representation overseas, including the provision of a security remit for all missions. - - - - - a. mfaft supported",714,107,130,11,jamaica_2006_NationalSecurityStrategy.md,2025-01-28 18:56:03
285,"by the mns will provide security advisers in overseas missions in states where there are substantial security matters of interest to jamaica. diplomatic staff to be sensitised to security matters. b. improve the national management system for refugees, migrants and other displaced persons, consistent with international agreements established through united nations high commission for refugees ( unhcr ) and other internationally recognized bodies. c. mfaft supported by the mns, odpem and moh will review the function and operation of the existing ad hoc management system and formalise adequate standards for the provision of facilities, medical care and food for refugees, asylum seekers and migrants. this requires",720,106,130,11,jamaica_2006_NationalSecurityStrategy.md,2025-01-28 18:56:03
286,"cross - sectoral consultations in order to co - ordinate approaches with the relevant government entities and ngos to formulate and establish an effective management system. - maintain a permanent capability within the security forces to provide for peacekeeping missions. * * specific action – short term * * a. * * mns will ensure that jdf and jcf maintain and enhance the capability to assist * * any un, oas or caricom peacekeeping and specific law enforcement related requirements. similarly, the jcf is to be prepared to provide the required support for law enforcement operations overseas. - * * improve national capacity to provide external humanitarian assistance.",673,108,130,11,jamaica_2006_NationalSecurityStrategy.md,2025-01-28 18:56:03
287,"* * * * specific action – short term * * a. * * mns supported by mfaft, jdf and jcf will maintain a cadre of trained * * personnel for any government approved overseas deployments, to include the conducting of regular exercises with regional forces, to provide external humanitarian assistance as required. * * • * * * * ensure signature / ratification of regional and international security * * * * agreements which promote peace and security consistent with jamaica ’ s * * * * interests. * * * * specific action – short term * * a. * * mfaft supported by the mns will regularly review the instruments",603,113,130,11,jamaica_2006_NationalSecurityStrategy.md,2025-01-28 18:56:03
288,"affecting * * jamaica ’ s regional and international security interests in order to ensure that those interests are better protected and enhanced. * * • * * * * ensure adequate domestic legislation to ensure compliance with regional and * * * * international security obligations. * * - - - - - * * specific action – short term * * a. * * mfaft supported by the moj ( cpc ) and mns will expedite the drafting, * * and facilitate the enactment of, the necessary legislation to enable accession to the current regional and international agreements which are of interest to jamaica, taking into account the various international rules and laws. -",643,116,130,11,jamaica_2006_NationalSecurityStrategy.md,2025-01-28 18:56:03
289,"* * implement regional and international agreements to which jamaica has * * * * acceded, including recent caricom security initiatives. * * * * specific action – short term * * a. * * mfaft supported by the mns will ensure that security measures are * * implemented so that jamaica carries out its obligations to comply with the provisions of the agreements. effective units / departments are to be established to co - ordinate the implementation activities and to monitor the agreements. b. * * mfaft and mns will actively participate in regional and international * * discussions and negotiations on security matters. * * goal 7 – to provide",644,112,130,11,jamaica_2006_NationalSecurityStrategy.md,2025-01-28 18:56:03
290,"the environment for a stable economy, and an effective * * * * delivery of social services * * the government has a responsibility to combat financial crimes and to implement sound macro - economic policies and programmes to create a society in which each citizen has the prospect for a better quality of life. there is need to ensure that regulatory and other measures are geared towards strengthening the financial system, stimulating investment, encouraging tax compliance and facilitating sustainable economic growth and development in a secure and stable environment. it is also essential to counter the methods used by individuals, groups and organizations to earn, move and store illicit funds. this will help to enhance and maintain the integrity",754,120,130,11,jamaica_2006_NationalSecurityStrategy.md,2025-01-28 18:56:03
291,"of jamaica ’ s economic system and to close the conduits in which national security are targetted. the government will also foster an environment that provides access to economic opportunities and reduce the dependency on illegal activities, particularly among persons in the lower socio - economic bracket. - - - - - the government has a role to protect and preserve the fundamental human rights of all jamaican citizens and to provide access to basic education, health, shelter, and effective systems for the provision of other social services. the protection of the most vulnerable and the alleviation of poverty are also government objectives for a stable and secure environment. social stability and development are essential",730,115,130,11,jamaica_2006_NationalSecurityStrategy.md,2025-01-28 18:56:03
292,"contributing factors to the strengthening of national security, hence it is critical that the social dimension is incorporated in jamaica ’ s national security strategy. unemployment, low standards of living and poor social infrastructure contribute to social, economic and political instability. improvements in the social sector are required and the country needs the capability to ensure that social threats can be eliminated or reduced. for this goal, the capabilities, objectives and specific actions are listed collectively and not as developed in previous cases. * * capability 1 * * a. a more effective legislative and supervisory framework for the entire financial sector is required. this is to facilitate a high level of compliance with appropriate sanctions to",772,117,130,11,jamaica_2006_NationalSecurityStrategy.md,2025-01-28 18:56:03
293,"address tax evasion, fraud, corruption and illegally - sourced individual or business - related income and assets. it should also protect intellectual and cultural property ( ip ) rights. such a framework should reduce systemic risk and the country ’ s vulnerability to financial crises. b. enhanced computer security in critical areas, such as the financial infrastructure, to prevent, detect and respond rapidly to cyber crimes and avoid catastrophic data loss or related problems is required. * * objectives * * * * • * * * * a strong and effective security sector to reduce crime and violence, which * * * * impact negatively on investment and growth. * * * * specific",672,115,130,11,jamaica_2006_NationalSecurityStrategy.md,2025-01-28 18:56:03
294,"actions for a stable economic * * * * environment – short term * * a. * * mit supported by mns, mtw, mle will provide enhanced and visible land, * * sea and air security systems in key resort areas for the protection of the tourism sector, including a coor - dinated emergency response capability. substantial * * private sector support will be necessary. * * - - - - - b. * * mtw supported by mns and mfp will seek to strengthen security and customs * * clearance policies and procedures at the international seaports, airports and other points of entry to detect and deter the trade",584,110,130,11,jamaica_2006_NationalSecurityStrategy.md,2025-01-28 18:56:03
295,"in contraband, especially arms and narcotics. existing customs laws will be reviewed to address inadequacies, including the need for increased penalties and provisions to deal with problems that are associated with smuggling and unlicensed customs brokers. the timelines for implementation will vary, but the maximum time frame will be approximately eighteen months. * * • * * * * effective policies and programmes to monitor, detect, investigate and * * * * prosecute financial crimes, supported by relevant legislation, are required. * * * * specific actions * * a. * * mfp, mns and moj will strengthen policies, laws and regulations",635,102,130,11,jamaica_2006_NationalSecurityStrategy.md,2025-01-28 18:56:03
296,"to combat * * money laundering, terrorist financing and other illegal or irregular financial transactions. b. regional and international co - operation must be expanded and improved to adopt the recommendations / standards of the financial action task force ( fatf ), caribbean financial action task force ( cfatf ) and other recognised bodies, in matters relating to financial crimes and terrorist financing. this is the primary responsibility of the mfp, with support from the mns / jcf and mfaft. c. mcst and fiscal services limited / mfp, with support from other relevant agencies, will ensure the continued enhancement of computer security to facilitate effective prevention and detection of",696,109,130,11,jamaica_2006_NationalSecurityStrategy.md,2025-01-28 18:56:03
297,"cyber crimes. this will be an ongoing process. d. formal mechanisms will be established including permanent inter - agency committees for the detection, investigation and prosecution of financial crimes. the proposed nia is intended to be one of the mechanisms to carry out these functions. mfp ( boj, fsc, fid, jamaica customs, taxpayer audit and assessment department ( taad ) ) will lead with support from, moj, dpp, and jcf. - effective combating of money laundering, tax evasion and other financial / economic crimes * * specific actions * * a. * * all mdas will ensure that adequate risk",593,100,130,11,jamaica_2006_NationalSecurityStrategy.md,2025-01-28 18:56:03
298,"mitigation, prevention and response * * contingency plans are developed and implemented to protect critical economic and physical infrastructure and the essential services from disasters and criminal activities, such as sabotage, terrorism and accidents. emergency response programmes will be coordinated and filed with the national disaster committee, odpem and jdf as is relevant. - - - - - * * • * * * * providing for economic diversification, energy security and systems to * * * * reduce the impact of economic shocks * * * * specific actions * * a. to forestall the impact of any sudden energy shocks the national energy policy will be enhanced and vigorously",665,111,130,11,jamaica_2006_NationalSecurityStrategy.md,2025-01-28 18:56:03
299,"implemented. the imminent exploration of jamaica ’ s territorial waters for natural resources such as crude oil and natural gas will continue to be promoted on an ongoing basis. mcst and its energyrelated agencies would have primary responsibility for implementation. b. * * mcst, with support from mfaft, mns, moj, will strengthen the protection * * of ‘ brand jamaica ’ and associated intellectual property ( ip ) rights. this will be done through appropriate legislation, monitoring, investigation, prosecution of violators and a robust public awareness campaign. * * capability 2 * * * * delivery of social services * * a. established and effective conflict",661,106,130,11,jamaica_2006_NationalSecurityStrategy.md,2025-01-28 18:56:03
300,"management mechanisms to prevent or resolve industrial, community and domestic conflicts in a non - violent manner, thus reducing crime and preventing the destruction of critical infrastructure and public or private property. b. effective measures to address socio - economic problems that contribute to crime and violence and the institution of programmes to counter social ills, such as illiteracy, unemployment and poverty, which have a direct impact on the level of crime, economic growth and development. c. the capability to prevent and to respond effectively to the problem of drug abuse and to strengthen demand management policies and programmes. d. security services to ensure safer school environments through the efforts of both government",751,113,130,11,jamaica_2006_NationalSecurityStrategy.md,2025-01-28 18:56:03
301,"and relevant private sector interests. e. enhanced security facilities at major health facilities. f. programmes to promote positive values and attitudes. g. coordinated social reintegration programmes, to provide opportunities for the reintegration of ex - offenders, including youth offenders and youth - at - risk. h. mechanism to coordinate the myriad organizations, programmes and initiatives relating to youth in order to avoid fragmentation and possible duplication of effort. - - - - - i. capability to expand and ensure better coordination of community programmes to enhance parenting skills. j. programmes which highlight mentoring and positive role models, recreational and sports development, educational and cultural achievements.",743,105,130,11,jamaica_2006_NationalSecurityStrategy.md,2025-01-28 18:56:03
302,"k. hiv policies in the workplace and hiv prevention and control programmes in schools and the health services. * * objectives * * * * • * * * * commitment to enforce laws and regulations which affect social values and * * * * practices, such as the use of expletives, lewd behaviour, indiscipline, lack of * * * * respect and invasion of privacy. * * specific actions for delivery of social services – short term a. moh supported by meyc will enforce public order and social legislation, particularly those aimed at minors ; and strengthen rehabilitation and therapeutic programmes. - sustained community programmes in",618,107,130,11,jamaica_2006_NationalSecurityStrategy.md,2025-01-28 18:56:03
303,"support of existing security related initiatives and other community development initiatives. – such programmes should encompass the expansion of care centres, shelters, residential training and placement in mentoring and / or apprenticeship groups, and others designed for the level of intensity of the intervention needed. * * specific actions * * a. * * meyc will expand parenting skills training and mentoring programmes in * * schools and communities and encourage service clubs and professional groups to participate. expand the family life component of the guidance counselling programmes in schools. b. * * development division ( cabinet office ) supported by mlgcds will expand * * community development programmes and provide opportunities to develop",760,114,130,11,jamaica_2006_NationalSecurityStrategy.md,2025-01-28 18:56:03
304,"the community economy, in partnership with the private sector. - seek funding from legitimate sources to sustain various community security initiatives – supported by massive public education and incentive programmes, communities, business enterprises, civic groups and families should be encouraged to sponsor their selected programmes. a. moh, with support from meyc and mns, will expand social intervention programmes to provide guidance and support for vulnerable children. - - - - - - expand poverty alleviation and employment programmes. * * specific actions * * a. * * meyc will institute measures to ensure increased inter - agency coordination of * * issues relating to youth. b.",688,106,130,11,jamaica_2006_NationalSecurityStrategy.md,2025-01-28 18:56:03
