chunk_id,text,char_length,word_count,token_count,section_index,source_file,processed_date
1,"# national defense program guidelines for fy 2014 and beyond december 17, 2013",78,13,17,0,japan_2013_NationalDefenseProgramGuidelines.md,2025-01-28 18:56:54
2,"# # i. ndpg ' s objective in light of the current security environment surrounding japan, the government of japan sets out the "" national defense program guidelines for fy 2014 and beyond "" as new guidelines for japan ' s national defense, based on "" defense capability build - up in fy2013 "" ( approved by the security council and the cabinet on january 25, 2013 ) and the "" national security strategy "" ( approved by the national security council and the cabinet on december 17, 2013 ).",488,90,103,1,japan_2013_NationalDefenseProgramGuidelines.md,2025-01-28 18:56:54
3,"# # ii. security environment surrounding japan 1. as interdependence among countries expands and deepens, there is a growing risk that unrest in the global security environment or a security problem in a single country or region could immediately develop into a security challenge or destabilizing factor for the entire international community. the multi - polarization of the world continues as a result of shifts in the balance of power due to the further development of countries such as china and india and the relative change of influence of the united states ( u. s. ). at the same time, the u. s. is expected to continue to play",635,109,130,2,japan_2013_NationalDefenseProgramGuidelines.md,2025-01-28 18:56:54
4,"the role in maintaining world peace and stability as it retains the largest national power. there are ongoing regional conflicts involving various countries as well as an increase in the number of so - called "" gray - zone "" situations, that is, neither pure peacetime nor contingencies over territory, sovereignty and maritime economic interests. the proliferation of weapons of mass destruction ( wmd ) and ballistic missiles continues to be a deep concern despite non - proliferation efforts by the international community. the presence of countries with weak governance and failed states feeds the expansion and spread of international terrorism. these problems continue to pose imminent security challenges. in the maritime domain, piracy acts",748,115,130,2,japan_2013_NationalDefenseProgramGuidelines.md,2025-01-28 18:56:54
5,"have taken place in various parts of the world, and there have been cases where coastal states unilaterally asserted their rights and took action based on their own assertion concerning international maritime law, thereby unduly infringing the freedom of the high seas. securing the stable use of outer space and cyberspace as global commons is becoming a significant security challenge for the international community including japan against the backdrop of rapid technology innovation. in addition, military strategies and military balance in the future are anticipated to be significantly affected by the progress and proliferation of technologies such as those related to precision guided munitions, unmanned vehicles, stealth capability and nanotechnology.",761,110,130,2,japan_2013_NationalDefenseProgramGuidelines.md,2025-01-28 18:56:54
6,"2. in the asia - pacific region, including areas surrounding japan, countries are enhancing and strengthening their cooperative relationships to resolve security challenges. specific and practical cooperation and collaboration have progressed to settle challenges particularly in non - traditional security fields. in the meantime, gray - zone situations over territory, sovereignty and maritime economic interests tend to linger, raising concerns that they may develop into more serious situations. north korea is military - focused and deploys a massive military force. it is also proceeding with the development, deployment and proliferation of wmds including nuclear weapons and ballistic missiles which may be used to deliver such weapons, and it maintains a large - scale",777,113,130,2,japan_2013_NationalDefenseProgramGuidelines.md,2025-01-28 18:56:54
7,"special operations force. through these activities, north korea is maintaining and strengthening its asymmetrical military capabilities. north korea has also repeatedly heightened tension in the region by conducting military provocations in the korean peninsula and by escalating its provocative rhetoric and behavior against japan and other countries. such north korean military trend constitutes a serious destabilizing factor to the security not only of japan but of the entire region and the international community. therefore, japan needs to pay utmost attention to such activities. in particular, north korea ' s ballistic missile development has presumably entered a new stage, as technological improvements have been made to extend the range and",753,109,130,2,japan_2013_NationalDefenseProgramGuidelines.md,2025-01-28 18:56:54
8,"increase the accuracy of its missiles through a series of missile launches. also, north korea has conducted nuclear tests in defiance of calls for restraint from the international community, so the possibility cannot be ruled out that it has successfully miniaturized nuclear weapons for warheads and equipped them on ballistic missiles. north korea ' s nuclear and missile development, coupled with its provocative rhetoric and behavior, such as suggesting a missile attack on japan, pose a serious and imminent threat to japan ' s security. as for china, while it is greatly expected to play an active role in a more cooperative manner in the region and the world, it has been continuously increasing its",706,115,130,2,japan_2013_NationalDefenseProgramGuidelines.md,2025-01-28 18:56:54
9,"defense expenditures and has been rapidly reinforcing its military in a wide range of areas. as part of such effort, china is believed to be making efforts to strengthen its asymmetrical military capabilities to prevent military activity by other countries in the region by denying access and deployment of foreign militaries to its surrounding areas. however, china has not clearly stated the purposes and goals of the military buildup and therefore, transparency concerning its military and security is not fully achieved. in addition, china is rapidly expanding and intensifying its activities in the maritime and aerial domains in the region including in the east china sea and the south china sea",701,111,130,2,japan_2013_NationalDefenseProgramGuidelines.md,2025-01-28 18:56:54
10,". in particular, china has taken assertive actions with regard to issues of conflicts of interest in the maritime domain, as exemplified by its attempts to change the status quo by coercion. as for the seas and airspace around japan, china has intruded into japanese territorial waters frequently and violated japan ' s airspace, and has engaged in dangerous activities that could cause unexpected situations, such as its announcement of establishing an "" air defense identification zone "" based on its own assertion thereby infringing the freedom of overflight above the high seas. china is also expanding and intensifying its activities in the maritime and aerial domains farther offshore than before",702,111,130,2,japan_2013_NationalDefenseProgramGuidelines.md,2025-01-28 18:56:54
11,". for example, chinese military vessels and aircraft routinely enter the pacific ocean, and are expanding their operational areas which include areas north of japan. as japan has great concern about these chinese activities, it will need to pay utmost attention to them, as these activities also raise concerns over regional and global security. as for russia, it is observed that the country is proceeding to reform and modernize its military forces mainly by strengthening their readiness and introducing new equipment. the activities of russian armed forces have been active. the u. s. has clearly manifested its strategic decision to put greater emphasis on the asia - pacific region ( the rebalance to the asia",715,115,130,2,japan_2013_NationalDefenseProgramGuidelines.md,2025-01-28 18:56:54
12,"- pacific region ) and is maintaining and strengthening its engagement and presence in the region despite fiscal and various other constraints in order to maintain the stability and growth of the region while enhancing its relationships with its allies and expanding cooperation with partner countries. in addition, the u. s. has made its stance clear to prevent coercive actions that aim at changing the status quo in the region in cooperation with allies and partners. 3. japan is surrounded by the sea, and has a long coastline, numerous remote islands and a vast exclusive economic zone. japan is a maritime state and dependent largely on international trade for its supply of food and natural resources.",708,116,130,2,japan_2013_NationalDefenseProgramGuidelines.md,2025-01-28 18:56:54
13,"therefore, securing the safety of maritime and air traffic, through strengthening an "" open and stable seas "" order based upon such fundamental principles as the rule of law and the freedom of navigation, constitutes the basis of peace and prosperity. japan also faces security vulnerabilities resulting from concentration of industry, population and information infrastructure in urban areas and from the presence of a large number of key facilities, such as nuclear power plants, in coastal areas. in the event of another massive earthquake like the great east japan earthquake, japan may suffer enormous damage and the impact may spread not only nationwide but also to other countries. the possibility of future huge earthquakes such",736,115,130,2,japan_2013_NationalDefenseProgramGuidelines.md,2025-01-28 18:56:54
14,"as a nankai trough earthquake or a tokyo inland earthquake makes it increasingly necessary to take every possible measure to prepare for large - scale disasters. 4. in light of the above, while the probability of a large - scale military conflict between major countries, which was a concern during the cold war era, presumably remains low, various security challenges and destabilizing factors are emerging and becoming more tangible and acute. as a result, the security environment surrounding japan has become increasingly severe, since the formulation of "" national defense program guidelines, fy2011 and beyond "" ( approved by the security council and the cabinet on december 17, 2010 )",691,110,130,2,japan_2013_NationalDefenseProgramGuidelines.md,2025-01-28 18:56:54
15,". as the security challenges and destabilizing factors are diverse and wide - ranging, it is difficult for a single country to deal with them on its own. under these circumstances, it is increasingly necessary not only that the military sector cooperate with the non - military sector but also that countries which share interests in responding to shared security challenges cooperate and actively respond to maintain regional and global stability.",448,71,80,2,japan_2013_NationalDefenseProgramGuidelines.md,2025-01-28 18:56:54
16,"# # iii. japan ' s basic defense policy 1. basic policy in light of the national security strategy, japan will strengthen its diplomatic and defense capabilities along the policy of "" proactive contribution to peace "" based on the principle of international cooperation, thereby expanding the role it can play. at the same time, japan will contribute even more proactively in securing peace, stability and prosperity of the international community while achieving its own security as well as peace and stability in the asia - pacific region by expanding and deepening cooperative relationships with other countries, with the japan - u. s. alliance as its cornerstone. under this basic principle, japan",701,112,130,3,japan_2013_NationalDefenseProgramGuidelines.md,2025-01-28 18:56:54
17,"will build a comprehensive defense architecture and strengthen its posture for preventing and responding to various situations. in addition, japan will strengthen the japan - u. s. alliance and actively promote bilateral and multilateral security cooperation with other countries while closely coordinating defense and diplomatic policies. japan will also seek to establish an infrastructure necessary for its defense forces to fully exercise their capabilities. when implementing these measures, under the constitution, japan will efficiently build a highly effective and joint defense force in line with the basic principles of maintaining an exclusively defense - oriented policy, not becoming a military power that poses a threat to other countries, while adhering to the principle of civilian control",805,116,130,3,japan_2013_NationalDefenseProgramGuidelines.md,2025-01-28 18:56:54
18,"of the military and observing the three non - nuclear principles. with regard to the threat of nuclear weapons, the extended deterrence provided by the u. s. with nuclear deterrence at its core, is indispensable. in order to maintain and enhance the credibility of the extended deterrence, japan will closely cooperate with the u. s. in addition, japan will take appropriate responses through its own efforts, including ballistic missile defense ( bmd ) and protection of the people. at the same time, japan will play a constructive and active role in international nuclear disarmament and non - proliferation efforts so as to achieve the long -",645,106,130,3,japan_2013_NationalDefenseProgramGuidelines.md,2025-01-28 18:56:54
19,term goal of creating a world free of nuclear weapons.,54,10,13,3,japan_2013_NationalDefenseProgramGuidelines.md,2025-01-28 18:56:54
20,"# # 2. japan ' s own efforts recognizing that a country ' s security depends first and foremost on its independent efforts, japan will make full - scale efforts on its own initiative to prevent various situations and will seamlessly respond to them as the situation evolves with the national security council as the control tower, while maintaining cooperation with its ally, partners and other countries concerned.",415,68,77,4,japan_2013_NationalDefenseProgramGuidelines.md,2025-01-28 18:56:54
21,"# # ( 1 ) * * building a comprehensive defense architecture * * given the increasingly severe security environment, japan will efficiently develop a highly effective joint defense force and make efforts to employ it with a high level of flexibility and readiness based on joint operations. japan will also ensure close regular interagency cooperation in normal times. in the event of various situations, the government, under strong political leadership, will appropriately and promptly make decisions. japan will seamlessly respond to situations as they unfold, in a whole - of - the - government approach, to ensure the protection of the lives and property of its people and the sovereignty of japan ' s",705,115,130,5,japan_2013_NationalDefenseProgramGuidelines.md,2025-01-28 18:56:54
22,"territorial land, waters and airspace, in coordination with local governments, private sectors, and others. japan will also continue to develop various systems to respond to a variety of disasters and protect its people and will enhance the capability to quickly evacuate japanese nationals from foreign countries in an emergency situation and ensure their safety. in order to take such approaches appropriately, japan will increase the effectiveness of its situation and disaster response posture by systemizing various related plans and formulating and reviewing them as well as expanding the use of simulations, comprehensive training and exercises.",652,95,108,5,japan_2013_NationalDefenseProgramGuidelines.md,2025-01-28 18:56:54
23,"# # ( 2 ) * * japan ' s defense forces - building a dynamic joint defense force * * japan ' s defense forces are the ultimate guarantee of national security, and represent japan ' s will and ability to deter threats from directly reaching japan and defeat them if threats should reach japan. in the times of an ever - changing security environment surrounding japan, defense forces need to be constantly reviewed to adapt to the environment. to this aim, japan needs to allocate limited resources in a focused and flexible way to prioritize the functions and capabilities from a comprehensive perspective, identified through joint operation - based capability assessments of the self - defense",693,118,130,6,japan_2013_NationalDefenseProgramGuidelines.md,2025-01-28 18:56:54
24,"force ' s ( sdf ' s ) total functions and capabilities against various situations. amid the increasingly severe security environment surrounding japan, the sdf, in addition to its regular activities, needs to respond to various situations, including "" gray zone "" situations which require sdf commitment. the frequency of such situations and the duration of responses are both increasing. therefore, japan will regularly conduct persistent intelligence, surveillance and reconnaissance ( hereinafter "" isr "" ) activities. moreover, the sdf will conduct strategic training and exercises in accordance with the development of the situation and swiftly build a response posture including advance deployment of units in response to the",731,109,130,6,japan_2013_NationalDefenseProgramGuidelines.md,2025-01-28 18:56:54
25,"security environment and rapid deployment of adequate units. thus japan will demonstrate its will and highly developed capability to prevent further escalation. in dealing with situations, depending on their development, minimizing damage by effective response through achieving maritime supremacy and air superiority is essential in safeguarding the lives and property of the japanese people, and the sovereignty of japan ' s territorial land, waters and airspace. therefore, japan will enhance its deterrence and response capability by improving the mission - capable rate of equipment and its employment to conduct tailored activities swiftly and sustainably based on joint operations, as well as by developing defense capabilities adequate both in quantity and quality that",777,112,130,6,japan_2013_NationalDefenseProgramGuidelines.md,2025-01-28 18:56:54
26,"underpin various activities to realize a more robust defense force. at the same time, from the perspective of "" proactive contribution to peace "" based on the principle of international cooperation, japan will strengthen its bilateral and multilateral cooperative relationships in order to ensure the stability of the asia - pacific region, which is closely related to its own security. japan will also engage in international peacekeeping and other similar activities ( peacekeeping operations by the united nations, non - traditional security initiatives including humanitarian assistance / disaster relief ( ha / dr ), and other internationally collaborative activities to improve the international security environment ) and other efforts more proactively than before as efforts to",785,116,130,6,japan_2013_NationalDefenseProgramGuidelines.md,2025-01-28 18:56:54
27,"address the global security challenges, in light of the diversified roles and increased opportunities of the defense force. from these viewpoints, given the changes in the security environment, the defense force based on this ndpg should prioritize particularly important functions and capabilities through optimal resource allocation as a whole. the defense force also must be an effective one which enables conducting a diverse range of activities to be seamless as well as dynamic and adapting to situations as they demand. to that end, japan will build a dynamic joint defense force, which emphasizes both soft and hard aspects of readiness, sustainability, resiliency and connectivity, reinforced by advanced technology and capability",739,110,130,6,japan_2013_NationalDefenseProgramGuidelines.md,2025-01-28 18:56:54
28,"for c3i, with a consideration to establish a wide range of infrastructure to support the sdf ' s operation.",107,19,26,6,japan_2013_NationalDefenseProgramGuidelines.md,2025-01-28 18:56:54
29,"# # 3. strengthening of the japan - u. s. alliance the japan - u. s. security arrangements based on the japan - u. s. security treaty, together with japan ' s own efforts, constitute the cornerstone for japan ' s national security. the japan - u. s. alliance centered on bilateral security arrangements functions as public goods that contribute to the stability and prosperity not only of japan but also of the asia - pacific region and the world at large. under its policy of strategic rebalancing towards the asia - pacific region, the u. s. is maintaining and strengthening its engagement and presence in the region while",624,109,130,7,japan_2013_NationalDefenseProgramGuidelines.md,2025-01-28 18:56:54
30,"enhancing its partnerships and cooperation with its allies, including japan, and partner countries. as the security environment surrounding japan becomes increasingly severer, it has become more important than ever for japan ' s security to strengthen the japan - u. s. alliance and make it more balanced and effective. ( 1 ) * * strengthening deterrence and response capabilities of the japan - u. s. alliance * * in order to ensure japan ' s national security by maintaining and strengthening the commitment of the u. s. towards japan and the asia - pacific region, japan will revise the guidelines for japan - u. s. defense cooperation, further enhance japan",661,110,130,7,japan_2013_NationalDefenseProgramGuidelines.md,2025-01-28 18:56:54
31,"- u. s. defense cooperation and reinforce the deterrence provided by the japan - u. s. alliance and the alliance ' s contingency response capabilities, while strengthening japan ' s own capabilities as a premise for these efforts. at the same time, in response to the increasingly severe security environment, while increasing the presence of japan and the u. s. in the western pacific region, japan will build seamless cooperation with the u. s. ranging from situations on a day - to - day basis to various situations, including cooperation in responding to "" gray - zone "" situations. to that end, japan will continue to expand joint",635,108,130,7,japan_2013_NationalDefenseProgramGuidelines.md,2025-01-28 18:56:54
32,"training and exercises, joint isr activities and the joint / shared use of facilities and areas with the u. s. it will also tighten the japan - u. s. operational cooperation and policy coordination including contingency response and medium - to long - term strategies, such as bmd, bilateral planning, and extended deterrence dialogue.",335,54,70,7,japan_2013_NationalDefenseProgramGuidelines.md,2025-01-28 18:56:54
33,"# # ( 2 ) * * strengthening and expanding cooperation in a broad range of fields * * the japan - u. s. alliance will contribute to the peace and stability of the world, including the asia - pacific region, by strengthening cooperation not only in the fields of anti - piracy efforts, capacity building assistance, ha / dr, peacekeeping and counter terrorism but also in maritime affairs, outer space and cyberspace. as for disaster response, japan will further strengthen its cooperation between the sdf and the u. s. forces within and outside japan in light of the fact that the u. s. forces, including its usfj facilities",623,109,130,8,japan_2013_NationalDefenseProgramGuidelines.md,2025-01-28 18:56:54
34,"and areas, greatly contributed to the safety of the japanese people during the great east japan earthquake. in addition, japan will constantly strengthen and expand the japan - u. s. cooperative relationship over a broad range of fields, including efforts for intelligence cooperation and information security, and cooperation in the field of defense equipment and technology, to build a firmer and effective alliance.",418,63,75,8,japan_2013_NationalDefenseProgramGuidelines.md,2025-01-28 18:56:54
35,"# # ( 3 ) * * steady implementation of measures relating to the stationing of u. s. forces in * * japan japan will provide stable support for the smooth and effective stationing of u. s. forces in japan through various measures, including host nation support ( hns ). at the same time, efforts will be made to steadily implement the realignment of u. s. forces in japan and mitigate the impact on local communities while maintaining the deterrence provided by u. s. forces. in particular, japan will seek to mitigate the impact on okinawa, located in a critically important location in terms of national security",612,107,130,9,japan_2013_NationalDefenseProgramGuidelines.md,2025-01-28 18:56:54
36,"and where the stationing of u. s. forces significantly contributes to the deterrence of the japan - u. s. alliance, by realignment, consolidation and reduction of usfj facilities and areas including through the relocation of marine corps air station futenma as well as the dispersion of the impact and other measures, in light of the heavy concentration of such facilities and areas there.",389,63,82,9,japan_2013_NationalDefenseProgramGuidelines.md,2025-01-28 18:56:54
37,"# # 4. active promotion of security cooperation ( 1 ) * * cooperation in the asia - pacific region * * in the asia - pacific region, specific cooperative measures have been taken mainly in non - traditional security fields, including disaster relief. multilateral frameworks such as the asean regional forum ( arf ), the asean defense ministers ' meeting - plus ( admm - plus ) and the east asia summit ( eas ) have been developed and the regional integration initiative led by asean has been making progress. however, security challenges are becoming more serious than ever in north east asia. japan will promote a variety of further cooperative initiatives in a",663,115,130,10,japan_2013_NationalDefenseProgramGuidelines.md,2025-01-28 18:56:54
