chunk_id,text,char_length,word_count,token_count,section_index,source_file,processed_date
38,"multi - layered manner to ease the atmosphere of confrontation and the sense of curiosity toward one another in the region. japan will promote close cooperation with the republic of korea ( rok ), which is in a position to support the u. s. presence in north east asia together with japan, and will make efforts to establish a foundation for further cooperation with the rok, for example by concluding an agreement on security information protection and an acquisition and cross - servicing agreement. japan will further deepen its relationship with australia, with which japan shares security interests and security cooperation has been advancing, and strengthen cooperation in fields such as international peacekeeping activities. japan",738,115,130,10,japan_2013_NationalDefenseProgramGuidelines.md,2025-01-28 18:56:54
39,"will also actively conduct joint training and other activities so as to improve interoperability with moreover, efforts will be made to promote the partnerships among u. s. allies in the asia - pacific region by strengthening cooperative relationships under trilateral frameworks among japan, the u. s. and rok and among japan, the u. s. and australia. as chinese activities have a significant impact on regional security, japan will promote security dialogue and exchanges with china in order to enhance mutual understanding and will develop confidence - building measures to prevent unexpected situations. japan will maintain a calm and firm stance in dealing with the rapid expansion and intensification of",709,109,130,10,japan_2013_NationalDefenseProgramGuidelines.md,2025-01-28 18:56:54
40,"chinese activities on the sea and in the air surrounding japan. japan will promote security dialogues with russia, including the foreign and defense ministerial consultations ( "" 2 + 2 "" ), high - level exchanges, and unit - to - unit exchanges in order to deepen understanding about the intention of russian military activities and develop mutual trust with russia. in addition, japan will enhance bilateral training and exercises with russia to promote regional stability. japan will also further strengthen its relationships with partner countries in the region, including southeast asian countries, and will actively promote joint training and exercises and capacity building assistance. in addition, japan will strengthen its cooperation with these countries",763,115,130,10,japan_2013_NationalDefenseProgramGuidelines.md,2025-01-28 18:56:54
41,"in the field of disaster management in light of the increasing frequency and growing scale of disasters in the region. japan will strengthen its relationship with india in a broad range of fields, including maritime security, through joint training and exercises as well as joint implementation of international peacekeeping activities. as capacity building assistance is effective in stabilizing the security environment and strengthening bilateral defense cooperation, japan will promote it in full coordination with diplomatic policy initiatives, including the official development assistance, and aligning it with joint training and exercises and international peacekeeping activities. japan will also strengthen cooperation with relevant countries which actively provide such support, thereby expanding the range of countries receiving support as",851,116,130,10,japan_2013_NationalDefenseProgramGuidelines.md,2025-01-28 18:56:54
42,"well as its scope. under ongoing multilateral security cooperation and dialogue in the asia - pacific region, japan in cooperation with the united states and australia will proactively contribute to building cooperative relationships in the region. moreover, japan will actively participate in multilateral joint training and exercises and play a major role in enhancing confidence - building measures among countries in the region, attaching importance to multilateral frameworks such as the arf and the admm - plus.",517,77,94,10,japan_2013_NationalDefenseProgramGuidelines.md,2025-01-28 18:56:54
43,"# # ( 2 ) * * cooperation with the international community * * it is very difficult for a single country to respond to global security challenges on its own. moreover, as the roles of military forces have diversified, there are increasing opportunities for such forces to play an important role not only in preventing and responding to conflicts and maintaining peace but also in supporting post - conflict reconstruction, building peace and promoting confidence - building and friendly relationships. therefore, japan will promote various initiatives to improve the global security environment on a regular basis in cooperation with the international community. japan will continue and strengthen various initiatives concerning arms control, disarmament, nonprolife",766,115,130,11,japan_2013_NationalDefenseProgramGuidelines.md,2025-01-28 18:56:54
44,"##ration and capacity building assistance in order to respond to global security challenges, including regional conflicts, expansion and spread of international terrorism, failed states, proliferation of weapons of mass destruction and problems related to the sea, outer space and cyberspace, while regularly cooperating with its ally and relevant countries with which it shares security interests and with international organizations and other relevant bodies. in this respect, japan will further strengthen its cooperation with the european union ( eu ), north atlantic treaty organization ( nato ), the organization for security and co - operation in europe ( osce ) and with the united kingdom, france and other european countries and will work with them",758,114,133,11,japan_2013_NationalDefenseProgramGuidelines.md,2025-01-28 18:56:54
45,"in responding to these challenges. japan will also promote cooperation and exchanges with regard to equipment and technology with these countries and organizations. in order to stabilize the security environment in the asia - pacific region and improve the global security environment based on the policy of "" proactive contribution to peace "" based on the principle of international cooperation, japan will actively promote various international peace cooperation activities, including international peace cooperation assignments and emergency relief activities, in a multi - layered manner. to this end, japan will ensure close cooperation between the defense and foreign affairs authorities, with comprehensive consideration given to the significance of the dispatch of sdf units, the situation of countries accepting",820,117,130,11,japan_2013_NationalDefenseProgramGuidelines.md,2025-01-28 18:56:54
46,"sdf units and japan ' s political and economic relationships with recipient countries. with regard to international peace cooperation activities and other similar activities in particular, japan will continue to actively conduct activities utilizing the sdf ' s capabilities and will increase the number of sdf personnel it dispatches to assume positions of responsibility at organizations such as the local mission headquarters and the united nations department of peacekeeping operations. in addition, japan will conduct a study on various challenges it has to overcome to enable the dispatch of sdf personnel in a broad range of fields, and take necessary measures. japan will also contribute to the training of domestic and foreign personnel engaging in peacebuilding",771,116,130,11,japan_2013_NationalDefenseProgramGuidelines.md,2025-01-28 18:56:54
47,by making use of the sdf ' s experience and knowledge.,54,11,15,11,japan_2013_NationalDefenseProgramGuidelines.md,2025-01-28 18:56:54
48,"# # iv. future defense forces 1. the role of the defense force japan ' s future defense forces will be developed as described in iii. 2 ( 2 ) above, and will be capable of effectively fulfilling the expected roles in the following fields, and will maintain the necessary posture.",279,51,59,12,japan_2013_NationalDefenseProgramGuidelines.md,2025-01-28 18:56:54
49,"# # ( 1 ) * * effective deterrence of and response to various situations * * in order to respond to various situations in a timely and appropriate manner, and certainly protect the lives and property of its people and the sovereignty of its land, sea and airspace, japan will achieve intelligence superiority through persistent isr activities in an extensive surrounding area to constantly gain an understanding of military developments in other countries and to detect any signs of development at an early stage. through such activities, japan will clearly express its resolve not to tolerate the change of the status quo by force, thereby preventing various situations from occurring. at the same time, japan will swiftly",723,118,130,13,japan_2013_NationalDefenseProgramGuidelines.md,2025-01-28 18:56:54
50,"and seamlessly respond to situations including gray zone situations, and will establish the necessary posture to continuously moreover, japan will implement an effective response tailored to each situation, even in cases when multiple events occur in a consecutive or concurrent manner. when implementing the initiatives above, the following points are emphasized in particular :",379,54,62,13,japan_2013_NationalDefenseProgramGuidelines.md,2025-01-28 18:56:54
51,"# # a. ensuring security of the sea and airspace surrounding japan in addition to persistent isr in an extensive area around japan, japan will immediately take appropriate measures to deal with any incursions into its territorial airspace. japan will respond effectively and promptly to gray - zone situations or any other acts that may violate its sovereignty. furthermore, should the acts in question become protracted or escalate, japan will respond seamlessly as the situation evolves, taking all possible measures for the defense and security of the sea and airspace surrounding japan.",590,92,110,14,japan_2013_NationalDefenseProgramGuidelines.md,2025-01-28 18:56:54
52,"# # b. response to an attack on remote islands in responding to an attack on remote islands, japan will intercept and defeat any invasion, by securing maritime supremacy and air superiority, with the necessary sdf units swiftly deployed to interdict, in addition to the units deployed in advance in accordance with the security environment. moreover, should any remote islands be invaded, japan will recapture them. in doing so, any ballistic missile or cruise missile attacks will be dealt with appropriately.",510,81,96,15,japan_2013_NationalDefenseProgramGuidelines.md,2025-01-28 18:56:54
53,"# # c. response to ballistic missile attacks japan will promptly detect any signs of a ballistic missile launch and facilitate a swift, sustained response by establishing a multi - layered defense posture. should any damage result, japan will take steps to minimize it. moreover, in the event of an attack by guerrillas or special operations forces concurrent with a ballistic missile attack, japan will protect key facilities including nuclear power plants and search and destroy the infiltrating units.",504,79,92,16,japan_2013_NationalDefenseProgramGuidelines.md,2025-01-28 18:56:54
54,"# # d. responses in outer space and cyberspace in regard with outer space and cyberspace, japan will build up persistent isr capabilities to prevent any acts that could impede efficient action by the sdf. furthermore, should any situation arise, japan will identify the event without delay and swiftly repair any damage, while taking necessary steps to contain it. moreover, in light of society ' s growing dependence on outer space and cyberspace, japan will make effective use of the sdf ' s capabilities when endeavoring to strengthen collaboration with relevant organizations and clarify the division of roles, thereby contributing to comprehensive, government - wide initiatives.",684,106,128,17,japan_2013_NationalDefenseProgramGuidelines.md,2025-01-28 18:56:54
55,"# # e. responses to major disasters should a major disaster occur, japan will swiftly transport and deploy the requisite units and take all possible measures as part of its initial response, and maintain its presence in the longer term, when required. moreover, as well as providing a meticulous response to the needs of disaster - stricken citizens and local government bodies, japan will engage in appropriate partnerships and cooperation with local governments and the private sector, in order to save lives, carry out emergency repairs, and provide livelihood support.",572,90,106,18,japan_2013_NationalDefenseProgramGuidelines.md,2025-01-28 18:56:54
56,"# # ( 2 ) * * stabilization of the asia - pacific and improvement of global security * * environments through persistent isr in the area surrounding japan and the timely and appropriate implementation of training, exercises, and various other activities, japan will ensure the stability of the security environment in the asia - pacific region as a whole including the vicinity of japan. moreover, working in partnership with its ally and partners, japan will promote multi - tiered initiatives, including bilateral and multilateral defense cooperation and exchange, joint training and exercises, and capacity building assistance, effectively fulfilling its key role in initiatives focused on the stabilization of the security environment, including the",753,114,130,19,japan_2013_NationalDefenseProgramGuidelines.md,2025-01-28 18:56:54
57,"building and strengthening of intra - regional cooperative frameworks in the asia - pacific region. as the roles played by military capacity diversify, in order to respond appropriately to global security issues including regional conflicts, the expansion and spread of international terrorism, failed states, and the proliferation of weapons of mass destruction, japan will strengthen various initiatives focused on arms control, disarmament and non - proliferation, as well as actively promote international peace cooperation activities, anti - piracy initiatives and capacity building assistance, thereby working on improvement of the global security environment. japan will attach importance to the following in particular, when engaging in the aforementioned initiatives.",776,107,126,19,japan_2013_NationalDefenseProgramGuidelines.md,2025-01-28 18:56:54
58,"# # a. holding training and exercises as well as the timely and appropriate implementation of sdf training and exercises, japan will promote bilateral and multilateral joint training and exercises in the asia - pacific region, proactively and visibly demonstrating our nation ' s resolve and advanced capabilities focused on regional stabilization. in addition, it will build and strengthen cooperative relationships with relevant countries.",441,64,76,20,japan_2013_NationalDefenseProgramGuidelines.md,2025-01-28 18:56:54
59,"# # b. promoting defense cooperation and exchange enhancing mutual understanding and relationships of trust with other countries and international organizations is the cornerstone of efforts to stabilize the security environment. japan will take further steps to promote multi - layered defense cooperation and exchange, such as building and strengthening cooperative relationships focused on wide - ranging security issues of common interest including hadr and ensuring the stable use of the seas, outer space and cyberspace.",526,76,85,21,japan_2013_NationalDefenseProgramGuidelines.md,2025-01-28 18:56:54
60,"# # c. promoting capacity building assistance utilizing the capabilities of the sdf, japan will continuously engage in capacity building assistance such as human resource development and technical support on a regular basis in order to enhance the ability of developing countries themselves, thereby improving the security environment with particular focus on active creation of stability in the asia - pacific region.",418,62,69,22,japan_2013_NationalDefenseProgramGuidelines.md,2025-01-28 18:56:54
61,"# # d. ensuring maritime security as it is particularly vital for japan as a maritime state to maintain an "" open and stable seas "" order which serves as the cornerstone of peace and prosperity, japan will take all possible measures to secure the safety of maritime traffic. japan will also conduct anti - piracy activities in cooperation with countries concerned, and will promote various efforts including capacity building assistance of coastal states in this field and enhancement of joint training and exercises by taking various opportunities in waters other than those surrounding our country. e. implementing international peace cooperation activities working in partnership with non - governmental organizations and other relevant organizations, japan will actively engage in international peace",804,121,130,23,japan_2013_NationalDefenseProgramGuidelines.md,2025-01-28 18:56:54
62,"cooperation assignments and emergency relief activities to meet diverse needs, from peacekeeping to peacebuilding, placing greater emphasis on playing more of a leading role. in doing so, as well as enhancing its readiness posture to facilitate rapid overseas dispatch according to the situation, japan will strengthen its sustainable preparedness for a protracted overseas deployment. f. cooperating with efforts to promote arms control, disarmament, and nonproliferation japan will be actively involved in arms control and disarmament activities undertaken by the united nations and other bodies. in doing so, japan will make active, effective use of the sdf ' s knowledge, including through personnel contribution",716,103,130,23,japan_2013_NationalDefenseProgramGuidelines.md,2025-01-28 18:56:54
63,". moreover, the proliferation of weapons of mass destruction and missiles that can serve as their means of delivery, as well as the proliferation of arms and goods and technology which could be diverted to military use pose severe threats to the peace and stability not only of japan but also of the international community as a whole. thus, japan will cooperate with relevant countries and international organizations and other relevant bodies in promoting nonproliferation initiatives.",487,76,86,23,japan_2013_NationalDefenseProgramGuidelines.md,2025-01-28 18:56:54
64,"# # 2. priorities in strengthening architecture of the self defense forces ( 1 ) * * basic approach * * the sdf will maintain an appropriate structure to effectively fulfill the abovementioned roles of defense forces. as such, japan has conducted capability assessments based on joint operations in relation to various potential contingencies to identify the functions and capabilities that should be prioritized in order to pursue more effective build - up of the defense force. based on the results of the capability assessments, in the defense capability buildup, the sdf will prioritize the development of capacities to ensure maritime supremacy and air superiority, which is the prere",689,109,130,24,japan_2013_NationalDefenseProgramGuidelines.md,2025-01-28 18:56:54
65,"##quisite for effective deterrence and response in various situations, including defense posture buildup in the southwestern region. furthermore, the sdf will emphasize the establishment of rapid deployment capabilities with a consideration to establishing a wide - ranging logistical support foundation. at the same time, in terms of preparation for a cold - war era style invasion such as the landing of large - scale ground forces, the sdf will possess the minimum necessary level of expertise and skills required to respond to unforeseen changes in the situation in the future and to maintain and inherit them, and thereby further promote efforts to achieve even greater efficiency and rationalization.",706,108,130,24,japan_2013_NationalDefenseProgramGuidelines.md,2025-01-28 18:56:54
66,"# # ( 2 ) * * functions and capabilities to be emphasized * * from the perspective of efficiently developing an effective defense force, the sdf will selectively strengthen the following functions and capabilities in particular, paying attention to enhance joint functions with interoperability with the u. s. forces.",317,50,61,25,japan_2013_NationalDefenseProgramGuidelines.md,2025-01-28 18:56:54
67,"# # a. isr capabilities in order to ensure effective deterrence and response to various situations, while utilizing unmanned equipment, japan will implement extensive persistent isr on objectives such as aircraft and vessels in the seas and airspace surrounding it, and the sdf will adopt a flexible approach to boosting its isr posture according to the developments of situations.",381,59,72,26,japan_2013_NationalDefenseProgramGuidelines.md,2025-01-28 18:56:54
68,"# # b. intelligence capabilities japan will strengthen its system for intelligence collection, processing information, and analyzing and sharing the collected information, so that the sdf can promptly detect and swiftly respond to signs of various situations and take necessary measures based on medium - to long - term military trends mainly in its vicinity. in doing so, the sdf will seek to augment its various information collection capabilities, including humint, osint, sigint, and imint, as well as persistent isr capabilities using unmanned aerial vehicles. also, the sdf will engage in integrated efforts to strengthen its geospatial intelligence capabilities to combine various",687,102,130,27,japan_2013_NationalDefenseProgramGuidelines.md,2025-01-28 18:56:54
69,"types of intelligence on images and maps to exploit them in a sophisticated manner, while establishing a framework for the integrated and systematic nurturing of highly capable personnel in information gathering analysis.",221,32,37,27,japan_2013_NationalDefenseProgramGuidelines.md,2025-01-28 18:56:54
70,"# # c. transport capability in order to secure swift and large - scale transport and deployment capability, and to swiftly deploy and move necessary units, the sdf will strengthen integrated transport capacity including maritime and airborne transport capacity, with collaboration with the civilian transport sector. in doing so, the sdf will avoid redundancy in functions by clarifying roles and assignments among various means of transport, considering their respective characteristics. d. command and control, and information and communications capabilities in order to establish a command and control system that can manage units nationwide in a mobile, joint integrated manner, the sdf will take steps to deploy the ground self -",734,110,130,28,japan_2013_NationalDefenseProgramGuidelines.md,2025-01-28 18:56:54
71,"defense force ( gsdf ), maritime self - defense force ( msdf ) and air self - defense force ( asdf ) personnel in the main headquarters of each service, making effective use of the knowledge and experience held by each respective service. furthermore, the sdf will facilitate swift, resilient nationwide operation of the gsdf ' s units such as basic operational units ( divisions and brigades ) through the establishment of a new central headquarters to control all of the regional armies, as well as greater efficiency and streamlining of the command and control function in each regional army headquarters, and other measures. moreover, the sdf will strive to",661,110,130,28,japan_2013_NationalDefenseProgramGuidelines.md,2025-01-28 18:56:54
72,"enhance and strengthen its information and communications capabilities that are prerequisites for supporting nationwide operation, starting with the communications infrastructure on remote islands and data link functions among the three services. e. response to an attack on remote islands in order to ensure maritime supremacy and air superiority which is a prerequisite for effective response to an attack on remote islands, the sdf will strengthen its ability to deal with attacks by aircraft, naval vessels, and missiles, etc. moreover, while strengthening the integrated capabilities to seek to interdict any attack on japan ' s remote islands at sea, the sdf will newly develop sufficient amphibious operations capability, which enables",742,109,130,28,japan_2013_NationalDefenseProgramGuidelines.md,2025-01-28 18:56:54
73,"the sdf to land, recapture and secure without delay in the case of an invasion of any remote islands. furthermore, the sdf will enhance its logistical support capabilities, so that sdf units can swiftly and continuously respond in the event of a situation in the southwestern region. in addition, the sdf will also examine the desirable air defense posture in remote islands in the pacific. f. response to ballistic missile attacks to counter north korea ' s improved ballistic missile capability, japan will pursue comprehensive improvement of its response capability against the threat of ballistic missiles. with regard to the bmd system, japan will enhance readiness, simultaneous engagement capability and sustainable",722,111,130,28,japan_2013_NationalDefenseProgramGuidelines.md,2025-01-28 18:56:54
74,"response capability to strengthen the capability to protect the entire territory. based on appropriate role and mission sharing between japan and the u. s., in order to strengthen the deterrent of the japan - u. s. alliance as a whole through enhancement of japan ' s own deterrent and response capability, japan will study a potential form of response capability to address the means of ballistic missile launches and related facilities, and take means as necessary.",467,76,89,28,japan_2013_NationalDefenseProgramGuidelines.md,2025-01-28 18:56:54
