chunk_id,text,char_length,word_count,token_count,section_index,source_file,processed_date
60,"que le otorga la constitucion en el art. 238 inc. 9 puede ordenar que las demas instituciones acudan a apoyar a la institucion que tiene la responsabilidad principal en la atencion del caso, hasta que la normalidad sea reestablecida. el ministro de defensa nacional, asume los roles de formulador, ejecutor y coordinador de la implementacion de la politica militar y de los planes de defensa aprobados por el",408,68,130,13,paraguay_1999_NationalDefensePolicy_noneng.md,2025-01-28 18:58:18
61,"poder ejecutivo ; mantiene el equilibrio y la integracion de fuerzas dentro de la estructura militar ; y desempena la funcion de enlace de la misma con los campos politico, economico, sicosocial y cientifico - tecnologico ; y dirige el relacionamiento de las fuerzas armadas con la sociedad civil.",297,49,105,13,paraguay_1999_NationalDefensePolicy_noneng.md,2025-01-28 18:58:18
62,"# # iv. lineamientos de accion para asegurar la consecucion de sus objetivos de la defensa nacional, la republica del paraguay implementa las previsiones y acciones necesarias para : a. contribuir a la construccion de un orden internacional basado en el respeto al derecho internacional y a los principios de independencia y autodeterminacion de los pueblos ; la igualdad juridica entre los estados ; la solidaridad y",417,67,130,14,paraguay_1999_NationalDefensePolicy_noneng.md,2025-01-28 18:58:18
63,"la cooperacion internacionales ; la proteccion internacional de los derechos humanos ; la libre navegacion de los rios internacionales ; la no intervencion y la condena a toda forma de dictadura, colonialismo e imperialismo, de conformidad con lo establecido en el articulo 143 de la constitucion nacional. b. aumentar y perfeccionar la capacidad de negociacion de recursos humanos del pais orientados hacia la defensa de los intereses nacionales. c. capac",456,70,130,14,paraguay_1999_NationalDefensePolicy_noneng.md,2025-01-28 18:58:18
64,"##itar recursos humanos para participar de operaciones internacionales de mantenimiento de la paz, de acuerdo con los intereses y posibilidades nacionales. d. implementar la participacion de las fuerzas armadas en acciones subsidiarias que tiendan a la integracion nacional de manera coherente con su mision constitucional.",323,45,100,14,paraguay_1999_NationalDefensePolicy_noneng.md,2025-01-28 18:58:18
65,"#! [ 11 _ image _ 1. png ] ( 11 _ image _ 1. png )! [ 11 _ image _ 2. png ] ( 11 _ image _ 2. png ) consejo de la defensa nacional secretaria permanente e. proteger la integridad territorial sobre la base de la presencia nacional,! [ 11 _ image _ 3. png ] ( 11 _ image _ 3. png ) incluyendo la militar, y el apoyo de toda la sociedad. f. perfeccionar la",353,81,130,15,paraguay_1999_NationalDefensePolicy_noneng.md,2025-01-28 18:58:18
66,"capacidad de comando, control e inteligencia de todos los organos involucrados en la defensa nacional, proporcionandoles condiciones que faciliten el proceso de decision, en la paz o en situaciones de conflicto. g. mejorar y perfeccionar el sistema de vigilancia y defensa de la inviolabilidad del territorio nacional. h. modernizar, perfeccionar y actualizar permanentemente la organizacion, la estructura",406,57,130,15,paraguay_1999_NationalDefensePolicy_noneng.md,2025-01-28 18:58:18
67,", el adiestramiento y la articulacion de las fuerzas armadas y los demas organos involucrados en la defensa nacional, proporcionandoles las condiciones y los medios apropiados para el cumplimiento de sus misiones constitucionales y legales. i. regular y controlar los traficos terrestre, aereo y fluvial dentro de la republica. j. promover el desarrollo cientifico, tecnologico y productivo de",393,58,130,15,paraguay_1999_NationalDefensePolicy_noneng.md,2025-01-28 18:58:18
68,"recursos de interes estrategico para el pais, de manera a minimizar la dependencia del exterior. k. fortalecer los sistemas nacionales de transporte, energia y comunicaciones. l. mantener y perfeccionar el sistema de movilizacion nacional para atender las necesidades del pais cuando este se vea obligado a involucrarse en un conflicto armado ; m. perfeccionar la defensa civil para casos de desastre ;",402,62,130,15,paraguay_1999_NationalDefensePolicy_noneng.md,2025-01-28 18:58:18
69,n. perfeccionar la defensa del medio ambiente. n. promover el interes y la participacion de todos los sectores de la sociedad paraguaya en las actividades de defensa nacional.! [ 11 _ image _ 0. png ] ( 11 _ image _ 0. png )! [ 12 _ image _ 0. png ] ( 12 _ image _ 0. png )! [ 12 _ image _ 1. png ] ( 12 _ image _ 1. png )! [ 12 _ image _ 2. png,345,83,130,15,paraguay_1999_NationalDefensePolicy_noneng.md,2025-01-28 18:58:18
70,] ( 12 _ image _ 2. png ) * * secretaria permanente * *,55,15,21,15,paraguay_1999_NationalDefensePolicy_noneng.md,2025-01-28 18:58:18
71,"# # v. marco referencial para la emision de la directiva de defensa nacional las orientaciones especificas derivadas de la politica de defensa estan establecidas en la directiva de defensa nacional. este es el documento en el cual el gobierno, a propuesta del consejo de defensa nacional, define los objetivos de la defensa nacional tendientes a la proteccion de los intereses nacionales permanentes establecidos en la politica de defensa nacional",447,70,130,16,paraguay_1999_NationalDefensePolicy_noneng.md,2025-01-28 18:58:18
72,"y expone las lineas genericas de actuacion que considera mas adecuadas para alcanzarlos dentro de un periodo constitucional de gobierno, conforme a la situacion estrategica del momento. constituye la base del planeamiento de la defensa nacional ; de la politica militar y del planeamiento de la defensa militar, estableciendo el marco geopolitico en el que deberan desarrollarse y las metas esenciales para el manten",416,64,130,16,paraguay_1999_NationalDefensePolicy_noneng.md,2025-01-28 18:58:18
73,##imiento de la seguridad integral de la republica.,51,8,18,16,paraguay_1999_NationalDefensePolicy_noneng.md,2025-01-28 18:58:18
74,"# # vi. orientacion de la politica militar la politica militar debe derivar de la politica de defensa nacional. esta dirigida! [ 12 _ image _ 3. png ] ( 12 _ image _ 3. png ) exclusivamente hacia las fuerzas armadas y consiste en un conjunto de leyes, reglamentos y decretos que dirigen y orientan exclusivamente las actividades castrenses, incluyendo aspectos de modernizacion",377,64,130,17,paraguay_1999_NationalDefensePolicy_noneng.md,2025-01-28 18:58:18
75,de la organizacion y doctrina de las fuerzas armadas ; definicion de aspectos operativos y logisticos y las medidas necesarias para alcanzar una estructura militar equilibrada y adecuada para responder a las amenazas posibles.,226,34,76,17,paraguay_1999_NationalDefensePolicy_noneng.md,2025-01-28 18:58:18
